,context,question,answer,source_doc
0,": 147269
UnitID: 147244
institution name: Millikin University
year: 2023
CIP2020Title: Computer Science.
CIP_Code: 110701
SOC2018Title: Computer Programmers
SOC_Code: 151251
CIPDefinition: A program that focuses on computer theory, computing problems and solutions, and the design of computer systems and user interfaces from a scientific perspective. Includes instruction in the principles of computational science, computer development and programming, and applications to a variety of end-use situations.
CrossReferences: 14.0901 - Computer Engineering, General.
Institution Name: Millikin University
Books and supplies 2023-24 (IC2023_AY): 1000.0
On campus  food and housing 2023-24 (IC2023_AY): 13330.0
Off campus (not with family)  food and housing 2023-24 (IC2023_AY): 12710.0
Off campus (not with family)  other expenses 2023-24 (IC2023_AY): 2100.0
Off campus (with family)  other expenses 2023-24 (IC2023_AY): 2100.0
On campus  food and housing 2020-21 (IC2023_AY): 12210.0
Published out-of-state tuition and fees 2023-24 (IC2023_AY): 43670.0
Published in-district tuition and fees 2023-24 (IC2023_AY): 26892.0
Published in-state tuition and fees 2023-24 (IC2023_AY): 43670.0
Institution provide nstitutionally-controlled housing (on-campus and/or off-campus) (IC2023): 1.0
Typical housing charges for an academic year (IC2023): 9776.0
Typical food charge for academic year (IC2023): 3140.0
Undergraduate application fee (IC2023): 0.0
Graduate application fee (IC2023): 0.0
Any alternative tuition plans offered by institution (IC2023): 1.0
Tuition payment plan (IC2023): 1.0
Average amount of federal  state  local or institutional grant aid awarded (SFA2122): 30528.0
Average amount of federal grant aid awarded to full-time first-time undergraduates (SFA2122): 5485.0
Average amount of Pell grant aid awarded to full-time first-time undergraduates (SFA2122): 5059.0
Average amount of other federal grant aid awarded to full-time first-time undergraduates (SFA2122): 693.0
Average amount of state/local grant aid awarded to full-time first-time undergraduates (SFA2122): 5319.0
Average amount of institutional grant aid awarded to full-time first-time undergraduates (SFA2122): 26982.0
Average amount of student loans awarded to full-time first-time undergraduates (SFA2122): 7197.0
Average amount of other student loans awarded to full-time first-time undergraduates (SFA2122): 14550.0
Average amount of federal  state  local  institutional or other sources of grant aid awarded to undergraduate students (SFA2122): 28498.0
Average amount Pell grant aid awarded to undergraduate students (SFA2122): 4927.0
Average amount of federal student loans awarded to undergraduate students (SFA2122): 7109.0
Average amount of federal  state  local  institutional or other sources of grant aid awarded to degree/certificate-seeking undergraduate students (SFA2122): 28536.0
Average amount of federal  state  local  institutional or other sources of grant aid awarded to non-degree/non-certificate-seeking undergraduates (SFA2122): 7156.0
Average net price-students awarded grant or scholarship aid  2021-22 (SFA2122): 10492.0
Average net price (income 0-30 000)-students awarded Title IV federal financial aid  2021-22 (SFA2122): 3367.0
Average net price (income 30 001-48 000)-students awarded Title IV federal financial aid  2021-22 (SFA2122): 4033.0
Average net price (income 48 001-75 000)-students awarded Title IV federal financial aid  2021-22 (SFA2122): 8346.0
Average net price (income 75 001-110 000)-students awarded Title IV federal financial aid  2021-22 (SFA2122): 13672.0
Average net price (income over 110 000)-students awarded Title IV federal financial aid  2021-22 (SFA2122): 14251.0
Books and supplies 2022-23 (IC2022_AY): 1000.0
On campus  room and board 2022-23 (IC2022_AY): 12836.0
Off campus (not with family)  room and board 2022-23 (IC2022_AY): 12836.0
Off campus (not with family)  other expenses 2022-23 (IC2022_AY): 2100.0
Off campus (with family)  other expenses 2022-23 (IC2022_AY): 2100.0
On campus  room and board 2019-20 (IC2022_AY): 11818.0
Published out-of-state tuition and fees 2022-23 (IC2022_AY): 41632.0
Published in-district tuition and fees 2022-23 (IC2022_AY): 26892.0
Published in-state tuition and fees 2022-23 (IC2022_AY): 41632.0
Institution provide on-campus housing (IC2022): 1.0
Typical room charge for academic year (IC2022): 9400.0
Typical board charge for academic year (IC2022): 2218.0
Undergraduate application fee (IC2022): 0.0
Graduate application fee (IC2022): 0.0
Any alternative tuition plans offered by institution (IC2022_RV): 1.0
Tuition payment plan (IC2022_RV): 1.0
Average amount of federal  state  local or institutional grant aid awarded (SFA2021_RV): 32198.0
Average amount of federal grant aid awarded to full-time first-time undergraduates (SFA2021_RV): 5222.0
Average amount of Pell grant aid awarded to full-time first-time undergraduates (SFA2021_RV): 4941.0
Average amount of other federal grant aid awarded to full-time first-time undergraduates (SFA2021_RV): 573.0
Average amount of state/local grant aid awarded to full-time first-time undergraduates (SFA2021_RV): 5091.0
Average amount of institutional grant aid awarded to full-time first-time undergraduates (SFA2021_RV): 28476.0
Average amount of student loans awarded to full-time first-time undergraduates (SFA2021_RV): 7069.0
Average amount of other student loans awarded to full-time first-time undergraduates (SFA2021_RV): 12206.0
Average amount of federal  state  local  institutional or other sources of grant aid awarded to undergraduate students (SFA2021_RV): 27928.0
Average amount Pell grant aid awarded to undergraduate students (SFA2021_RV): 4907.0
Average amount of federal student loans awarded to undergraduate students (SFA2021_RV): 7740.0
Average net price-students awarded grant or scholarship aid  2020-21 (SFA2021_RV): 20055.0
Average net price (income 0-30 000)-students awarded Title IV federal financial aid  2020-21 (SFA2021_RV): 15418.0
Average net price (income 30 001-48 000)-students awarded Title IV federal financial aid  2020-21 (SFA2021_RV): 15502.0
Average net price (income 48 001-75 000)-students awarded Title IV federal financial aid  2020-21 (SFA2021_RV): 18349.0
Average net price (income 75 001-110 000)-students awarded Title IV federal financial aid  2020-21 (SFA2021_RV): 20558.0
Average net price (income over 110 000)-students awarded Title IV federal financial aid  2020-21 (SFA2021_RV): 24732.0
Books and supplies 2021-22 (IC2021_AY): 1000.0
On campus  room and board 2021-22 (IC2021_AY): 12690.0
Off campus (not with family)  room and board 2021-22 (IC2021_AY): 12690.0
Off campus (not with family)  other expenses 2021-22 (IC2021_AY): 2100.0
Off campus (with family)  other expenses 2021-22 (IC2021_AY): 2100.0
On campus  room and board 2018-19 (IC2021_AY): 11818.0
Published out-of-state tuition and fees 2021-22 (IC2021_AY): 39592.0
Published in-district tuition and fees 2021-22 (IC2021_AY): 26792.0
Published in-state tuition and fees 2021-22 (IC2021_AY): 39592.0
Institution provide on-campus housing (IC2021): 1.0
Typical room charge for academic year (IC2021): 9400.0
Typical board charge for academic year (IC2021): 2150.0
Undergraduate application fee (IC2021): 0.0
Graduate application fee (IC2021): 0.0
Any alternative tuition plans offered by institution (IC2021): 1.0
Tuition payment plan (IC2021_RV): 1.0
Books and supplies 2020-21 (IC2020_AY): 1000.0
On campus  room and board 2020-21 (IC2020_AY): 12210.0
Off campus (not with family)  room and board 2020-21 (IC2020_AY): 12210.0
Off campus (not with family)  other expenses 2020-21 (IC2020_AY): 2100.0
Off campus (with family)  other expenses 2020-21 (IC2020_AY): 2100.0
On campus  room and board 2017-18 (IC2020_AY): 11498.0
Published out-of-state tuition and fees 2020-21 (IC2020_AY): 39592.0
Published in-district tuition and fees 2020-21 (IC2020_AY): 39592.0
Published in-state tuition and fees 2020-21 (IC2020_AY): 39592.0
Institution provide on-campus housing (IC2020): 1.0
Typical room charge for academic year (IC2020): 9400.0
Typical board charge for academic year (IC2020): 2760.0
Undergraduate application fee (IC2020): 0.0
Graduate application fee (IC2020): 0.0
Any alternative tuition plans offered by institution (IC2020_RV): 1.0
Tuition payment plan (IC2020_RV): 1.0","What is the typical food charge for an academic year at Millikin University?
",The typical food charge for an academic year at Millikin University is 3140.0.,../data/final_p1.csv
1,": 564510
UnitID: 236948
institution name: University of Washington-Seattle Campus
year: 2023
CIP2020Title: Information Technology.
CIP_Code: 110103
SOC2018Title: Software Quality Assurance Analysts and Testers
SOC_Code: 151253
CIPDefinition: A program that focuses on the design of technological information systems, including computing systems, as solutions to business and research data and communications support needs.  Includes instruction in the principles of computer hardware and software components, algorithms, databases, telecommunications, user tactics, application testing, and human interface design.
CrossReferences: 
Institution Name: University of Washington-Seattle Campus
Books and supplies 2023-24 (IC2023_AY): 900.0
On campus  food and housing 2023-24 (IC2023_AY): 17982.0
Off campus (not with family)  food and housing 2023-24 (IC2023_AY): 17982.0
Off campus (not with family)  other expenses 2023-24 (IC2023_AY): 3027.0
Off campus (with family)  other expenses 2023-24 (IC2023_AY): 3297.0
On campus  food and housing 2020-21 (IC2023_AY): 13887.0
Published out-of-state tuition and fees 2023-24 (IC2023_AY): 41997.0
Published in-district tuition and fees 2023-24 (IC2023_AY): 12643.0
Published in-state tuition and fees 2023-24 (IC2023_AY): 12643.0
Institution provide nstitutionally-controlled housing (on-campus and/or off-campus) (IC2023): 1.0
Typical housing charges for an academic year (IC2023): 12117.0
Typical food charge for academic year (IC2023): 5865.0
Undergraduate application fee (IC2023): 80.0
Graduate application fee (IC2023): 85.0
Any alternative tuition plans offered by institution (IC2023): 1.0
Tuition payment plan (IC2023): 0.0
Average amount of federal  state  local or institutional grant aid awarded (SFA2122): 14731.0
Average amount of federal grant aid awarded to full-time first-time undergraduates (SFA2122): 5382.0
Average amount of Pell grant aid awarded to full-time first-time undergraduates (SFA2122): 5058.0
Average amount of other federal grant aid awarded to full-time first-time undergraduates (SFA2122): 1967.0
Average amount of state/local grant aid awarded to full-time first-time undergraduates (SFA2122): 8114.0
Average amount of institutional grant aid awarded to full-time first-time undergraduates (SFA2122): 7485.0
Average amount of student loans awarded to full-time first-time undergraduates (SFA2122): 6169.0
Average amount of other student loans awarded to full-time first-time undergraduates (SFA2122): 25775.0
Average amount of federal  state  local  institutional or other sources of grant aid awarded to undergraduate students (SFA2122): 15700.0
Average amount Pell grant aid awarded to undergraduate students (SFA2122): 5080.0
Average amount of federal student loans awarded to undergraduate students (SFA2122): 5452.0
Average amount of federal  state  local  institutional or other sources of grant aid awarded to degree/certificate-seeking undergraduate students (SFA2122): 15716.0
Average amount of federal  state  local  institutional or other sources of grant aid awarded to non-degree/non-certificate-seeking undergraduates (SFA2122): 6912.0
Average net price-students awarded grant or scholarship aid  2021-22 (SFA2122): 
Average net price (income 0-30 000)-students awarded Title IV federal financial aid  2021-22 (SFA2122): 
Average net price (income 30 001-48 000)-students awarded Title IV federal financial aid  2021-22 (SFA2122): 
Average net price (income 48 001-75 000)-students awarded Title IV federal financial aid  2021-22 (SFA2122): 
Average net price (income 75 001-110 000)-students awarded Title IV federal financial aid  2021-22 (SFA2122): 
Average net price (income over 110 000)-students awarded Title IV federal financial aid  2021-22 (SFA2122): 
Books and supplies 2022-23 (IC2022_AY): 900.0
On campus  room and board 2022-23 (IC2022_AY): 16068.0
Off campus (not with family)  room and board 2022-23 (IC2022_AY): 16068.0
Off campus (not with family)  other expenses 2022-23 (IC2022_AY): 2880.0
Off campus (with family)  other expenses 2022-23 (IC2022_AY): 3102.0
On campus  room and board 2019-20 (IC2022_AY): 13296.0
Published out-of-state tuition and fees 2022-23 (IC2022_AY): 40740.0
Published in-district tuition and fees 2022-23 (IC2022_AY): 12242.0
Published in-state tuition and fees 2022-23 (IC2022_AY): 12242.0
Institution provide on-campus housing (IC2022): 1.0
Typical room charge for academic year (IC2022): 
Typical board charge for academic year (IC2022): 
Undergraduate application fee (IC2022): 80.0
Graduate application fee (IC2022): 85.0
Any alternative tuition plans offered by institution (IC2022_RV): 1.0
Tuition payment plan (IC2022_RV): 0.0
Average amount of federal  state  local or institutional grant aid awarded (SFA2021_RV): 15895.0
Average amount of federal grant aid awarded to full-time first-time undergraduates (SFA2021_RV): 6695.0
Average amount of Pell grant aid awarded to full-time first-time undergraduates (SFA2021_RV): 4960.0
Average amount of other federal grant aid awarded to full-time first-time undergraduates (SFA2021_RV): 3456.0
Average amount of state/local grant aid awarded to full-time first-time undergraduates (SFA2021_RV): 7595.0
Average amount of institutional grant aid awarded to full-time first-time undergraduates (SFA2021_RV): 7752.0
Average amount of student loans awarded to full-time first-time undergraduates (SFA2021_RV): 5832.0
Average amount of other student loans awarded to full-time first-time undergraduates (SFA2021_RV): 24258.0
Average amount of federal  state  local  institutional or other sources of grant aid awarded to undergraduate students (SFA2021_RV): 16355.0
Average amount Pell grant aid awarded to undergraduate students (SFA2021_RV): 5080.0
Average amount of federal student loans awarded to undergraduate students (SFA2021_RV): 5450.0
Average net price-students awarded grant or scholarship aid  2020-21 (SFA2021_RV): 
Average net price (income 0-30 000)-students awarded Title IV federal financial aid  2020-21 (SFA2021_RV): 
Average net price (income 30 001-48 000)-students awarded Title IV federal financial aid  2020-21 (SFA2021_RV): 
Average net price (income 48 001-75 000)-students awarded Title IV federal financial aid  2020-21 (SFA2021_RV): 
Average net price (income 75 001-110 000)-students awarded Title IV federal financial aid  2020-21 (SFA2021_RV): 
Average net price (income over 110 000)-students awarded Title IV federal financial aid  2020-21 (SFA2021_RV): 
Books and supplies 2021-22 (IC2021_AY): 900.0
On campus  room and board 2021-22 (IC2021_AY): 14871.0
Off campus (not with family)  room and board 2021-22 (IC2021_AY): 14871.0
Off campus (not with family)  other expenses 2021-22 (IC2021_AY): 2793.0
Off campus (with family)  other expenses 2021-22 (IC2021_AY): 3009.0
On campus  room and board 2018-19 (IC2021_AY): 12798.0
Published out-of-state tuition and fees 2021-22 (IC2021_AY): 39906.0
Published in-district tuition and fees 2021-22 (IC2021_AY): 12076.0
Published in-state tuition and fees 2021-22 (IC2021_AY): 12076.0
Institution provide on-campus housing (IC2021): 1.0
Typical room charge for academic year (IC2021): 
Typical board charge for academic year (IC2021): 
Undergraduate application fee (IC2021): 80.0
Graduate application fee (IC2021): 85.0
Any alternative tuition plans offered by institution (IC2021): 1.0
Tuition payment plan (IC2021_RV): 0.0
Books and supplies 2020-21 (IC2020_AY): 900.0
On campus  room and board 2020-21 (IC2020_AY): 13887.0
Off campus (not with family)  room and board 2020-21 (IC2020_AY): 13887.0
Off campus (not with family)  other expenses 2020-21 (IC2020_AY): 2787.0
Off campus (with family)  other expenses 2020-21 (IC2020_AY): 3003.0
On campus  room and board 2017-18 (IC2020_AY): 12117.0
Published out-of-state tuition and fees 2020-21 (IC2020_AY): 39114.0
Published in-district tuition and fees 2020-21 (IC2020_AY): 11745.0
Published in-state tuition and fees 2020-21 (IC2020_AY): 11745.0
Institution provide on-campus housing (IC2020): 1.0
Typical room charge for academic year (IC2020): 
Typical board charge for academic year (IC2020): 
Undergraduate application fee (IC2020): 80.0
Graduate application fee (IC2020): 85.0
Any alternative tuition plans offered by institution (IC2020_RV): 1.0
Tuition payment plan (IC2020_RV): 0.0","What is the average amount of federal grant aid awarded to full-time first-time undergraduates in the University of Washington-Seattle Campus in 2023?
",5382.0,../data/final_p1.csv
2,": 277839
AREA: 30780
AREA_TITLE: Little Rock-North Little Rock-Conway, AR
AREA_TYPE: 4
PRIM_STATE: AR
NAICS: 0
NAICS_TITLE: Cross-industry
I_GROUP: cross-industry
OWN_CODE: 1235
OCC_CODE: 29-1292
OCC_TITLE: Dental Hygienists
O_GROUP: detailed
TOT_EMP: 510
EMP_PRSE: 16.0
JOBS_1000: 1.461
LOC_QUOTIENT: 1.05
PCT_TOTAL: 
PCT_RPT: 
H_MEAN: 37.53
A_MEAN: 78,060
MEAN_PRSE: 3.9
H_PCT10: 23.92
H_PCT25: 35.93
H_MEDIAN: 37.63
H_PCT75: 39.53
H_PCT90: 44.00
A_PCT10: 49,750
A_PCT25: 74,730
A_MEDIAN: 78,260
A_PCT75: 82,220
A_PCT90: 91,510
ANNUAL: 
HOURLY: 
SOC_Code: 291292","What is the median hourly wage for dental hygienists in Little Rock-North Little Rock-Conway, AR?
","The median hourly wage for dental hygienists in Little Rock-North Little Rock-Conway, AR is $37.63.",../data/final_p2.csv
3,": 569510
UnitID: 237817
institution name: Southern West Virginia Community and Technical College
year: 2023
CIP2020Title: Accounting.
CIP_Code: 520301
SOC2018Title: Appraisers of Personal and Business Property
SOC_Code: 132022
CIPDefinition: A program that prepares individuals to practice the profession of accounting and to perform related business functions.  Includes instruction in accounting principles and theory, financial accounting, managerial accounting, cost accounting, budget control, tax accounting, legal aspects of accounting, auditing, reporting procedures, statement analysis, planning and consulting, business information systems, accounting research methods, professional standards and ethics, and applications to specific for-profit, public, and non-profit organizations.
CrossReferences: 
Institution Name: Southern West Virginia Community and Technical College
Books and supplies 2023-24 (IC2023_AY): 2250.0
On campus  food and housing 2023-24 (IC2023_AY): 
Off campus (not with family)  food and housing 2023-24 (IC2023_AY): 6000.0
Off campus (not with family)  other expenses 2023-24 (IC2023_AY): 8980.0
Off campus (with family)  other expenses 2023-24 (IC2023_AY): 7480.0
On campus  food and housing 2020-21 (IC2023_AY): 
Published out-of-state tuition and fees 2023-24 (IC2023_AY): 7560.0
Published in-district tuition and fees 2023-24 (IC2023_AY): 4944.0
Published in-state tuition and fees 2023-24 (IC2023_AY): 4944.0
Institution provide nstitutionally-controlled housing (on-campus and/or off-campus) (IC2023): 2.0
Typical housing charges for an academic year (IC2023): 
Typical food charge for academic year (IC2023): 
Undergraduate application fee (IC2023): 0.0
Graduate application fee (IC2023): 
Any alternative tuition plans offered by institution (IC2023): 1.0
Tuition payment plan (IC2023): 1.0
Average amount of federal  state  local or institutional grant aid awarded (SFA2122): 8075.0
Average amount of federal grant aid awarded to full-time first-time undergraduates (SFA2122): 5914.0
Average amount of Pell grant aid awarded to full-time first-time undergraduates (SFA2122): 5121.0
Average amount of other federal grant aid awarded to full-time first-time undergraduates (SFA2122): 2801.0
Average amount of state/local grant aid awarded to full-time first-time undergraduates (SFA2122): 3129.0
Average amount of institutional grant aid awarded to full-time first-time undergraduates (SFA2122): 3104.0
Average amount of student loans awarded to full-time first-time undergraduates (SFA2122): 4915.0
Average amount of other student loans awarded to full-time first-time undergraduates (SFA2122): 
Average amount of federal  state  local  institutional or other sources of grant aid awarded to undergraduate students (SFA2122): 6438.0
Average amount Pell grant aid awarded to undergraduate students (SFA2122): 4722.0
Average amount of federal student loans awarded to undergraduate students (SFA2122): 5323.0
Average amount of federal  state  local  institutional or other sources of grant aid awarded to degree/certificate-seeking undergraduate students (SFA2122): 7377.0
Average amount of federal  state  local  institutional or other sources of grant aid awarded to non-degree/non-certificate-seeking undergraduates (SFA2122): 994.0
Average net price-students awarded grant or scholarship aid  2021-22 (SFA2122): 
Average net price (income 0-30 000)-students awarded Title IV federal financial aid  2021-22 (SFA2122): 
Average net price (income 30 001-48 000)-students awarded Title IV federal financial aid  2021-22 (SFA2122): 
Average net price (income 48 001-75 000)-students awarded Title IV federal financial aid  2021-22 (SFA2122): 
Average net price (income 75 001-110 000)-students awarded Title IV federal financial aid  2021-22 (SFA2122): 
Average net price (income over 110 000)-students awarded Title IV federal financial aid  2021-22 (SFA2122): 
Books and supplies 2022-23 (IC2022_AY): 1500.0
On campus  room and board 2022-23 (IC2022_AY): 
Off campus (not with family)  room and board 2022-23 (IC2022_AY): 5600.0
Off campus (not with family)  other expenses 2022-23 (IC2022_AY): 8900.0
Off campus (with family)  other expenses 2022-23 (IC2022_AY): 7100.0
On campus  room and board 2019-20 (IC2022_AY): 
Published out-of-state tuition and fees 2022-23 (IC2022_AY): 6864.0
Published in-district tuition and fees 2022-23 (IC2022_AY): 4344.0
Published in-state tuition and fees 2022-23 (IC2022_AY): 4344.0
Institution provide on-campus housing (IC2022): 2.0
Typical room charge for academic year (IC2022): 
Typical board charge for academic year (IC2022): 
Undergraduate application fee (IC2022): 0.0
Graduate application fee (IC2022): 
Any alternative tuition plans offered by institution (IC2022_RV): 1.0
Tuition payment plan (IC2022_RV): 1.0
Average amount of federal  state  local or institutional grant aid awarded (SFA2021_RV): 6033.0
Average amount of federal grant aid awarded to full-time first-time undergraduates (SFA2021_RV): 4377.0
Average amount of Pell grant aid awarded to full-time first-time undergraduates (SFA2021_RV): 4791.0
Average amount of other federal grant aid awarded to full-time first-time undergraduates (SFA2021_RV): 813.0
Average amount of state/local grant aid awarded to full-time first-time undergraduates (SFA2021_RV): 2782.0
Average amount of institutional grant aid awarded to full-time first-time undergraduates (SFA2021_RV): 3123.0
Average amount of student loans awarded to full-time first-time undergraduates (SFA2021_RV): 4579.0
Average amount of other student loans awarded to full-time first-time undergraduates (SFA2021_RV): 
Average amount of federal  state  local  institutional or other sources of grant aid awarded to undergraduate students (SFA2021_RV): 5703.0
Average amount Pell grant aid awarded to undergraduate students (SFA2021_RV): 4597.0
Average amount of federal student loans awarded to undergraduate students (SFA2021_RV): 4970.0
Average net price-students awarded grant or scholarship aid  2020-21 (SFA2021_RV): 
Average net price (income 0-30 000)-students awarded Title IV federal financial aid  2020-21 (SFA2021_RV): 
Average net price (income 30 001-48 000)-students awarded Title IV federal financial aid  2020-21 (SFA2021_RV): 
Average net price (income 48 001-75 000)-students awarded Title IV federal financial aid  2020-21 (SFA2021_RV): 
Average net price (income 75 001-110 000)-students awarded Title IV federal financial aid  2020-21 (SFA2021_RV): 
Average net price (income over 110 000)-students awarded Title IV federal financial aid  2020-21 (SFA2021_RV): 
Books and supplies 2021-22 (IC2021_AY): 2000.0
On campus  room and board 2021-22 (IC2021_AY): 
Off campus (not with family)  room and board 2021-22 (IC2021_AY): 4900.0
Off campus (not with family)  other expenses 2021-22 (IC2021_AY): 4700.0
Off campus (with family)  other expenses 2021-22 (IC2021_AY): 3200.0
On campus  room and board 2018-19 (IC2021_AY): 
Published out-of-state tuition and fees 2021-22 (IC2021_AY): 6470.0
Published in-district tuition and fees 2021-22 (IC2021_AY): 4084.0
Published in-state tuition and fees 2021-22 (IC2021_AY): 4084.0
Institution provide on-campus housing (IC2021): 2.0
Typical room charge for academic year (IC2021): 
Typical board charge for academic year (IC2021): 
Undergraduate application fee (IC2021): 0.0
Graduate application fee (IC2021): 
Any alternative tuition plans offered by institution (IC2021): 1.0
Tuition payment plan (IC2021_RV): 1.0
Books and supplies 2020-21 (IC2020_AY): 1800.0
On campus  room and board 2020-21 (IC2020_AY): 
Off campus (not with family)  room and board 2020-21 (IC2020_AY): 4800.0
Off campus (not with family)  other expenses 2020-21 (IC2020_AY): 4500.0
Off campus (with family)  other expenses 2020-21 (IC2020_AY): 3000.0
On campus  room and board 2017-18 (IC2020_AY): 
Published out-of-state tuition and fees 2020-21 (IC2020_AY): 6314.0
Published in-district tuition and fees 2020-21 (IC2020_AY): 4084.0
Published in-state tuition and fees 2020-21 (IC2020_AY): 4084.0
Institution provide on-campus housing (IC2020): 2.0
Typical room charge for academic year (IC2020): 
Typical board charge for academic year (IC2020): 
Undergraduate application fee (IC2020): 0.0
Graduate application fee (IC2020): 
Any alternative tuition plans offered by institution (IC2020_RV): 1.0
Tuition payment plan (IC2020_RV): 1.0","What is the average amount of Pell grant aid awarded to full-time first-time undergraduates at Southern West Virginia Community and Technical College in 2021-22?
",The average amount of Pell grant aid awarded to full-time first-time,../data/final_p1.csv
4,": 167637
AREA: 99
AREA_TITLE: U.S.
AREA_TYPE: 1
PRIM_STATE: US
NAICS: 999300
NAICS_TITLE: Local Government, excluding Schools and Hospitals (OEWS Designation)
I_GROUP: 4-digit
OWN_CODE: 3
OCC_CODE: 51-8010
OCC_TITLE: Power Plant Operators, Distributors, and Dispatchers
O_GROUP: broad
TOT_EMP: 4,450
EMP_PRSE: 4.0
JOBS_1000: 
LOC_QUOTIENT: 
PCT_TOTAL: 0.08
PCT_RPT: 2
H_MEAN: 42.93
A_MEAN: 89,300
MEAN_PRSE: 1.4
H_PCT10: 22.78
H_PCT25: 30.89
H_MEDIAN: 42.00
H_PCT75: 52.66
H_PCT90: 63.09
A_PCT10: 47,380
A_PCT25: 64,250
A_MEDIAN: 87,360
A_PCT75: 109,520
A_PCT90: 131,220
ANNUAL: 
HOURLY: 
SOC_Code: 518010","What is the median annual salary for Power Plant Operators, Distributors, and Dispatchers in the U.S.?
","The median annual salary for Power Plant Operators, Distributors, and Dispatchers in the U.S. is 87,360.",../data/final_p2.csv
5,": 617998
UnitID: 483018
institution name: Antioch College
year: 2023
CIP2020Title: Environmental Science.
CIP_Code: 030104
SOC2018Title: Environmental Scientists and Specialists, Including Health
SOC_Code: 192041
CIPDefinition: A program that focuses on the application of biological, chemical, and physical principles to the study of the physical environment and the solution of environmental problems, including subjects such as abating or controlling environmental pollution and degradation; the interaction between human society and the natural environment; and natural resources management.  Includes instruction in biology, chemistry, physics, geosciences, climatology, statistics, and mathematical modeling.
CrossReferences: 26.1305 - Environmental Biology., 26.1307 - Conservation Biology., 14.1401 - Environmental/Environmental Health Engineering.
Institution Name: Antioch College
Books and supplies 2023-24 (IC2023_AY): 1200.0
On campus  food and housing 2023-24 (IC2023_AY): 7640.0
Off campus (not with family)  food and housing 2023-24 (IC2023_AY): 9600.0
Off campus (not with family)  other expenses 2023-24 (IC2023_AY): 4400.0
Off campus (with family)  other expenses 2023-24 (IC2023_AY): 4400.0
On campus  food and housing 2020-21 (IC2023_AY): 7640.0
Published out-of-state tuition and fees 2023-24 (IC2023_AY): 37143.0
Published in-district tuition and fees 2023-24 (IC2023_AY): 37143.0
Published in-state tuition and fees 2023-24 (IC2023_AY): 37143.0
Institution provide nstitutionally-controlled housing (on-campus and/or off-campus) (IC2023): 1.0
Typical housing charges for an academic year (IC2023): 4622.0
Typical food charge for academic year (IC2023): 3018.0
Undergraduate application fee (IC2023): 0.0
Graduate application fee (IC2023): 
Any alternative tuition plans offered by institution (IC2023): 1.0
Tuition payment plan (IC2023): 1.0
Average amount of federal  state  local or institutional grant aid awarded (SFA2122): 32536.0
Average amount of federal grant aid awarded to full-time first-time undergraduates (SFA2122): 4490.0
Average amount of Pell grant aid awarded to full-time first-time undergraduates (SFA2122): 4490.0
Average amount of other federal grant aid awarded to full-time first-time undergraduates (SFA2122): 
Average amount of state/local grant aid awarded to full-time first-time undergraduates (SFA2122): 3699.0
Average amount of institutional grant aid awarded to full-time first-time undergraduates (SFA2122): 28107.0
Average amount of student loans awarded to full-time first-time undergraduates (SFA2122): 3708.0
Average amount of other student loans awarded to full-time first-time undergraduates (SFA2122): 
Average amount of federal  state  local  institutional or other sources of grant aid awarded to undergraduate students (SFA2122): 36245.0
Average amount Pell grant aid awarded to undergraduate students (SFA2122): 5031.0
Average amount of federal student loans awarded to undergraduate students (SFA2122): 4791.0
Average amount of federal  state  local  institutional or other sources of grant aid awarded to degree/certificate-seeking undergraduate students (SFA2122): 36245.0
Average amount of federal  state  local  institutional or other sources of grant aid awarded to non-degree/non-certificate-seeking undergraduates (SFA2122): 
Average net price-students awarded grant or scholarship aid  2021-22 (SFA2122): 17083.0
Average net price (income 0-30 000)-students awarded Title IV federal financial aid  2021-22 (SFA2122): 14911.0
Average net price (income 30 001-48 000)-students awarded Title IV federal financial aid  2021-22 (SFA2122): 16995.0
Average net price (income 48 001-75 000)-students awarded Title IV federal financial aid  2021-22 (SFA2122): 18239.0
Average net price (income 75 001-110 000)-students awarded Title IV federal financial aid  2021-22 (SFA2122): 23912.0
Average net price (income over 110 000)-students awarded Title IV federal financial aid  2021-22 (SFA2122): 24445.0
Books and supplies 2022-23 (IC2022_AY): 1200.0
On campus  room and board 2022-23 (IC2022_AY): 7640.0
Off campus (not with family)  room and board 2022-23 (IC2022_AY): 9600.0
Off campus (not with family)  other expenses 2022-23 (IC2022_AY): 4400.0
Off campus (with family)  other expenses 2022-23 (IC2022_AY): 4400.0
On campus  room and board 2019-20 (IC2022_AY): 7640.0
Published out-of-state tuition and fees 2022-23 (IC2022_AY): 37143.0
Published in-district tuition and fees 2022-23 (IC2022_AY): 37143.0
Published in-state tuition and fees 2022-23 (IC2022_AY): 37143.0
Institution provide on-campus housing (IC2022): 1.0
Typical room charge for academic year (IC2022): 4622.0
Typical board charge for academic year (IC2022): 3018.0
Undergraduate application fee (IC2022): 0.0
Graduate application fee (IC2022): 
Any alternative tuition plans offered by institution (IC2022_RV): 1.0
Tuition payment plan (IC2022_RV): 1.0
Average amount of federal  state  local or institutional grant aid awarded (SFA2021_RV): 33164.0
Average amount of federal grant aid awarded to full-time first-time undergraduates (SFA2021_RV): 4233.0
Average amount of Pell grant aid awarded to full-time first-time undergraduates (SFA2021_RV): 4233.0
Average amount of other federal grant aid awarded to full-time first-time undergraduates (SFA2021_RV): 
Average amount of state/local grant aid awarded to full-time first-time undergraduates (SFA2021_RV): 3050.0
Average amount of institutional grant aid awarded to full-time first-time undergraduates (SFA2021_RV): 28992.0
Average amount of student loans awarded to full-time first-time undergraduates (SFA2021_RV): 3466.0
Average amount of other student loans awarded to full-time first-time undergraduates (SFA2021_RV): 
Average amount of federal  state  local  institutional or other sources of grant aid awarded to undergraduate students (SFA2021_RV): 37156.0
Average amount Pell grant aid awarded to undergraduate students (SFA2021_RV): 4814.0
Average amount of federal student loans awarded to undergraduate students (SFA2021_RV): 4684.0
Average net price-students awarded grant or scholarship aid  2020-21 (SFA2021_RV): 17045.0
Average net price (income 0-30 000)-students awarded Title IV federal financial aid  2020-21 (SFA2021_RV): 17473.0
Average net price (income 30 001-48 000)-students awarded Title IV federal financial aid  2020-21 (SFA2021_RV): 19527.0
Average net price (income 48 001-75 000)-students awarded Title IV federal financial aid  2020-21 (SFA2021_RV): 20733.0
Average net price (income 75 001-110 000)-students awarded Title IV federal financial aid  2020-21 (SFA2021_RV): 26416.0
Average net price (income over 110 000)-students awarded Title IV federal financial aid  2020-21 (SFA2021_RV): 26933.0
Books and supplies 2021-22 (IC2021_AY): 1200.0
On campus  room and board 2021-22 (IC2021_AY): 7640.0
Off campus (not with family)  room and board 2021-22 (IC2021_AY): 9600.0
Off campus (not with family)  other expenses 2021-22 (IC2021_AY): 4400.0
Off campus (with family)  other expenses 2021-22 (IC2021_AY): 4400.0
On campus  room and board 2018-19 (IC2021_AY): 11460.0
Published out-of-state tuition and fees 2021-22 (IC2021_AY): 37143.0
Published in-district tuition and fees 2021-22 (IC2021_AY): 37143.0
Published in-state tuition and fees 2021-22 (IC2021_AY): 37143.0
Institution provide on-campus housing (IC2021): 1.0
Typical room charge for academic year (IC2021): 4622.0
Typical board charge for academic year (IC2021): 3018.0
Undergraduate application fee (IC2021): 0.0
Graduate application fee (IC2021): 
Any alternative tuition plans offered by institution (IC2021): 1.0
Tuition payment plan (IC2021_RV): 1.0
Books and supplies 2020-21 (IC2020_AY): 1200.0
On campus  room and board 2020-21 (IC2020_AY): 7640.0
Off campus (not with family)  room and board 2020-21 (IC2020_AY): 9600.0
Off campus (not with family)  other expenses 2020-21 (IC2020_AY): 4400.0
Off campus (with family)  other expenses 2020-21 (IC2020_AY): 4400.0
On campus  room and board 2017-18 (IC2020_AY): 11460.0
Published out-of-state tuition and fees 2020-21 (IC2020_AY): 37143.0
Published in-district tuition and fees 2020-21 (IC2020_AY): 37143.0
Published in-state tuition and fees 2020-21 (IC2020_AY): 37143.0
Institution provide on-campus housing (IC2020): 1.0
Typical room charge for academic year (IC2020): 4622.0
Typical board charge for academic year (IC2020): 3018.0
Undergraduate application fee (IC2020): 0.0
Graduate application fee (IC2020): 
Any alternative tuition plans offered by institution (IC2020_RV): 1.0
Tuition payment plan (IC2020_RV): 1.0","What is the typical food charge for an academic year at Antioch College?
",The typical food charge for an academic year at Antioch College is 3018.0.,../data/final_p1.csv
6,": 525090
UnitID: 228547
institution name: Tarrant County College District
year: 2023
CIP2020Title: Computer and Information Sciences, General.
CIP_Code: 110101
SOC2018Title: Software Quality Assurance Analysts and Testers
SOC_Code: 151253
CIPDefinition: A general program that focuses on computing, computer science, and information science and systems. Such programs are undifferentiated as to title and content and are not to be confused with specific programs in computer science, information science, or related support services.
CrossReferences: 
Institution Name: Tarrant County College District
Books and supplies 2023-24 (IC2023_AY): 1719.0
On campus  food and housing 2023-24 (IC2023_AY): 
Off campus (not with family)  food and housing 2023-24 (IC2023_AY): 10116.0
Off campus (not with family)  other expenses 2023-24 (IC2023_AY): 5117.0
Off campus (with family)  other expenses 2023-24 (IC2023_AY): 5117.0
On campus  food and housing 2020-21 (IC2023_AY): 
Published out-of-state tuition and fees 2023-24 (IC2023_AY): 8235.0
Published in-district tuition and fees 2023-24 (IC2023_AY): 1728.0
Published in-state tuition and fees 2023-24 (IC2023_AY): 3402.0
Institution provide nstitutionally-controlled housing (on-campus and/or off-campus) (IC2023): 2.0
Typical housing charges for an academic year (IC2023): 
Typical food charge for academic year (IC2023): 
Undergraduate application fee (IC2023): 0.0
Graduate application fee (IC2023): 
Any alternative tuition plans offered by institution (IC2023): 1.0
Tuition payment plan (IC2023): 1.0
Average amount of federal  state  local or institutional grant aid awarded (SFA2122): 5082.0
Average amount of federal grant aid awarded to full-time first-time undergraduates (SFA2122): 6139.0
Average amount of Pell grant aid awarded to full-time first-time undergraduates (SFA2122): 5918.0
Average amount of other federal grant aid awarded to full-time first-time undergraduates (SFA2122): 391.0
Average amount of state/local grant aid awarded to full-time first-time undergraduates (SFA2122): 2762.0
Average amount of institutional grant aid awarded to full-time first-time undergraduates (SFA2122): 1175.0
Average amount of student loans awarded to full-time first-time undergraduates (SFA2122): 4916.0
Average amount of other student loans awarded to full-time first-time undergraduates (SFA2122): 19568.0
Average amount of federal  state  local  institutional or other sources of grant aid awarded to undergraduate students (SFA2122): 5376.0
Average amount Pell grant aid awarded to undergraduate students (SFA2122): 4699.0
Average amount of federal student loans awarded to undergraduate students (SFA2122): 3205.0
Average amount of federal  state  local  institutional or other sources of grant aid awarded to degree/certificate-seeking undergraduate students (SFA2122): 5392.0
Average amount of federal  state  local  institutional or other sources of grant aid awarded to non-degree/non-certificate-seeking undergraduates (SFA2122): 4841.0
Average net price-students awarded grant or scholarship aid  2021-22 (SFA2122): 
Average net price (income 0-30 000)-students awarded Title IV federal financial aid  2021-22 (SFA2122): 
Average net price (income 30 001-48 000)-students awarded Title IV federal financial aid  2021-22 (SFA2122): 
Average net price (income 48 001-75 000)-students awarded Title IV federal financial aid  2021-22 (SFA2122): 
Average net price (income 75 001-110 000)-students awarded Title IV federal financial aid  2021-22 (SFA2122): 
Average net price (income over 110 000)-students awarded Title IV federal financial aid  2021-22 (SFA2122): 
Books and supplies 2022-23 (IC2022_AY): 1719.0
On campus  room and board 2022-23 (IC2022_AY): 
Off campus (not with family)  room and board 2022-23 (IC2022_AY): 10116.0
Off campus (not with family)  other expenses 2022-23 (IC2022_AY): 5117.0
Off campus (with family)  other expenses 2022-23 (IC2022_AY): 5117.0
On campus  room and board 2019-20 (IC2022_AY): 
Published out-of-state tuition and fees 2022-23 (IC2022_AY): 8235.0
Published in-district tuition and fees 2022-23 (IC2022_AY): 1728.0
Published in-state tuition and fees 2022-23 (IC2022_AY): 3402.0
Institution provide on-campus housing (IC2022): 2.0
Typical room charge for academic year (IC2022): 
Typical board charge for academic year (IC2022): 
Undergraduate application fee (IC2022): 0.0
Graduate application fee (IC2022): 
Any alternative tuition plans offered by institution (IC2022_RV): 1.0
Tuition payment plan (IC2022_RV): 1.0
Average amount of federal  state  local or institutional grant aid awarded (SFA2021_RV): 4793.0
Average amount of federal grant aid awarded to full-time first-time undergraduates (SFA2021_RV): 5769.0
Average amount of Pell grant aid awarded to full-time first-time undergraduates (SFA2021_RV): 5551.0
Average amount of other federal grant aid awarded to full-time first-time undergraduates (SFA2021_RV): 480.0
Average amount of state/local grant aid awarded to full-time first-time undergraduates (SFA2021_RV): 3048.0
Average amount of institutional grant aid awarded to full-time first-time undergraduates (SFA2021_RV): 981.0
Average amount of student loans awarded to full-time first-time undergraduates (SFA2021_RV): 5476.0
Average amount of other student loans awarded to full-time first-time undergraduates (SFA2021_RV): 8344.0
Average amount of federal  state  local  institutional or other sources of grant aid awarded to undergraduate students (SFA2021_RV): 4241.0
Average amount Pell grant aid awarded to undergraduate students (SFA2021_RV): 4139.0
Average amount of federal student loans awarded to undergraduate students (SFA2021_RV): 1884.0
Average net price-students awarded grant or scholarship aid  2020-21 (SFA2021_RV): 
Average net price (income 0-30 000)-students awarded Title IV federal financial aid  2020-21 (SFA2021_RV): 
Average net price (income 30 001-48 000)-students awarded Title IV federal financial aid  2020-21 (SFA2021_RV): 
Average net price (income 48 001-75 000)-students awarded Title IV federal financial aid  2020-21 (SFA2021_RV): 
Average net price (income 75 001-110 000)-students awarded Title IV federal financial aid  2020-21 (SFA2021_RV): 
Average net price (income over 110 000)-students awarded Title IV federal financial aid  2020-21 (SFA2021_RV): 
Books and supplies 2021-22 (IC2021_AY): 1639.0
On campus  room and board 2021-22 (IC2021_AY): 
Off campus (not with family)  room and board 2021-22 (IC2021_AY): 9647.0
Off campus (not with family)  other expenses 2021-22 (IC2021_AY): 4880.0
Off campus (with family)  other expenses 2021-22 (IC2021_AY): 4880.0
On campus  room and board 2018-19 (IC2021_AY): 
Published out-of-state tuition and fees 2021-22 (IC2021_AY): 8235.0
Published in-district tuition and fees 2021-22 (IC2021_AY): 1728.0
Published in-state tuition and fees 2021-22 (IC2021_AY): 3402.0
Institution provide on-campus housing (IC2021): 2.0
Typical room charge for academic year (IC2021): 
Typical board charge for academic year (IC2021): 
Undergraduate application fee (IC2021): 0.0
Graduate application fee (IC2021): 
Any alternative tuition plans offered by institution (IC2021): 1.0
Tuition payment plan (IC2021_RV): 1.0
Books and supplies 2020-21 (IC2020_AY): 1631.0
On campus  room and board 2020-21 (IC2020_AY): 
Off campus (not with family)  room and board 2020-21 (IC2020_AY): 9601.0
Off campus (not with family)  other expenses 2020-21 (IC2020_AY): 4857.0
Off campus (with family)  other expenses 2020-21 (IC2020_AY): 4857.0
On campus  room and board 2017-18 (IC2020_AY): 
Published out-of-state tuition and fees 2020-21 (IC2020_AY): 8235.0
Published in-district tuition and fees 2020-21 (IC2020_AY): 1728.0
Published in-state tuition and fees 2020-21 (IC2020_AY): 3402.0
Institution provide on-campus housing (IC2020): 2.0
Typical room charge for academic year (IC2020): 
Typical board charge for academic year (IC2020): 
Undergraduate application fee (IC2020): 0.0
Graduate application fee (IC2020): 
Any alternative tuition plans offered by institution (IC2020_RV): 1.0
Tuition payment plan (IC2020_RV): 1.0","What is the average net price for students awarded grant or scholarship aid at Tarrant County College District in 2021-22?
",The average net price for students awarded grant or scholarship aid at Tarrant County College District in 2021-22 is not provided in the context.,../data/final_p1.csv
7,": 394010
AREA: 4000003
AREA_TITLE: Southwest Oklahoma nonmetropolitan area
AREA_TYPE: 6
PRIM_STATE: OK
NAICS: 0
NAICS_TITLE: Cross-industry
I_GROUP: cross-industry
OWN_CODE: 1235
OCC_CODE: 41-2011
OCC_TITLE: Cashiers
O_GROUP: detailed
TOT_EMP: 2,220
EMP_PRSE: 3.9
JOBS_1000: 35.813
LOC_QUOTIENT: 1.65
PCT_TOTAL: 
PCT_RPT: 
H_MEAN: 11.65
A_MEAN: 24,240
MEAN_PRSE: 1.0
H_PCT10: 8.62
H_PCT25: 10.00
H_MEDIAN: 11.40
H_PCT75: 13.29
H_PCT90: 14.04
A_PCT10: 17,920
A_PCT25: 20,800
A_MEDIAN: 23,720
A_PCT75: 27,640
A_PCT90: 29,210
ANNUAL: 
HOURLY: 
SOC_Code: 412011","What is the median hourly wage for cashiers in Southwest Oklahoma nonmetropolitan area?
",The median hourly wage for cashiers in Southwest Oklahoma nonmetropolitan area is $11.40.,../data/final_p2.csv
8,": 71338
UnitID: 123013
institution name: Santa Rosa Junior College
year: 2023
CIP2020Title: Horse Husbandry/Equine Science and Management.
CIP_Code: 010307
SOC2018Title: Farmers, Ranchers, and Other Agricultural Managers
SOC_Code: 119013
CIPDefinition: A program that prepares individuals to manage the selection, breeding, care, and maintenance of work, athletic, and show horses; and to manage horse farms, stables, tracks and related equipment and operations.  Includes instruction in applicable principles of animal science, care, and health; stable and track management; design and operation of facilities and equipment; and related issues such as regulations, business management; and logistics.
CrossReferences: 
Institution Name: Santa Rosa Junior College
Books and supplies 2023-24 (IC2023_AY): 1298.0
On campus  food and housing 2023-24 (IC2023_AY): 
Off campus (not with family)  food and housing 2023-24 (IC2023_AY): 21270.0
Off campus (not with family)  other expenses 2023-24 (IC2023_AY): 4734.0
Off campus (with family)  other expenses 2023-24 (IC2023_AY): 3858.0
On campus  food and housing 2020-21 (IC2023_AY): 
Published out-of-state tuition and fees 2023-24 (IC2023_AY): 11308.0
Published in-district tuition and fees 2023-24 (IC2023_AY): 1318.0
Published in-state tuition and fees 2023-24 (IC2023_AY): 1318.0
Institution provide nstitutionally-controlled housing (on-campus and/or off-campus) (IC2023): 2.0
Typical housing charges for an academic year (IC2023): 
Typical food charge for academic year (IC2023): 
Undergraduate application fee (IC2023): 0.0
Graduate application fee (IC2023): 
Any alternative tuition plans offered by institution (IC2023): 1.0
Tuition payment plan (IC2023): 1.0
Average amount of federal  state  local or institutional grant aid awarded (SFA2122): 5219.0
Average amount of federal grant aid awarded to full-time first-time undergraduates (SFA2122): 5404.0
Average amount of Pell grant aid awarded to full-time first-time undergraduates (SFA2122): 4549.0
Average amount of other federal grant aid awarded to full-time first-time undergraduates (SFA2122): 2499.0
Average amount of state/local grant aid awarded to full-time first-time undergraduates (SFA2122): 1437.0
Average amount of institutional grant aid awarded to full-time first-time undergraduates (SFA2122): 1127.0
Average amount of student loans awarded to full-time first-time undergraduates (SFA2122): 10951.0
Average amount of other student loans awarded to full-time first-time undergraduates (SFA2122): 18500.0
Average amount of federal  state  local  institutional or other sources of grant aid awarded to undergraduate students (SFA2122): 4336.0
Average amount Pell grant aid awarded to undergraduate students (SFA2122): 3720.0
Average amount of federal student loans awarded to undergraduate students (SFA2122): 6365.0
Average amount of federal  state  local  institutional or other sources of grant aid awarded to degree/certificate-seeking undergraduate students (SFA2122): 4487.0
Average amount of federal  state  local  institutional or other sources of grant aid awarded to non-degree/non-certificate-seeking undergraduates (SFA2122): 1950.0
Average net price-students awarded grant or scholarship aid  2021-22 (SFA2122): 
Average net price (income 0-30 000)-students awarded Title IV federal financial aid  2021-22 (SFA2122): 
Average net price (income 30 001-48 000)-students awarded Title IV federal financial aid  2021-22 (SFA2122): 
Average net price (income 48 001-75 000)-students awarded Title IV federal financial aid  2021-22 (SFA2122): 
Average net price (income 75 001-110 000)-students awarded Title IV federal financial aid  2021-22 (SFA2122): 
Average net price (income over 110 000)-students awarded Title IV federal financial aid  2021-22 (SFA2122): 
Books and supplies 2022-23 (IC2022_AY): 1214.0
On campus  room and board 2022-23 (IC2022_AY): 
Off campus (not with family)  room and board 2022-23 (IC2022_AY): 18726.0
Off campus (not with family)  other expenses 2022-23 (IC2022_AY): 5118.0
Off campus (with family)  other expenses 2022-23 (IC2022_AY): 4606.0
On campus  room and board 2019-20 (IC2022_AY): 
Published out-of-state tuition and fees 2022-23 (IC2022_AY): 9310.0
Published in-district tuition and fees 2022-23 (IC2022_AY): 1318.0
Published in-state tuition and fees 2022-23 (IC2022_AY): 1318.0
Institution provide on-campus housing (IC2022): 2.0
Typical room charge for academic year (IC2022): 
Typical board charge for academic year (IC2022): 
Undergraduate application fee (IC2022): 0.0
Graduate application fee (IC2022): 
Any alternative tuition plans offered by institution (IC2022_RV): 1.0
Tuition payment plan (IC2022_RV): 1.0
Average amount of federal  state  local or institutional grant aid awarded (SFA2021_RV): 4446.0
Average amount of federal grant aid awarded to full-time first-time undergraduates (SFA2021_RV): 4910.0
Average amount of Pell grant aid awarded to full-time first-time undergraduates (SFA2021_RV): 4766.0
Average amount of other federal grant aid awarded to full-time first-time undergraduates (SFA2021_RV): 757.0
Average amount of state/local grant aid awarded to full-time first-time undergraduates (SFA2021_RV): 1727.0
Average amount of institutional grant aid awarded to full-time first-time undergraduates (SFA2021_RV): 1176.0
Average amount of student loans awarded to full-time first-time undergraduates (SFA2021_RV): 3464.0
Average amount of other student loans awarded to full-time first-time undergraduates (SFA2021_RV): 
Average amount of federal  state  local  institutional or other sources of grant aid awarded to undergraduate students (SFA2021_RV): 3641.0
Average amount Pell grant aid awarded to undergraduate students (SFA2021_RV): 3819.0
Average amount of federal student loans awarded to undergraduate students (SFA2021_RV): 6891.0
Average net price-students awarded grant or scholarship aid  2020-21 (SFA2021_RV): 
Average net price (income 0-30 000)-students awarded Title IV federal financial aid  2020-21 (SFA2021_RV): 
Average net price (income 30 001-48 000)-students awarded Title IV federal financial aid  2020-21 (SFA2021_RV): 
Average net price (income 48 001-75 000)-students awarded Title IV federal financial aid  2020-21 (SFA2021_RV): 
Average net price (income 75 001-110 000)-students awarded Title IV federal financial aid  2020-21 (SFA2021_RV): 
Average net price (income over 110 000)-students awarded Title IV federal financial aid  2020-21 (SFA2021_RV): 
Books and supplies 2021-22 (IC2021_AY): 1972.0
On campus  room and board 2021-22 (IC2021_AY): 
Off campus (not with family)  room and board 2021-22 (IC2021_AY): 18594.0
Off campus (not with family)  other expenses 2021-22 (IC2021_AY): 5960.0
Off campus (with family)  other expenses 2021-22 (IC2021_AY): 5536.0
On campus  room and board 2018-19 (IC2021_AY): 
Published out-of-state tuition and fees 2021-22 (IC2021_AY): 8170.0
Published in-district tuition and fees 2021-22 (IC2021_AY): 1328.0
Published in-state tuition and fees 2021-22 (IC2021_AY): 1328.0
Institution provide on-campus housing (IC2021): 2.0
Typical room charge for academic year (IC2021): 
Typical board charge for academic year (IC2021): 
Undergraduate application fee (IC2021): 0.0
Graduate application fee (IC2021): 
Any alternative tuition plans offered by institution (IC2021): 1.0
Tuition payment plan (IC2021_RV): 1.0
Books and supplies 2020-21 (IC2020_AY): 1972.0
On campus  room and board 2020-21 (IC2020_AY): 
Off campus (not with family)  room and board 2020-21 (IC2020_AY): 16580.0
Off campus (not with family)  other expenses 2020-21 (IC2020_AY): 5274.0
Off campus (with family)  other expenses 2020-21 (IC2020_AY): 4698.0
On campus  room and board 2017-18 (IC2020_AY): 
Published out-of-state tuition and fees 2020-21 (IC2020_AY): 8170.0
Published in-district tuition and fees 2020-21 (IC2020_AY): 1324.0
Published in-state tuition and fees 2020-21 (IC2020_AY): 1324.0
Institution provide on-campus housing (IC2020): 2.0
Typical room charge for academic year (IC2020): 
Typical board charge for academic year (IC2020): 
Undergraduate application fee (IC2020): 0.0
Graduate application fee (IC2020): 
Any alternative tuition plans offered by institution (IC2020_RV): 1.0
Tuition payment plan (IC2020_RV): 1.0","What is the cost of books and supplies for the Horse Husbandry/Equine Science and Management program at Santa Rosa Junior College in 2023?
",1298.0,../data/final_p1.csv
9,": 14330
UnitID: 105154
institution name: Mesa Community College
year: 2023
CIP2020Title: Business Administration and Management, General.
CIP_Code: 520201
SOC2018Title: Compensation and Benefits Managers
SOC_Code: 113111
CIPDefinition: A program that generally prepares individuals to plan, organize, direct, and control the functions and processes of a firm or organization.  Includes instruction in management theory, human resources management and behavior, accounting and other quantitative methods, purchasing and logistics, organization and production, marketing, and business decision-making.
CrossReferences: 
Institution Name: Mesa Community College
Books and supplies 2023-24 (IC2023_AY): 1464.0
On campus  food and housing 2023-24 (IC2023_AY): 
Off campus (not with family)  food and housing 2023-24 (IC2023_AY): 10872.0
Off campus (not with family)  other expenses 2023-24 (IC2023_AY): 11304.0
Off campus (with family)  other expenses 2023-24 (IC2023_AY): 10872.0
On campus  food and housing 2020-21 (IC2023_AY): 
Published out-of-state tuition and fees 2023-24 (IC2023_AY): 8958.0
Published in-district tuition and fees 2023-24 (IC2023_AY): 2358.0
Published in-state tuition and fees 2023-24 (IC2023_AY): 2358.0
Institution provide nstitutionally-controlled housing (on-campus and/or off-campus) (IC2023): 2.0
Typical housing charges for an academic year (IC2023): 
Typical food charge for academic year (IC2023): 
Undergraduate application fee (IC2023): 0.0
Graduate application fee (IC2023): 
Any alternative tuition plans offered by institution (IC2023): 1.0
Tuition payment plan (IC2023): 1.0
Average amount of federal  state  local or institutional grant aid awarded (SFA2122): 3405.0
Average amount of federal grant aid awarded to full-time first-time undergraduates (SFA2122): 2936.0
Average amount of Pell grant aid awarded to full-time first-time undergraduates (SFA2122): 4786.0
Average amount of other federal grant aid awarded to full-time first-time undergraduates (SFA2122): 938.0
Average amount of state/local grant aid awarded to full-time first-time undergraduates (SFA2122): 500.0
Average amount of institutional grant aid awarded to full-time first-time undergraduates (SFA2122): 1646.0
Average amount of student loans awarded to full-time first-time undergraduates (SFA2122): 3750.0
Average amount of other student loans awarded to full-time first-time undergraduates (SFA2122): 7100.0
Average amount of federal  state  local  institutional or other sources of grant aid awarded to undergraduate students (SFA2122): 1772.0
Average amount Pell grant aid awarded to undergraduate students (SFA2122): 3493.0
Average amount of federal student loans awarded to undergraduate students (SFA2122): 3577.0
Average amount of federal  state  local  institutional or other sources of grant aid awarded to degree/certificate-seeking undergraduate students (SFA2122): 2089.0
Average amount of federal  state  local  institutional or other sources of grant aid awarded to non-degree/non-certificate-seeking undergraduates (SFA2122): 642.0
Average net price-students awarded grant or scholarship aid  2021-22 (SFA2122): 
Average net price (income 0-30 000)-students awarded Title IV federal financial aid  2021-22 (SFA2122): 
Average net price (income 30 001-48 000)-students awarded Title IV federal financial aid  2021-22 (SFA2122): 
Average net price (income 48 001-75 000)-students awarded Title IV federal financial aid  2021-22 (SFA2122): 
Average net price (income 75 001-110 000)-students awarded Title IV federal financial aid  2021-22 (SFA2122): 
Average net price (income over 110 000)-students awarded Title IV federal financial aid  2021-22 (SFA2122): 
Books and supplies 2022-23 (IC2022_AY): 1464.0
On campus  room and board 2022-23 (IC2022_AY): 
Off campus (not with family)  room and board 2022-23 (IC2022_AY): 10872.0
Off campus (not with family)  other expenses 2022-23 (IC2022_AY): 11241.0
Off campus (with family)  other expenses 2022-23 (IC2022_AY): 10872.0
On campus  room and board 2019-20 (IC2022_AY): 
Published out-of-state tuition and fees 2022-23 (IC2022_AY): 7854.0
Published in-district tuition and fees 2022-23 (IC2022_AY): 2070.0
Published in-state tuition and fees 2022-23 (IC2022_AY): 2070.0
Institution provide on-campus housing (IC2022): 2.0
Typical room charge for academic year (IC2022): 
Typical board charge for academic year (IC2022): 
Undergraduate application fee (IC2022): 0.0
Graduate application fee (IC2022): 
Any alternative tuition plans offered by institution (IC2022_RV): 1.0
Tuition payment plan (IC2022_RV): 1.0
Average amount of federal  state  local or institutional grant aid awarded (SFA2021_RV): 4595.0
Average amount of federal grant aid awarded to full-time first-time undergraduates (SFA2021_RV): 4201.0
Average amount of Pell grant aid awarded to full-time first-time undergraduates (SFA2021_RV): 4693.0
Average amount of other federal grant aid awarded to full-time first-time undergraduates (SFA2021_RV): 1156.0
Average amount of state/local grant aid awarded to full-time first-time undergraduates (SFA2021_RV): 819.0
Average amount of institutional grant aid awarded to full-time first-time undergraduates (SFA2021_RV): 1691.0
Average amount of student loans awarded to full-time first-time undergraduates (SFA2021_RV): 3385.0
Average amount of other student loans awarded to full-time first-time undergraduates (SFA2021_RV): 7360.0
Average amount of federal  state  local  institutional or other sources of grant aid awarded to undergraduate students (SFA2021_RV): 3722.0
Average amount Pell grant aid awarded to undergraduate students (SFA2021_RV): 3751.0
Average amount of federal student loans awarded to undergraduate students (SFA2021_RV): 3731.0
Average net price-students awarded grant or scholarship aid  2020-21 (SFA2021_RV): 
Average net price (income 0-30 000)-students awarded Title IV federal financial aid  2020-21 (SFA2021_RV): 
Average net price (income 30 001-48 000)-students awarded Title IV federal financial aid  2020-21 (SFA2021_RV): 
Average net price (income 48 001-75 000)-students awarded Title IV federal financial aid  2020-21 (SFA2021_RV): 
Average net price (income 75 001-110 000)-students awarded Title IV federal financial aid  2020-21 (SFA2021_RV): 
Average net price (income over 110 000)-students awarded Title IV federal financial aid  2020-21 (SFA2021_RV): 
Books and supplies 2021-22 (IC2021_AY): 1464.0
On campus  room and board 2021-22 (IC2021_AY): 
Off campus (not with family)  room and board 2021-22 (IC2021_AY): 8496.0
Off campus (not with family)  other expenses 2021-22 (IC2021_AY): 10476.0
Off campus (with family)  other expenses 2021-22 (IC2021_AY): 10476.0
On campus  room and board 2018-19 (IC2021_AY): 
Published out-of-state tuition and fees 2021-22 (IC2021_AY): 7854.0
Published in-district tuition and fees 2021-22 (IC2021_AY): 2070.0
Published in-state tuition and fees 2021-22 (IC2021_AY): 2070.0
Institution provide on-campus housing (IC2021): 2.0
Typical room charge for academic year (IC2021): 
Typical board charge for academic year (IC2021): 
Undergraduate application fee (IC2021): 0.0
Graduate application fee (IC2021): 
Any alternative tuition plans offered by institution (IC2021): 1.0
Tuition payment plan (IC2021_RV): 1.0
Books and supplies 2020-21 (IC2020_AY): 1472.0
On campus  room and board 2020-21 (IC2020_AY): 
Off campus (not with family)  room and board 2020-21 (IC2020_AY): 9216.0
Off campus (not with family)  other expenses 2020-21 (IC2020_AY): 8532.0
Off campus (with family)  other expenses 2020-21 (IC2020_AY): 8532.0
On campus  room and board 2017-18 (IC2020_AY): 
Published out-of-state tuition and fees 2020-21 (IC2020_AY): 7854.0
Published in-district tuition and fees 2020-21 (IC2020_AY): 2070.0
Published in-state tuition and fees 2020-21 (IC2020_AY): 2070.0
Institution provide on-campus housing (IC2020): 2.0
Typical room charge for academic year (IC2020): 
Typical board charge for academic year (IC2020): 
Undergraduate application fee (IC2020): 0.0
Graduate application fee (IC2020): 
Any alternative tuition plans offered by institution (IC2020_RV): 1.0
Tuition payment plan (IC2020_RV): 1.0","What is the average net price for students awarded grant or scholarship aid at Mesa Community College in 2021-22?
",The average net price for students awarded grant or scholarship aid at Mesa Community College in 2021-22 is $1772.0.,../data/final_p1.csv
10,": 199111
UnitID: 157793
institution name: Sullivan University
year: 2023
CIP2020Title: Accounting.
CIP_Code: 520301
SOC2018Title: Business Teachers, Postsecondary
SOC_Code: 251011
CIPDefinition: A program that prepares individuals to practice the profession of accounting and to perform related business functions.  Includes instruction in accounting principles and theory, financial accounting, managerial accounting, cost accounting, budget control, tax accounting, legal aspects of accounting, auditing, reporting procedures, statement analysis, planning and consulting, business information systems, accounting research methods, professional standards and ethics, and applications to specific for-profit, public, and non-profit organizations.
CrossReferences: 
Institution Name: Sullivan University
Books and supplies 2023-24 (IC2023_AY): 1800.0
On campus  food and housing 2023-24 (IC2023_AY): 10485.0
Off campus (not with family)  food and housing 2023-24 (IC2023_AY): 7554.0
Off campus (not with family)  other expenses 2023-24 (IC2023_AY): 10319.0
Off campus (with family)  other expenses 2023-24 (IC2023_AY): 10319.0
On campus  food and housing 2020-21 (IC2023_AY): 10485.0
Published out-of-state tuition and fees 2023-24 (IC2023_AY): 14220.0
Published in-district tuition and fees 2023-24 (IC2023_AY): 14220.0
Published in-state tuition and fees 2023-24 (IC2023_AY): 14220.0
Institution provide nstitutionally-controlled housing (on-campus and/or off-campus) (IC2023): 1.0
Typical housing charges for an academic year (IC2023): 6435.0
Typical food charge for academic year (IC2023): 4050.0
Undergraduate application fee (IC2023): 0.0
Graduate application fee (IC2023): 0.0
Any alternative tuition plans offered by institution (IC2023): 2.0
Tuition payment plan (IC2023): 0.0
Average amount of federal  state  local or institutional grant aid awarded (SFA2122): 10433.0
Average amount of federal grant aid awarded to full-time first-time undergraduates (SFA2122): 5291.0
Average amount of Pell grant aid awarded to full-time first-time undergraduates (SFA2122): 5137.0
Average amount of other federal grant aid awarded to full-time first-time undergraduates (SFA2122): 1649.0
Average amount of state/local grant aid awarded to full-time first-time undergraduates (SFA2122): 4303.0
Average amount of institutional grant aid awarded to full-time first-time undergraduates (SFA2122): 4188.0
Average amount of student loans awarded to full-time first-time undergraduates (SFA2122): 10090.0
Average amount of other student loans awarded to full-time first-time undergraduates (SFA2122): 7272.0
Average amount of federal  state  local  institutional or other sources of grant aid awarded to undergraduate students (SFA2122): 6417.0
Average amount Pell grant aid awarded to undergraduate students (SFA2122): 4424.0
Average amount of federal student loans awarded to undergraduate students (SFA2122): 10956.0
Average amount of federal  state  local  institutional or other sources of grant aid awarded to degree/certificate-seeking undergraduate students (SFA2122): 6417.0
Average amount of federal  state  local  institutional or other sources of grant aid awarded to non-degree/non-certificate-seeking undergraduates (SFA2122): 
Average net price-students awarded grant or scholarship aid  2021-22 (SFA2122): 19537.0
Average net price (income 0-30 000)-students awarded Title IV federal financial aid  2021-22 (SFA2122): 23348.0
Average net price (income 30 001-48 000)-students awarded Title IV federal financial aid  2021-22 (SFA2122): 29848.0
Average net price (income 48 001-75 000)-students awarded Title IV federal financial aid  2021-22 (SFA2122): 29861.0
Average net price (income 75 001-110 000)-students awarded Title IV federal financial aid  2021-22 (SFA2122): 30017.0
Average net price (income over 110 000)-students awarded Title IV federal financial aid  2021-22 (SFA2122): 
Books and supplies 2022-23 (IC2022_AY): 1800.0
On campus  room and board 2022-23 (IC2022_AY): 10485.0
Off campus (not with family)  room and board 2022-23 (IC2022_AY): 6885.0
Off campus (not with family)  other expenses 2022-23 (IC2022_AY): 9310.0
Off campus (with family)  other expenses 2022-23 (IC2022_AY): 9310.0
On campus  room and board 2019-20 (IC2022_AY): 10485.0
Published out-of-state tuition and fees 2022-23 (IC2022_AY): 14220.0
Published in-district tuition and fees 2022-23 (IC2022_AY): 14220.0
Published in-state tuition and fees 2022-23 (IC2022_AY): 14220.0
Institution provide on-campus housing (IC2022): 1.0
Typical room charge for academic year (IC2022): 6435.0
Typical board charge for academic year (IC2022): 4050.0
Undergraduate application fee (IC2022): 30.0
Graduate application fee (IC2022): 30.0
Any alternative tuition plans offered by institution (IC2022_RV): 2.0
Tuition payment plan (IC2022_RV): 0.0
Average amount of federal  state  local or institutional grant aid awarded (SFA2021_RV): 12873.0
Average amount of federal grant aid awarded to full-time first-time undergraduates (SFA2021_RV): 5729.0
Average amount of Pell grant aid awarded to full-time first-time undergraduates (SFA2021_RV): 5477.0
Average amount of other federal grant aid awarded to full-time first-time undergraduates (SFA2021_RV): 1446.0
Average amount of state/local grant aid awarded to full-time first-time undergraduates (SFA2021_RV): 4494.0
Average amount of institutional grant aid awarded to full-time first-time undergraduates (SFA2021_RV): 4812.0
Average amount of student loans awarded to full-time first-time undergraduates (SFA2021_RV): 12712.0
Average amount of other student loans awarded to full-time first-time undergraduates (SFA2021_RV): 14301.0
Average amount of federal  state  local  institutional or other sources of grant aid awarded to undergraduate students (SFA2021_RV): 6679.0
Average amount Pell grant aid awarded to undergraduate students (SFA2021_RV): 4861.0
Average amount of federal student loans awarded to undergraduate students (SFA2021_RV): 11728.0
Average net price-students awarded grant or scholarship aid  2020-21 (SFA2021_RV): 15703.0
Average net price (income 0-30 000)-students awarded Title IV federal financial aid  2020-21 (SFA2021_RV): 22236.0
Average net price (income 30 001-48 000)-students awarded Title IV federal financial aid  2020-21 (SFA2021_RV): 28276.0
Average net price (income 48 001-75 000)-students awarded Title IV federal financial aid  2020-21 (SFA2021_RV): 28586.0
Average net price (income 75 001-110 000)-students awarded Title IV federal financial aid  2020-21 (SFA2021_RV): 28686.0
Average net price (income over 110 000)-students awarded Title IV federal financial aid  2020-21 (SFA2021_RV): 28886.0
Books and supplies 2021-22 (IC2021_AY): 1800.0
On campus  room and board 2021-22 (IC2021_AY): 10485.0
Off campus (not with family)  room and board 2021-22 (IC2021_AY): 6593.0
Off campus (not with family)  other expenses 2021-22 (IC2021_AY): 8831.0
Off campus (with family)  other expenses 2021-22 (IC2021_AY): 8831.0
On campus  room and board 2018-19 (IC2021_AY): 10485.0
Published out-of-state tuition and fees 2021-22 (IC2021_AY): 13500.0
Published in-district tuition and fees 2021-22 (IC2021_AY): 13500.0
Published in-state tuition and fees 2021-22 (IC2021_AY): 13500.0
Institution provide on-campus housing (IC2021): 1.0
Typical room charge for academic year (IC2021): 6435.0
Typical board charge for academic year (IC2021): 4050.0
Undergraduate application fee (IC2021): 30.0
Graduate application fee (IC2021): 30.0
Any alternative tuition plans offered by institution (IC2021): 2.0
Tuition payment plan (IC2021_RV): 0.0
Books and supplies 2020-21 (IC2020_AY): 1800.0
On campus  room and board 2020-21 (IC2020_AY): 10485.0
Off campus (not with family)  room and board 2020-21 (IC2020_AY): 6013.0
Off campus (not with family)  other expenses 2020-21 (IC2020_AY): 8138.0
Off campus (with family)  other expenses 2020-21 (IC2020_AY): 8138.0
On campus  room and board 2017-18 (IC2020_AY): 10485.0
Published out-of-state tuition and fees 2020-21 (IC2020_AY): 13860.0
Published in-district tuition and fees 2020-21 (IC2020_AY): 13860.0
Published in-state tuition and fees 2020-21 (IC2020_AY): 13860.0
Institution provide on-campus housing (IC2020): 1.0
Typical room charge for academic year (IC2020): 6435.0
Typical board charge for academic year (IC2020): 4050.0
Undergraduate application fee (IC2020): 30.0
Graduate application fee (IC2020): 30.0
Any alternative tuition plans offered by institution (IC2020_RV): 2.0
Tuition payment plan (IC2020_RV): 0.0","What is the typical housing charge for an academic year at Sullivan University in 2023?
",The typical housing charge for an academic year at Sullivan University in 2023 is 6435.0.,../data/final_p1.csv
11,": 126677
UnitID: 141325
institution name: Wesleyan College
year: 2023
CIP2020Title: Psychology, General.
CIP_Code: 420101
SOC2018Title: Clinical and Counseling Psychologists
SOC_Code: 193033
CIPDefinition: A general program that focuses on the scientific study of individual and collective behavior, the physical and environmental bases of behavior, and the analysis and treatment of behavior problems and disorders.  Includes instruction in the principles of the various subfields of psychology, research methods, and psychological assessment and testing methods.
CrossReferences: 30.1701 - Behavioral Sciences.
Institution Name: Wesleyan College
Books and supplies 2023-24 (IC2023_AY): 
On campus  food and housing 2023-24 (IC2023_AY): 11326.0
Off campus (not with family)  food and housing 2023-24 (IC2023_AY): 11326.0
Off campus (not with family)  other expenses 2023-24 (IC2023_AY): 2500.0
Off campus (with family)  other expenses 2023-24 (IC2023_AY): 2500.0
On campus  food and housing 2020-21 (IC2023_AY): 10365.0
Published out-of-state tuition and fees 2023-24 (IC2023_AY): 27650.0
Published in-district tuition and fees 2023-24 (IC2023_AY): 27650.0
Published in-state tuition and fees 2023-24 (IC2023_AY): 27650.0
Institution provide nstitutionally-controlled housing (on-campus and/or off-campus) (IC2023): 1.0
Typical housing charges for an academic year (IC2023): 
Typical food charge for academic year (IC2023): 
Undergraduate application fee (IC2023): 0.0
Graduate application fee (IC2023): 0.0
Any alternative tuition plans offered by institution (IC2023): 1.0
Tuition payment plan (IC2023): 1.0
Average amount of federal  state  local or institutional grant aid awarded (SFA2122): 24800.0
Average amount of federal grant aid awarded to full-time first-time undergraduates (SFA2122): 6118.0
Average amount of Pell grant aid awarded to full-time first-time undergraduates (SFA2122): 5798.0
Average amount of other federal grant aid awarded to full-time first-time undergraduates (SFA2122): 1277.0
Average amount of state/local grant aid awarded to full-time first-time undergraduates (SFA2122): 3883.0
Average amount of institutional grant aid awarded to full-time first-time undergraduates (SFA2122): 17368.0
Average amount of student loans awarded to full-time first-time undergraduates (SFA2122): 6379.0
Average amount of other student loans awarded to full-time first-time undergraduates (SFA2122): 9295.0
Average amount of federal  state  local  institutional or other sources of grant aid awarded to undergraduate students (SFA2122): 19051.0
Average amount Pell grant aid awarded to undergraduate students (SFA2122): 5409.0
Average amount of federal student loans awarded to undergraduate students (SFA2122): 6680.0
Average amount of federal  state  local  institutional or other sources of grant aid awarded to degree/certificate-seeking undergraduate students (SFA2122): 22081.0
Average amount of federal  state  local  institutional or other sources of grant aid awarded to non-degree/non-certificate-seeking undergraduates (SFA2122): 3898.0
Average net price-students awarded grant or scholarship aid  2021-22 (SFA2122): 13900.0
Average net price (income 0-30 000)-students awarded Title IV federal financial aid  2021-22 (SFA2122): 11746.0
Average net price (income 30 001-48 000)-students awarded Title IV federal financial aid  2021-22 (SFA2122): 10285.0
Average net price (income 48 001-75 000)-students awarded Title IV federal financial aid  2021-22 (SFA2122): 16446.0
Average net price (income 75 001-110 000)-students awarded Title IV federal financial aid  2021-22 (SFA2122): 17031.0
Average net price (income over 110 000)-students awarded Title IV federal financial aid  2021-22 (SFA2122): 19440.0
Books and supplies 2022-23 (IC2022_AY): 
On campus  room and board 2022-23 (IC2022_AY): 10996.0
Off campus (not with family)  room and board 2022-23 (IC2022_AY): 10996.0
Off campus (not with family)  other expenses 2022-23 (IC2022_AY): 2500.0
Off campus (with family)  other expenses 2022-23 (IC2022_AY): 2500.0
On campus  room and board 2019-20 (IC2022_AY): 10060.0
Published out-of-state tuition and fees 2022-23 (IC2022_AY): 27650.0
Published in-district tuition and fees 2022-23 (IC2022_AY): 27650.0
Published in-state tuition and fees 2022-23 (IC2022_AY): 27650.0
Institution provide on-campus housing (IC2022): 1.0
Typical room charge for academic year (IC2022): 
Typical board charge for academic year (IC2022): 
Undergraduate application fee (IC2022): 0.0
Graduate application fee (IC2022): 0.0
Any alternative tuition plans offered by institution (IC2022_RV): 1.0
Tuition payment plan (IC2022_RV): 1.0
Average amount of federal  state  local or institutional grant aid awarded (SFA2021_RV): 24118.0
Average amount of federal grant aid awarded to full-time first-time undergraduates (SFA2021_RV): 5788.0
Average amount of Pell grant aid awarded to full-time first-time undergraduates (SFA2021_RV): 5512.0
Average amount of other federal grant aid awarded to full-time first-time undergraduates (SFA2021_RV): 779.0
Average amount of state/local grant aid awarded to full-time first-time undergraduates (SFA2021_RV): 4076.0
Average amount of institutional grant aid awarded to full-time first-time undergraduates (SFA2021_RV): 16521.0
Average amount of student loans awarded to full-time first-time undergraduates (SFA2021_RV): 5878.0
Average amount of other student loans awarded to full-time first-time undergraduates (SFA2021_RV): 8301.0
Average amount of federal  state  local  institutional or other sources of grant aid awarded to undergraduate students (SFA2021_RV): 18208.0
Average amount Pell grant aid awarded to undergraduate students (SFA2021_RV): 5313.0
Average amount of federal student loans awarded to undergraduate students (SFA2021_RV): 6893.0
Average net price-students awarded grant or scholarship aid  2020-21 (SFA2021_RV): 12222.0
Average net price (income 0-30 000)-students awarded Title IV federal financial aid  2020-21 (SFA2021_RV): 9972.0
Average net price (income 30 001-48 000)-students awarded Title IV federal financial aid  2020-21 (SFA2021_RV): 10751.0
Average net price (income 48 001-75 000)-students awarded Title IV federal financial aid  2020-21 (SFA2021_RV): 11235.0
Average net price (income 75 001-110 000)-students awarded Title IV federal financial aid  2020-21 (SFA2021_RV): 18284.0
Average net price (income over 110 000)-students awarded Title IV federal financial aid  2020-21 (SFA2021_RV): 14356.0
Books and supplies 2021-22 (IC2021_AY): 
On campus  room and board 2021-22 (IC2021_AY): 10676.0
Off campus (not with family)  room and board 2021-22 (IC2021_AY): 10676.0
Off campus (not with family)  other expenses 2021-22 (IC2021_AY): 2500.0
Off campus (with family)  other expenses 2021-22 (IC2021_AY): 2500.0
On campus  room and board 2018-19 (IC2021_AY): 9860.0
Published out-of-state tuition and fees 2021-22 (IC2021_AY): 26390.0
Published in-district tuition and fees 2021-22 (IC2021_AY): 26390.0
Published in-state tuition and fees 2021-22 (IC2021_AY): 26390.0
Institution provide on-campus housing (IC2021): 1.0
Typical room charge for academic year (IC2021): 
Typical board charge for academic year (IC2021): 
Undergraduate application fee (IC2021): 0.0
Graduate application fee (IC2021): 0.0
Any alternative tuition plans offered by institution (IC2021): 1.0
Tuition payment plan (IC2021_RV): 1.0
Books and supplies 2020-21 (IC2020_AY): 
On campus  room and board 2020-21 (IC2020_AY): 10365.0
Off campus (not with family)  room and board 2020-21 (IC2020_AY): 10365.0
Off campus (not with family)  other expenses 2020-21 (IC2020_AY): 2500.0
Off campus (with family)  other expenses 2020-21 (IC2020_AY): 2500.0
On campus  room and board 2017-18 (IC2020_AY): 9570.0
Published out-of-state tuition and fees 2020-21 (IC2020_AY): 25190.0
Published in-district tuition and fees 2020-21 (IC2020_AY): 25190.0
Published in-state tuition and fees 2020-21 (IC2020_AY): 25190.0
Institution provide on-campus housing (IC2020): 1.0
Typical room charge for academic year (IC2020): 
Typical board charge for academic year (IC2020): 
Undergraduate application fee (IC2020): 0.0
Graduate application fee (IC2020): 0.0
Any alternative tuition plans offered by institution (IC2020_RV): 1.0
Tuition payment plan (IC2020_RV): 1.0","What is the typical housing charge for an academic year at Wesleyan College in 2023?
",The typical housing charge for an academic year at Wesleyan College in 2023 is not provided in the context.,../data/final_p1.csv
12,": 114435
UnitID: 138354
institution name: University of West Florida
year: 2023
CIP2020Title: Educational/Instructional Technology.
CIP_Code: 130501
SOC2018Title: Librarians and Media Collections Specialists
SOC_Code: 254022
CIPDefinition: A program that focuses on integrating technology into educational curricula. Includes instruction in foundations of educational technology, computer applications, utilizing technology for assessment, multimedia instruction, web-based instruction, distance education, and designing and producing educational software and materials.
CrossReferences: 
Institution Name: University of West Florida
Books and supplies 2023-24 (IC2023_AY): 1600.0
On campus  food and housing 2023-24 (IC2023_AY): 12432.0
Off campus (not with family)  food and housing 2023-24 (IC2023_AY): 14082.0
Off campus (not with family)  other expenses 2023-24 (IC2023_AY): 3024.0
Off campus (with family)  other expenses 2023-24 (IC2023_AY): 3024.0
On campus  food and housing 2020-21 (IC2023_AY): 11268.0
Published out-of-state tuition and fees 2023-24 (IC2023_AY): 19241.0
Published in-district tuition and fees 2023-24 (IC2023_AY): 6360.0
Published in-state tuition and fees 2023-24 (IC2023_AY): 6360.0
Institution provide nstitutionally-controlled housing (on-campus and/or off-campus) (IC2023): 1.0
Typical housing charges for an academic year (IC2023): 6124.0
Typical food charge for academic year (IC2023): 5405.0
Undergraduate application fee (IC2023): 30.0
Graduate application fee (IC2023): 30.0
Any alternative tuition plans offered by institution (IC2023): 1.0
Tuition payment plan (IC2023): 1.0
Average amount of federal  state  local or institutional grant aid awarded (SFA2122): 11515.0
Average amount of federal grant aid awarded to full-time first-time undergraduates (SFA2122): 6208.0
Average amount of Pell grant aid awarded to full-time first-time undergraduates (SFA2122): 6256.0
Average amount of other federal grant aid awarded to full-time first-time undergraduates (SFA2122): 2365.0
Average amount of state/local grant aid awarded to full-time first-time undergraduates (SFA2122): 5892.0
Average amount of institutional grant aid awarded to full-time first-time undergraduates (SFA2122): 3596.0
Average amount of student loans awarded to full-time first-time undergraduates (SFA2122): 6174.0
Average amount of other student loans awarded to full-time first-time undergraduates (SFA2122): 12151.0
Average amount of federal  state  local  institutional or other sources of grant aid awarded to undergraduate students (SFA2122): 8401.0
Average amount Pell grant aid awarded to undergraduate students (SFA2122): 5984.0
Average amount of federal student loans awarded to undergraduate students (SFA2122): 6701.0
Average amount of federal  state  local  institutional or other sources of grant aid awarded to degree/certificate-seeking undergraduate students (SFA2122): 8445.0
Average amount of federal  state  local  institutional or other sources of grant aid awarded to non-degree/non-certificate-seeking undergraduates (SFA2122): 1740.0
Average net price-students awarded grant or scholarship aid  2021-22 (SFA2122): 
Average net price (income 0-30 000)-students awarded Title IV federal financial aid  2021-22 (SFA2122): 
Average net price (income 30 001-48 000)-students awarded Title IV federal financial aid  2021-22 (SFA2122): 
Average net price (income 48 001-75 000)-students awarded Title IV federal financial aid  2021-22 (SFA2122): 
Average net price (income 75 001-110 000)-students awarded Title IV federal financial aid  2021-22 (SFA2122): 
Average net price (income over 110 000)-students awarded Title IV federal financial aid  2021-22 (SFA2122): 
Books and supplies 2022-23 (IC2022_AY): 1600.0
On campus  room and board 2022-23 (IC2022_AY): 11268.0
Off campus (not with family)  room and board 2022-23 (IC2022_AY): 11268.0
Off campus (not with family)  other expenses 2022-23 (IC2022_AY): 2300.0
Off campus (with family)  other expenses 2022-23 (IC2022_AY): 2300.0
On campus  room and board 2019-20 (IC2022_AY): 10062.0
Published out-of-state tuition and fees 2022-23 (IC2022_AY): 19241.0
Published in-district tuition and fees 2022-23 (IC2022_AY): 6360.0
Published in-state tuition and fees 2022-23 (IC2022_AY): 6360.0
Institution provide on-campus housing (IC2022): 1.0
Typical room charge for academic year (IC2022): 5900.0
Typical board charge for academic year (IC2022): 4956.0
Undergraduate application fee (IC2022): 30.0
Graduate application fee (IC2022): 30.0
Any alternative tuition plans offered by institution (IC2022_RV): 1.0
Tuition payment plan (IC2022_RV): 1.0
Average amount of federal  state  local or institutional grant aid awarded (SFA2021_RV): 10774.0
Average amount of federal grant aid awarded to full-time first-time undergraduates (SFA2021_RV): 4684.0
Average amount of Pell grant aid awarded to full-time first-time undergraduates (SFA2021_RV): 5216.0
Average amount of other federal grant aid awarded to full-time first-time undergraduates (SFA2021_RV): 1114.0
Average amount of state/local grant aid awarded to full-time first-time undergraduates (SFA2021_RV): 5635.0
Average amount of institutional grant aid awarded to full-time first-time undergraduates (SFA2021_RV): 4154.0
Average amount of student loans awarded to full-time first-time undergraduates (SFA2021_RV): 5202.0
Average amount of other student loans awarded to full-time first-time undergraduates (SFA2021_RV): 10351.0
Average amount of federal  state  local  institutional or other sources of grant aid awarded to undergraduate students (SFA2021_RV): 6113.0
Average amount Pell grant aid awarded to undergraduate students (SFA2021_RV): 4675.0
Average amount of federal student loans awarded to undergraduate students (SFA2021_RV): 6463.0
Average net price-students awarded grant or scholarship aid  2020-21 (SFA2021_RV): 
Average net price (income 0-30 000)-students awarded Title IV federal financial aid  2020-21 (SFA2021_RV): 
Average net price (income 30 001-48 000)-students awarded Title IV federal financial aid  2020-21 (SFA2021_RV): 
Average net price (income 48 001-75 000)-students awarded Title IV federal financial aid  2020-21 (SFA2021_RV): 
Average net price (income 75 001-110 000)-students awarded Title IV federal financial aid  2020-21 (SFA2021_RV): 
Average net price (income over 110 000)-students awarded Title IV federal financial aid  2020-21 (SFA2021_RV): 
Books and supplies 2021-22 (IC2021_AY): 1600.0
On campus  room and board 2021-22 (IC2021_AY): 11268.0
Off campus (not with family)  room and board 2021-22 (IC2021_AY): 11268.0
Off campus (not with family)  other expenses 2021-22 (IC2021_AY): 2300.0
Off campus (with family)  other expenses 2021-22 (IC2021_AY): 2300.0
On campus  room and board 2018-19 (IC2021_AY): 9354.0
Published out-of-state tuition and fees 2021-22 (IC2021_AY): 19241.0
Published in-district tuition and fees 2021-22 (IC2021_AY): 6360.0
Published in-state tuition and fees 2021-22 (IC2021_AY): 6360.0
Institution provide on-campus housing (IC2021): 1.0
Typical room charge for academic year (IC2021): 5900.0
Typical board charge for academic year (IC2021): 4590.0
Undergraduate application fee (IC2021): 30.0
Graduate application fee (IC2021): 30.0
Any alternative tuition plans offered by institution (IC2021): 1.0
Tuition payment plan (IC2021_RV): 1.0
Books and supplies 2020-21 (IC2020_AY): 1600.0
On campus  room and board 2020-21 (IC2020_AY): 11268.0
Off campus (not with family)  room and board 2020-21 (IC2020_AY): 11268.0
Off campus (not with family)  other expenses 2020-21 (IC2020_AY): 2300.0
Off campus (with family)  other expenses 2020-21 (IC2020_AY): 2300.0
On campus  room and board 2017-18 (IC2020_AY): 9354.0
Published out-of-state tuition and fees 2020-21 (IC2020_AY): 19241.0
Published in-district tuition and fees 2020-21 (IC2020_AY): 6360.0
Published in-state tuition and fees 2020-21 (IC2020_AY): 6360.0
Institution provide on-campus housing (IC2020): 1.0
Typical room charge for academic year (IC2020): 5900.0
Typical board charge for academic year (IC2020): 4478.0
Undergraduate application fee (IC2020): 30.0
Graduate application fee (IC2020): 30.0
Any alternative tuition plans offered by institution (IC2020_RV): 1.0
Tuition payment plan (IC2020_RV): 1.0","What is the typical food charge for an academic year at the University of West Florida?
",The typical food charge for an academic year at the University of West Florida is 5405.0.,../data/final_p1.csv
13,": 175289
UnitID: 153603
institution name: Iowa State University
year: 2023
CIP2020Title: Applied Mathematics, General.
CIP_Code: 270301
SOC2018Title: Mathematicians
SOC_Code: 152021
CIPDefinition: A program that focuses on the application of mathematics to the solution of functional problems in fields such as engineering and the applied sciences.  Includes instruction in natural phenomena modeling continuum mechanics, reaction-diffusion, wave propagation, dynamic systems, numerical analysis, controlled theory, asymptotic methods, variation, optimization theory, inverse problems, and applications to specific scientific and industrial topics.
CrossReferences: 
Institution Name: Iowa State University
Books and supplies 2023-24 (IC2023_AY): 1091.0
On campus  food and housing 2023-24 (IC2023_AY): 9726.0
Off campus (not with family)  food and housing 2023-24 (IC2023_AY): 9726.0
Off campus (not with family)  other expenses 2023-24 (IC2023_AY): 2890.0
Off campus (with family)  other expenses 2023-24 (IC2023_AY): 2890.0
On campus  food and housing 2020-21 (IC2023_AY): 9193.0
Published out-of-state tuition and fees 2023-24 (IC2023_AY): 27683.0
Published in-district tuition and fees 2023-24 (IC2023_AY): 10497.0
Published in-state tuition and fees 2023-24 (IC2023_AY): 10497.0
Institution provide nstitutionally-controlled housing (on-campus and/or off-campus) (IC2023): 1.0
Typical housing charges for an academic year (IC2023): 4862.0
Typical food charge for academic year (IC2023): 4864.0
Undergraduate application fee (IC2023): 40.0
Graduate application fee (IC2023): 60.0
Any alternative tuition plans offered by institution (IC2023): 1.0
Tuition payment plan (IC2023): 1.0
Average amount of federal  state  local or institutional grant aid awarded (SFA2122): 11043.0
Average amount of federal grant aid awarded to full-time first-time undergraduates (SFA2122): 4556.0
Average amount of Pell grant aid awarded to full-time first-time undergraduates (SFA2122): 4784.0
Average amount of other federal grant aid awarded to full-time first-time undergraduates (SFA2122): 2433.0
Average amount of state/local grant aid awarded to full-time first-time undergraduates (SFA2122): 4376.0
Average amount of institutional grant aid awarded to full-time first-time undergraduates (SFA2122): 9377.0
Average amount of student loans awarded to full-time first-time undergraduates (SFA2122): 7620.0
Average amount of other student loans awarded to full-time first-time undergraduates (SFA2122): 11787.0
Average amount of federal  state  local  institutional or other sources of grant aid awarded to undergraduate students (SFA2122): 9461.0
Average amount Pell grant aid awarded to undergraduate students (SFA2122): 4826.0
Average amount of federal student loans awarded to undergraduate students (SFA2122): 6070.0
Average amount of federal  state  local  institutional or other sources of grant aid awarded to degree/certificate-seeking undergraduate students (SFA2122): 9467.0
Average amount of federal  state  local  institutional or other sources of grant aid awarded to non-degree/non-certificate-seeking undergraduates (SFA2122): 2361.0
Average net price-students awarded grant or scholarship aid  2021-22 (SFA2122): 
Average net price (income 0-30 000)-students awarded Title IV federal financial aid  2021-22 (SFA2122): 
Average net price (income 30 001-48 000)-students awarded Title IV federal financial aid  2021-22 (SFA2122): 
Average net price (income 48 001-75 000)-students awarded Title IV federal financial aid  2021-22 (SFA2122): 
Average net price (income 75 001-110 000)-students awarded Title IV federal financial aid  2021-22 (SFA2122): 
Average net price (income over 110 000)-students awarded Title IV federal financial aid  2021-22 (SFA2122): 
Books and supplies 2022-23 (IC2022_AY): 1091.0
On campus  room and board 2022-23 (IC2022_AY): 9358.0
Off campus (not with family)  room and board 2022-23 (IC2022_AY): 9358.0
Off campus (not with family)  other expenses 2022-23 (IC2022_AY): 2890.0
Off campus (with family)  other expenses 2022-23 (IC2022_AY): 2890.0
On campus  room and board 2019-20 (IC2022_AY): 9149.0
Published out-of-state tuition and fees 2022-23 (IC2022_AY): 26617.0
Published in-district tuition and fees 2022-23 (IC2022_AY): 10133.0
Published in-state tuition and fees 2022-23 (IC2022_AY): 10133.0
Institution provide on-campus housing (IC2022): 1.0
Typical room charge for academic year (IC2022): 4725.0
Typical board charge for academic year (IC2022): 4633.0
Undergraduate application fee (IC2022): 40.0
Graduate application fee (IC2022): 60.0
Any alternative tuition plans offered by institution (IC2022_RV): 1.0
Tuition payment plan (IC2022_RV): 1.0
Average amount of federal  state  local or institutional grant aid awarded (SFA2021_RV): 8833.0
Average amount of federal grant aid awarded to full-time first-time undergraduates (SFA2021_RV): 4577.0
Average amount of Pell grant aid awarded to full-time first-time undergraduates (SFA2021_RV): 4818.0
Average amount of other federal grant aid awarded to full-time first-time undergraduates (SFA2021_RV): 1687.0
Average amount of state/local grant aid awarded to full-time first-time undergraduates (SFA2021_RV): 3930.0
Average amount of institutional grant aid awarded to full-time first-time undergraduates (SFA2021_RV): 7429.0
Average amount of student loans awarded to full-time first-time undergraduates (SFA2021_RV): 7684.0
Average amount of other student loans awarded to full-time first-time undergraduates (SFA2021_RV): 11630.0
Average amount of federal  state  local  institutional or other sources of grant aid awarded to undergraduate students (SFA2021_RV): 8659.0
Average amount Pell grant aid awarded to undergraduate students (SFA2021_RV): 4736.0
Average amount of federal student loans awarded to undergraduate students (SFA2021_RV): 6142.0
Average net price-students awarded grant or scholarship aid  2020-21 (SFA2021_RV): 
Average net price (income 0-30 000)-students awarded Title IV federal financial aid  2020-21 (SFA2021_RV): 
Average net price (income 30 001-48 000)-students awarded Title IV federal financial aid  2020-21 (SFA2021_RV): 
Average net price (income 48 001-75 000)-students awarded Title IV federal financial aid  2020-21 (SFA2021_RV): 
Average net price (income 75 001-110 000)-students awarded Title IV federal financial aid  2020-21 (SFA2021_RV): 
Average net price (income over 110 000)-students awarded Title IV federal financial aid  2020-21 (SFA2021_RV): 
Books and supplies 2021-22 (IC2021_AY): 1000.0
On campus  room and board 2021-22 (IC2021_AY): 9088.0
Off campus (not with family)  room and board 2021-22 (IC2021_AY): 9088.0
Off campus (not with family)  other expenses 2021-22 (IC2021_AY): 2430.0
Off campus (with family)  other expenses 2021-22 (IC2021_AY): 2430.0
On campus  room and board 2018-19 (IC2021_AY): 8720.0
Published out-of-state tuition and fees 2021-22 (IC2021_AY): 25446.0
Published in-district tuition and fees 2021-22 (IC2021_AY): 9634.0
Published in-state tuition and fees 2021-22 (IC2021_AY): 9634.0
Institution provide on-campus housing (IC2021): 1.0
Typical room charge for academic year (IC2021): 4590.0
Typical board charge for academic year (IC2021): 4498.0
Undergraduate application fee (IC2021): 40.0
Graduate application fee (IC2021): 60.0
Any alternative tuition plans offered by institution (IC2021): 1.0
Tuition payment plan (IC2021_RV): 1.0
Books and supplies 2020-21 (IC2020_AY): 1001.0
On campus  room and board 2020-21 (IC2020_AY): 9193.0
Off campus (not with family)  room and board 2020-21 (IC2020_AY): 9193.0
Off campus (not with family)  other expenses 2020-21 (IC2020_AY): 2430.0
Off campus (with family)  other expenses 2020-21 (IC2020_AY): 2430.0
On campus  room and board 2017-18 (IC2020_AY): 8546.0
Published out-of-state tuition and fees 2020-21 (IC2020_AY): 24504.0
Published in-district tuition and fees 2020-21 (IC2020_AY): 9316.0
Published in-state tuition and fees 2020-21 (IC2020_AY): 9316.0
Institution provide on-campus housing (IC2020): 1.0
Typical room charge for academic year (IC2020): 4783.0
Typical board charge for academic year (IC2020): 4410.0
Undergraduate application fee (IC2020): 40.0
Graduate application fee (IC2020): 60.0
Any alternative tuition plans offered by institution (IC2020_RV): 1.0
Tuition payment plan (IC2020_RV): 1.0","What is the typical food charge for an academic year at Iowa State University in 2023?
",The typical food charge for an academic year at Iowa State University in 2023 is 4864.0.,../data/final_p1.csv
14,": 79168
AREA: 99
AREA_TITLE: U.S.
AREA_TYPE: 1
PRIM_STATE: US
NAICS: 493000
NAICS_TITLE: Warehousing and Storage
I_GROUP: 3-digit
OWN_CODE: 5
OCC_CODE: 11-3120
OCC_TITLE: Human Resources Managers
O_GROUP: broad
TOT_EMP: 1,800
EMP_PRSE: 2.2
JOBS_1000: 
LOC_QUOTIENT: 
PCT_TOTAL: 0.09
PCT_RPT: 6
H_MEAN: 60.97
A_MEAN: 126,820
MEAN_PRSE: 1.0
H_PCT10: 39.05
H_PCT25: 47.79
H_MEDIAN: 60.00
H_PCT75: 73.82
H_PCT90: 82.77
A_PCT10: 81,220
A_PCT25: 99,400
A_MEDIAN: 124,800
A_PCT75: 153,540
A_PCT90: 172,160
ANNUAL: 
HOURLY: 
SOC_Code: 113120","What is the median annual salary for human resources managers in the U.S.?
","$124,800",../data/final_p2.csv
15,": 414314
UnitID: 204848
institution name: Ohio University-Lancaster Campus
year: 2023
CIP2020Title: Geography and Environmental Studies.
CIP_Code: 304401
SOC2018Title: Environmental Scientists and Specialists, Including Health
SOC_Code: 192041
CIPDefinition: A program that focuses on interactions between people and the natural and built environments. Includes instruction in climate science, sustainability, environmental science and policy, research methods, geographic information systems (GIS), human geography, physical geography, remote sensing, and public policy.
CrossReferences: 45.0701 - Geography., 03.0103 - Environmental Studies.
Institution Name: Ohio University-Lancaster Campus
Books and supplies 2023-24 (IC2023_AY): 840.0
On campus  food and housing 2023-24 (IC2023_AY): 
Off campus (not with family)  food and housing 2023-24 (IC2023_AY): 6632.0
Off campus (not with family)  other expenses 2023-24 (IC2023_AY): 3670.0
Off campus (with family)  other expenses 2023-24 (IC2023_AY): 3308.0
On campus  food and housing 2020-21 (IC2023_AY): 
Published out-of-state tuition and fees 2023-24 (IC2023_AY): 9170.0
Published in-district tuition and fees 2023-24 (IC2023_AY): 6178.0
Published in-state tuition and fees 2023-24 (IC2023_AY): 6178.0
Institution provide nstitutionally-controlled housing (on-campus and/or off-campus) (IC2023): 2.0
Typical housing charges for an academic year (IC2023): 
Typical food charge for academic year (IC2023): 
Undergraduate application fee (IC2023): 20.0
Graduate application fee (IC2023): 
Any alternative tuition plans offered by institution (IC2023): 1.0
Tuition payment plan (IC2023): 1.0
Average amount of federal  state  local or institutional grant aid awarded (SFA2122): 5572.0
Average amount of federal grant aid awarded to full-time first-time undergraduates (SFA2122): 5000.0
Average amount of Pell grant aid awarded to full-time first-time undergraduates (SFA2122): 4128.0
Average amount of other federal grant aid awarded to full-time first-time undergraduates (SFA2122): 2156.0
Average amount of state/local grant aid awarded to full-time first-time undergraduates (SFA2122): 681.0
Average amount of institutional grant aid awarded to full-time first-time undergraduates (SFA2122): 3736.0
Average amount of student loans awarded to full-time first-time undergraduates (SFA2122): 3555.0
Average amount of other student loans awarded to full-time first-time undergraduates (SFA2122): 2500.0
Average amount of federal  state  local  institutional or other sources of grant aid awarded to undergraduate students (SFA2122): 5464.0
Average amount Pell grant aid awarded to undergraduate students (SFA2122): 4318.0
Average amount of federal student loans awarded to undergraduate students (SFA2122): 4668.0
Average amount of federal  state  local  institutional or other sources of grant aid awarded to degree/certificate-seeking undergraduate students (SFA2122): 5464.0
Average amount of federal  state  local  institutional or other sources of grant aid awarded to non-degree/non-certificate-seeking undergraduates (SFA2122): 
Average net price-students awarded grant or scholarship aid  2021-22 (SFA2122): 
Average net price (income 0-30 000)-students awarded Title IV federal financial aid  2021-22 (SFA2122): 
Average net price (income 30 001-48 000)-students awarded Title IV federal financial aid  2021-22 (SFA2122): 
Average net price (income 48 001-75 000)-students awarded Title IV federal financial aid  2021-22 (SFA2122): 
Average net price (income 75 001-110 000)-students awarded Title IV federal financial aid  2021-22 (SFA2122): 
Average net price (income over 110 000)-students awarded Title IV federal financial aid  2021-22 (SFA2122): 
Books and supplies 2022-23 (IC2022_AY): 788.0
On campus  room and board 2022-23 (IC2022_AY): 
Off campus (not with family)  room and board 2022-23 (IC2022_AY): 6228.0
Off campus (not with family)  other expenses 2022-23 (IC2022_AY): 3446.0
Off campus (with family)  other expenses 2022-23 (IC2022_AY): 3106.0
On campus  room and board 2019-20 (IC2022_AY): 
Published out-of-state tuition and fees 2022-23 (IC2022_AY): 8996.0
Published in-district tuition and fees 2022-23 (IC2022_AY): 6004.0
Published in-state tuition and fees 2022-23 (IC2022_AY): 6004.0
Institution provide on-campus housing (IC2022): 2.0
Typical room charge for academic year (IC2022): 
Typical board charge for academic year (IC2022): 
Undergraduate application fee (IC2022): 20.0
Graduate application fee (IC2022): 
Any alternative tuition plans offered by institution (IC2022_RV): 1.0
Tuition payment plan (IC2022_RV): 1.0
Average amount of federal  state  local or institutional grant aid awarded (SFA2021_RV): 3861.0
Average amount of federal grant aid awarded to full-time first-time undergraduates (SFA2021_RV): 4515.0
Average amount of Pell grant aid awarded to full-time first-time undergraduates (SFA2021_RV): 4280.0
Average amount of other federal grant aid awarded to full-time first-time undergraduates (SFA2021_RV): 1556.0
Average amount of state/local grant aid awarded to full-time first-time undergraduates (SFA2021_RV): 1713.0
Average amount of institutional grant aid awarded to full-time first-time undergraduates (SFA2021_RV): 1815.0
Average amount of student loans awarded to full-time first-time undergraduates (SFA2021_RV): 3384.0
Average amount of other student loans awarded to full-time first-time undergraduates (SFA2021_RV): 4533.0
Average amount of federal  state  local  institutional or other sources of grant aid awarded to undergraduate students (SFA2021_RV): 4536.0
Average amount Pell grant aid awarded to undergraduate students (SFA2021_RV): 4380.0
Average amount of federal student loans awarded to undergraduate students (SFA2021_RV): 4485.0
Average net price-students awarded grant or scholarship aid  2020-21 (SFA2021_RV): 
Average net price (income 0-30 000)-students awarded Title IV federal financial aid  2020-21 (SFA2021_RV): 
Average net price (income 30 001-48 000)-students awarded Title IV federal financial aid  2020-21 (SFA2021_RV): 
Average net price (income 48 001-75 000)-students awarded Title IV federal financial aid  2020-21 (SFA2021_RV): 
Average net price (income 75 001-110 000)-students awarded Title IV federal financial aid  2020-21 (SFA2021_RV): 
Average net price (income over 110 000)-students awarded Title IV federal financial aid  2020-21 (SFA2021_RV): 
Books and supplies 2021-22 (IC2021_AY): 918.0
On campus  room and board 2021-22 (IC2021_AY): 
Off campus (not with family)  room and board 2021-22 (IC2021_AY): 6228.0
Off campus (not with family)  other expenses 2021-22 (IC2021_AY): 4472.0
Off campus (with family)  other expenses 2021-22 (IC2021_AY): 5054.0
On campus  room and board 2018-19 (IC2021_AY): 
Published out-of-state tuition and fees 2021-22 (IC2021_AY): 8766.0
Published in-district tuition and fees 2021-22 (IC2021_AY): 5774.0
Published in-state tuition and fees 2021-22 (IC2021_AY): 5774.0
Institution provide on-campus housing (IC2021): 2.0
Typical room charge for academic year (IC2021): 
Typical board charge for academic year (IC2021): 
Undergraduate application fee (IC2021): 20.0
Graduate application fee (IC2021): 
Any alternative tuition plans offered by institution (IC2021): 1.0
Tuition payment plan (IC2021_RV): 1.0
Books and supplies 2020-21 (IC2020_AY): 984.0
On campus  room and board 2020-21 (IC2020_AY): 
Off campus (not with family)  room and board 2020-21 (IC2020_AY): 6142.0
Off campus (not with family)  other expenses 2020-21 (IC2020_AY): 4410.0
Off campus (with family)  other expenses 2020-21 (IC2020_AY): 4994.0
On campus  room and board 2017-18 (IC2020_AY): 
Published out-of-state tuition and fees 2020-21 (IC2020_AY): 8666.0
Published in-district tuition and fees 2020-21 (IC2020_AY): 5674.0
Published in-state tuition and fees 2020-21 (IC2020_AY): 5674.0
Institution provide on-campus housing (IC2020): 2.0
Typical room charge for academic year (IC2020): 
Typical board charge for academic year (IC2020): 
Undergraduate application fee (IC2020): 20.0
Graduate application fee (IC2020): 
Any alternative tuition plans offered by institution (IC2020_RV): 1.0
Tuition payment plan (IC2020_RV): 1.0","What is the average amount of federal grant aid awarded to full-time first-time undergraduates at Ohio University-Lancaster Campus in 2023?
",5000.0,../data/final_p1.csv
16,": 91789
UnitID: 130697
institution name: Wesleyan University
year: 2023
CIP2020Title: Econometrics and Quantitative Economics.
CIP_Code: 450603
SOC2018Title: Economists
SOC_Code: 193011
CIPDefinition: A program that focuses on the systematic study of mathematical and statistical analysis of economic phenomena and problems.  Includes instruction in economic statistics, optimization theory, cost/benefit analysis, price theory, economic modeling, and economic forecasting and evaluation.
CrossReferences: 30.4901 - Mathematical Economics.
Institution Name: Wesleyan University
Books and supplies 2023-24 (IC2023_AY): 1200.0
On campus  food and housing 2023-24 (IC2023_AY): 19034.0
Off campus (not with family)  food and housing 2023-24 (IC2023_AY): 
Off campus (not with family)  other expenses 2023-24 (IC2023_AY): 
Off campus (with family)  other expenses 2023-24 (IC2023_AY): 
On campus  food and housing 2020-21 (IC2023_AY): 16384.0
Published out-of-state tuition and fees 2023-24 (IC2023_AY): 67316.0
Published in-district tuition and fees 2023-24 (IC2023_AY): 67316.0
Published in-state tuition and fees 2023-24 (IC2023_AY): 67316.0
Institution provide nstitutionally-controlled housing (on-campus and/or off-campus) (IC2023): 1.0
Typical housing charges for an academic year (IC2023): 
Typical food charge for academic year (IC2023): 
Undergraduate application fee (IC2023): 65.0
Graduate application fee (IC2023): 0.0
Any alternative tuition plans offered by institution (IC2023): 1.0
Tuition payment plan (IC2023): 1.0
Average amount of federal  state  local or institutional grant aid awarded (SFA2122): 59825.0
Average amount of federal grant aid awarded to full-time first-time undergraduates (SFA2122): 5594.0
Average amount of Pell grant aid awarded to full-time first-time undergraduates (SFA2122): 5154.0
Average amount of other federal grant aid awarded to full-time first-time undergraduates (SFA2122): 3415.0
Average amount of state/local grant aid awarded to full-time first-time undergraduates (SFA2122): 2593.0
Average amount of institutional grant aid awarded to full-time first-time undergraduates (SFA2122): 58780.0
Average amount of student loans awarded to full-time first-time undergraduates (SFA2122): 9716.0
Average amount of other student loans awarded to full-time first-time undergraduates (SFA2122): 32496.0
Average amount of federal  state  local  institutional or other sources of grant aid awarded to undergraduate students (SFA2122): 58506.0
Average amount Pell grant aid awarded to undergraduate students (SFA2122): 5036.0
Average amount of federal student loans awarded to undergraduate students (SFA2122): 4909.0
Average amount of federal  state  local  institutional or other sources of grant aid awarded to degree/certificate-seeking undergraduate students (SFA2122): 58565.0
Average amount of federal  state  local  institutional or other sources of grant aid awarded to non-degree/non-certificate-seeking undergraduates (SFA2122): 17798.0
Average net price-students awarded grant or scholarship aid  2021-22 (SFA2122): 21270.0
Average net price (income 0-30 000)-students awarded Title IV federal financial aid  2021-22 (SFA2122): 5122.0
Average net price (income 30 001-48 000)-students awarded Title IV federal financial aid  2021-22 (SFA2122): 3847.0
Average net price (income 48 001-75 000)-students awarded Title IV federal financial aid  2021-22 (SFA2122): 6975.0
Average net price (income 75 001-110 000)-students awarded Title IV federal financial aid  2021-22 (SFA2122): 15364.0
Average net price (income over 110 000)-students awarded Title IV federal financial aid  2021-22 (SFA2122): 44356.0
Books and supplies 2022-23 (IC2022_AY): 1200.0
On campus  room and board 2022-23 (IC2022_AY): 18180.0
Off campus (not with family)  room and board 2022-23 (IC2022_AY): 
Off campus (not with family)  other expenses 2022-23 (IC2022_AY): 
Off campus (with family)  other expenses 2022-23 (IC2022_AY): 
On campus  room and board 2019-20 (IC2022_AY): 15724.0
Published out-of-state tuition and fees 2022-23 (IC2022_AY): 64322.0
Published in-district tuition and fees 2022-23 (IC2022_AY): 64322.0
Published in-state tuition and fees 2022-23 (IC2022_AY): 64322.0
Institution provide on-campus housing (IC2022): 1.0
Typical room charge for academic year (IC2022): 
Typical board charge for academic year (IC2022): 
Undergraduate application fee (IC2022): 65.0
Graduate application fee (IC2022): 0.0
Any alternative tuition plans offered by institution (IC2022_RV): 1.0
Tuition payment plan (IC2022_RV): 1.0
Average amount of federal  state  local or institutional grant aid awarded (SFA2021_RV): 58925.0
Average amount of federal grant aid awarded to full-time first-time undergraduates (SFA2021_RV): 7148.0
Average amount of Pell grant aid awarded to full-time first-time undergraduates (SFA2021_RV): 5244.0
Average amount of other federal grant aid awarded to full-time first-time undergraduates (SFA2021_RV): 3420.0
Average amount of state/local grant aid awarded to full-time first-time undergraduates (SFA2021_RV): 2514.0
Average amount of institutional grant aid awarded to full-time first-time undergraduates (SFA2021_RV): 55516.0
Average amount of student loans awarded to full-time first-time undergraduates (SFA2021_RV): 7079.0
Average amount of other student loans awarded to full-time first-time undergraduates (SFA2021_RV): 27881.0
Average amount of federal  state  local  institutional or other sources of grant aid awarded to undergraduate students (SFA2021_RV): 55564.0
Average amount Pell grant aid awarded to undergraduate students (SFA2021_RV): 5021.0
Average amount of federal student loans awarded to undergraduate students (SFA2021_RV): 4816.0
Average net price-students awarded grant or scholarship aid  2020-21 (SFA2021_RV): 20535.0
Average net price (income 0-30 000)-students awarded Title IV federal financial aid  2020-21 (SFA2021_RV): 4449.0
Average net price (income 30 001-48 000)-students awarded Title IV federal financial aid  2020-21 (SFA2021_RV): 4800.0
Average net price (income 48 001-75 000)-students awarded Title IV federal financial aid  2020-21 (SFA2021_RV): 10298.0
Average net price (income 75 001-110 000)-students awarded Title IV federal financial aid  2020-21 (SFA2021_RV): 14835.0
Average net price (income over 110 000)-students awarded Title IV federal financial aid  2020-21 (SFA2021_RV): 51016.0
Books and supplies 2021-22 (IC2021_AY): 1200.0
On campus  room and board 2021-22 (IC2021_AY): 17531.0
Off campus (not with family)  room and board 2021-22 (IC2021_AY): 
Off campus (not with family)  other expenses 2021-22 (IC2021_AY): 
Off campus (with family)  other expenses 2021-22 (IC2021_AY): 
On campus  room and board 2018-19 (IC2021_AY): 15060.0
Published out-of-state tuition and fees 2021-22 (IC2021_AY): 62049.0
Published in-district tuition and fees 2021-22 (IC2021_AY): 62049.0
Published in-state tuition and fees 2021-22 (IC2021_AY): 62049.0
Institution provide on-campus housing (IC2021): 1.0
Typical room charge for academic year (IC2021): 
Typical board charge for academic year (IC2021): 
Undergraduate application fee (IC2021): 55.0
Graduate application fee (IC2021): 0.0
Any alternative tuition plans offered by institution (IC2021): 1.0
Tuition payment plan (IC2021_RV): 1.0
Books and supplies 2020-21 (IC2020_AY): 1200.0
On campus  room and board 2020-21 (IC2020_AY): 16384.0
Off campus (not with family)  room and board 2020-21 (IC2020_AY): 
Off campus (not with family)  other expenses 2020-21 (IC2020_AY): 
Off campus (with family)  other expenses 2020-21 (IC2020_AY): 
On campus  room and board 2017-18 (IC2020_AY): 14466.0
Published out-of-state tuition and fees 2020-21 (IC2020_AY): 59686.0
Published in-district tuition and fees 2020-21 (IC2020_AY): 59686.0
Published in-state tuition and fees 2020-21 (IC2020_AY): 59686.0
Institution provide on-campus housing (IC2020): 1.0
Typical room charge for academic year (IC2020): 
Typical board charge for academic year (IC2020): 
Undergraduate application fee (IC2020): 55.0
Graduate application fee (IC2020): 0.0
Any alternative tuition plans offered by institution (IC2020_RV): 1.0
Tuition payment plan (IC2020_RV): 1.0","What is the cost of books and supplies for the 2023-24 academic year at Wesleyan University?
",1200.0,../data/final_p1.csv
17,": 266150
UnitID: 174020
institution name: Metropolitan State University
year: 2023
CIP2020Title: Professional, Technical, Business, and Scientific Writing.
CIP_Code: 231303
SOC2018Title: Technical Writers
SOC_Code: 273042
CIPDefinition: A program that focuses on professional, technical, business, and scientific writing; and that prepares individuals for academic positions or for professional careers as writers, editors, researchers, and related careers in business, government, non-profits, and the professions. Includes instruction in theories of rhetoric, writing, and digital literacy; document design, production, and management; visual rhetoric and multimedia composition; documentation development; usability testing; web writing; and publishing in print and electronic media.
CrossReferences: 09.0908 - Technical and Scientific Communication.
Institution Name: Metropolitan State University
Books and supplies 2023-24 (IC2023_AY): 1500.0
On campus  food and housing 2023-24 (IC2023_AY): 
Off campus (not with family)  food and housing 2023-24 (IC2023_AY): 15864.0
Off campus (not with family)  other expenses 2023-24 (IC2023_AY): 9064.0
Off campus (with family)  other expenses 2023-24 (IC2023_AY): 9064.0
On campus  food and housing 2020-21 (IC2023_AY): 
Published out-of-state tuition and fees 2023-24 (IC2023_AY): 9780.0
Published in-district tuition and fees 2023-24 (IC2023_AY): 9780.0
Published in-state tuition and fees 2023-24 (IC2023_AY): 9780.0
Institution provide nstitutionally-controlled housing (on-campus and/or off-campus) (IC2023): 2.0
Typical housing charges for an academic year (IC2023): 
Typical food charge for academic year (IC2023): 
Undergraduate application fee (IC2023): 0.0
Graduate application fee (IC2023): 20.0
Any alternative tuition plans offered by institution (IC2023): 1.0
Tuition payment plan (IC2023): 1.0
Average amount of federal  state  local or institutional grant aid awarded (SFA2122): 8322.0
Average amount of federal grant aid awarded to full-time first-time undergraduates (SFA2122): 6246.0
Average amount of Pell grant aid awarded to full-time first-time undergraduates (SFA2122): 5159.0
Average amount of other federal grant aid awarded to full-time first-time undergraduates (SFA2122): 2402.0
Average amount of state/local grant aid awarded to full-time first-time undergraduates (SFA2122): 2491.0
Average amount of institutional grant aid awarded to full-time first-time undergraduates (SFA2122): 
Average amount of student loans awarded to full-time first-time undergraduates (SFA2122): 4941.0
Average amount of other student loans awarded to full-time first-time undergraduates (SFA2122): 
Average amount of federal  state  local  institutional or other sources of grant aid awarded to undergraduate students (SFA2122): 4570.0
Average amount Pell grant aid awarded to undergraduate students (SFA2122): 3761.0
Average amount of federal student loans awarded to undergraduate students (SFA2122): 7348.0
Average amount of federal  state  local  institutional or other sources of grant aid awarded to degree/certificate-seeking undergraduate students (SFA2122): 4749.0
Average amount of federal  state  local  institutional or other sources of grant aid awarded to non-degree/non-certificate-seeking undergraduates (SFA2122): 773.0
Average net price-students awarded grant or scholarship aid  2021-22 (SFA2122): 
Average net price (income 0-30 000)-students awarded Title IV federal financial aid  2021-22 (SFA2122): 
Average net price (income 30 001-48 000)-students awarded Title IV federal financial aid  2021-22 (SFA2122): 
Average net price (income 48 001-75 000)-students awarded Title IV federal financial aid  2021-22 (SFA2122): 
Average net price (income 75 001-110 000)-students awarded Title IV federal financial aid  2021-22 (SFA2122): 
Average net price (income over 110 000)-students awarded Title IV federal financial aid  2021-22 (SFA2122): 
Books and supplies 2022-23 (IC2022_AY): 1500.0
On campus  room and board 2022-23 (IC2022_AY): 
Off campus (not with family)  room and board 2022-23 (IC2022_AY): 11644.0
Off campus (not with family)  other expenses 2022-23 (IC2022_AY): 11188.0
Off campus (with family)  other expenses 2022-23 (IC2022_AY): 11188.0
On campus  room and board 2019-20 (IC2022_AY): 
Published out-of-state tuition and fees 2022-23 (IC2022_AY): 9684.0
Published in-district tuition and fees 2022-23 (IC2022_AY): 9684.0
Published in-state tuition and fees 2022-23 (IC2022_AY): 9684.0
Institution provide on-campus housing (IC2022): 2.0
Typical room charge for academic year (IC2022): 
Typical board charge for academic year (IC2022): 
Undergraduate application fee (IC2022): 0.0
Graduate application fee (IC2022): 20.0
Any alternative tuition plans offered by institution (IC2022_RV): 1.0
Tuition payment plan (IC2022_RV): 1.0
Average amount of federal  state  local or institutional grant aid awarded (SFA2021_RV): 6790.0
Average amount of federal grant aid awarded to full-time first-time undergraduates (SFA2021_RV): 4978.0
Average amount of Pell grant aid awarded to full-time first-time undergraduates (SFA2021_RV): 5058.0
Average amount of other federal grant aid awarded to full-time first-time undergraduates (SFA2021_RV): 1278.0
Average amount of state/local grant aid awarded to full-time first-time undergraduates (SFA2021_RV): 2129.0
Average amount of institutional grant aid awarded to full-time first-time undergraduates (SFA2021_RV): 1732.0
Average amount of student loans awarded to full-time first-time undergraduates (SFA2021_RV): 4675.0
Average amount of other student loans awarded to full-time first-time undergraduates (SFA2021_RV): 
Average amount of federal  state  local  institutional or other sources of grant aid awarded to undergraduate students (SFA2021_RV): 3778.0
Average amount Pell grant aid awarded to undergraduate students (SFA2021_RV): 3795.0
Average amount of federal student loans awarded to undergraduate students (SFA2021_RV): 7383.0
Average net price-students awarded grant or scholarship aid  2020-21 (SFA2021_RV): 
Average net price (income 0-30 000)-students awarded Title IV federal financial aid  2020-21 (SFA2021_RV): 
Average net price (income 30 001-48 000)-students awarded Title IV federal financial aid  2020-21 (SFA2021_RV): 
Average net price (income 48 001-75 000)-students awarded Title IV federal financial aid  2020-21 (SFA2021_RV): 
Average net price (income 75 001-110 000)-students awarded Title IV federal financial aid  2020-21 (SFA2021_RV): 
Average net price (income over 110 000)-students awarded Title IV federal financial aid  2020-21 (SFA2021_RV): 
Books and supplies 2021-22 (IC2021_AY): 1500.0
On campus  room and board 2021-22 (IC2021_AY): 
Off campus (not with family)  room and board 2021-22 (IC2021_AY): 11644.0
Off campus (not with family)  other expenses 2021-22 (IC2021_AY): 11188.0
Off campus (with family)  other expenses 2021-22 (IC2021_AY): 11188.0
On campus  room and board 2018-19 (IC2021_AY): 
Published out-of-state tuition and fees 2021-22 (IC2021_AY): 9395.0
Published in-district tuition and fees 2021-22 (IC2021_AY): 9395.0
Published in-state tuition and fees 2021-22 (IC2021_AY): 9395.0
Institution provide on-campus housing (IC2021): 2.0
Typical room charge for academic year (IC2021): 
Typical board charge for academic year (IC2021): 
Undergraduate application fee (IC2021): 0.0
Graduate application fee (IC2021): 20.0
Any alternative tuition plans offered by institution (IC2021): 1.0
Tuition payment plan (IC2021_RV): 1.0
Books and supplies 2020-21 (IC2020_AY): 1500.0
On campus  room and board 2020-21 (IC2020_AY): 
Off campus (not with family)  room and board 2020-21 (IC2020_AY): 11244.0
Off campus (not with family)  other expenses 2020-21 (IC2020_AY): 10380.0
Off campus (with family)  other expenses 2020-21 (IC2020_AY): 10380.0
On campus  room and board 2017-18 (IC2020_AY): 
Published out-of-state tuition and fees 2020-21 (IC2020_AY): 15673.0
Published in-district tuition and fees 2020-21 (IC2020_AY): 8249.0
Published in-state tuition and fees 2020-21 (IC2020_AY): 8249.0
Institution provide on-campus housing (IC2020): 2.0
Typical room charge for academic year (IC2020): 
Typical board charge for academic year (IC2020): 
Undergraduate application fee (IC2020): 0.0
Graduate application fee (IC2020): 20.0
Any alternative tuition plans offered by institution (IC2020_RV): 1.0
Tuition payment plan (IC2020_RV): 1.0","What is the cost of books and supplies for the 2023-24 academic year at Metropolitan State University?
",1500.0,../data/final_p1.csv
18,": 208917
UnitID: 161484
institution name: Northern Maine Community College
year: 2023
CIP2020Title: Registered Nursing/Registered Nurse.
CIP_Code: 513801
SOC2018Title: Registered Nurses
SOC_Code: 291141
CIPDefinition: A program that generally prepares individuals in the knowledge, techniques and procedures for promoting health, providing care for sick, disabled, infirmed, or other individuals or groups.  Includes instruction in the administration of medication and treatments, assisting a physician during treatments and examinations, Referring patients to physicians and other health care specialists, and planning education for health maintenance.
CrossReferences: 
Institution Name: Northern Maine Community College
Books and supplies 2023-24 (IC2023_AY): 1400.0
On campus  food and housing 2023-24 (IC2023_AY): 8598.0
Off campus (not with family)  food and housing 2023-24 (IC2023_AY): 6474.0
Off campus (not with family)  other expenses 2023-24 (IC2023_AY): 5742.0
Off campus (with family)  other expenses 2023-24 (IC2023_AY): 5742.0
On campus  food and housing 2020-21 (IC2023_AY): 7818.0
Published out-of-state tuition and fees 2023-24 (IC2023_AY): 6760.0
Published in-district tuition and fees 2023-24 (IC2023_AY): 3880.0
Published in-state tuition and fees 2023-24 (IC2023_AY): 3880.0
Institution provide nstitutionally-controlled housing (on-campus and/or off-campus) (IC2023): 1.0
Typical housing charges for an academic year (IC2023): 3114.0
Typical food charge for academic year (IC2023): 5484.0
Undergraduate application fee (IC2023): 0.0
Graduate application fee (IC2023): 
Any alternative tuition plans offered by institution (IC2023): 1.0
Tuition payment plan (IC2023): 1.0
Average amount of federal  state  local or institutional grant aid awarded (SFA2122): 10099.0
Average amount of federal grant aid awarded to full-time first-time undergraduates (SFA2122): 7536.0
Average amount of Pell grant aid awarded to full-time first-time undergraduates (SFA2122): 4506.0
Average amount of other federal grant aid awarded to full-time first-time undergraduates (SFA2122): 5036.0
Average amount of state/local grant aid awarded to full-time first-time undergraduates (SFA2122): 2040.0
Average amount of institutional grant aid awarded to full-time first-time undergraduates (SFA2122): 2385.0
Average amount of student loans awarded to full-time first-time undergraduates (SFA2122): 4627.0
Average amount of other student loans awarded to full-time first-time undergraduates (SFA2122): 
Average amount of federal  state  local  institutional or other sources of grant aid awarded to undergraduate students (SFA2122): 6622.0
Average amount Pell grant aid awarded to undergraduate students (SFA2122): 3650.0
Average amount of federal student loans awarded to undergraduate students (SFA2122): 5296.0
Average amount of federal  state  local  institutional or other sources of grant aid awarded to degree/certificate-seeking undergraduate students (SFA2122): 8432.0
Average amount of federal  state  local  institutional or other sources of grant aid awarded to non-degree/non-certificate-seeking undergraduates (SFA2122): 473.0
Average net price-students awarded grant or scholarship aid  2021-22 (SFA2122): 
Average net price (income 0-30 000)-students awarded Title IV federal financial aid  2021-22 (SFA2122): 
Average net price (income 30 001-48 000)-students awarded Title IV federal financial aid  2021-22 (SFA2122): 
Average net price (income 48 001-75 000)-students awarded Title IV federal financial aid  2021-22 (SFA2122): 
Average net price (income 75 001-110 000)-students awarded Title IV federal financial aid  2021-22 (SFA2122): 
Average net price (income over 110 000)-students awarded Title IV federal financial aid  2021-22 (SFA2122): 
Books and supplies 2022-23 (IC2022_AY): 1400.0
On campus  room and board 2022-23 (IC2022_AY): 7818.0
Off campus (not with family)  room and board 2022-23 (IC2022_AY): 6328.0
Off campus (not with family)  other expenses 2022-23 (IC2022_AY): 5612.0
Off campus (with family)  other expenses 2022-23 (IC2022_AY): 5612.0
On campus  room and board 2019-20 (IC2022_AY): 7818.0
Published out-of-state tuition and fees 2022-23 (IC2022_AY): 6610.0
Published in-district tuition and fees 2022-23 (IC2022_AY): 3730.0
Published in-state tuition and fees 2022-23 (IC2022_AY): 3730.0
Institution provide on-campus housing (IC2022): 1.0
Typical room charge for academic year (IC2022): 2832.0
Typical board charge for academic year (IC2022): 4986.0
Undergraduate application fee (IC2022): 0.0
Graduate application fee (IC2022): 
Any alternative tuition plans offered by institution (IC2022_RV): 1.0
Tuition payment plan (IC2022_RV): 1.0
Average amount of federal  state  local or institutional grant aid awarded (SFA2021_RV): 6264.0
Average amount of federal grant aid awarded to full-time first-time undergraduates (SFA2021_RV): 5380.0
Average amount of Pell grant aid awarded to full-time first-time undergraduates (SFA2021_RV): 4853.0
Average amount of other federal grant aid awarded to full-time first-time undergraduates (SFA2021_RV): 2162.0
Average amount of state/local grant aid awarded to full-time first-time undergraduates (SFA2021_RV): 1217.0
Average amount of institutional grant aid awarded to full-time first-time undergraduates (SFA2021_RV): 1988.0
Average amount of student loans awarded to full-time first-time undergraduates (SFA2021_RV): 5235.0
Average amount of other student loans awarded to full-time first-time undergraduates (SFA2021_RV): 
Average amount of federal  state  local  institutional or other sources of grant aid awarded to undergraduate students (SFA2021_RV): 6350.0
Average amount Pell grant aid awarded to undergraduate students (SFA2021_RV): 3956.0
Average amount of federal student loans awarded to undergraduate students (SFA2021_RV): 5702.0
Average net price-students awarded grant or scholarship aid  2020-21 (SFA2021_RV): 
Average net price (income 0-30 000)-students awarded Title IV federal financial aid  2020-21 (SFA2021_RV): 
Average net price (income 30 001-48 000)-students awarded Title IV federal financial aid  2020-21 (SFA2021_RV): 
Average net price (income 48 001-75 000)-students awarded Title IV federal financial aid  2020-21 (SFA2021_RV): 
Average net price (income 75 001-110 000)-students awarded Title IV federal financial aid  2020-21 (SFA2021_RV): 
Average net price (income over 110 000)-students awarded Title IV federal financial aid  2020-21 (SFA2021_RV): 
Books and supplies 2021-22 (IC2021_AY): 1400.0
On campus  room and board 2021-22 (IC2021_AY): 7818.0
Off campus (not with family)  room and board 2021-22 (IC2021_AY): 6328.0
Off campus (not with family)  other expenses 2021-22 (IC2021_AY): 5612.0
Off campus (with family)  other expenses 2021-22 (IC2021_AY): 5612.0
On campus  room and board 2018-19 (IC2021_AY): 7818.0
Published out-of-state tuition and fees 2021-22 (IC2021_AY): 6710.0
Published in-district tuition and fees 2021-22 (IC2021_AY): 3830.0
Published in-state tuition and fees 2021-22 (IC2021_AY): 3830.0
Institution provide on-campus housing (IC2021): 1.0
Typical room charge for academic year (IC2021): 2832.0
Typical board charge for academic year (IC2021): 4986.0
Undergraduate application fee (IC2021): 20.0
Graduate application fee (IC2021): 
Any alternative tuition plans offered by institution (IC2021): 1.0
Tuition payment plan (IC2021_RV): 1.0
Books and supplies 2020-21 (IC2020_AY): 1400.0
On campus  room and board 2020-21 (IC2020_AY): 7818.0
Off campus (not with family)  room and board 2020-21 (IC2020_AY): 6328.0
Off campus (not with family)  other expenses 2020-21 (IC2020_AY): 5612.0
Off campus (with family)  other expenses 2020-21 (IC2020_AY): 5612.0
On campus  room and board 2017-18 (IC2020_AY): 7818.0
Published out-of-state tuition and fees 2020-21 (IC2020_AY): 6710.0
Published in-district tuition and fees 2020-21 (IC2020_AY): 3830.0
Published in-state tuition and fees 2020-21 (IC2020_AY): 3830.0
Institution provide on-campus housing (IC2020): 1.0
Typical room charge for academic year (IC2020): 2832.0
Typical board charge for academic year (IC2020): 4986.0
Undergraduate application fee (IC2020): 20.0
Graduate application fee (IC2020): 
Any alternative tuition plans offered by institution (IC2020_RV): 1.0
Tuition payment plan (IC2020_RV): 1.0","What is the typical food charge for an academic year at Northern Maine Community College?
",The typical food charge for an academic year at Northern Maine Community College is 5484.0.,../data/final_p1.csv
19,": 455207
UnitID: 213996
institution name: Messiah University
year: 2023
CIP2020Title: Cinematography and Film/Video Production.
CIP_Code: 500602
SOC2018Title: Film and Video Editors
SOC_Code: 274032
CIPDefinition: A program that prepares individuals to communicate dramatic information, ideas, moods, and feelings through the making and producing of films and videos. Includes instruction in theory of film, film technology and equipment operation, film production, film directing, film editing, cinematographic art, film audio, techniques for making specific types of films and/or videos, media technologies, computer image making, multi-media production, and the planning and management of film/video operations.
CrossReferences: 
Institution Name: Messiah University
Books and supplies 2023-24 (IC2023_AY): 1460.0
On campus  food and housing 2023-24 (IC2023_AY): 11910.0
Off campus (not with family)  food and housing 2023-24 (IC2023_AY): 11910.0
Off campus (not with family)  other expenses 2023-24 (IC2023_AY): 4080.0
Off campus (with family)  other expenses 2023-24 (IC2023_AY): 3650.0
On campus  food and housing 2020-21 (IC2023_AY): 10900.0
Published out-of-state tuition and fees 2023-24 (IC2023_AY): 40640.0
Published in-district tuition and fees 2023-24 (IC2023_AY): 40640.0
Published in-state tuition and fees 2023-24 (IC2023_AY): 40640.0
Institution provide nstitutionally-controlled housing (on-campus and/or off-campus) (IC2023): 1.0
Typical housing charges for an academic year (IC2023): 6335.0
Typical food charge for academic year (IC2023): 5575.0
Undergraduate application fee (IC2023): 50.0
Graduate application fee (IC2023): 0.0
Any alternative tuition plans offered by institution (IC2023): 1.0
Tuition payment plan (IC2023): 1.0
Average amount of federal  state  local or institutional grant aid awarded (SFA2122): 27519.0
Average amount of federal grant aid awarded to full-time first-time undergraduates (SFA2122): 5187.0
Average amount of Pell grant aid awarded to full-time first-time undergraduates (SFA2122): 4744.0
Average amount of other federal grant aid awarded to full-time first-time undergraduates (SFA2122): 1058.0
Average amount of state/local grant aid awarded to full-time first-time undergraduates (SFA2122): 4046.0
Average amount of institutional grant aid awarded to full-time first-time undergraduates (SFA2122): 25633.0
Average amount of student loans awarded to full-time first-time undergraduates (SFA2122): 10343.0
Average amount of other student loans awarded to full-time first-time undergraduates (SFA2122): 9725.0
Average amount of federal  state  local  institutional or other sources of grant aid awarded to undergraduate students (SFA2122): 26414.0
Average amount Pell grant aid awarded to undergraduate students (SFA2122): 4724.0
Average amount of federal student loans awarded to undergraduate students (SFA2122): 8445.0
Average amount of federal  state  local  institutional or other sources of grant aid awarded to degree/certificate-seeking undergraduate students (SFA2122): 26693.0
Average amount of federal  state  local  institutional or other sources of grant aid awarded to non-degree/non-certificate-seeking undergraduates (SFA2122): 2321.0
Average net price-students awarded grant or scholarship aid  2021-22 (SFA2122): 24120.0
Average net price (income 0-30 000)-students awarded Title IV federal financial aid  2021-22 (SFA2122): 12996.0
Average net price (income 30 001-48 000)-students awarded Title IV federal financial aid  2021-22 (SFA2122): 15320.0
Average net price (income 48 001-75 000)-students awarded Title IV federal financial aid  2021-22 (SFA2122): 16358.0
Average net price (income 75 001-110 000)-students awarded Title IV federal financial aid  2021-22 (SFA2122): 22397.0
Average net price (income over 110 000)-students awarded Title IV federal financial aid  2021-22 (SFA2122): 29871.0
Books and supplies 2022-23 (IC2022_AY): 1350.0
On campus  room and board 2022-23 (IC2022_AY): 11560.0
Off campus (not with family)  room and board 2022-23 (IC2022_AY): 11560.0
Off campus (not with family)  other expenses 2022-23 (IC2022_AY): 3760.0
Off campus (with family)  other expenses 2022-23 (IC2022_AY): 3370.0
On campus  room and board 2019-20 (IC2022_AY): 10580.0
Published out-of-state tuition and fees 2022-23 (IC2022_AY): 39490.0
Published in-district tuition and fees 2022-23 (IC2022_AY): 39490.0
Published in-state tuition and fees 2022-23 (IC2022_AY): 39490.0
Institution provide on-campus housing (IC2022): 1.0
Typical room charge for academic year (IC2022): 6150.0
Typical board charge for academic year (IC2022): 5410.0
Undergraduate application fee (IC2022): 50.0
Graduate application fee (IC2022): 0.0
Any alternative tuition plans offered by institution (IC2022_RV): 1.0
Tuition payment plan (IC2022_RV): 1.0
Average amount of federal  state  local or institutional grant aid awarded (SFA2021_RV): 26620.0
Average amount of federal grant aid awarded to full-time first-time undergraduates (SFA2021_RV): 5043.0
Average amount of Pell grant aid awarded to full-time first-time undergraduates (SFA2021_RV): 4296.0
Average amount of other federal grant aid awarded to full-time first-time undergraduates (SFA2021_RV): 2216.0
Average amount of state/local grant aid awarded to full-time first-time undergraduates (SFA2021_RV): 3575.0
Average amount of institutional grant aid awarded to full-time first-time undergraduates (SFA2021_RV): 24015.0
Average amount of student loans awarded to full-time first-time undergraduates (SFA2021_RV): 9562.0
Average amount of other student loans awarded to full-time first-time undergraduates (SFA2021_RV): 11228.0
Average amount of federal  state  local  institutional or other sources of grant aid awarded to undergraduate students (SFA2021_RV): 21650.0
Average amount Pell grant aid awarded to undergraduate students (SFA2021_RV): 4384.0
Average amount of federal student loans awarded to undergraduate students (SFA2021_RV): 6653.0
Average net price-students awarded grant or scholarship aid  2020-21 (SFA2021_RV): 23895.0
Average net price (income 0-30 000)-students awarded Title IV federal financial aid  2020-21 (SFA2021_RV): 13658.0
Average net price (income 30 001-48 000)-students awarded Title IV federal financial aid  2020-21 (SFA2021_RV): 14760.0
Average net price (income 48 001-75 000)-students awarded Title IV federal financial aid  2020-21 (SFA2021_RV): 16573.0
Average net price (income 75 001-110 000)-students awarded Title IV federal financial aid  2020-21 (SFA2021_RV): 22327.0
Average net price (income over 110 000)-students awarded Title IV federal financial aid  2020-21 (SFA2021_RV): 29654.0
Books and supplies 2021-22 (IC2021_AY): 1260.0
On campus  room and board 2021-22 (IC2021_AY): 11220.0
Off campus (not with family)  room and board 2021-22 (IC2021_AY): 11220.0
Off campus (not with family)  other expenses 2021-22 (IC2021_AY): 3490.0
Off campus (with family)  other expenses 2021-22 (IC2021_AY): 3070.0
On campus  room and board 2018-19 (IC2021_AY): 10520.0
Published out-of-state tuition and fees 2021-22 (IC2021_AY): 38370.0
Published in-district tuition and fees 2021-22 (IC2021_AY): 38370.0
Published in-state tuition and fees 2021-22 (IC2021_AY): 38370.0
Institution provide on-campus housing (IC2021): 1.0
Typical room charge for academic year (IC2021): 5970.0
Typical board charge for academic year (IC2021): 5250.0
Undergraduate application fee (IC2021): 50.0
Graduate application fee (IC2021): 0.0
Any alternative tuition plans offered by institution (IC2021): 1.0
Tuition payment plan (IC2021_RV): 1.0
Books and supplies 2020-21 (IC2020_AY): 1240.0
On campus  room and board 2020-21 (IC2020_AY): 10900.0
Off campus (not with family)  room and board 2020-21 (IC2020_AY): 10900.0
Off campus (not with family)  other expenses 2020-21 (IC2020_AY): 3460.0
Off campus (with family)  other expenses 2020-21 (IC2020_AY): 3100.0
On campus  room and board 2017-18 (IC2020_AY): 10220.0
Published out-of-state tuition and fees 2020-21 (IC2020_AY): 37180.0
Published in-district tuition and fees 2020-21 (IC2020_AY): 37180.0
Published in-state tuition and fees 2020-21 (IC2020_AY): 37180.0
Institution provide on-campus housing (IC2020): 1.0
Typical room charge for academic year (IC2020): 5800.0
Typical board charge for academic year (IC2020): 5100.0
Undergraduate application fee (IC2020): 50.0
Graduate application fee (IC2020): 0.0
Any alternative tuition plans offered by institution (IC2020_RV): 1.0
Tuition payment plan (IC2020_RV): 1.0","What is the typical board charge for academic year 2023 at Messiah University?
",The typical board charge for academic year 2023 at Messiah University is 5575.0.,../data/final_p1.csv
20,": 50282
AREA: 99
AREA_TITLE: U.S.
AREA_TYPE: 1
PRIM_STATE: US
NAICS: 334500
NAICS_TITLE: Navigational, Measuring, Electromedical, and Control Instruments Manufacturing
I_GROUP: 4-digit
OWN_CODE: 5
OCC_CODE: 13-1150
OCC_TITLE: Training and Development Specialists
O_GROUP: broad
TOT_EMP: 1,190
EMP_PRSE: 6.7
JOBS_1000: 
LOC_QUOTIENT: 
PCT_TOTAL: 0.28
PCT_RPT: 5
H_MEAN: 45.51
A_MEAN: 94,660
MEAN_PRSE: 2.9
H_PCT10: 26.35
H_PCT25: 35.06
H_MEDIAN: 42.43
H_PCT75: 58.42
H_PCT90: 64.66
A_PCT10: 54,820
A_PCT25: 72,920
A_MEDIAN: 88,240
A_PCT75: 121,510
A_PCT90: 134,490
ANNUAL: 
HOURLY: 
SOC_Code: 131150","What is the median hourly wage for training and development specialists in the U.S.?
",The median hourly wage for training and development specialists in the U.S. is $42.43.,../data/final_p2.csv
21,": 590856
UnitID: 364025
institution name: Chandler-Gilbert Community College
year: 2023
CIP2020Title: Forensic Science and Technology.
CIP_Code: 430406
SOC2018Title: Criminal Justice and Law Enforcement Teachers, Postsecondary
SOC_Code: 251111
CIPDefinition: A program that focuses on the application of the physical, biomedical, and social sciences to the analysis and evaluation of physical evidence, human testimony and criminal suspects. Includes instruction in forensic medicine, forensic dentistry, anthropology, psychology, entomology, pathology, forensic laboratory technology and autopsy procedures, DNA and blood pattern analysis, crime scene analysis, crime scene photography, fingerprint technology, document analysis, witness and suspect examination procedures, applicable law and regulations, and professional standards and ethics.
CrossReferences: 42.2812 - Forensic Psychology., 40.0510 - Forensic Chemistry., 44.0703 - Forensic Social Work., 45.0205 - Forensic Anthropology.
Institution Name: Chandler-Gilbert Community College
Books and supplies 2023-24 (IC2023_AY): 1104.0
On campus  food and housing 2023-24 (IC2023_AY): 10440.0
Off campus (not with family)  food and housing 2023-24 (IC2023_AY): 10872.0
Off campus (not with family)  other expenses 2023-24 (IC2023_AY): 11304.0
Off campus (with family)  other expenses 2023-24 (IC2023_AY): 10872.0
On campus  food and housing 2020-21 (IC2023_AY): 11100.0
Published out-of-state tuition and fees 2023-24 (IC2023_AY): 8958.0
Published in-district tuition and fees 2023-24 (IC2023_AY): 2358.0
Published in-state tuition and fees 2023-24 (IC2023_AY): 2358.0
Institution provide nstitutionally-controlled housing (on-campus and/or off-campus) (IC2023): 1.0
Typical housing charges for an academic year (IC2023): 4636.0
Typical food charge for academic year (IC2023): 6030.0
Undergraduate application fee (IC2023): 0.0
Graduate application fee (IC2023): 
Any alternative tuition plans offered by institution (IC2023): 1.0
Tuition payment plan (IC2023): 1.0
Average amount of federal  state  local or institutional grant aid awarded (SFA2122): 2822.0
Average amount of federal grant aid awarded to full-time first-time undergraduates (SFA2122): 2282.0
Average amount of Pell grant aid awarded to full-time first-time undergraduates (SFA2122): 4881.0
Average amount of other federal grant aid awarded to full-time first-time undergraduates (SFA2122): 840.0
Average amount of state/local grant aid awarded to full-time first-time undergraduates (SFA2122): 833.0
Average amount of institutional grant aid awarded to full-time first-time undergraduates (SFA2122): 1743.0
Average amount of student loans awarded to full-time first-time undergraduates (SFA2122): 3573.0
Average amount of other student loans awarded to full-time first-time undergraduates (SFA2122): 8250.0
Average amount of federal  state  local  institutional or other sources of grant aid awarded to undergraduate students (SFA2122): 1401.0
Average amount Pell grant aid awarded to undergraduate students (SFA2122): 3768.0
Average amount of federal student loans awarded to undergraduate students (SFA2122): 3750.0
Average amount of federal  state  local  institutional or other sources of grant aid awarded to degree/certificate-seeking undergraduate students (SFA2122): 1883.0
Average amount of federal  state  local  institutional or other sources of grant aid awarded to non-degree/non-certificate-seeking undergraduates (SFA2122): 719.0
Average net price-students awarded grant or scholarship aid  2021-22 (SFA2122): 
Average net price (income 0-30 000)-students awarded Title IV federal financial aid  2021-22 (SFA2122): 
Average net price (income 30 001-48 000)-students awarded Title IV federal financial aid  2021-22 (SFA2122): 
Average net price (income 48 001-75 000)-students awarded Title IV federal financial aid  2021-22 (SFA2122): 
Average net price (income 75 001-110 000)-students awarded Title IV federal financial aid  2021-22 (SFA2122): 
Average net price (income over 110 000)-students awarded Title IV federal financial aid  2021-22 (SFA2122): 
Books and supplies 2022-23 (IC2022_AY): 1464.0
On campus  room and board 2022-23 (IC2022_AY): 10440.0
Off campus (not with family)  room and board 2022-23 (IC2022_AY): 10872.0
Off campus (not with family)  other expenses 2022-23 (IC2022_AY): 11241.0
Off campus (with family)  other expenses 2022-23 (IC2022_AY): 10872.0
On campus  room and board 2019-20 (IC2022_AY): 10440.0
Published out-of-state tuition and fees 2022-23 (IC2022_AY): 7854.0
Published in-district tuition and fees 2022-23 (IC2022_AY): 2070.0
Published in-state tuition and fees 2022-23 (IC2022_AY): 2070.0
Institution provide on-campus housing (IC2022): 1.0
Typical room charge for academic year (IC2022): 4636.0
Typical board charge for academic year (IC2022): 6030.0
Undergraduate application fee (IC2022): 0.0
Graduate application fee (IC2022): 
Any alternative tuition plans offered by institution (IC2022_RV): 1.0
Tuition payment plan (IC2022_RV): 1.0
Average amount of federal  state  local or institutional grant aid awarded (SFA2021_RV): 3944.0
Average amount of federal grant aid awarded to full-time first-time undergraduates (SFA2021_RV): 3496.0
Average amount of Pell grant aid awarded to full-time first-time undergraduates (SFA2021_RV): 5010.0
Average amount of other federal grant aid awarded to full-time first-time undergraduates (SFA2021_RV): 841.0
Average amount of state/local grant aid awarded to full-time first-time undergraduates (SFA2021_RV): 833.0
Average amount of institutional grant aid awarded to full-time first-time undergraduates (SFA2021_RV): 1765.0
Average amount of student loans awarded to full-time first-time undergraduates (SFA2021_RV): 3497.0
Average amount of other student loans awarded to full-time first-time undergraduates (SFA2021_RV): 
Average amount of federal  state  local  institutional or other sources of grant aid awarded to undergraduate students (SFA2021_RV): 3400.0
Average amount Pell grant aid awarded to undergraduate students (SFA2021_RV): 3878.0
Average amount of federal student loans awarded to undergraduate students (SFA2021_RV): 3755.0
Average net price-students awarded grant or scholarship aid  2020-21 (SFA2021_RV): 
Average net price (income 0-30 000)-students awarded Title IV federal financial aid  2020-21 (SFA2021_RV): 
Average net price (income 30 001-48 000)-students awarded Title IV federal financial aid  2020-21 (SFA2021_RV): 
Average net price (income 48 001-75 000)-students awarded Title IV federal financial aid  2020-21 (SFA2021_RV): 
Average net price (income 75 001-110 000)-students awarded Title IV federal financial aid  2020-21 (SFA2021_RV): 
Average net price (income over 110 000)-students awarded Title IV federal financial aid  2020-21 (SFA2021_RV): 
Books and supplies 2021-22 (IC2021_AY): 1464.0
On campus  room and board 2021-22 (IC2021_AY): 10310.0
Off campus (not with family)  room and board 2021-22 (IC2021_AY): 8496.0
Off campus (not with family)  other expenses 2021-22 (IC2021_AY): 10476.0
Off campus (with family)  other expenses 2021-22 (IC2021_AY): 10476.0
On campus  room and board 2018-19 (IC2021_AY): 10500.0
Published out-of-state tuition and fees 2021-22 (IC2021_AY): 7854.0
Published in-district tuition and fees 2021-22 (IC2021_AY): 2070.0
Published in-state tuition and fees 2021-22 (IC2021_AY): 2070.0
Institution provide on-campus housing (IC2021): 1.0
Typical room charge for academic year (IC2021): 4500.0
Typical board charge for academic year (IC2021): 5810.0
Undergraduate application fee (IC2021): 0.0
Graduate application fee (IC2021): 
Any alternative tuition plans offered by institution (IC2021): 1.0
Tuition payment plan (IC2021_RV): 1.0
Books and supplies 2020-21 (IC2020_AY): 1472.0
On campus  room and board 2020-21 (IC2020_AY): 11100.0
Off campus (not with family)  room and board 2020-21 (IC2020_AY): 9216.0
Off campus (not with family)  other expenses 2020-21 (IC2020_AY): 8532.0
Off campus (with family)  other expenses 2020-21 (IC2020_AY): 8532.0
On campus  room and board 2017-18 (IC2020_AY): 10200.0
Published out-of-state tuition and fees 2020-21 (IC2020_AY): 7854.0
Published in-district tuition and fees 2020-21 (IC2020_AY): 2070.0
Published in-state tuition and fees 2020-21 (IC2020_AY): 2070.0
Institution provide on-campus housing (IC2020): 1.0
Typical room charge for academic year (IC2020): 5400.0
Typical board charge for academic year (IC2020): 5700.0
Undergraduate application fee (IC2020): 0.0
Graduate application fee (IC2020): 
Any alternative tuition plans offered by institution (IC2020_RV): 1.0
Tuition payment plan (IC2020_RV): 1.0","What is the typical food charge for an academic year at Chandler-Gilbert Community College?
",The typical food charge for an academic year at Chandler-Gilbert Community College is 6000.0.,../data/final_p1.csv
22,": 279638
AREA: 17660
AREA_TITLE: Coeur d'Alene, ID
AREA_TYPE: 4
PRIM_STATE: ID
NAICS: 0
NAICS_TITLE: Cross-industry
I_GROUP: cross-industry
OWN_CODE: 1235
OCC_CODE: 29-2042
OCC_TITLE: Emergency Medical Technicians
O_GROUP: detailed
TOT_EMP: 60
EMP_PRSE: 18.3
JOBS_1000: 0.902
LOC_QUOTIENT: 0.82
PCT_TOTAL: 
PCT_RPT: 
H_MEAN: 30.68
A_MEAN: 63,820
MEAN_PRSE: 13.8
H_PCT10: 13.08
H_PCT25: 18.73
H_MEDIAN: 20.97
H_PCT75: 43.00
H_PCT90: 43.62
A_PCT10: 27,210
A_PCT25: 38,960
A_MEDIAN: 43,610
A_PCT75: 89,440
A_PCT90: 90,730
ANNUAL: 
HOURLY: 
SOC_Code: 292042","What is the median hourly wage for Emergency Medical Technicians in Coeur d'Alene, ID?
","The median hourly wage for Emergency Medical Technicians in Coeur d'Alene, ID is 20.97.",../data/final_p2.csv
23,": 403564
AREA: 2700001
AREA_TITLE: Northwest Minnesota nonmetropolitan area
AREA_TYPE: 6
PRIM_STATE: MN
NAICS: 0
NAICS_TITLE: Cross-industry
I_GROUP: cross-industry
OWN_CODE: 1235
OCC_CODE: 49-2011
OCC_TITLE: Computer, Automated Teller, and Office Machine Repairers
O_GROUP: detailed
TOT_EMP: 90
EMP_PRSE: 16.0
JOBS_1000: 0.452
LOC_QUOTIENT: 0.88
PCT_TOTAL: 
PCT_RPT: 
H_MEAN: 21.15
A_MEAN: 44,000
MEAN_PRSE: 2.5
H_PCT10: 14.91
H_PCT25: 17.00
H_MEDIAN: 19.50
H_PCT75: 23.32
H_PCT90: 28.89
A_PCT10: 31,010
A_PCT25: 35,350
A_MEDIAN: 40,560
A_PCT75: 48,500
A_PCT90: 60,090
ANNUAL: 
HOURLY: 
SOC_Code: 492011","What is the median annual salary for Computer, Automated Teller, and Office Machine Repairers in Northwest Minnesota nonmetropolitan area?
","$40,560",../data/final_p2.csv
24,": 220515
UnitID: 164632
institution name: Bay Path University
year: 2023
CIP2020Title: Forensic Psychology.
CIP_Code: 422812
SOC2018Title: Psychologists, All Other
SOC_Code: 193039
CIPDefinition: A program that prepares individuals to apply clinical, counseling, school, and neuropsychology skills to the provision of psychological services within the criminal justice and civil legal systems, including consultation, assessment, and interventions.  Includes instruction in the epidemiology of mental/behavioral disorders, risk factors for violence and criminality, profiling and patterning, psychological testing, prediction and intervention measurement, forensic assessment, criminal and civil law and procedures, secure environments, forensic treatment and intervention skills, and professional standards and ethics.
CrossReferences: 
Institution Name: Bay Path University
Books and supplies 2023-24 (IC2023_AY): 1800.0
On campus  food and housing 2023-24 (IC2023_AY): 13316.0
Off campus (not with family)  food and housing 2023-24 (IC2023_AY): 3500.0
Off campus (not with family)  other expenses 2023-24 (IC2023_AY): 2400.0
Off campus (with family)  other expenses 2023-24 (IC2023_AY): 2400.0
On campus  food and housing 2020-21 (IC2023_AY): 12799.0
Published out-of-state tuition and fees 2023-24 (IC2023_AY): 37227.0
Published in-district tuition and fees 2023-24 (IC2023_AY): 37227.0
Published in-state tuition and fees 2023-24 (IC2023_AY): 37227.0
Institution provide nstitutionally-controlled housing (on-campus and/or off-campus) (IC2023): 1.0
Typical housing charges for an academic year (IC2023): 
Typical food charge for academic year (IC2023): 
Undergraduate application fee (IC2023): 25.0
Graduate application fee (IC2023): 0.0
Any alternative tuition plans offered by institution (IC2023): 1.0
Tuition payment plan (IC2023): 1.0
Average amount of federal  state  local or institutional grant aid awarded (SFA2122): 27913.0
Average amount of federal grant aid awarded to full-time first-time undergraduates (SFA2122): 7450.0
Average amount of Pell grant aid awarded to full-time first-time undergraduates (SFA2122): 5164.0
Average amount of other federal grant aid awarded to full-time first-time undergraduates (SFA2122): 2807.0
Average amount of state/local grant aid awarded to full-time first-time undergraduates (SFA2122): 3710.0
Average amount of institutional grant aid awarded to full-time first-time undergraduates (SFA2122): 21755.0
Average amount of student loans awarded to full-time first-time undergraduates (SFA2122): 7142.0
Average amount of other student loans awarded to full-time first-time undergraduates (SFA2122): 13910.0
Average amount of federal  state  local  institutional or other sources of grant aid awarded to undergraduate students (SFA2122): 12546.0
Average amount Pell grant aid awarded to undergraduate students (SFA2122): 3885.0
Average amount of federal student loans awarded to undergraduate students (SFA2122): 6819.0
Average amount of federal  state  local  institutional or other sources of grant aid awarded to degree/certificate-seeking undergraduate students (SFA2122): 12546.0
Average amount of federal  state  local  institutional or other sources of grant aid awarded to non-degree/non-certificate-seeking undergraduates (SFA2122): 
Average net price-students awarded grant or scholarship aid  2021-22 (SFA2122): 18502.0
Average net price (income 0-30 000)-students awarded Title IV federal financial aid  2021-22 (SFA2122): 12460.0
Average net price (income 30 001-48 000)-students awarded Title IV federal financial aid  2021-22 (SFA2122): 14988.0
Average net price (income 48 001-75 000)-students awarded Title IV federal financial aid  2021-22 (SFA2122): 17214.0
Average net price (income 75 001-110 000)-students awarded Title IV federal financial aid  2021-22 (SFA2122): 26134.0
Average net price (income over 110 000)-students awarded Title IV federal financial aid  2021-22 (SFA2122): 25585.0
Books and supplies 2022-23 (IC2022_AY): 1800.0
On campus  room and board 2022-23 (IC2022_AY): 12799.0
Off campus (not with family)  room and board 2022-23 (IC2022_AY): 3500.0
Off campus (not with family)  other expenses 2022-23 (IC2022_AY): 2400.0
Off campus (with family)  other expenses 2022-23 (IC2022_AY): 2400.0
On campus  room and board 2019-20 (IC2022_AY): 12799.0
Published out-of-state tuition and fees 2022-23 (IC2022_AY): 35781.0
Published in-district tuition and fees 2022-23 (IC2022_AY): 35781.0
Published in-state tuition and fees 2022-23 (IC2022_AY): 35781.0
Institution provide on-campus housing (IC2022): 1.0
Typical room charge for academic year (IC2022): 
Typical board charge for academic year (IC2022): 
Undergraduate application fee (IC2022): 25.0
Graduate application fee (IC2022): 0.0
Any alternative tuition plans offered by institution (IC2022_RV): 1.0
Tuition payment plan (IC2022_RV): 1.0
Average amount of federal  state  local or institutional grant aid awarded (SFA2021_RV): 28360.0
Average amount of federal grant aid awarded to full-time first-time undergraduates (SFA2021_RV): 7199.0
Average amount of Pell grant aid awarded to full-time first-time undergraduates (SFA2021_RV): 5401.0
Average amount of other federal grant aid awarded to full-time first-time undergraduates (SFA2021_RV): 4868.0
Average amount of state/local grant aid awarded to full-time first-time undergraduates (SFA2021_RV): 2991.0
Average amount of institutional grant aid awarded to full-time first-time undergraduates (SFA2021_RV): 22263.0
Average amount of student loans awarded to full-time first-time undergraduates (SFA2021_RV): 6198.0
Average amount of other student loans awarded to full-time first-time undergraduates (SFA2021_RV): 7366.0
Average amount of federal  state  local  institutional or other sources of grant aid awarded to undergraduate students (SFA2021_RV): 12154.0
Average amount Pell grant aid awarded to undergraduate students (SFA2021_RV): 3855.0
Average amount of federal student loans awarded to undergraduate students (SFA2021_RV): 6309.0
Average net price-students awarded grant or scholarship aid  2020-21 (SFA2021_RV): 18664.0
Average net price (income 0-30 000)-students awarded Title IV federal financial aid  2020-21 (SFA2021_RV): 16227.0
Average net price (income 30 001-48 000)-students awarded Title IV federal financial aid  2020-21 (SFA2021_RV): 15893.0
Average net price (income 48 001-75 000)-students awarded Title IV federal financial aid  2020-21 (SFA2021_RV): 18911.0
Average net price (income 75 001-110 000)-students awarded Title IV federal financial aid  2020-21 (SFA2021_RV): 23499.0
Average net price (income over 110 000)-students awarded Title IV federal financial aid  2020-21 (SFA2021_RV): 25107.0
Books and supplies 2021-22 (IC2021_AY): 1600.0
On campus  room and board 2021-22 (IC2021_AY): 12799.0
Off campus (not with family)  room and board 2021-22 (IC2021_AY): 3500.0
Off campus (not with family)  other expenses 2021-22 (IC2021_AY): 2400.0
Off campus (with family)  other expenses 2021-22 (IC2021_AY): 2400.0
On campus  room and board 2018-19 (IC2021_AY): 12799.0
Published out-of-state tuition and fees 2021-22 (IC2021_AY): 35781.0
Published in-district tuition and fees 2021-22 (IC2021_AY): 35781.0
Published in-state tuition and fees 2021-22 (IC2021_AY): 35781.0
Institution provide on-campus housing (IC2021): 1.0
Typical room charge for academic year (IC2021): 
Typical board charge for academic year (IC2021): 
Undergraduate application fee (IC2021): 25.0
Graduate application fee (IC2021): 0.0
Any alternative tuition plans offered by institution (IC2021): 1.0
Tuition payment plan (IC2021_RV): 1.0
Books and supplies 2020-21 (IC2020_AY): 1600.0
On campus  room and board 2020-21 (IC2020_AY): 12799.0
Off campus (not with family)  room and board 2020-21 (IC2020_AY): 3500.0
Off campus (not with family)  other expenses 2020-21 (IC2020_AY): 2400.0
Off campus (with family)  other expenses 2020-21 (IC2020_AY): 2400.0
On campus  room and board 2017-18 (IC2020_AY): 12799.0
Published out-of-state tuition and fees 2020-21 (IC2020_AY): 35781.0
Published in-district tuition and fees 2020-21 (IC2020_AY): 35781.0
Published in-state tuition and fees 2020-21 (IC2020_AY): 35781.0
Institution provide on-campus housing (IC2020): 1.0
Typical room charge for academic year (IC2020): 
Typical board charge for academic year (IC2020): 
Undergraduate application fee (IC2020): 25.0
Graduate application fee (IC2020): 0.0
Any alternative tuition plans offered by institution (IC2020_RV): 1.0
Tuition payment plan (IC2020_RV): 1.0","What is the typical housing charge for an academic year at Bay Path University?
",The typical housing charge for an academic year at Bay Path University is not provided in the context.,../data/final_p1.csv
25,": 613061
UnitID: 461795
institution name: North American University
year: 2023
CIP2020Title: Computer Science.
CIP_Code: 110701
SOC2018Title: Computer Programmers
SOC_Code: 151251
CIPDefinition: A program that focuses on computer theory, computing problems and solutions, and the design of computer systems and user interfaces from a scientific perspective. Includes instruction in the principles of computational science, computer development and programming, and applications to a variety of end-use situations.
CrossReferences: 14.0901 - Computer Engineering, General.
Institution Name: North American University
Books and supplies 2023-24 (IC2023_AY): 1122.0
On campus  food and housing 2023-24 (IC2023_AY): 8360.0
Off campus (not with family)  food and housing 2023-24 (IC2023_AY): 10000.0
Off campus (not with family)  other expenses 2023-24 (IC2023_AY): 5500.0
Off campus (with family)  other expenses 2023-24 (IC2023_AY): 5000.0
On campus  food and housing 2020-21 (IC2023_AY): 8900.0
Published out-of-state tuition and fees 2023-24 (IC2023_AY): 12836.0
Published in-district tuition and fees 2023-24 (IC2023_AY): 12836.0
Published in-state tuition and fees 2023-24 (IC2023_AY): 12836.0
Institution provide nstitutionally-controlled housing (on-campus and/or off-campus) (IC2023): 1.0
Typical housing charges for an academic year (IC2023): 4500.0
Typical food charge for academic year (IC2023): 3860.0
Undergraduate application fee (IC2023): 0.0
Graduate application fee (IC2023): 50.0
Any alternative tuition plans offered by institution (IC2023): 1.0
Tuition payment plan (IC2023): 1.0
Average amount of federal  state  local or institutional grant aid awarded (SFA2122): 9202.0
Average amount of federal grant aid awarded to full-time first-time undergraduates (SFA2122): 5348.0
Average amount of Pell grant aid awarded to full-time first-time undergraduates (SFA2122): 5271.0
Average amount of other federal grant aid awarded to full-time first-time undergraduates (SFA2122): 118.0
Average amount of state/local grant aid awarded to full-time first-time undergraduates (SFA2122): 
Average amount of institutional grant aid awarded to full-time first-time undergraduates (SFA2122): 6779.0
Average amount of student loans awarded to full-time first-time undergraduates (SFA2122): 4960.0
Average amount of other student loans awarded to full-time first-time undergraduates (SFA2122): 
Average amount of federal  state  local  institutional or other sources of grant aid awarded to undergraduate students (SFA2122): 12462.0
Average amount Pell grant aid awarded to undergraduate students (SFA2122): 5816.0
Average amount of federal student loans awarded to undergraduate students (SFA2122): 6728.0
Average amount of federal  state  local  institutional or other sources of grant aid awarded to degree/certificate-seeking undergraduate students (SFA2122): 12462.0
Average amount of federal  state  local  institutional or other sources of grant aid awarded to non-degree/non-certificate-seeking undergraduates (SFA2122): 
Average net price-students awarded grant or scholarship aid  2021-22 (SFA2122): 13978.0
Average net price (income 0-30 000)-students awarded Title IV federal financial aid  2021-22 (SFA2122): 10828.0
Average net price (income 30 001-48 000)-students awarded Title IV federal financial aid  2021-22 (SFA2122): 11764.0
Average net price (income 48 001-75 000)-students awarded Title IV federal financial aid  2021-22 (SFA2122): 15923.0
Average net price (income 75 001-110 000)-students awarded Title IV federal financial aid  2021-22 (SFA2122): 16365.0
Average net price (income over 110 000)-students awarded Title IV federal financial aid  2021-22 (SFA2122): 19663.0
Books and supplies 2022-23 (IC2022_AY): 1122.0
On campus  room and board 2022-23 (IC2022_AY): 8360.0
Off campus (not with family)  room and board 2022-23 (IC2022_AY): 10000.0
Off campus (not with family)  other expenses 2022-23 (IC2022_AY): 5500.0
Off campus (with family)  other expenses 2022-23 (IC2022_AY): 5000.0
On campus  room and board 2019-20 (IC2022_AY): 9080.0
Published out-of-state tuition and fees 2022-23 (IC2022_AY): 12300.0
Published in-district tuition and fees 2022-23 (IC2022_AY): 12300.0
Published in-state tuition and fees 2022-23 (IC2022_AY): 12300.0
Institution provide on-campus housing (IC2022): 1.0
Typical room charge for academic year (IC2022): 4500.0
Typical board charge for academic year (IC2022): 3860.0
Undergraduate application fee (IC2022): 0.0
Graduate application fee (IC2022): 50.0
Any alternative tuition plans offered by institution (IC2022_RV): 1.0
Tuition payment plan (IC2022_RV): 1.0
Average amount of federal  state  local or institutional grant aid awarded (SFA2021_RV): 7446.0
Average amount of federal grant aid awarded to full-time first-time undergraduates (SFA2021_RV): 4885.0
Average amount of Pell grant aid awarded to full-time first-time undergraduates (SFA2021_RV): 4819.0
Average amount of other federal grant aid awarded to full-time first-time undergraduates (SFA2021_RV): 100.0
Average amount of state/local grant aid awarded to full-time first-time undergraduates (SFA2021_RV): 
Average amount of institutional grant aid awarded to full-time first-time undergraduates (SFA2021_RV): 5383.0
Average amount of student loans awarded to full-time first-time undergraduates (SFA2021_RV): 5212.0
Average amount of other student loans awarded to full-time first-time undergraduates (SFA2021_RV): 
Average amount of federal  state  local  institutional or other sources of grant aid awarded to undergraduate students (SFA2021_RV): 8224.0
Average amount Pell grant aid awarded to undergraduate students (SFA2021_RV): 4670.0
Average amount of federal student loans awarded to undergraduate students (SFA2021_RV): 5917.0
Average net price-students awarded grant or scholarship aid  2020-21 (SFA2021_RV): 15991.0
Average net price (income 0-30 000)-students awarded Title IV federal financial aid  2020-21 (SFA2021_RV): 14703.0
Average net price (income 30 001-48 000)-students awarded Title IV federal financial aid  2020-21 (SFA2021_RV): 13476.0
Average net price (income 48 001-75 000)-students awarded Title IV federal financial aid  2020-21 (SFA2021_RV): 15197.0
Average net price (income 75 001-110 000)-students awarded Title IV federal financial aid  2020-21 (SFA2021_RV): 17195.0
Average net price (income over 110 000)-students awarded Title IV federal financial aid  2020-21 (SFA2021_RV): 17543.0
Books and supplies 2021-22 (IC2021_AY): 1122.0
On campus  room and board 2021-22 (IC2021_AY): 9652.0
Off campus (not with family)  room and board 2021-22 (IC2021_AY): 9652.0
Off campus (not with family)  other expenses 2021-22 (IC2021_AY): 5098.0
Off campus (with family)  other expenses 2021-22 (IC2021_AY): 4570.0
On campus  room and board 2018-19 (IC2021_AY): 9080.0
Published out-of-state tuition and fees 2021-22 (IC2021_AY): 9900.0
Published in-district tuition and fees 2021-22 (IC2021_AY): 9900.0
Published in-state tuition and fees 2021-22 (IC2021_AY): 9900.0
Institution provide on-campus housing (IC2021): 1.0
Typical room charge for academic year (IC2021): 4500.0
Typical board charge for academic year (IC2021): 5152.0
Undergraduate application fee (IC2021): 0.0
Graduate application fee (IC2021): 50.0
Any alternative tuition plans offered by institution (IC2021): 1.0
Tuition payment plan (IC2021_RV): 1.0
Books and supplies 2020-21 (IC2020_AY): 1122.0
On campus  room and board 2020-21 (IC2020_AY): 8900.0
Off campus (not with family)  room and board 2020-21 (IC2020_AY): 9882.0
Off campus (not with family)  other expenses 2020-21 (IC2020_AY): 5098.0
Off campus (with family)  other expenses 2020-21 (IC2020_AY): 4570.0
On campus  room and board 2017-18 (IC2020_AY): 9080.0
Published out-of-state tuition and fees 2020-21 (IC2020_AY): 12675.0
Published in-district tuition and fees 2020-21 (IC2020_AY): 9900.0
Published in-state tuition and fees 2020-21 (IC2020_AY): 9900.0
Institution provide on-campus housing (IC2020): 1.0
Typical room charge for academic year (IC2020): 4500.0
Typical board charge for academic year (IC2020): 4580.0
Undergraduate application fee (IC2020): 60.0
Graduate application fee (IC2020): 60.0
Any alternative tuition plans offered by institution (IC2020_RV): 1.0
Tuition payment plan (IC2020_RV): 1.0","What is the typical food charge for an academic year at North American University in 2023?
",The typical food charge for an academic year at North American University in 2023 is 3860.0.,../data/final_p1.csv
26,": 579731
UnitID: 240277
institution name: University of Wisconsin-Green Bay
year: 2023
CIP2020Title: Political Science and Government, General.
CIP_Code: 451001
SOC2018Title: Managers, All Other
SOC_Code: 119199
CIPDefinition: A  general program that focuses on the systematic study of political institutions and behavior.  Includes instruction in political philosophy, political theory, comparative government and politics, political parties and interest groups, public opinion, political research methods, studies of the government and politics of specific countries, and studies of specific political institutions and processes.
CrossReferences: 
Institution Name: University of Wisconsin-Green Bay
Books and supplies 2023-24 (IC2023_AY): 800.0
On campus  food and housing 2023-24 (IC2023_AY): 8042.0
Off campus (not with family)  food and housing 2023-24 (IC2023_AY): 8042.0
Off campus (not with family)  other expenses 2023-24 (IC2023_AY): 4276.0
Off campus (with family)  other expenses 2023-24 (IC2023_AY): 3274.0
On campus  food and housing 2020-21 (IC2023_AY): 7280.0
Published out-of-state tuition and fees 2023-24 (IC2023_AY): 16929.0
Published in-district tuition and fees 2023-24 (IC2023_AY): 8342.0
Published in-state tuition and fees 2023-24 (IC2023_AY): 8342.0
Institution provide nstitutionally-controlled housing (on-campus and/or off-campus) (IC2023): 1.0
Typical housing charges for an academic year (IC2023): 4925.0
Typical food charge for academic year (IC2023): 3100.0
Undergraduate application fee (IC2023): 0.0
Graduate application fee (IC2023): 56.0
Any alternative tuition plans offered by institution (IC2023): 1.0
Tuition payment plan (IC2023): 1.0
Average amount of federal  state  local or institutional grant aid awarded (SFA2122): 5590.0
Average amount of federal grant aid awarded to full-time first-time undergraduates (SFA2122): 4758.0
Average amount of Pell grant aid awarded to full-time first-time undergraduates (SFA2122): 4572.0
Average amount of other federal grant aid awarded to full-time first-time undergraduates (SFA2122): 2055.0
Average amount of state/local grant aid awarded to full-time first-time undergraduates (SFA2122): 2340.0
Average amount of institutional grant aid awarded to full-time first-time undergraduates (SFA2122): 3189.0
Average amount of student loans awarded to full-time first-time undergraduates (SFA2122): 5895.0
Average amount of other student loans awarded to full-time first-time undergraduates (SFA2122): 9165.0
Average amount of federal  state  local  institutional or other sources of grant aid awarded to undergraduate students (SFA2122): 6920.0
Average amount Pell grant aid awarded to undergraduate students (SFA2122): 4453.0
Average amount of federal student loans awarded to undergraduate students (SFA2122): 6182.0
Average amount of federal  state  local  institutional or other sources of grant aid awarded to degree/certificate-seeking undergraduate students (SFA2122): 6943.0
Average amount of federal  state  local  institutional or other sources of grant aid awarded to non-degree/non-certificate-seeking undergraduates (SFA2122): 4342.0
Average net price-students awarded grant or scholarship aid  2021-22 (SFA2122): 
Average net price (income 0-30 000)-students awarded Title IV federal financial aid  2021-22 (SFA2122): 
Average net price (income 30 001-48 000)-students awarded Title IV federal financial aid  2021-22 (SFA2122): 
Average net price (income 48 001-75 000)-students awarded Title IV federal financial aid  2021-22 (SFA2122): 
Average net price (income 75 001-110 000)-students awarded Title IV federal financial aid  2021-22 (SFA2122): 
Average net price (income over 110 000)-students awarded Title IV federal financial aid  2021-22 (SFA2122): 
Books and supplies 2022-23 (IC2022_AY): 800.0
On campus  room and board 2022-23 (IC2022_AY): 7634.0
Off campus (not with family)  room and board 2022-23 (IC2022_AY): 7634.0
Off campus (not with family)  other expenses 2022-23 (IC2022_AY): 3930.0
Off campus (with family)  other expenses 2022-23 (IC2022_AY): 2994.0
On campus  room and board 2019-20 (IC2022_AY): 7170.0
Published out-of-state tuition and fees 2022-23 (IC2022_AY): 16091.0
Published in-district tuition and fees 2022-23 (IC2022_AY): 7873.0
Published in-state tuition and fees 2022-23 (IC2022_AY): 7873.0
Institution provide on-campus housing (IC2022): 1.0
Typical room charge for academic year (IC2022): 4748.0
Typical board charge for academic year (IC2022): 2950.0
Undergraduate application fee (IC2022): 25.0
Graduate application fee (IC2022): 56.0
Any alternative tuition plans offered by institution (IC2022_RV): 1.0
Tuition payment plan (IC2022_RV): 1.0
Average amount of federal  state  local or institutional grant aid awarded (SFA2021_RV): 5083.0
Average amount of federal grant aid awarded to full-time first-time undergraduates (SFA2021_RV): 4208.0
Average amount of Pell grant aid awarded to full-time first-time undergraduates (SFA2021_RV): 4448.0
Average amount of other federal grant aid awarded to full-time first-time undergraduates (SFA2021_RV): 1030.0
Average amount of state/local grant aid awarded to full-time first-time undergraduates (SFA2021_RV): 2298.0
Average amount of institutional grant aid awarded to full-time first-time undergraduates (SFA2021_RV): 3558.0
Average amount of student loans awarded to full-time first-time undergraduates (SFA2021_RV): 5866.0
Average amount of other student loans awarded to full-time first-time undergraduates (SFA2021_RV): 8517.0
Average amount of federal  state  local  institutional or other sources of grant aid awarded to undergraduate students (SFA2021_RV): 6322.0
Average amount Pell grant aid awarded to undergraduate students (SFA2021_RV): 4391.0
Average amount of federal student loans awarded to undergraduate students (SFA2021_RV): 6173.0
Average net price-students awarded grant or scholarship aid  2020-21 (SFA2021_RV): 
Average net price (income 0-30 000)-students awarded Title IV federal financial aid  2020-21 (SFA2021_RV): 
Average net price (income 30 001-48 000)-students awarded Title IV federal financial aid  2020-21 (SFA2021_RV): 
Average net price (income 48 001-75 000)-students awarded Title IV federal financial aid  2020-21 (SFA2021_RV): 
Average net price (income 75 001-110 000)-students awarded Title IV federal financial aid  2020-21 (SFA2021_RV): 
Average net price (income over 110 000)-students awarded Title IV federal financial aid  2020-21 (SFA2021_RV): 
Books and supplies 2021-22 (IC2021_AY): 800.0
On campus  room and board 2021-22 (IC2021_AY): 7392.0
Off campus (not with family)  room and board 2021-22 (IC2021_AY): 7392.0
Off campus (not with family)  other expenses 2021-22 (IC2021_AY): 3824.0
Off campus (with family)  other expenses 2021-22 (IC2021_AY): 2902.0
On campus  room and board 2018-19 (IC2021_AY): 7306.0
Published out-of-state tuition and fees 2021-22 (IC2021_AY): 16091.0
Published in-district tuition and fees 2021-22 (IC2021_AY): 7873.0
Published in-state tuition and fees 2021-22 (IC2021_AY): 7873.0
Institution provide on-campus housing (IC2021): 1.0
Typical room charge for academic year (IC2021): 4575.0
Typical board charge for academic year (IC2021): 2850.0
Undergraduate application fee (IC2021): 25.0
Graduate application fee (IC2021): 56.0
Any alternative tuition plans offered by institution (IC2021): 1.0
Tuition payment plan (IC2021_RV): 1.0
Books and supplies 2020-21 (IC2020_AY): 800.0
On campus  room and board 2020-21 (IC2020_AY): 7280.0
Off campus (not with family)  room and board 2020-21 (IC2020_AY): 7280.0
Off campus (not with family)  other expenses 2020-21 (IC2020_AY): 3770.0
Off campus (with family)  other expenses 2020-21 (IC2020_AY): 2862.0
On campus  room and board 2017-18 (IC2020_AY): 7306.0
Published out-of-state tuition and fees 2020-21 (IC2020_AY): 16091.0
Published in-district tuition and fees 2020-21 (IC2020_AY): 7873.0
Published in-state tuition and fees 2020-21 (IC2020_AY): 7873.0
Institution provide on-campus housing (IC2020): 1.0
Typical room charge for academic year (IC2020): 4445.0
Typical board charge for academic year (IC2020): 2800.0
Undergraduate application fee (IC2020): 25.0
Graduate application fee (IC2020): 56.0
Any alternative tuition plans offered by institution (IC2020_RV): 1.0
Tuition payment plan (IC2020_RV): 1.0","What is the typical food charge for an academic year at the University of Wisconsin-Green Bay?
",The typical food charge for an academic year at the University of Wisconsin-Green Bay is 3100.0.,../data/final_p1.csv
27,": 85915
UnitID: 128498
institution name: Albertus Magnus College
year: 2023
CIP2020Title: Psychology, General.
CIP_Code: 420101
SOC2018Title: Psychologists, All Other
SOC_Code: 193039
CIPDefinition: A general program that focuses on the scientific study of individual and collective behavior, the physical and environmental bases of behavior, and the analysis and treatment of behavior problems and disorders.  Includes instruction in the principles of the various subfields of psychology, research methods, and psychological assessment and testing methods.
CrossReferences: 30.1701 - Behavioral Sciences.
Institution Name: Albertus Magnus College
Books and supplies 2023-24 (IC2023_AY): 1000.0
On campus  food and housing 2023-24 (IC2023_AY): 15338.0
Off campus (not with family)  food and housing 2023-24 (IC2023_AY): 14966.0
Off campus (not with family)  other expenses 2023-24 (IC2023_AY): 7804.0
Off campus (with family)  other expenses 2023-24 (IC2023_AY): 7804.0
On campus  food and housing 2020-21 (IC2023_AY): 14454.0
Published out-of-state tuition and fees 2023-24 (IC2023_AY): 39924.0
Published in-district tuition and fees 2023-24 (IC2023_AY): 39924.0
Published in-state tuition and fees 2023-24 (IC2023_AY): 39924.0
Institution provide nstitutionally-controlled housing (on-campus and/or off-campus) (IC2023): 1.0
Typical housing charges for an academic year (IC2023): 11686.0
Typical food charge for academic year (IC2023): 3652.0
Undergraduate application fee (IC2023): 0.0
Graduate application fee (IC2023): 50.0
Any alternative tuition plans offered by institution (IC2023): 1.0
Tuition payment plan (IC2023): 1.0
Average amount of federal  state  local or institutional grant aid awarded (SFA2122): 26016.0
Average amount of federal grant aid awarded to full-time first-time undergraduates (SFA2122): 5732.0
Average amount of Pell grant aid awarded to full-time first-time undergraduates (SFA2122): 5172.0
Average amount of other federal grant aid awarded to full-time first-time undergraduates (SFA2122): 572.0
Average amount of state/local grant aid awarded to full-time first-time undergraduates (SFA2122): 1983.0
Average amount of institutional grant aid awarded to full-time first-time undergraduates (SFA2122): 23261.0
Average amount of student loans awarded to full-time first-time undergraduates (SFA2122): 10764.0
Average amount of other student loans awarded to full-time first-time undergraduates (SFA2122): 13024.0
Average amount of federal  state  local  institutional or other sources of grant aid awarded to undergraduate students (SFA2122): 19174.0
Average amount Pell grant aid awarded to undergraduate students (SFA2122): 4858.0
Average amount of federal student loans awarded to undergraduate students (SFA2122): 10069.0
Average amount of federal  state  local  institutional or other sources of grant aid awarded to degree/certificate-seeking undergraduate students (SFA2122): 19174.0
Average amount of federal  state  local  institutional or other sources of grant aid awarded to non-degree/non-certificate-seeking undergraduates (SFA2122): 
Average net price-students awarded grant or scholarship aid  2021-22 (SFA2122): 27469.0
Average net price (income 0-30 000)-students awarded Title IV federal financial aid  2021-22 (SFA2122): 25039.0
Average net price (income 30 001-48 000)-students awarded Title IV federal financial aid  2021-22 (SFA2122): 25604.0
Average net price (income 48 001-75 000)-students awarded Title IV federal financial aid  2021-22 (SFA2122): 26120.0
Average net price (income 75 001-110 000)-students awarded Title IV federal financial aid  2021-22 (SFA2122): 29532.0
Average net price (income over 110 000)-students awarded Title IV federal financial aid  2021-22 (SFA2122): 29077.0
Books and supplies 2022-23 (IC2022_AY): 1000.0
On campus  room and board 2022-23 (IC2022_AY): 15046.0
Off campus (not with family)  room and board 2022-23 (IC2022_AY): 14472.0
Off campus (not with family)  other expenses 2022-23 (IC2022_AY): 7542.0
Off campus (with family)  other expenses 2022-23 (IC2022_AY): 7542.0
On campus  room and board 2019-20 (IC2022_AY): 13910.0
Published out-of-state tuition and fees 2022-23 (IC2022_AY): 37682.0
Published in-district tuition and fees 2022-23 (IC2022_AY): 37682.0
Published in-state tuition and fees 2022-23 (IC2022_AY): 37682.0
Institution provide on-campus housing (IC2022): 1.0
Typical room charge for academic year (IC2022): 11568.0
Typical board charge for academic year (IC2022): 3478.0
Undergraduate application fee (IC2022): 35.0
Graduate application fee (IC2022): 50.0
Any alternative tuition plans offered by institution (IC2022_RV): 1.0
Tuition payment plan (IC2022_RV): 1.0
Average amount of federal  state  local or institutional grant aid awarded (SFA2021_RV): 23401.0
Average amount of federal grant aid awarded to full-time first-time undergraduates (SFA2021_RV): 7986.0
Average amount of Pell grant aid awarded to full-time first-time undergraduates (SFA2021_RV): 5035.0
Average amount of other federal grant aid awarded to full-time first-time undergraduates (SFA2021_RV): 3100.0
Average amount of state/local grant aid awarded to full-time first-time undergraduates (SFA2021_RV): 3473.0
Average amount of institutional grant aid awarded to full-time first-time undergraduates (SFA2021_RV): 20001.0
Average amount of student loans awarded to full-time first-time undergraduates (SFA2021_RV): 11083.0
Average amount of other student loans awarded to full-time first-time undergraduates (SFA2021_RV): 16180.0
Average amount of federal  state  local  institutional or other sources of grant aid awarded to undergraduate students (SFA2021_RV): 14789.0
Average amount Pell grant aid awarded to undergraduate students (SFA2021_RV): 4703.0
Average amount of federal student loans awarded to undergraduate students (SFA2021_RV): 9793.0
Average net price-students awarded grant or scholarship aid  2020-21 (SFA2021_RV): 28774.0
Average net price (income 0-30 000)-students awarded Title IV federal financial aid  2020-21 (SFA2021_RV): 26294.0
Average net price (income 30 001-48 000)-students awarded Title IV federal financial aid  2020-21 (SFA2021_RV): 26567.0
Average net price (income 48 001-75 000)-students awarded Title IV federal financial aid  2020-21 (SFA2021_RV): 28964.0
Average net price (income 75 001-110 000)-students awarded Title IV federal financial aid  2020-21 (SFA2021_RV): 30088.0
Average net price (income over 110 000)-students awarded Title IV federal financial aid  2020-21 (SFA2021_RV): 33117.0
Books and supplies 2021-22 (IC2021_AY): 1000.0
On campus  room and board 2021-22 (IC2021_AY): 14898.0
Off campus (not with family)  room and board 2021-22 (IC2021_AY): 14312.0
Off campus (not with family)  other expenses 2021-22 (IC2021_AY): 7468.0
Off campus (with family)  other expenses 2021-22 (IC2021_AY): 7468.0
On campus  room and board 2018-19 (IC2021_AY): 13200.0
Published out-of-state tuition and fees 2021-22 (IC2021_AY): 36442.0
Published in-district tuition and fees 2021-22 (IC2021_AY): 36442.0
Published in-state tuition and fees 2021-22 (IC2021_AY): 36442.0
Institution provide on-campus housing (IC2021): 1.0
Typical room charge for academic year (IC2021): 11454.0
Typical board charge for academic year (IC2021): 3444.0
Undergraduate application fee (IC2021): 35.0
Graduate application fee (IC2021): 50.0
Any alternative tuition plans offered by institution (IC2021): 1.0
Tuition payment plan (IC2021_RV): 1.0
Books and supplies 2020-21 (IC2020_AY): 1000.0
On campus  room and board 2020-21 (IC2020_AY): 14454.0
Off campus (not with family)  room and board 2020-21 (IC2020_AY): 14254.0
Off campus (not with family)  other expenses 2020-21 (IC2020_AY): 7438.0
Off campus (with family)  other expenses 2020-21 (IC2020_AY): 7438.0
On campus  room and board 2017-18 (IC2020_AY): 13000.0
Published out-of-state tuition and fees 2020-21 (IC2020_AY): 35410.0
Published in-district tuition and fees 2020-21 (IC2020_AY): 35410.0
Published in-state tuition and fees 2020-21 (IC2020_AY): 35410.0
Institution provide on-campus housing (IC2020): 1.0
Typical room charge for academic year (IC2020): 11120.0
Typical board charge for academic year (IC2020): 3334.0
Undergraduate application fee (IC2020): 35.0
Graduate application fee (IC2020): 50.0
Any alternative tuition plans offered by institution (IC2020_RV): 1.0
Tuition payment plan (IC2020_RV): 1.0","What is the typical food charge for an academic year at Albertus Magnus College?
",The typical food charge for an academic year at Albertus Magnus College is 3652.0.,../data/final_p1.csv
28,": 113669
AREA: 99
AREA_TITLE: U.S.
AREA_TYPE: 1
PRIM_STATE: US
NAICS: 611000
NAICS_TITLE: Educational Services
I_GROUP: 3-digit, ownership
OWN_CODE: 2
OCC_CODE: 25-1120
OCC_TITLE: Arts, Communications, History, and Humanities Teachers, Postsecondary
O_GROUP: broad
TOT_EMP: 101,530
EMP_PRSE: 0.6
JOBS_1000: 
LOC_QUOTIENT: 
PCT_TOTAL: 5.06
PCT_RPT: 36
H_MEAN: *
A_MEAN: 78,380
MEAN_PRSE: 0.5
H_PCT10: *
H_PCT25: *
H_MEDIAN: *
H_PCT75: *
H_PCT90: *
A_PCT10: 47,030
A_PCT25: 54,780
A_MEDIAN: 71,940
A_PCT75: 93,210
A_PCT90: 121,800
ANNUAL: True
HOURLY: 
SOC_Code: 251120","What is the median salary for Arts, Communications, History, and Humanities Teachers, Postsecondary in the U.S.?
","$71,940",../data/final_p2.csv
29,": 306064
UnitID: 182281
institution name: University of Nevada-Las Vegas
year: 2023
CIP2020Title: Nutrition Sciences.
CIP_Code: 301901
SOC2018Title: Life Scientists, All Other
SOC_Code: 191099
CIPDefinition: A scientific program that focuses on the utilization of food for human growth and metabolism, in both normal and dysfunctional states, from the interdisciplinary perspective of the agricultural, human, biological, and biomedical sciences.  Includes instruction in food science, biochemistry, physiology, dietetics, food and nutrition studies, biotechnology, biophysics, and the clinical sciences.
CrossReferences: 19.0504 - Human Nutrition., 51.3102 - Clinical Nutrition/Nutritionist.
Institution Name: University of Nevada-Las Vegas
Books and supplies 2023-24 (IC2023_AY): 1240.0
On campus  food and housing 2023-24 (IC2023_AY): 12072.0
Off campus (not with family)  food and housing 2023-24 (IC2023_AY): 12710.0
Off campus (not with family)  other expenses 2023-24 (IC2023_AY): 5448.0
Off campus (with family)  other expenses 2023-24 (IC2023_AY): 5448.0
On campus  food and housing 2020-21 (IC2023_AY): 10924.0
Published out-of-state tuition and fees 2023-24 (IC2023_AY): 26098.0
Published in-district tuition and fees 2023-24 (IC2023_AY): 9142.0
Published in-state tuition and fees 2023-24 (IC2023_AY): 9142.0
Institution provide nstitutionally-controlled housing (on-campus and/or off-campus) (IC2023): 1.0
Typical housing charges for an academic year (IC2023): 6232.0
Typical food charge for academic year (IC2023): 5984.0
Undergraduate application fee (IC2023): 60.0
Graduate application fee (IC2023): 60.0
Any alternative tuition plans offered by institution (IC2023): 1.0
Tuition payment plan (IC2023): 1.0
Average amount of federal  state  local or institutional grant aid awarded (SFA2122): 6346.0
Average amount of federal grant aid awarded to full-time first-time undergraduates (SFA2122): 5144.0
Average amount of Pell grant aid awarded to full-time first-time undergraduates (SFA2122): 5058.0
Average amount of other federal grant aid awarded to full-time first-time undergraduates (SFA2122): 752.0
Average amount of state/local grant aid awarded to full-time first-time undergraduates (SFA2122): 1835.0
Average amount of institutional grant aid awarded to full-time first-time undergraduates (SFA2122): 3243.0
Average amount of student loans awarded to full-time first-time undergraduates (SFA2122): 5722.0
Average amount of other student loans awarded to full-time first-time undergraduates (SFA2122): 15387.0
Average amount of federal  state  local  institutional or other sources of grant aid awarded to undergraduate students (SFA2122): 6668.0
Average amount Pell grant aid awarded to undergraduate students (SFA2122): 4652.0
Average amount of federal student loans awarded to undergraduate students (SFA2122): 9016.0
Average amount of federal  state  local  institutional or other sources of grant aid awarded to degree/certificate-seeking undergraduate students (SFA2122): 6688.0
Average amount of federal  state  local  institutional or other sources of grant aid awarded to non-degree/non-certificate-seeking undergraduates (SFA2122): 882.0
Average net price-students awarded grant or scholarship aid  2021-22 (SFA2122): 
Average net price (income 0-30 000)-students awarded Title IV federal financial aid  2021-22 (SFA2122): 
Average net price (income 30 001-48 000)-students awarded Title IV federal financial aid  2021-22 (SFA2122): 
Average net price (income 48 001-75 000)-students awarded Title IV federal financial aid  2021-22 (SFA2122): 
Average net price (income 75 001-110 000)-students awarded Title IV federal financial aid  2021-22 (SFA2122): 
Average net price (income over 110 000)-students awarded Title IV federal financial aid  2021-22 (SFA2122): 
Books and supplies 2022-23 (IC2022_AY): 1240.0
On campus  room and board 2022-23 (IC2022_AY): 11512.0
Off campus (not with family)  room and board 2022-23 (IC2022_AY): 12710.0
Off campus (not with family)  other expenses 2022-23 (IC2022_AY): 5448.0
Off campus (with family)  other expenses 2022-23 (IC2022_AY): 5448.0
On campus  room and board 2019-20 (IC2022_AY): 10892.0
Published out-of-state tuition and fees 2022-23 (IC2022_AY): 25489.0
Published in-district tuition and fees 2022-23 (IC2022_AY): 8947.0
Published in-state tuition and fees 2022-23 (IC2022_AY): 8947.0
Institution provide on-campus housing (IC2022): 1.0
Typical room charge for academic year (IC2022): 5880.0
Typical board charge for academic year (IC2022): 5456.0
Undergraduate application fee (IC2022): 60.0
Graduate application fee (IC2022): 60.0
Any alternative tuition plans offered by institution (IC2022_RV): 1.0
Tuition payment plan (IC2022_RV): 1.0
Average amount of federal  state  local or institutional grant aid awarded (SFA2021_RV): 6217.0
Average amount of federal grant aid awarded to full-time first-time undergraduates (SFA2021_RV): 4291.0
Average amount of Pell grant aid awarded to full-time first-time undergraduates (SFA2021_RV): 5102.0
Average amount of other federal grant aid awarded to full-time first-time undergraduates (SFA2021_RV): 310.0
Average amount of state/local grant aid awarded to full-time first-time undergraduates (SFA2021_RV): 2312.0
Average amount of institutional grant aid awarded to full-time first-time undergraduates (SFA2021_RV): 3724.0
Average amount of student loans awarded to full-time first-time undergraduates (SFA2021_RV): 6039.0
Average amount of other student loans awarded to full-time first-time undergraduates (SFA2021_RV): 17424.0
Average amount of federal  state  local  institutional or other sources of grant aid awarded to undergraduate students (SFA2021_RV): 5796.0
Average amount Pell grant aid awarded to undergraduate students (SFA2021_RV): 4610.0
Average amount of federal student loans awarded to undergraduate students (SFA2021_RV): 8953.0
Average net price-students awarded grant or scholarship aid  2020-21 (SFA2021_RV): 
Average net price (income 0-30 000)-students awarded Title IV federal financial aid  2020-21 (SFA2021_RV): 
Average net price (income 30 001-48 000)-students awarded Title IV federal financial aid  2020-21 (SFA2021_RV): 
Average net price (income 48 001-75 000)-students awarded Title IV federal financial aid  2020-21 (SFA2021_RV): 
Average net price (income 75 001-110 000)-students awarded Title IV federal financial aid  2020-21 (SFA2021_RV): 
Average net price (income over 110 000)-students awarded Title IV federal financial aid  2020-21 (SFA2021_RV): 
Books and supplies 2021-22 (IC2021_AY): 1240.0
On campus  room and board 2021-22 (IC2021_AY): 11512.0
Off campus (not with family)  room and board 2021-22 (IC2021_AY): 11430.0
Off campus (not with family)  other expenses 2021-22 (IC2021_AY): 6596.0
Off campus (with family)  other expenses 2021-22 (IC2021_AY): 6596.0
On campus  room and board 2018-19 (IC2021_AY): 10780.0
Published out-of-state tuition and fees 2021-22 (IC2021_AY): 24828.0
Published in-district tuition and fees 2021-22 (IC2021_AY): 8737.0
Published in-state tuition and fees 2021-22 (IC2021_AY): 8737.0
Institution provide on-campus housing (IC2021): 1.0
Typical room charge for academic year (IC2021): 5880.0
Typical board charge for academic year (IC2021): 5456.0
Undergraduate application fee (IC2021): 60.0
Graduate application fee (IC2021): 60.0
Any alternative tuition plans offered by institution (IC2021): 1.0
Tuition payment plan (IC2021_RV): 1.0
Books and supplies 2020-21 (IC2020_AY): 1240.0
On campus  room and board 2020-21 (IC2020_AY): 10924.0
Off campus (not with family)  room and board 2020-21 (IC2020_AY): 10830.0
Off campus (not with family)  other expenses 2020-21 (IC2020_AY): 6596.0
Off campus (with family)  other expenses 2020-21 (IC2020_AY): 6596.0
On campus  room and board 2017-18 (IC2020_AY): 10806.0
Published out-of-state tuition and fees 2020-21 (IC2020_AY): 24338.0
Published in-district tuition and fees 2020-21 (IC2020_AY): 8685.0
Published in-state tuition and fees 2020-21 (IC2020_AY): 8685.0
Institution provide on-campus housing (IC2020): 1.0
Typical room charge for academic year (IC2020): 5880.0
Typical board charge for academic year (IC2020): 5246.0
Undergraduate application fee (IC2020): 60.0
Graduate application fee (IC2020): 60.0
Any alternative tuition plans offered by institution (IC2020_RV): 1.0
Tuition payment plan (IC2020_RV): 1.0","What is the cost of books and supplies for the 2023-24 academic year at the University of Nevada-Las Vegas?
",The cost of books and supplies for the 2023-24 academic year at the University of Nevada-Las Vegas is $1240.0.,../data/final_p1.csv
30,": 520678
UnitID: 227881
institution name: Sam Houston State University
year: 2023
CIP2020Title: Musical Theatre.
CIP_Code: 500509
SOC2018Title: Producers and Directors
SOC_Code: 272012
CIPDefinition: A program that focuses on the principles and techniques for integrating theatre, music, and dance into a unified production. Includes instruction in acting, dance, voice, technical theater, musical genres, piano, and history of musical theater.
CrossReferences: 
Institution Name: Sam Houston State University
Books and supplies 2023-24 (IC2023_AY): 1380.0
On campus  food and housing 2023-24 (IC2023_AY): 11720.0
Off campus (not with family)  food and housing 2023-24 (IC2023_AY): 11720.0
Off campus (not with family)  other expenses 2023-24 (IC2023_AY): 3866.0
Off campus (with family)  other expenses 2023-24 (IC2023_AY): 3866.0
On campus  food and housing 2020-21 (IC2023_AY): 9670.0
Published out-of-state tuition and fees 2023-24 (IC2023_AY): 19020.0
Published in-district tuition and fees 2023-24 (IC2023_AY): 9228.0
Published in-state tuition and fees 2023-24 (IC2023_AY): 9228.0
Institution provide nstitutionally-controlled housing (on-campus and/or off-campus) (IC2023): 1.0
Typical housing charges for an academic year (IC2023): 6384.0
Typical food charge for academic year (IC2023): 5334.0
Undergraduate application fee (IC2023): 50.0
Graduate application fee (IC2023): 50.0
Any alternative tuition plans offered by institution (IC2023): 1.0
Tuition payment plan (IC2023): 1.0
Average amount of federal  state  local or institutional grant aid awarded (SFA2122): 10499.0
Average amount of federal grant aid awarded to full-time first-time undergraduates (SFA2122): 5543.0
Average amount of Pell grant aid awarded to full-time first-time undergraduates (SFA2122): 5189.0
Average amount of other federal grant aid awarded to full-time first-time undergraduates (SFA2122): 2746.0
Average amount of state/local grant aid awarded to full-time first-time undergraduates (SFA2122): 6748.0
Average amount of institutional grant aid awarded to full-time first-time undergraduates (SFA2122): 6247.0
Average amount of student loans awarded to full-time first-time undergraduates (SFA2122): 5658.0
Average amount of other student loans awarded to full-time first-time undergraduates (SFA2122): 14585.0
Average amount of federal  state  local  institutional or other sources of grant aid awarded to undergraduate students (SFA2122): 8466.0
Average amount Pell grant aid awarded to undergraduate students (SFA2122): 4895.0
Average amount of federal student loans awarded to undergraduate students (SFA2122): 6865.0
Average amount of federal  state  local  institutional or other sources of grant aid awarded to degree/certificate-seeking undergraduate students (SFA2122): 8466.0
Average amount of federal  state  local  institutional or other sources of grant aid awarded to non-degree/non-certificate-seeking undergraduates (SFA2122): 
Average net price-students awarded grant or scholarship aid  2021-22 (SFA2122): 
Average net price (income 0-30 000)-students awarded Title IV federal financial aid  2021-22 (SFA2122): 
Average net price (income 30 001-48 000)-students awarded Title IV federal financial aid  2021-22 (SFA2122): 
Average net price (income 48 001-75 000)-students awarded Title IV federal financial aid  2021-22 (SFA2122): 
Average net price (income 75 001-110 000)-students awarded Title IV federal financial aid  2021-22 (SFA2122): 
Average net price (income over 110 000)-students awarded Title IV federal financial aid  2021-22 (SFA2122): 
Books and supplies 2022-23 (IC2022_AY): 1380.0
On campus  room and board 2022-23 (IC2022_AY): 10908.0
Off campus (not with family)  room and board 2022-23 (IC2022_AY): 10908.0
Off campus (not with family)  other expenses 2022-23 (IC2022_AY): 3866.0
Off campus (with family)  other expenses 2022-23 (IC2022_AY): 3866.0
On campus  room and board 2019-20 (IC2022_AY): 9552.0
Published out-of-state tuition and fees 2022-23 (IC2022_AY): 18752.0
Published in-district tuition and fees 2022-23 (IC2022_AY): 8960.0
Published in-state tuition and fees 2022-23 (IC2022_AY): 8960.0
Institution provide on-campus housing (IC2022): 1.0
Typical room charge for academic year (IC2022): 6008.0
Typical board charge for academic year (IC2022): 4900.0
Undergraduate application fee (IC2022): 50.0
Graduate application fee (IC2022): 50.0
Any alternative tuition plans offered by institution (IC2022_RV): 1.0
Tuition payment plan (IC2022_RV): 1.0
Average amount of federal  state  local or institutional grant aid awarded (SFA2021_RV): 9492.0
Average amount of federal grant aid awarded to full-time first-time undergraduates (SFA2021_RV): 5702.0
Average amount of Pell grant aid awarded to full-time first-time undergraduates (SFA2021_RV): 4995.0
Average amount of other federal grant aid awarded to full-time first-time undergraduates (SFA2021_RV): 1988.0
Average amount of state/local grant aid awarded to full-time first-time undergraduates (SFA2021_RV): 5681.0
Average amount of institutional grant aid awarded to full-time first-time undergraduates (SFA2021_RV): 4393.0
Average amount of student loans awarded to full-time first-time undergraduates (SFA2021_RV): 5728.0
Average amount of other student loans awarded to full-time first-time undergraduates (SFA2021_RV): 14496.0
Average amount of federal  state  local  institutional or other sources of grant aid awarded to undergraduate students (SFA2021_RV): 7937.0
Average amount Pell grant aid awarded to undergraduate students (SFA2021_RV): 4796.0
Average amount of federal student loans awarded to undergraduate students (SFA2021_RV): 6907.0
Average net price-students awarded grant or scholarship aid  2020-21 (SFA2021_RV): 
Average net price (income 0-30 000)-students awarded Title IV federal financial aid  2020-21 (SFA2021_RV): 
Average net price (income 30 001-48 000)-students awarded Title IV federal financial aid  2020-21 (SFA2021_RV): 
Average net price (income 48 001-75 000)-students awarded Title IV federal financial aid  2020-21 (SFA2021_RV): 
Average net price (income 75 001-110 000)-students awarded Title IV federal financial aid  2020-21 (SFA2021_RV): 
Average net price (income over 110 000)-students awarded Title IV federal financial aid  2020-21 (SFA2021_RV): 
Books and supplies 2021-22 (IC2021_AY): 1380.0
On campus  room and board 2021-22 (IC2021_AY): 10406.0
Off campus (not with family)  room and board 2021-22 (IC2021_AY): 10406.0
Off campus (not with family)  other expenses 2021-22 (IC2021_AY): 3866.0
Off campus (with family)  other expenses 2021-22 (IC2021_AY): 3866.0
On campus  room and board 2018-19 (IC2021_AY): 9386.0
Published out-of-state tuition and fees 2021-22 (IC2021_AY): 18752.0
Published in-district tuition and fees 2021-22 (IC2021_AY): 8960.0
Published in-state tuition and fees 2021-22 (IC2021_AY): 8960.0
Institution provide on-campus housing (IC2021): 1.0
Typical room charge for academic year (IC2021): 5918.0
Typical board charge for academic year (IC2021): 4650.0
Undergraduate application fee (IC2021): 50.0
Graduate application fee (IC2021): 50.0
Any alternative tuition plans offered by institution (IC2021): 1.0
Tuition payment plan (IC2021_RV): 1.0
Books and supplies 2020-21 (IC2020_AY): 1380.0
On campus  room and board 2020-21 (IC2020_AY): 9670.0
Off campus (not with family)  room and board 2020-21 (IC2020_AY): 9670.0
Off campus (not with family)  other expenses 2020-21 (IC2020_AY): 3866.0
Off campus (with family)  other expenses 2020-21 (IC2020_AY): 3866.0
On campus  room and board 2017-18 (IC2020_AY): 9178.0
Published out-of-state tuition and fees 2020-21 (IC2020_AY): 18552.0
Published in-district tuition and fees 2020-21 (IC2020_AY): 8736.0
Published in-state tuition and fees 2020-21 (IC2020_AY): 8736.0
Institution provide on-campus housing (IC2020): 1.0
Typical room charge for academic year (IC2020): 5760.0
Typical board charge for academic year (IC2020): 4290.0
Undergraduate application fee (IC2020): 45.0
Graduate application fee (IC2020): 45.0
Any alternative tuition plans offered by institution (IC2020_RV): 1.0
Tuition payment plan (IC2020_RV): 1.0","What is the cost of books and supplies for the 2023-24 academic year at Sam Houston State University for the Musical Theatre program?
",1380.0,../data/final_p1.csv
31,": 421694
UnitID: 206604
institution name: Wright State University-Main Campus
year: 2023
CIP2020Title: Medicine.
CIP_Code: 511201
SOC2018Title: Dermatologists
SOC_Code: 291213
CIPDefinition: A program that prepares individuals for the independent professional practice of medicine, involving the prevention, diagnosis, and treatment of illnesses, injuries, and other disorders of the human body. Includes instruction in the basic medical sciences, clinical medicine, examination and diagnosis, patient communications, medical ethics and law, professional standards, and rotations in specialties such as internal medicine, surgery, pediatrics, obstetrics and gynecology, orthopedics, neurology, ophthalmology, radiology, clinical pathology, anesthesiology, family medicine, and psychiatry.
CrossReferences: 
Institution Name: Wright State University-Main Campus
Books and supplies 2023-24 (IC2023_AY): 1400.0
On campus  food and housing 2023-24 (IC2023_AY): 10900.0
Off campus (not with family)  food and housing 2023-24 (IC2023_AY): 10900.0
Off campus (not with family)  other expenses 2023-24 (IC2023_AY): 3370.0
Off campus (with family)  other expenses 2023-24 (IC2023_AY): 3370.0
On campus  food and housing 2020-21 (IC2023_AY): 12000.0
Published out-of-state tuition and fees 2023-24 (IC2023_AY): 20606.0
Published in-district tuition and fees 2023-24 (IC2023_AY): 11188.0
Published in-state tuition and fees 2023-24 (IC2023_AY): 11188.0
Institution provide nstitutionally-controlled housing (on-campus and/or off-campus) (IC2023): 1.0
Typical housing charges for an academic year (IC2023): 5552.0
Typical food charge for academic year (IC2023): 5106.0
Undergraduate application fee (IC2023): 0.0
Graduate application fee (IC2023): 40.0
Any alternative tuition plans offered by institution (IC2023): 1.0
Tuition payment plan (IC2023): 1.0
Average amount of federal  state  local or institutional grant aid awarded (SFA2122): 8867.0
Average amount of federal grant aid awarded to full-time first-time undergraduates (SFA2122): 6240.0
Average amount of Pell grant aid awarded to full-time first-time undergraduates (SFA2122): 5033.0
Average amount of other federal grant aid awarded to full-time first-time undergraduates (SFA2122): 3145.0
Average amount of state/local grant aid awarded to full-time first-time undergraduates (SFA2122): 2916.0
Average amount of institutional grant aid awarded to full-time first-time undergraduates (SFA2122): 3635.0
Average amount of student loans awarded to full-time first-time undergraduates (SFA2122): 5975.0
Average amount of other student loans awarded to full-time first-time undergraduates (SFA2122): 11286.0
Average amount of federal  state  local  institutional or other sources of grant aid awarded to undergraduate students (SFA2122): 8515.0
Average amount Pell grant aid awarded to undergraduate students (SFA2122): 5177.0
Average amount of federal student loans awarded to undergraduate students (SFA2122): 6571.0
Average amount of federal  state  local  institutional or other sources of grant aid awarded to degree/certificate-seeking undergraduate students (SFA2122): 8875.0
Average amount of federal  state  local  institutional or other sources of grant aid awarded to non-degree/non-certificate-seeking undergraduates (SFA2122): 762.0
Average net price-students awarded grant or scholarship aid  2021-22 (SFA2122): 
Average net price (income 0-30 000)-students awarded Title IV federal financial aid  2021-22 (SFA2122): 
Average net price (income 30 001-48 000)-students awarded Title IV federal financial aid  2021-22 (SFA2122): 
Average net price (income 48 001-75 000)-students awarded Title IV federal financial aid  2021-22 (SFA2122): 
Average net price (income 75 001-110 000)-students awarded Title IV federal financial aid  2021-22 (SFA2122): 
Average net price (income over 110 000)-students awarded Title IV federal financial aid  2021-22 (SFA2122): 
Books and supplies 2022-23 (IC2022_AY): 1400.0
On campus  room and board 2022-23 (IC2022_AY): 10686.0
Off campus (not with family)  room and board 2022-23 (IC2022_AY): 10686.0
Off campus (not with family)  other expenses 2022-23 (IC2022_AY): 3170.0
Off campus (with family)  other expenses 2022-23 (IC2022_AY): 3170.0
On campus  room and board 2019-20 (IC2022_AY): 11592.0
Published out-of-state tuition and fees 2022-23 (IC2022_AY): 20282.0
Published in-district tuition and fees 2022-23 (IC2022_AY): 10864.0
Published in-state tuition and fees 2022-23 (IC2022_AY): 10864.0
Institution provide on-campus housing (IC2022): 1.0
Typical room charge for academic year (IC2022): 5332.0
Typical board charge for academic year (IC2022): 4896.0
Undergraduate application fee (IC2022): 0.0
Graduate application fee (IC2022): 40.0
Any alternative tuition plans offered by institution (IC2022_RV): 1.0
Tuition payment plan (IC2022_RV): 1.0
Average amount of federal  state  local or institutional grant aid awarded (SFA2021_RV): 8040.0
Average amount of federal grant aid awarded to full-time first-time undergraduates (SFA2021_RV): 3173.0
Average amount of Pell grant aid awarded to full-time first-time undergraduates (SFA2021_RV): 4953.0
Average amount of other federal grant aid awarded to full-time first-time undergraduates (SFA2021_RV): 963.0
Average amount of state/local grant aid awarded to full-time first-time undergraduates (SFA2021_RV): 2958.0
Average amount of institutional grant aid awarded to full-time first-time undergraduates (SFA2021_RV): 5624.0
Average amount of student loans awarded to full-time first-time undergraduates (SFA2021_RV): 6195.0
Average amount of other student loans awarded to full-time first-time undergraduates (SFA2021_RV): 10596.0
Average amount of federal  state  local  institutional or other sources of grant aid awarded to undergraduate students (SFA2021_RV): 6637.0
Average amount Pell grant aid awarded to undergraduate students (SFA2021_RV): 5051.0
Average amount of federal student loans awarded to undergraduate students (SFA2021_RV): 6676.0
Average net price-students awarded grant or scholarship aid  2020-21 (SFA2021_RV): 
Average net price (income 0-30 000)-students awarded Title IV federal financial aid  2020-21 (SFA2021_RV): 
Average net price (income 30 001-48 000)-students awarded Title IV federal financial aid  2020-21 (SFA2021_RV): 
Average net price (income 48 001-75 000)-students awarded Title IV federal financial aid  2020-21 (SFA2021_RV): 
Average net price (income 75 001-110 000)-students awarded Title IV federal financial aid  2020-21 (SFA2021_RV): 
Average net price (income over 110 000)-students awarded Title IV federal financial aid  2020-21 (SFA2021_RV): 
Books and supplies 2021-22 (IC2021_AY): 1400.0
On campus  room and board 2021-22 (IC2021_AY): 12000.0
Off campus (not with family)  room and board 2021-22 (IC2021_AY): 12000.0
Off campus (not with family)  other expenses 2021-22 (IC2021_AY): 3170.0
Off campus (with family)  other expenses 2021-22 (IC2021_AY): 3170.0
On campus  room and board 2018-19 (IC2021_AY): 11518.0
Published out-of-state tuition and fees 2021-22 (IC2021_AY): 19808.0
Published in-district tuition and fees 2021-22 (IC2021_AY): 10390.0
Published in-state tuition and fees 2021-22 (IC2021_AY): 10390.0
Institution provide on-campus housing (IC2021): 1.0
Typical room charge for academic year (IC2021): 5120.0
Typical board charge for academic year (IC2021): 4700.0
Undergraduate application fee (IC2021): 0.0
Graduate application fee (IC2021): 40.0
Any alternative tuition plans offered by institution (IC2021): 1.0
Tuition payment plan (IC2021_RV): 1.0
Books and supplies 2020-21 (IC2020_AY): 1400.0
On campus  room and board 2020-21 (IC2020_AY): 12000.0
Off campus (not with family)  room and board 2020-21 (IC2020_AY): 12000.0
Off campus (not with family)  other expenses 2020-21 (IC2020_AY): 3100.0
Off campus (with family)  other expenses 2020-21 (IC2020_AY): 3100.0
On campus  room and board 2017-18 (IC2020_AY): 11376.0
Published out-of-state tuition and fees 2020-21 (IC2020_AY): 19430.0
Published in-district tuition and fees 2020-21 (IC2020_AY): 10012.0
Published in-state tuition and fees 2020-21 (IC2020_AY): 10012.0
Institution provide on-campus housing (IC2020): 1.0
Typical room charge for academic year (IC2020): 6264.0
Typical board charge for academic year (IC2020): 6150.0
Undergraduate application fee (IC2020): 0.0
Graduate application fee (IC2020): 40.0
Any alternative tuition plans offered by institution (IC2020_RV): 1.0
Tuition payment plan (IC2020_RV): 1.0","What is the published in-state tuition and fees for Wright State University-Main Campus in 2023?
",The published in-state tuition and fees for Wright State University-Main Campus in 2023 is 11188.0.,../data/final_p1.csv
32,": 449068
UnitID: 212984
institution name: Holy Family University
year: 2023
CIP2020Title: Computer and Information Systems Security/Auditing/Information Assurance.
CIP_Code: 111003
SOC2018Title: Database Administrators
SOC_Code: 151242
CIPDefinition: A program that prepares individuals to assess the security needs of computer and network systems, recommend safeguard solutions, and manage the implementation, auditing, and maintenance of security devices, systems, and procedures.  Includes instruction in computer architecture, programming, and systems analysis; networking; telecommunications; cryptography; security system auditing and design; applicable law and regulations; risk assessment and policy analysis; contingency planning; user access issues; investigation techniques; and troubleshooting.
CrossReferences: 43.0403 - Cyber/Computer Forensics and Counterterrorism.
Institution Name: Holy Family University
Books and supplies 2023-24 (IC2023_AY): 1230.0
On campus  food and housing 2023-24 (IC2023_AY): 14694.0
Off campus (not with family)  food and housing 2023-24 (IC2023_AY): 11380.0
Off campus (not with family)  other expenses 2023-24 (IC2023_AY): 1516.0
Off campus (with family)  other expenses 2023-24 (IC2023_AY): 1516.0
On campus  food and housing 2020-21 (IC2023_AY): 14500.0
Published out-of-state tuition and fees 2023-24 (IC2023_AY): 33968.0
Published in-district tuition and fees 2023-24 (IC2023_AY): 33968.0
Published in-state tuition and fees 2023-24 (IC2023_AY): 33968.0
Institution provide nstitutionally-controlled housing (on-campus and/or off-campus) (IC2023): 1.0
Typical housing charges for an academic year (IC2023): 8960.0
Typical food charge for academic year (IC2023): 7520.0
Undergraduate application fee (IC2023): 0.0
Graduate application fee (IC2023): 80.0
Any alternative tuition plans offered by institution (IC2023): 1.0
Tuition payment plan (IC2023): 1.0
Average amount of federal  state  local or institutional grant aid awarded (SFA2122): 25316.0
Average amount of federal grant aid awarded to full-time first-time undergraduates (SFA2122): 4321.0
Average amount of Pell grant aid awarded to full-time first-time undergraduates (SFA2122): 5081.0
Average amount of other federal grant aid awarded to full-time first-time undergraduates (SFA2122): 1912.0
Average amount of state/local grant aid awarded to full-time first-time undergraduates (SFA2122): 4391.0
Average amount of institutional grant aid awarded to full-time first-time undergraduates (SFA2122): 19466.0
Average amount of student loans awarded to full-time first-time undergraduates (SFA2122): 6935.0
Average amount of other student loans awarded to full-time first-time undergraduates (SFA2122): 10281.0
Average amount of federal  state  local  institutional or other sources of grant aid awarded to undergraduate students (SFA2122): 18237.0
Average amount Pell grant aid awarded to undergraduate students (SFA2122): 4845.0
Average amount of federal student loans awarded to undergraduate students (SFA2122): 7669.0
Average amount of federal  state  local  institutional or other sources of grant aid awarded to degree/certificate-seeking undergraduate students (SFA2122): 18246.0
Average amount of federal  state  local  institutional or other sources of grant aid awarded to non-degree/non-certificate-seeking undergraduates (SFA2122): 875.0
Average net price-students awarded grant or scholarship aid  2021-22 (SFA2122): 12379.0
Average net price (income 0-30 000)-students awarded Title IV federal financial aid  2021-22 (SFA2122): 9737.0
Average net price (income 30 001-48 000)-students awarded Title IV federal financial aid  2021-22 (SFA2122): 10325.0
Average net price (income 48 001-75 000)-students awarded Title IV federal financial aid  2021-22 (SFA2122): 11491.0
Average net price (income 75 001-110 000)-students awarded Title IV federal financial aid  2021-22 (SFA2122): 15941.0
Average net price (income over 110 000)-students awarded Title IV federal financial aid  2021-22 (SFA2122): 16837.0
Books and supplies 2022-23 (IC2022_AY): 1150.0
On campus  room and board 2022-23 (IC2022_AY): 14500.0
Off campus (not with family)  room and board 2022-23 (IC2022_AY): 10636.0
Off campus (not with family)  other expenses 2022-23 (IC2022_AY): 1418.0
Off campus (with family)  other expenses 2022-23 (IC2022_AY): 1418.0
On campus  room and board 2019-20 (IC2022_AY): 14500.0
Published out-of-state tuition and fees 2022-23 (IC2022_AY): 32558.0
Published in-district tuition and fees 2022-23 (IC2022_AY): 32558.0
Published in-state tuition and fees 2022-23 (IC2022_AY): 32558.0
Institution provide on-campus housing (IC2022): 1.0
Typical room charge for academic year (IC2022): 8700.0
Typical board charge for academic year (IC2022): 7300.0
Undergraduate application fee (IC2022): 0.0
Graduate application fee (IC2022): 25.0
Any alternative tuition plans offered by institution (IC2022_RV): 1.0
Tuition payment plan (IC2022_RV): 1.0
Average amount of federal  state  local or institutional grant aid awarded (SFA2021_RV): 23364.0
Average amount of federal grant aid awarded to full-time first-time undergraduates (SFA2021_RV): 3786.0
Average amount of Pell grant aid awarded to full-time first-time undergraduates (SFA2021_RV): 5109.0
Average amount of other federal grant aid awarded to full-time first-time undergraduates (SFA2021_RV): 790.0
Average amount of state/local grant aid awarded to full-time first-time undergraduates (SFA2021_RV): 4086.0
Average amount of institutional grant aid awarded to full-time first-time undergraduates (SFA2021_RV): 18507.0
Average amount of student loans awarded to full-time first-time undergraduates (SFA2021_RV): 6620.0
Average amount of other student loans awarded to full-time first-time undergraduates (SFA2021_RV): 9324.0
Average amount of federal  state  local  institutional or other sources of grant aid awarded to undergraduate students (SFA2021_RV): 16809.0
Average amount Pell grant aid awarded to undergraduate students (SFA2021_RV): 4766.0
Average amount of federal student loans awarded to undergraduate students (SFA2021_RV): 7611.0
Average net price-students awarded grant or scholarship aid  2020-21 (SFA2021_RV): 11935.0
Average net price (income 0-30 000)-students awarded Title IV federal financial aid  2020-21 (SFA2021_RV): 9155.0
Average net price (income 30 001-48 000)-students awarded Title IV federal financial aid  2020-21 (SFA2021_RV): 8449.0
Average net price (income 48 001-75 000)-students awarded Title IV federal financial aid  2020-21 (SFA2021_RV): 10923.0
Average net price (income 75 001-110 000)-students awarded Title IV federal financial aid  2020-21 (SFA2021_RV): 15139.0
Average net price (income over 110 000)-students awarded Title IV federal financial aid  2020-21 (SFA2021_RV): 14969.0
Books and supplies 2021-22 (IC2021_AY): 1134.0
On campus  room and board 2021-22 (IC2021_AY): 14500.0
Off campus (not with family)  room and board 2021-22 (IC2021_AY): 10488.0
Off campus (not with family)  other expenses 2021-22 (IC2021_AY): 1398.0
Off campus (with family)  other expenses 2021-22 (IC2021_AY): 1398.0
On campus  room and board 2018-19 (IC2021_AY): 14500.0
Published out-of-state tuition and fees 2021-22 (IC2021_AY): 31640.0
Published in-district tuition and fees 2021-22 (IC2021_AY): 31640.0
Published in-state tuition and fees 2021-22 (IC2021_AY): 31640.0
Institution provide on-campus housing (IC2021): 1.0
Typical room charge for academic year (IC2021): 8700.0
Typical board charge for academic year (IC2021): 7300.0
Undergraduate application fee (IC2021): 0.0
Graduate application fee (IC2021): 25.0
Any alternative tuition plans offered by institution (IC2021): 1.0
Tuition payment plan (IC2021_RV): 1.0
Books and supplies 2020-21 (IC2020_AY): 1134.0
On campus  room and board 2020-21 (IC2020_AY): 14500.0
Off campus (not with family)  room and board 2020-21 (IC2020_AY): 10488.0
Off campus (not with family)  other expenses 2020-21 (IC2020_AY): 1398.0
Off campus (with family)  other expenses 2020-21 (IC2020_AY): 1398.0
On campus  room and board 2017-18 (IC2020_AY): 14500.0
Published out-of-state tuition and fees 2020-21 (IC2020_AY): 31640.0
Published in-district tuition and fees 2020-21 (IC2020_AY): 31640.0
Published in-state tuition and fees 2020-21 (IC2020_AY): 31640.0
Institution provide on-campus housing (IC2020): 1.0
Typical room charge for academic year (IC2020): 8193.0
Typical board charge for academic year (IC2020): 7070.0
Undergraduate application fee (IC2020): 25.0
Graduate application fee (IC2020): 25.0
Any alternative tuition plans offered by institution (IC2020_RV): 1.0
Tuition payment plan (IC2020_RV): 1.0","What is the typical food charge for an academic year at Holy Family University?
",The typical food charge for an academic year at Holy Family University is 7520.0.,../data/final_p1.csv
33,": 448042
UnitID: 212805
institution name: Grove City College
year: 2023
CIP2020Title: Biology Teacher Education.
CIP_Code: 131322
SOC2018Title: Education Teachers, Postsecondary
SOC_Code: 251081
CIPDefinition: A program that prepares individuals to teach biology programs at various educational levels.
CrossReferences: 
Institution Name: Grove City College
Books and supplies 2023-24 (IC2023_AY): 1000.0
On campus  food and housing 2023-24 (IC2023_AY): 11770.0
Off campus (not with family)  food and housing 2023-24 (IC2023_AY): 11770.0
Off campus (not with family)  other expenses 2023-24 (IC2023_AY): 850.0
Off campus (with family)  other expenses 2023-24 (IC2023_AY): 850.0
On campus  food and housing 2020-21 (IC2023_AY): 10310.0
Published out-of-state tuition and fees 2023-24 (IC2023_AY): 20890.0
Published in-district tuition and fees 2023-24 (IC2023_AY): 20890.0
Published in-state tuition and fees 2023-24 (IC2023_AY): 20890.0
Institution provide nstitutionally-controlled housing (on-campus and/or off-campus) (IC2023): 1.0
Typical housing charges for an academic year (IC2023): 
Typical food charge for academic year (IC2023): 
Undergraduate application fee (IC2023): 50.0
Graduate application fee (IC2023): 50.0
Any alternative tuition plans offered by institution (IC2023): 2.0
Tuition payment plan (IC2023): 0.0
Average amount of federal  state  local or institutional grant aid awarded (SFA2122): 8020.0
Average amount of federal grant aid awarded to full-time first-time undergraduates (SFA2122): 
Average amount of Pell grant aid awarded to full-time first-time undergraduates (SFA2122): 
Average amount of other federal grant aid awarded to full-time first-time undergraduates (SFA2122): 
Average amount of state/local grant aid awarded to full-time first-time undergraduates (SFA2122): 3831.0
Average amount of institutional grant aid awarded to full-time first-time undergraduates (SFA2122): 7468.0
Average amount of student loans awarded to full-time first-time undergraduates (SFA2122): 14541.0
Average amount of other student loans awarded to full-time first-time undergraduates (SFA2122): 14541.0
Average amount of federal  state  local  institutional or other sources of grant aid awarded to undergraduate students (SFA2122): 8255.0
Average amount Pell grant aid awarded to undergraduate students (SFA2122): 
Average amount of federal student loans awarded to undergraduate students (SFA2122): 
Average amount of federal  state  local  institutional or other sources of grant aid awarded to degree/certificate-seeking undergraduate students (SFA2122): 8255.0
Average amount of federal  state  local  institutional or other sources of grant aid awarded to non-degree/non-certificate-seeking undergraduates (SFA2122): 
Average net price-students awarded grant or scholarship aid  2021-22 (SFA2122): 23538.0
Average net price (income 0-30 000)-students awarded Title IV federal financial aid  2021-22 (SFA2122): 
Average net price (income 30 001-48 000)-students awarded Title IV federal financial aid  2021-22 (SFA2122): 
Average net price (income 48 001-75 000)-students awarded Title IV federal financial aid  2021-22 (SFA2122): 
Average net price (income 75 001-110 000)-students awarded Title IV federal financial aid  2021-22 (SFA2122): 
Average net price (income over 110 000)-students awarded Title IV federal financial aid  2021-22 (SFA2122): 
Books and supplies 2022-23 (IC2022_AY): 1000.0
On campus  room and board 2022-23 (IC2022_AY): 11050.0
Off campus (not with family)  room and board 2022-23 (IC2022_AY): 11050.0
Off campus (not with family)  other expenses 2022-23 (IC2022_AY): 850.0
Off campus (with family)  other expenses 2022-23 (IC2022_AY): 850.0
On campus  room and board 2019-20 (IC2022_AY): 10060.0
Published out-of-state tuition and fees 2022-23 (IC2022_AY): 19990.0
Published in-district tuition and fees 2022-23 (IC2022_AY): 19990.0
Published in-state tuition and fees 2022-23 (IC2022_AY): 19990.0
Institution provide on-campus housing (IC2022): 1.0
Typical room charge for academic year (IC2022): 
Typical board charge for academic year (IC2022): 
Undergraduate application fee (IC2022): 50.0
Graduate application fee (IC2022): 50.0
Any alternative tuition plans offered by institution (IC2022_RV): 2.0
Tuition payment plan (IC2022_RV): 0.0
Average amount of federal  state  local or institutional grant aid awarded (SFA2021_RV): 8807.0
Average amount of federal grant aid awarded to full-time first-time undergraduates (SFA2021_RV): 
Average amount of Pell grant aid awarded to full-time first-time undergraduates (SFA2021_RV): 
Average amount of other federal grant aid awarded to full-time first-time undergraduates (SFA2021_RV): 
Average amount of state/local grant aid awarded to full-time first-time undergraduates (SFA2021_RV): 3718.0
Average amount of institutional grant aid awarded to full-time first-time undergraduates (SFA2021_RV): 8251.0
Average amount of student loans awarded to full-time first-time undergraduates (SFA2021_RV): 14341.0
Average amount of other student loans awarded to full-time first-time undergraduates (SFA2021_RV): 14341.0
Average amount of federal  state  local  institutional or other sources of grant aid awarded to undergraduate students (SFA2021_RV): 8336.0
Average amount Pell grant aid awarded to undergraduate students (SFA2021_RV): 
Average amount of federal student loans awarded to undergraduate students (SFA2021_RV): 
Average net price-students awarded grant or scholarship aid  2020-21 (SFA2021_RV): 21846.0
Average net price (income 0-30 000)-students awarded Title IV federal financial aid  2020-21 (SFA2021_RV): 
Average net price (income 30 001-48 000)-students awarded Title IV federal financial aid  2020-21 (SFA2021_RV): 
Average net price (income 48 001-75 000)-students awarded Title IV federal financial aid  2020-21 (SFA2021_RV): 
Average net price (income 75 001-110 000)-students awarded Title IV federal financial aid  2020-21 (SFA2021_RV): 
Average net price (income over 110 000)-students awarded Title IV federal financial aid  2020-21 (SFA2021_RV): 
Books and supplies 2021-22 (IC2021_AY): 1000.0
On campus  room and board 2021-22 (IC2021_AY): 10680.0
Off campus (not with family)  room and board 2021-22 (IC2021_AY): 10680.0
Off campus (not with family)  other expenses 2021-22 (IC2021_AY): 850.0
Off campus (with family)  other expenses 2021-22 (IC2021_AY): 850.0
On campus  room and board 2018-19 (IC2021_AY): 9770.0
Published out-of-state tuition and fees 2021-22 (IC2021_AY): 19310.0
Published in-district tuition and fees 2021-22 (IC2021_AY): 19310.0
Published in-state tuition and fees 2021-22 (IC2021_AY): 19310.0
Institution provide on-campus housing (IC2021): 1.0
Typical room charge for academic year (IC2021): 
Typical board charge for academic year (IC2021): 
Undergraduate application fee (IC2021): 50.0
Graduate application fee (IC2021): 0.0
Any alternative tuition plans offered by institution (IC2021): 2.0
Tuition payment plan (IC2021_RV): 0.0
Books and supplies 2020-21 (IC2020_AY): 1000.0
On campus  room and board 2020-21 (IC2020_AY): 10310.0
Off campus (not with family)  room and board 2020-21 (IC2020_AY): 10310.0
Off campus (not with family)  other expenses 2020-21 (IC2020_AY): 850.0
Off campus (with family)  other expenses 2020-21 (IC2020_AY): 850.0
On campus  room and board 2017-18 (IC2020_AY): 9400.0
Published out-of-state tuition and fees 2020-21 (IC2020_AY): 18930.0
Published in-district tuition and fees 2020-21 (IC2020_AY): 18930.0
Published in-state tuition and fees 2020-21 (IC2020_AY): 18930.0
Institution provide on-campus housing (IC2020): 1.0
Typical room charge for academic year (IC2020): 
Typical board charge for academic year (IC2020): 
Undergraduate application fee (IC2020): 50.0
Graduate application fee (IC2020): 
Any alternative tuition plans offered by institution (IC2020_RV): 2.0
Tuition payment plan (IC2020_RV): 0.0","What is the cost of books and supplies for the 2023-24 academic year at Grove City College?
",The cost of books and supplies for the 2023-24 academic year at Grove City College is $1000.0.,../data/final_p1.csv
34,": 491745
UnitID: 219976
institution name: Lipscomb University
year: 2023
CIP2020Title: Computer Science.
CIP_Code: 110701
SOC2018Title: Information Security Analysts
SOC_Code: 151212
CIPDefinition: A program that focuses on computer theory, computing problems and solutions, and the design of computer systems and user interfaces from a scientific perspective. Includes instruction in the principles of computational science, computer development and programming, and applications to a variety of end-use situations.
CrossReferences: 14.0901 - Computer Engineering, General.
Institution Name: Lipscomb University
Books and supplies 2023-24 (IC2023_AY): 1650.0
On campus  food and housing 2023-24 (IC2023_AY): 14804.0
Off campus (not with family)  food and housing 2023-24 (IC2023_AY): 14490.0
Off campus (not with family)  other expenses 2023-24 (IC2023_AY): 4400.0
Off campus (with family)  other expenses 2023-24 (IC2023_AY): 4400.0
On campus  food and housing 2020-21 (IC2023_AY): 13804.0
Published out-of-state tuition and fees 2023-24 (IC2023_AY): 38824.0
Published in-district tuition and fees 2023-24 (IC2023_AY): 38824.0
Published in-state tuition and fees 2023-24 (IC2023_AY): 38824.0
Institution provide nstitutionally-controlled housing (on-campus and/or off-campus) (IC2023): 1.0
Typical housing charges for an academic year (IC2023): 8252.0
Typical food charge for academic year (IC2023): 6552.0
Undergraduate application fee (IC2023): 50.0
Graduate application fee (IC2023): 50.0
Any alternative tuition plans offered by institution (IC2023): 1.0
Tuition payment plan (IC2023): 1.0
Average amount of federal  state  local or institutional grant aid awarded (SFA2122): 24404.0
Average amount of federal grant aid awarded to full-time first-time undergraduates (SFA2122): 5234.0
Average amount of Pell grant aid awarded to full-time first-time undergraduates (SFA2122): 4847.0
Average amount of other federal grant aid awarded to full-time first-time undergraduates (SFA2122): 942.0
Average amount of state/local grant aid awarded to full-time first-time undergraduates (SFA2122): 5073.0
Average amount of institutional grant aid awarded to full-time first-time undergraduates (SFA2122): 20660.0
Average amount of student loans awarded to full-time first-time undergraduates (SFA2122): 7756.0
Average amount of other student loans awarded to full-time first-time undergraduates (SFA2122): 19025.0
Average amount of federal  state  local  institutional or other sources of grant aid awarded to undergraduate students (SFA2122): 22046.0
Average amount Pell grant aid awarded to undergraduate students (SFA2122): 4720.0
Average amount of federal student loans awarded to undergraduate students (SFA2122): 6155.0
Average amount of federal  state  local  institutional or other sources of grant aid awarded to degree/certificate-seeking undergraduate students (SFA2122): 22046.0
Average amount of federal  state  local  institutional or other sources of grant aid awarded to non-degree/non-certificate-seeking undergraduates (SFA2122): 
Average net price-students awarded grant or scholarship aid  2021-22 (SFA2122): 27937.0
Average net price (income 0-30 000)-students awarded Title IV federal financial aid  2021-22 (SFA2122): 22112.0
Average net price (income 30 001-48 000)-students awarded Title IV federal financial aid  2021-22 (SFA2122): 21502.0
Average net price (income 48 001-75 000)-students awarded Title IV federal financial aid  2021-22 (SFA2122): 24759.0
Average net price (income 75 001-110 000)-students awarded Title IV federal financial aid  2021-22 (SFA2122): 26742.0
Average net price (income over 110 000)-students awarded Title IV federal financial aid  2021-22 (SFA2122): 31495.0
Books and supplies 2022-23 (IC2022_AY): 1500.0
On campus  room and board 2022-23 (IC2022_AY): 14036.0
Off campus (not with family)  room and board 2022-23 (IC2022_AY): 12000.0
Off campus (not with family)  other expenses 2022-23 (IC2022_AY): 4000.0
Off campus (with family)  other expenses 2022-23 (IC2022_AY): 4000.0
On campus  room and board 2019-20 (IC2022_AY): 13280.0
Published out-of-state tuition and fees 2022-23 (IC2022_AY): 37152.0
Published in-district tuition and fees 2022-23 (IC2022_AY): 37152.0
Published in-state tuition and fees 2022-23 (IC2022_AY): 37152.0
Institution provide on-campus housing (IC2022): 1.0
Typical room charge for academic year (IC2022): 8040.0
Typical board charge for academic year (IC2022): 5996.0
Undergraduate application fee (IC2022): 50.0
Graduate application fee (IC2022): 50.0
Any alternative tuition plans offered by institution (IC2022_RV): 1.0
Tuition payment plan (IC2022_RV): 1.0
Average amount of federal  state  local or institutional grant aid awarded (SFA2021_RV): 24624.0
Average amount of federal grant aid awarded to full-time first-time undergraduates (SFA2021_RV): 5363.0
Average amount of Pell grant aid awarded to full-time first-time undergraduates (SFA2021_RV): 4961.0
Average amount of other federal grant aid awarded to full-time first-time undergraduates (SFA2021_RV): 1000.0
Average amount of state/local grant aid awarded to full-time first-time undergraduates (SFA2021_RV): 4966.0
Average amount of institutional grant aid awarded to full-time first-time undergraduates (SFA2021_RV): 20559.0
Average amount of student loans awarded to full-time first-time undergraduates (SFA2021_RV): 7497.0
Average amount of other student loans awarded to full-time first-time undergraduates (SFA2021_RV): 17590.0
Average amount of federal  state  local  institutional or other sources of grant aid awarded to undergraduate students (SFA2021_RV): 21415.0
Average amount Pell grant aid awarded to undergraduate students (SFA2021_RV): 4556.0
Average amount of federal student loans awarded to undergraduate students (SFA2021_RV): 10299.0
Average net price-students awarded grant or scholarship aid  2020-21 (SFA2021_RV): 26614.0
Average net price (income 0-30 000)-students awarded Title IV federal financial aid  2020-21 (SFA2021_RV): 21805.0
Average net price (income 30 001-48 000)-students awarded Title IV federal financial aid  2020-21 (SFA2021_RV): 21563.0
Average net price (income 48 001-75 000)-students awarded Title IV federal financial aid  2020-21 (SFA2021_RV): 22993.0
Average net price (income 75 001-110 000)-students awarded Title IV federal financial aid  2020-21 (SFA2021_RV): 25928.0
Average net price (income over 110 000)-students awarded Title IV federal financial aid  2020-21 (SFA2021_RV): 29064.0
Books and supplies 2021-22 (IC2021_AY): 1500.0
On campus  room and board 2021-22 (IC2021_AY): 13976.0
Off campus (not with family)  room and board 2021-22 (IC2021_AY): 12000.0
Off campus (not with family)  other expenses 2021-22 (IC2021_AY): 4000.0
Off campus (with family)  other expenses 2021-22 (IC2021_AY): 4000.0
On campus  room and board 2018-19 (IC2021_AY): 12652.0
Published out-of-state tuition and fees 2021-22 (IC2021_AY): 35752.0
Published in-district tuition and fees 2021-22 (IC2021_AY): 35752.0
Published in-state tuition and fees 2021-22 (IC2021_AY): 35752.0
Institution provide on-campus housing (IC2021): 1.0
Typical room charge for academic year (IC2021): 7816.0
Typical board charge for academic year (IC2021): 6160.0
Undergraduate application fee (IC2021): 50.0
Graduate application fee (IC2021): 50.0
Any alternative tuition plans offered by institution (IC2021): 1.0
Tuition payment plan (IC2021_RV): 1.0
Books and supplies 2020-21 (IC2020_AY): 1500.0
On campus  room and board 2020-21 (IC2020_AY): 13804.0
Off campus (not with family)  room and board 2020-21 (IC2020_AY): 10500.0
Off campus (not with family)  other expenses 2020-21 (IC2020_AY): 4000.0
Off campus (with family)  other expenses 2020-21 (IC2020_AY): 4000.0
On campus  room and board 2017-18 (IC2020_AY): 12052.0
Published out-of-state tuition and fees 2020-21 (IC2020_AY): 34744.0
Published in-district tuition and fees 2020-21 (IC2020_AY): 34744.0
Published in-state tuition and fees 2020-21 (IC2020_AY): 34744.0
Institution provide on-campus housing (IC2020): 1.0
Typical room charge for academic year (IC2020): 7816.0
Typical board charge for academic year (IC2020): 5988.0
Undergraduate application fee (IC2020): 50.0
Graduate application fee (IC2020): 50.0
Any alternative tuition plans offered by institution (IC2020_RV): 1.0
Tuition payment plan (IC2020_RV): 1.0","What is the typical food charge for an academic year at Lipscomb University?
",The typical food charge for an academic year at Lipscomb University is 6552.0.,../data/final_p1.csv
35,": 262004
UnitID: 173160
institution name: Bethel University
year: 2023
CIP2020Title: Environmental Science.
CIP_Code: 030104
SOC2018Title: Forest and Conservation Technicians
SOC_Code: 194071
CIPDefinition: A program that focuses on the application of biological, chemical, and physical principles to the study of the physical environment and the solution of environmental problems, including subjects such as abating or controlling environmental pollution and degradation; the interaction between human society and the natural environment; and natural resources management.  Includes instruction in biology, chemistry, physics, geosciences, climatology, statistics, and mathematical modeling.
CrossReferences: 26.1305 - Environmental Biology., 26.1307 - Conservation Biology., 14.1401 - Environmental/Environmental Health Engineering.
Institution Name: Bethel University
Books and supplies 2023-24 (IC2023_AY): 1340.0
On campus  food and housing 2023-24 (IC2023_AY): 12090.0
Off campus (not with family)  food and housing 2023-24 (IC2023_AY): 9270.0
Off campus (not with family)  other expenses 2023-24 (IC2023_AY): 6890.0
Off campus (with family)  other expenses 2023-24 (IC2023_AY): 5818.0
On campus  food and housing 2020-21 (IC2023_AY): 10960.0
Published out-of-state tuition and fees 2023-24 (IC2023_AY): 42930.0
Published in-district tuition and fees 2023-24 (IC2023_AY): 42930.0
Published in-state tuition and fees 2023-24 (IC2023_AY): 42930.0
Institution provide nstitutionally-controlled housing (on-campus and/or off-campus) (IC2023): 1.0
Typical housing charges for an academic year (IC2023): 6290.0
Typical food charge for academic year (IC2023): 5800.0
Undergraduate application fee (IC2023): 0.0
Graduate application fee (IC2023): 0.0
Any alternative tuition plans offered by institution (IC2023): 1.0
Tuition payment plan (IC2023): 1.0
Average amount of federal  state  local or institutional grant aid awarded (SFA2122): 24586.0
Average amount of federal grant aid awarded to full-time first-time undergraduates (SFA2122): 4295.0
Average amount of Pell grant aid awarded to full-time first-time undergraduates (SFA2122): 4190.0
Average amount of other federal grant aid awarded to full-time first-time undergraduates (SFA2122): 4547.0
Average amount of state/local grant aid awarded to full-time first-time undergraduates (SFA2122): 5452.0
Average amount of institutional grant aid awarded to full-time first-time undergraduates (SFA2122): 21278.0
Average amount of student loans awarded to full-time first-time undergraduates (SFA2122): 10464.0
Average amount of other student loans awarded to full-time first-time undergraduates (SFA2122): 16297.0
Average amount of federal  state  local  institutional or other sources of grant aid awarded to undergraduate students (SFA2122): 22134.0
Average amount Pell grant aid awarded to undergraduate students (SFA2122): 4313.0
Average amount of federal student loans awarded to undergraduate students (SFA2122): 6550.0
Average amount of federal  state  local  institutional or other sources of grant aid awarded to degree/certificate-seeking undergraduate students (SFA2122): 22426.0
Average amount of federal  state  local  institutional or other sources of grant aid awarded to non-degree/non-certificate-seeking undergraduates (SFA2122): 7019.0
Average net price-students awarded grant or scholarship aid  2021-22 (SFA2122): 29915.0
Average net price (income 0-30 000)-students awarded Title IV federal financial aid  2021-22 (SFA2122): 21600.0
Average net price (income 30 001-48 000)-students awarded Title IV federal financial aid  2021-22 (SFA2122): 24105.0
Average net price (income 48 001-75 000)-students awarded Title IV federal financial aid  2021-22 (SFA2122): 22265.0
Average net price (income 75 001-110 000)-students awarded Title IV federal financial aid  2021-22 (SFA2122): 27349.0
Average net price (income over 110 000)-students awarded Title IV federal financial aid  2021-22 (SFA2122): 33418.0
Books and supplies 2022-23 (IC2022_AY): 1300.0
On campus  room and board 2022-23 (IC2022_AY): 11490.0
Off campus (not with family)  room and board 2022-23 (IC2022_AY): 8470.0
Off campus (not with family)  other expenses 2022-23 (IC2022_AY): 6320.0
Off campus (with family)  other expenses 2022-23 (IC2022_AY): 5340.0
On campus  room and board 2019-20 (IC2022_AY): 10780.0
Published out-of-state tuition and fees 2022-23 (IC2022_AY): 41270.0
Published in-district tuition and fees 2022-23 (IC2022_AY): 41270.0
Published in-state tuition and fees 2022-23 (IC2022_AY): 41270.0
Institution provide on-campus housing (IC2022): 1.0
Typical room charge for academic year (IC2022): 6100.0
Typical board charge for academic year (IC2022): 5390.0
Undergraduate application fee (IC2022): 0.0
Graduate application fee (IC2022): 0.0
Any alternative tuition plans offered by institution (IC2022_RV): 1.0
Tuition payment plan (IC2022_RV): 1.0
Average amount of federal  state  local or institutional grant aid awarded (SFA2021_RV): 24534.0
Average amount of federal grant aid awarded to full-time first-time undergraduates (SFA2021_RV): 4752.0
Average amount of Pell grant aid awarded to full-time first-time undergraduates (SFA2021_RV): 4475.0
Average amount of other federal grant aid awarded to full-time first-time undergraduates (SFA2021_RV): 3694.0
Average amount of state/local grant aid awarded to full-time first-time undergraduates (SFA2021_RV): 6024.0
Average amount of institutional grant aid awarded to full-time first-time undergraduates (SFA2021_RV): 21173.0
Average amount of student loans awarded to full-time first-time undergraduates (SFA2021_RV): 9573.0
Average amount of other student loans awarded to full-time first-time undergraduates (SFA2021_RV): 15453.0
Average amount of federal  state  local  institutional or other sources of grant aid awarded to undergraduate students (SFA2021_RV): 21959.0
Average amount Pell grant aid awarded to undergraduate students (SFA2021_RV): 4372.0
Average amount of federal student loans awarded to undergraduate students (SFA2021_RV): 6562.0
Average net price-students awarded grant or scholarship aid  2020-21 (SFA2021_RV): 28840.0
Average net price (income 0-30 000)-students awarded Title IV federal financial aid  2020-21 (SFA2021_RV): 20410.0
Average net price (income 30 001-48 000)-students awarded Title IV federal financial aid  2020-21 (SFA2021_RV): 19498.0
Average net price (income 48 001-75 000)-students awarded Title IV federal financial aid  2020-21 (SFA2021_RV): 22498.0
Average net price (income 75 001-110 000)-students awarded Title IV federal financial aid  2020-21 (SFA2021_RV): 26099.0
Average net price (income over 110 000)-students awarded Title IV federal financial aid  2020-21 (SFA2021_RV): 33548.0
Books and supplies 2021-22 (IC2021_AY): 1290.0
On campus  room and board 2021-22 (IC2021_AY): 11150.0
Off campus (not with family)  room and board 2021-22 (IC2021_AY): 7960.0
Off campus (not with family)  other expenses 2021-22 (IC2021_AY): 5898.0
Off campus (with family)  other expenses 2021-22 (IC2021_AY): 5028.0
On campus  room and board 2018-19 (IC2021_AY): 10520.0
Published out-of-state tuition and fees 2021-22 (IC2021_AY): 40080.0
Published in-district tuition and fees 2021-22 (IC2021_AY): 40080.0
Published in-state tuition and fees 2021-22 (IC2021_AY): 40080.0
Institution provide on-campus housing (IC2021): 1.0
Typical room charge for academic year (IC2021): 5990.0
Typical board charge for academic year (IC2021): 5160.0
Undergraduate application fee (IC2021): 0.0
Graduate application fee (IC2021): 0.0
Any alternative tuition plans offered by institution (IC2021): 1.0
Tuition payment plan (IC2021_RV): 1.0
Books and supplies 2020-21 (IC2020_AY): 1290.0
On campus  room and board 2020-21 (IC2020_AY): 10960.0
Off campus (not with family)  room and board 2020-21 (IC2020_AY): 7540.0
Off campus (not with family)  other expenses 2020-21 (IC2020_AY): 5600.0
Off campus (with family)  other expenses 2020-21 (IC2020_AY): 4730.0
On campus  room and board 2017-18 (IC2020_AY): 10340.0
Published out-of-state tuition and fees 2020-21 (IC2020_AY): 39030.0
Published in-district tuition and fees 2020-21 (IC2020_AY): 39030.0
Published in-state tuition and fees 2020-21 (IC2020_AY): 39030.0
Institution provide on-campus housing (IC2020): 1.0
Typical room charge for academic year (IC2020): 5900.0
Typical board charge for academic year (IC2020): 5060.0
Undergraduate application fee (IC2020): 0.0
Graduate application fee (IC2020): 0.0
Any alternative tuition plans offered by institution (IC2020_RV): 1.0
Tuition payment plan (IC2020_RV): 1.0","What is the typical housing charge for an academic year at Bethel University?
",The typical housing charge for an academic year at Bethel University is 6290.0.,../data/final_p1.csv
36,": 182332
AREA: 38
AREA_TITLE: North Dakota
AREA_TYPE: 2
PRIM_STATE: ND
NAICS: 0
NAICS_TITLE: Cross-industry
I_GROUP: cross-industry
OWN_CODE: 1235
OCC_CODE: 17-2031
OCC_TITLE: Bioengineers and Biomedical Engineers
O_GROUP: detailed
TOT_EMP: 50
EMP_PRSE: 2.7
JOBS_1000: 0.125
LOC_QUOTIENT: 0.98
PCT_TOTAL: 
PCT_RPT: 
H_MEAN: 39.95
A_MEAN: 83,100
MEAN_PRSE: 0.7
H_PCT10: 25.47
H_PCT25: 31.43
H_MEDIAN: 39.99
H_PCT75: 49.58
H_PCT90: 49.58
A_PCT10: 52,970
A_PCT25: 65,370
A_MEDIAN: 83,180
A_PCT75: 103,130
A_PCT90: 103,130
ANNUAL: 
HOURLY: 
SOC_Code: 172031","How many bioengineers and biomedical engineers are there in North Dakota?
",50,../data/final_p2.csv
37,": 9025
AREA: 99
AREA_TITLE: U.S.
AREA_TYPE: 1
PRIM_STATE: US
NAICS: 55
NAICS_TITLE: Management of Companies and Enterprises
I_GROUP: sector
OWN_CODE: 5
OCC_CODE: 17-2151
OCC_TITLE: Mining and Geological Engineers, Including Mining Safety Engineers
O_GROUP: detailed
TOT_EMP: 540
EMP_PRSE: 18.1
JOBS_1000: 
LOC_QUOTIENT: 
PCT_TOTAL: 0.02
PCT_RPT: ~
H_MEAN: 59.79
A_MEAN: 124,370
MEAN_PRSE: 3.6
H_PCT10: 36.03
H_PCT25: 48.25
H_MEDIAN: 58.36
H_PCT75: 70.27
H_PCT90: 83.28
A_PCT10: 74,940
A_PCT25: 100,360
A_MEDIAN: 121,390
A_PCT75: 146,160
A_PCT90: 173,220
ANNUAL: 
HOURLY: 
SOC_Code: 172151","What is the median annual salary for Mining and Geological Engineers, Including Mining Safety Engineers in the U.S.?
","$121,390",../data/final_p2.csv
38,": 108148
UnitID: 136145
institution name: North Florida College
year: 2023
CIP2020Title: Criminal Justice/Law Enforcement Administration.
CIP_Code: 430103
SOC2018Title: Managers, All Other
SOC_Code: 119199
CIPDefinition: A program that prepares individuals to apply theories and practices of organization management and criminal justice to the administration of public law enforcement agencies and operations.  Includes instruction in law enforcement history and theory, operational command leadership, administration of public police organizations, labor relations, incident response strategies, legal and regulatory responsibilities, budgeting, public relations, and organizational leadership.
CrossReferences: 
Institution Name: North Florida College
Books and supplies 2023-24 (IC2023_AY): 1400.0
On campus  food and housing 2023-24 (IC2023_AY): 
Off campus (not with family)  food and housing 2023-24 (IC2023_AY): 5400.0
Off campus (not with family)  other expenses 2023-24 (IC2023_AY): 2900.0
Off campus (with family)  other expenses 2023-24 (IC2023_AY): 2900.0
On campus  food and housing 2020-21 (IC2023_AY): 
Published out-of-state tuition and fees 2023-24 (IC2023_AY): 11400.0
Published in-district tuition and fees 2023-24 (IC2023_AY): 3054.0
Published in-state tuition and fees 2023-24 (IC2023_AY): 3054.0
Institution provide nstitutionally-controlled housing (on-campus and/or off-campus) (IC2023): 2.0
Typical housing charges for an academic year (IC2023): 
Typical food charge for academic year (IC2023): 
Undergraduate application fee (IC2023): 20.0
Graduate application fee (IC2023): 
Any alternative tuition plans offered by institution (IC2023): 1.0
Tuition payment plan (IC2023): 1.0
Average amount of federal  state  local or institutional grant aid awarded (SFA2122): 7113.0
Average amount of federal grant aid awarded to full-time first-time undergraduates (SFA2122): 5523.0
Average amount of Pell grant aid awarded to full-time first-time undergraduates (SFA2122): 5689.0
Average amount of other federal grant aid awarded to full-time first-time undergraduates (SFA2122): 2309.0
Average amount of state/local grant aid awarded to full-time first-time undergraduates (SFA2122): 1942.0
Average amount of institutional grant aid awarded to full-time first-time undergraduates (SFA2122): 2288.0
Average amount of student loans awarded to full-time first-time undergraduates (SFA2122): 
Average amount of other student loans awarded to full-time first-time undergraduates (SFA2122): 
Average amount of federal  state  local  institutional or other sources of grant aid awarded to undergraduate students (SFA2122): 5386.0
Average amount Pell grant aid awarded to undergraduate students (SFA2122): 4853.0
Average amount of federal student loans awarded to undergraduate students (SFA2122): 
Average amount of federal  state  local  institutional or other sources of grant aid awarded to degree/certificate-seeking undergraduate students (SFA2122): 5615.0
Average amount of federal  state  local  institutional or other sources of grant aid awarded to non-degree/non-certificate-seeking undergraduates (SFA2122): 2376.0
Average net price-students awarded grant or scholarship aid  2021-22 (SFA2122): 
Average net price (income 0-30 000)-students awarded Title IV federal financial aid  2021-22 (SFA2122): 
Average net price (income 30 001-48 000)-students awarded Title IV federal financial aid  2021-22 (SFA2122): 
Average net price (income 48 001-75 000)-students awarded Title IV federal financial aid  2021-22 (SFA2122): 
Average net price (income 75 001-110 000)-students awarded Title IV federal financial aid  2021-22 (SFA2122): 
Average net price (income over 110 000)-students awarded Title IV federal financial aid  2021-22 (SFA2122): 
Books and supplies 2022-23 (IC2022_AY): 1400.0
On campus  room and board 2022-23 (IC2022_AY): 
Off campus (not with family)  room and board 2022-23 (IC2022_AY): 5400.0
Off campus (not with family)  other expenses 2022-23 (IC2022_AY): 2900.0
Off campus (with family)  other expenses 2022-23 (IC2022_AY): 2900.0
On campus  room and board 2019-20 (IC2022_AY): 
Published out-of-state tuition and fees 2022-23 (IC2022_AY): 11400.0
Published in-district tuition and fees 2022-23 (IC2022_AY): 3054.0
Published in-state tuition and fees 2022-23 (IC2022_AY): 3054.0
Institution provide on-campus housing (IC2022): 2.0
Typical room charge for academic year (IC2022): 
Typical board charge for academic year (IC2022): 
Undergraduate application fee (IC2022): 20.0
Graduate application fee (IC2022): 
Any alternative tuition plans offered by institution (IC2022_RV): 1.0
Tuition payment plan (IC2022_RV): 1.0
Average amount of federal  state  local or institutional grant aid awarded (SFA2021_RV): 5644.0
Average amount of federal grant aid awarded to full-time first-time undergraduates (SFA2021_RV): 6679.0
Average amount of Pell grant aid awarded to full-time first-time undergraduates (SFA2021_RV): 6107.0
Average amount of other federal grant aid awarded to full-time first-time undergraduates (SFA2021_RV): 1071.0
Average amount of state/local grant aid awarded to full-time first-time undergraduates (SFA2021_RV): 1642.0
Average amount of institutional grant aid awarded to full-time first-time undergraduates (SFA2021_RV): 1668.0
Average amount of student loans awarded to full-time first-time undergraduates (SFA2021_RV): 
Average amount of other student loans awarded to full-time first-time undergraduates (SFA2021_RV): 
Average amount of federal  state  local  institutional or other sources of grant aid awarded to undergraduate students (SFA2021_RV): 5778.0
Average amount Pell grant aid awarded to undergraduate students (SFA2021_RV): 5536.0
Average amount of federal student loans awarded to undergraduate students (SFA2021_RV): 
Average net price-students awarded grant or scholarship aid  2020-21 (SFA2021_RV): 
Average net price (income 0-30 000)-students awarded Title IV federal financial aid  2020-21 (SFA2021_RV): 
Average net price (income 30 001-48 000)-students awarded Title IV federal financial aid  2020-21 (SFA2021_RV): 
Average net price (income 48 001-75 000)-students awarded Title IV federal financial aid  2020-21 (SFA2021_RV): 
Average net price (income 75 001-110 000)-students awarded Title IV federal financial aid  2020-21 (SFA2021_RV): 
Average net price (income over 110 000)-students awarded Title IV federal financial aid  2020-21 (SFA2021_RV): 
Books and supplies 2021-22 (IC2021_AY): 1400.0
On campus  room and board 2021-22 (IC2021_AY): 
Off campus (not with family)  room and board 2021-22 (IC2021_AY): 5400.0
Off campus (not with family)  other expenses 2021-22 (IC2021_AY): 2900.0
Off campus (with family)  other expenses 2021-22 (IC2021_AY): 2900.0
On campus  room and board 2018-19 (IC2021_AY): 
Published out-of-state tuition and fees 2021-22 (IC2021_AY): 11400.0
Published in-district tuition and fees 2021-22 (IC2021_AY): 3054.0
Published in-state tuition and fees 2021-22 (IC2021_AY): 3054.0
Institution provide on-campus housing (IC2021): 2.0
Typical room charge for academic year (IC2021): 
Typical board charge for academic year (IC2021): 
Undergraduate application fee (IC2021): 20.0
Graduate application fee (IC2021): 
Any alternative tuition plans offered by institution (IC2021): 1.0
Tuition payment plan (IC2021_RV): 1.0
Books and supplies 2020-21 (IC2020_AY): 1400.0
On campus  room and board 2020-21 (IC2020_AY): 
Off campus (not with family)  room and board 2020-21 (IC2020_AY): 5400.0
Off campus (not with family)  other expenses 2020-21 (IC2020_AY): 2900.0
Off campus (with family)  other expenses 2020-21 (IC2020_AY): 2900.0
On campus  room and board 2017-18 (IC2020_AY): 
Published out-of-state tuition and fees 2020-21 (IC2020_AY): 11400.0
Published in-district tuition and fees 2020-21 (IC2020_AY): 3054.0
Published in-state tuition and fees 2020-21 (IC2020_AY): 3054.0
Institution provide on-campus housing (IC2020): 2.0
Typical room charge for academic year (IC2020): 
Typical board charge for academic year (IC2020): 
Undergraduate application fee (IC2020): 20.0
Graduate application fee (IC2020): 
Any alternative tuition plans offered by institution (IC2020_RV): 1.0
Tuition payment plan (IC2020_RV): 1.0","What is the average net price for students awarded grant or scholarship aid at North Florida College in 2021-22?
",The average net price for students awarded grant or scholarship aid at North Florida College in 2021-22 is $5386.0.,../data/final_p1.csv
39,": 229556
UnitID: 166629
institution name: University of Massachusetts-Amherst
year: 2023
CIP2020Title: Economics, General.
CIP_Code: 450601
SOC2018Title: Economics Teachers, Postsecondary
SOC_Code: 251063
CIPDefinition: A general program that focuses on the systematic study of the production, conservation and allocation of resources in conditions of scarcity, together with the organizational frameworks related to these processes.  Includes instruction in economic theory, micro- and macroeconomics, comparative economic systems, money and banking systems, international economics, quantitative analytical methods, and applications to specific industries and public policy issues.
CrossReferences: 01.0103 - Agricultural Economics., 19.0402 - Consumer Economics., 52.0601 - Business/Managerial Economics., 03.0204 - Environmental/Natural Resource Economics., 30.3901 - Economics and Computer Science., 30.4001 - Economics and Foreign Language/Literature.
Institution Name: University of Massachusetts-Amherst
Books and supplies 2023-24 (IC2023_AY): 1000.0
On campus  food and housing 2023-24 (IC2023_AY): 14869.0
Off campus (not with family)  food and housing 2023-24 (IC2023_AY): 15437.0
Off campus (not with family)  other expenses 2023-24 (IC2023_AY): 1440.0
Off campus (with family)  other expenses 2023-24 (IC2023_AY): 3840.0
On campus  food and housing 2020-21 (IC2023_AY): 13329.0
Published out-of-state tuition and fees 2023-24 (IC2023_AY): 39293.0
Published in-district tuition and fees 2023-24 (IC2023_AY): 17357.0
Published in-state tuition and fees 2023-24 (IC2023_AY): 17357.0
Institution provide nstitutionally-controlled housing (on-campus and/or off-campus) (IC2023): 1.0
Typical housing charges for an academic year (IC2023): 8154.0
Typical food charge for academic year (IC2023): 7283.0
Undergraduate application fee (IC2023): 85.0
Graduate application fee (IC2023): 85.0
Any alternative tuition plans offered by institution (IC2023): 1.0
Tuition payment plan (IC2023): 1.0
Average amount of federal  state  local or institutional grant aid awarded (SFA2122): 12350.0
Average amount of federal grant aid awarded to full-time first-time undergraduates (SFA2122): 4203.0
Average amount of Pell grant aid awarded to full-time first-time undergraduates (SFA2122): 4945.0
Average amount of other federal grant aid awarded to full-time first-time undergraduates (SFA2122): 2084.0
Average amount of state/local grant aid awarded to full-time first-time undergraduates (SFA2122): 2702.0
Average amount of institutional grant aid awarded to full-time first-time undergraduates (SFA2122): 9763.0
Average amount of student loans awarded to full-time first-time undergraduates (SFA2122): 8481.0
Average amount of other student loans awarded to full-time first-time undergraduates (SFA2122): 19644.0
Average amount of federal  state  local  institutional or other sources of grant aid awarded to undergraduate students (SFA2122): 11636.0
Average amount Pell grant aid awarded to undergraduate students (SFA2122): 4640.0
Average amount of federal student loans awarded to undergraduate students (SFA2122): 6433.0
Average amount of federal  state  local  institutional or other sources of grant aid awarded to degree/certificate-seeking undergraduate students (SFA2122): 11656.0
Average amount of federal  state  local  institutional or other sources of grant aid awarded to non-degree/non-certificate-seeking undergraduates (SFA2122): 2309.0
Average net price-students awarded grant or scholarship aid  2021-22 (SFA2122): 
Average net price (income 0-30 000)-students awarded Title IV federal financial aid  2021-22 (SFA2122): 
Average net price (income 30 001-48 000)-students awarded Title IV federal financial aid  2021-22 (SFA2122): 
Average net price (income 48 001-75 000)-students awarded Title IV federal financial aid  2021-22 (SFA2122): 
Average net price (income 75 001-110 000)-students awarded Title IV federal financial aid  2021-22 (SFA2122): 
Average net price (income over 110 000)-students awarded Title IV federal financial aid  2021-22 (SFA2122): 
Books and supplies 2022-23 (IC2022_AY): 1000.0
On campus  room and board 2022-23 (IC2022_AY): 14123.0
Off campus (not with family)  room and board 2022-23 (IC2022_AY): 14123.0
Off campus (not with family)  other expenses 2022-23 (IC2022_AY): 1400.0
Off campus (with family)  other expenses 2022-23 (IC2022_AY): 3400.0
On campus  room and board 2019-20 (IC2022_AY): 13004.0
Published out-of-state tuition and fees 2022-23 (IC2022_AY): 38171.0
Published in-district tuition and fees 2022-23 (IC2022_AY): 16952.0
Published in-state tuition and fees 2022-23 (IC2022_AY): 16952.0
Institution provide on-campus housing (IC2022): 1.0
Typical room charge for academic year (IC2022): 7840.0
Typical board charge for academic year (IC2022): 6283.0
Undergraduate application fee (IC2022): 85.0
Graduate application fee (IC2022): 85.0
Any alternative tuition plans offered by institution (IC2022_RV): 1.0
Tuition payment plan (IC2022_RV): 1.0
Average amount of federal  state  local or institutional grant aid awarded (SFA2021_RV): 10662.0
Average amount of federal grant aid awarded to full-time first-time undergraduates (SFA2021_RV): 2769.0
Average amount of Pell grant aid awarded to full-time first-time undergraduates (SFA2021_RV): 4946.0
Average amount of other federal grant aid awarded to full-time first-time undergraduates (SFA2021_RV): 809.0
Average amount of state/local grant aid awarded to full-time first-time undergraduates (SFA2021_RV): 2366.0
Average amount of institutional grant aid awarded to full-time first-time undergraduates (SFA2021_RV): 9187.0
Average amount of student loans awarded to full-time first-time undergraduates (SFA2021_RV): 7550.0
Average amount of other student loans awarded to full-time first-time undergraduates (SFA2021_RV): 15924.0
Average amount of federal  state  local  institutional or other sources of grant aid awarded to undergraduate students (SFA2021_RV): 9734.0
Average amount Pell grant aid awarded to undergraduate students (SFA2021_RV): 4618.0
Average amount of federal student loans awarded to undergraduate students (SFA2021_RV): 6373.0
Average net price-students awarded grant or scholarship aid  2020-21 (SFA2021_RV): 
Average net price (income 0-30 000)-students awarded Title IV federal financial aid  2020-21 (SFA2021_RV): 
Average net price (income 30 001-48 000)-students awarded Title IV federal financial aid  2020-21 (SFA2021_RV): 
Average net price (income 48 001-75 000)-students awarded Title IV federal financial aid  2020-21 (SFA2021_RV): 
Average net price (income 75 001-110 000)-students awarded Title IV federal financial aid  2020-21 (SFA2021_RV): 
Average net price (income over 110 000)-students awarded Title IV federal financial aid  2020-21 (SFA2021_RV): 
Books and supplies 2021-22 (IC2021_AY): 1000.0
On campus  room and board 2021-22 (IC2021_AY): 13595.0
Off campus (not with family)  room and board 2021-22 (IC2021_AY): 13595.0
Off campus (not with family)  other expenses 2021-22 (IC2021_AY): 1400.0
Off campus (with family)  other expenses 2021-22 (IC2021_AY): 3400.0
On campus  room and board 2018-19 (IC2021_AY): 12626.0
Published out-of-state tuition and fees 2021-22 (IC2021_AY): 36964.0
Published in-district tuition and fees 2021-22 (IC2021_AY): 16439.0
Published in-state tuition and fees 2021-22 (IC2021_AY): 16439.0
Institution provide on-campus housing (IC2021): 1.0
Typical room charge for academic year (IC2021): 7611.0
Typical board charge for academic year (IC2021): 5984.0
Undergraduate application fee (IC2021): 85.0
Graduate application fee (IC2021): 85.0
Any alternative tuition plans offered by institution (IC2021): 1.0
Tuition payment plan (IC2021_RV): 1.0
Books and supplies 2020-21 (IC2020_AY): 1000.0
On campus  room and board 2020-21 (IC2020_AY): 13329.0
Off campus (not with family)  room and board 2020-21 (IC2020_AY): 13329.0
Off campus (not with family)  other expenses 2020-21 (IC2020_AY): 1400.0
Off campus (with family)  other expenses 2020-21 (IC2020_AY): 3400.0
On campus  room and board 2017-18 (IC2020_AY): 12258.0
Published out-of-state tuition and fees 2020-21 (IC2020_AY): 36427.0
Published in-district tuition and fees 2020-21 (IC2020_AY): 16439.0
Published in-state tuition and fees 2020-21 (IC2020_AY): 16439.0
Institution provide on-campus housing (IC2020): 1.0
Typical room charge for academic year (IC2020): 7462.0
Typical board charge for academic year (IC2020): 5867.0
Undergraduate application fee (IC2020): 80.0
Graduate application fee (IC2020): 80.0
Any alternative tuition plans offered by institution (IC2020_RV): 1.0
Tuition payment plan (IC2020_RV): 1.0","What is the typical food charge for an academic year at the University of Massachusetts-Amherst in 2023?
",The typical food charge for an academic year at the University of Massachusetts-Amherst in 2023 is 7283.0.,../data/final_p1.csv
40,": 250924
AREA: 47260
AREA_TITLE: Virginia Beach-Norfolk-Newport News, VA-NC
AREA_TYPE: 4
PRIM_STATE: VA
NAICS: 0
NAICS_TITLE: Cross-industry
I_GROUP: cross-industry
OWN_CODE: 1235
OCC_CODE: 21-1018
OCC_TITLE: Substance Abuse, Behavioral Disorder, and Mental Health Counselors
O_GROUP: detailed
TOT_EMP: 3,500
EMP_PRSE: 4.0
JOBS_1000: 4.745
LOC_QUOTIENT: 1.81
PCT_TOTAL: 
PCT_RPT: 
H_MEAN: 27.54
A_MEAN: 57,280
MEAN_PRSE: 1.4
H_PCT10: 19.27
H_PCT25: 22.56
H_MEDIAN: 25.80
H_PCT75: 31.13
H_PCT90: 36.70
A_PCT10: 40,090
A_PCT25: 46,920
A_MEDIAN: 53,650
A_PCT75: 64,760
A_PCT90: 76,340
ANNUAL: 
HOURLY: 
SOC_Code: 211018","What is the median hourly wage for substance abuse, behavioral disorder, and mental health counselors in the Virginia Beach-Norfolk-Newport News, VA-NC area?
","The median hourly wage for substance abuse, behavioral disorder, and mental health counselors in the Virginia Beach-Norfolk-Newport News, VA-NC area is $25.80.",../data/final_p2.csv
41,": 592050
UnitID: 366465
institution name: Ogeechee Technical College
year: 2023
CIP2020Title: Health Information/Medical Records Technology/Technician.
CIP_Code: 510707
SOC2018Title: Health Information Technologists and Medical Registrars
SOC_Code: 299021
CIPDefinition: A program that prepares individuals, under the supervision of health information administrators and other professionals, to construct medical records and clinical databases, perform manipulations on retrieved data, control the security and quality of records, and supervise data entry and technical maintenance personnel.  Includes instruction in clinical and biomedical science data and information requirements, database management, data coding and validation, information security, quality control, health information content and structure, medical business procedures, and legal requirements.
CrossReferences: 
Institution Name: Ogeechee Technical College
Books and supplies 2023-24 (IC2023_AY): 1323.0
On campus  food and housing 2023-24 (IC2023_AY): 
Off campus (not with family)  food and housing 2023-24 (IC2023_AY): 11854.0
Off campus (not with family)  other expenses 2023-24 (IC2023_AY): 5304.0
Off campus (with family)  other expenses 2023-24 (IC2023_AY): 5304.0
On campus  food and housing 2020-21 (IC2023_AY): 
Published out-of-state tuition and fees 2023-24 (IC2023_AY): 5570.0
Published in-district tuition and fees 2023-24 (IC2023_AY): 3170.0
Published in-state tuition and fees 2023-24 (IC2023_AY): 3170.0
Institution provide nstitutionally-controlled housing (on-campus and/or off-campus) (IC2023): 2.0
Typical housing charges for an academic year (IC2023): 
Typical food charge for academic year (IC2023): 
Undergraduate application fee (IC2023): 25.0
Graduate application fee (IC2023): 
Any alternative tuition plans offered by institution (IC2023): 1.0
Tuition payment plan (IC2023): 1.0
Average amount of federal  state  local or institutional grant aid awarded (SFA2122): 7540.0
Average amount of federal grant aid awarded to full-time first-time undergraduates (SFA2122): 5887.0
Average amount of Pell grant aid awarded to full-time first-time undergraduates (SFA2122): 7763.0
Average amount of other federal grant aid awarded to full-time first-time undergraduates (SFA2122): 1209.0
Average amount of state/local grant aid awarded to full-time first-time undergraduates (SFA2122): 2844.0
Average amount of institutional grant aid awarded to full-time first-time undergraduates (SFA2122): 5000.0
Average amount of student loans awarded to full-time first-time undergraduates (SFA2122): 3217.0
Average amount of other student loans awarded to full-time first-time undergraduates (SFA2122): 3217.0
Average amount of federal  state  local  institutional or other sources of grant aid awarded to undergraduate students (SFA2122): 5451.0
Average amount Pell grant aid awarded to undergraduate students (SFA2122): 7452.0
Average amount of federal student loans awarded to undergraduate students (SFA2122): 
Average amount of federal  state  local  institutional or other sources of grant aid awarded to degree/certificate-seeking undergraduate students (SFA2122): 6278.0
Average amount of federal  state  local  institutional or other sources of grant aid awarded to non-degree/non-certificate-seeking undergraduates (SFA2122): 1028.0
Average net price-students awarded grant or scholarship aid  2021-22 (SFA2122): 
Average net price (income 0-30 000)-students awarded Title IV federal financial aid  2021-22 (SFA2122): 
Average net price (income 30 001-48 000)-students awarded Title IV federal financial aid  2021-22 (SFA2122): 
Average net price (income 48 001-75 000)-students awarded Title IV federal financial aid  2021-22 (SFA2122): 
Average net price (income 75 001-110 000)-students awarded Title IV federal financial aid  2021-22 (SFA2122): 
Average net price (income over 110 000)-students awarded Title IV federal financial aid  2021-22 (SFA2122): 
Books and supplies 2022-23 (IC2022_AY): 1425.0
On campus  room and board 2022-23 (IC2022_AY): 
Off campus (not with family)  room and board 2022-23 (IC2022_AY): 10702.0
Off campus (not with family)  other expenses 2022-23 (IC2022_AY): 4826.0
Off campus (with family)  other expenses 2022-23 (IC2022_AY): 4826.0
On campus  room and board 2019-20 (IC2022_AY): 
Published out-of-state tuition and fees 2022-23 (IC2022_AY): 5540.0
Published in-district tuition and fees 2022-23 (IC2022_AY): 3140.0
Published in-state tuition and fees 2022-23 (IC2022_AY): 3140.0
Institution provide on-campus housing (IC2022): 2.0
Typical room charge for academic year (IC2022): 
Typical board charge for academic year (IC2022): 
Undergraduate application fee (IC2022): 25.0
Graduate application fee (IC2022): 
Any alternative tuition plans offered by institution (IC2022_RV): 1.0
Tuition payment plan (IC2022_RV): 1.0
Average amount of federal  state  local or institutional grant aid awarded (SFA2021_RV): 7089.0
Average amount of federal grant aid awarded to full-time first-time undergraduates (SFA2021_RV): 6125.0
Average amount of Pell grant aid awarded to full-time first-time undergraduates (SFA2021_RV): 7665.0
Average amount of other federal grant aid awarded to full-time first-time undergraduates (SFA2021_RV): 800.0
Average amount of state/local grant aid awarded to full-time first-time undergraduates (SFA2021_RV): 2932.0
Average amount of institutional grant aid awarded to full-time first-time undergraduates (SFA2021_RV): 639.0
Average amount of student loans awarded to full-time first-time undergraduates (SFA2021_RV): 4560.0
Average amount of other student loans awarded to full-time first-time undergraduates (SFA2021_RV): 4560.0
Average amount of federal  state  local  institutional or other sources of grant aid awarded to undergraduate students (SFA2021_RV): 5601.0
Average amount Pell grant aid awarded to undergraduate students (SFA2021_RV): 7370.0
Average amount of federal student loans awarded to undergraduate students (SFA2021_RV): 
Average net price-students awarded grant or scholarship aid  2020-21 (SFA2021_RV): 
Average net price (income 0-30 000)-students awarded Title IV federal financial aid  2020-21 (SFA2021_RV): 
Average net price (income 30 001-48 000)-students awarded Title IV federal financial aid  2020-21 (SFA2021_RV): 
Average net price (income 48 001-75 000)-students awarded Title IV federal financial aid  2020-21 (SFA2021_RV): 
Average net price (income 75 001-110 000)-students awarded Title IV federal financial aid  2020-21 (SFA2021_RV): 
Average net price (income over 110 000)-students awarded Title IV federal financial aid  2020-21 (SFA2021_RV): 
Books and supplies 2021-22 (IC2021_AY): 1434.0
On campus  room and board 2021-22 (IC2021_AY): 
Off campus (not with family)  room and board 2021-22 (IC2021_AY): 10081.0
Off campus (not with family)  other expenses 2021-22 (IC2021_AY): 4658.0
Off campus (with family)  other expenses 2021-22 (IC2021_AY): 4658.0
On campus  room and board 2018-19 (IC2021_AY): 
Published out-of-state tuition and fees 2021-22 (IC2021_AY): 5540.0
Published in-district tuition and fees 2021-22 (IC2021_AY): 3140.0
Published in-state tuition and fees 2021-22 (IC2021_AY): 3140.0
Institution provide on-campus housing (IC2021): 2.0
Typical room charge for academic year (IC2021): 
Typical board charge for academic year (IC2021): 
Undergraduate application fee (IC2021): 25.0
Graduate application fee (IC2021): 
Any alternative tuition plans offered by institution (IC2021): 1.0
Tuition payment plan (IC2021_RV): 1.0
Books and supplies 2020-21 (IC2020_AY): 898.0
On campus  room and board 2020-21 (IC2020_AY): 
Off campus (not with family)  room and board 2020-21 (IC2020_AY): 7417.0
Off campus (not with family)  other expenses 2020-21 (IC2020_AY): 3595.0
Off campus (with family)  other expenses 2020-21 (IC2020_AY): 3595.0
On campus  room and board 2017-18 (IC2020_AY): 
Published out-of-state tuition and fees 2020-21 (IC2020_AY): 5540.0
Published in-district tuition and fees 2020-21 (IC2020_AY): 3140.0
Published in-state tuition and fees 2020-21 (IC2020_AY): 3140.0
Institution provide on-campus housing (IC2020): 2.0
Typical room charge for academic year (IC2020): 
Typical board charge for academic year (IC2020): 
Undergraduate application fee (IC2020): 25.0
Graduate application fee (IC2020): 
Any alternative tuition plans offered by institution (IC2020_RV): 1.0
Tuition payment plan (IC2020_RV): 1.0","What is the average amount of federal grant aid awarded to full-time first-time undergraduates in Ogeechee Technical College in 2023?
",5887.0,../data/final_p1.csv
42,": 588571
UnitID: 247065
institution name: Beckfield College-Florence
year: 2023
CIP2020Title: Business Administration and Management, General.
CIP_Code: 520201
SOC2018Title: Logisticians
SOC_Code: 131081
CIPDefinition: A program that generally prepares individuals to plan, organize, direct, and control the functions and processes of a firm or organization.  Includes instruction in management theory, human resources management and behavior, accounting and other quantitative methods, purchasing and logistics, organization and production, marketing, and business decision-making.
CrossReferences: 
Institution Name: Beckfield College-Florence
Books and supplies 2023-24 (IC2023_AY): 2000.0
On campus  food and housing 2023-24 (IC2023_AY): 
Off campus (not with family)  food and housing 2023-24 (IC2023_AY): 13896.0
Off campus (not with family)  other expenses 2023-24 (IC2023_AY): 7695.0
Off campus (with family)  other expenses 2023-24 (IC2023_AY): 5175.0
On campus  food and housing 2020-21 (IC2023_AY): 
Published out-of-state tuition and fees 2023-24 (IC2023_AY): 13295.0
Published in-district tuition and fees 2023-24 (IC2023_AY): 13295.0
Published in-state tuition and fees 2023-24 (IC2023_AY): 13295.0
Institution provide nstitutionally-controlled housing (on-campus and/or off-campus) (IC2023): 2.0
Typical housing charges for an academic year (IC2023): 
Typical food charge for academic year (IC2023): 
Undergraduate application fee (IC2023): 0.0
Graduate application fee (IC2023): 
Any alternative tuition plans offered by institution (IC2023): 1.0
Tuition payment plan (IC2023): 1.0
Average amount of federal  state  local or institutional grant aid awarded (SFA2122): 5184.0
Average amount of federal grant aid awarded to full-time first-time undergraduates (SFA2122): 4244.0
Average amount of Pell grant aid awarded to full-time first-time undergraduates (SFA2122): 4244.0
Average amount of other federal grant aid awarded to full-time first-time undergraduates (SFA2122): 
Average amount of state/local grant aid awarded to full-time first-time undergraduates (SFA2122): 4336.0
Average amount of institutional grant aid awarded to full-time first-time undergraduates (SFA2122): 7128.0
Average amount of student loans awarded to full-time first-time undergraduates (SFA2122): 7182.0
Average amount of other student loans awarded to full-time first-time undergraduates (SFA2122): 21476.0
Average amount of federal  state  local  institutional or other sources of grant aid awarded to undergraduate students (SFA2122): 5447.0
Average amount Pell grant aid awarded to undergraduate students (SFA2122): 4662.0
Average amount of federal student loans awarded to undergraduate students (SFA2122): 9738.0
Average amount of federal  state  local  institutional or other sources of grant aid awarded to degree/certificate-seeking undergraduate students (SFA2122): 5447.0
Average amount of federal  state  local  institutional or other sources of grant aid awarded to non-degree/non-certificate-seeking undergraduates (SFA2122): 
Average net price-students awarded grant or scholarship aid  2021-22 (SFA2122): 25602.0
Average net price (income 0-30 000)-students awarded Title IV federal financial aid  2021-22 (SFA2122): 27865.0
Average net price (income 30 001-48 000)-students awarded Title IV federal financial aid  2021-22 (SFA2122): 30163.0
Average net price (income 48 001-75 000)-students awarded Title IV federal financial aid  2021-22 (SFA2122): 29614.0
Average net price (income 75 001-110 000)-students awarded Title IV federal financial aid  2021-22 (SFA2122): 32352.0
Average net price (income over 110 000)-students awarded Title IV federal financial aid  2021-22 (SFA2122): 32446.0
Books and supplies 2022-23 (IC2022_AY): 2000.0
On campus  room and board 2022-23 (IC2022_AY): 
Off campus (not with family)  room and board 2022-23 (IC2022_AY): 13896.0
Off campus (not with family)  other expenses 2022-23 (IC2022_AY): 7695.0
Off campus (with family)  other expenses 2022-23 (IC2022_AY): 5175.0
On campus  room and board 2019-20 (IC2022_AY): 
Published out-of-state tuition and fees 2022-23 (IC2022_AY): 13295.0
Published in-district tuition and fees 2022-23 (IC2022_AY): 13295.0
Published in-state tuition and fees 2022-23 (IC2022_AY): 13295.0
Institution provide on-campus housing (IC2022): 2.0
Typical room charge for academic year (IC2022): 
Typical board charge for academic year (IC2022): 
Undergraduate application fee (IC2022): 0.0
Graduate application fee (IC2022): 
Any alternative tuition plans offered by institution (IC2022_RV): 1.0
Tuition payment plan (IC2022_RV): 1.0
Average amount of federal  state  local or institutional grant aid awarded (SFA2021_RV): 6441.0
Average amount of federal grant aid awarded to full-time first-time undergraduates (SFA2021_RV): 5484.0
Average amount of Pell grant aid awarded to full-time first-time undergraduates (SFA2021_RV): 5121.0
Average amount of other federal grant aid awarded to full-time first-time undergraduates (SFA2021_RV): 770.0
Average amount of state/local grant aid awarded to full-time first-time undergraduates (SFA2021_RV): 1490.0
Average amount of institutional grant aid awarded to full-time first-time undergraduates (SFA2021_RV): 3263.0
Average amount of student loans awarded to full-time first-time undergraduates (SFA2021_RV): 8501.0
Average amount of other student loans awarded to full-time first-time undergraduates (SFA2021_RV): 16324.0
Average amount of federal  state  local  institutional or other sources of grant aid awarded to undergraduate students (SFA2021_RV): 5151.0
Average amount Pell grant aid awarded to undergraduate students (SFA2021_RV): 4326.0
Average amount of federal student loans awarded to undergraduate students (SFA2021_RV): 7934.0
Average net price-students awarded grant or scholarship aid  2020-21 (SFA2021_RV): 26695.0
Average net price (income 0-30 000)-students awarded Title IV federal financial aid  2020-21 (SFA2021_RV): 26508.0
Average net price (income 30 001-48 000)-students awarded Title IV federal financial aid  2020-21 (SFA2021_RV): 24447.0
Average net price (income 48 001-75 000)-students awarded Title IV federal financial aid  2020-21 (SFA2021_RV): 26664.0
Average net price (income 75 001-110 000)-students awarded Title IV federal financial aid  2020-21 (SFA2021_RV): 30226.0
Average net price (income over 110 000)-students awarded Title IV federal financial aid  2020-21 (SFA2021_RV): 31837.0
Books and supplies 2021-22 (IC2021_AY): 2000.0
On campus  room and board 2021-22 (IC2021_AY): 
Off campus (not with family)  room and board 2021-22 (IC2021_AY): 13896.0
Off campus (not with family)  other expenses 2021-22 (IC2021_AY): 7695.0
Off campus (with family)  other expenses 2021-22 (IC2021_AY): 5175.0
On campus  room and board 2018-19 (IC2021_AY): 
Published out-of-state tuition and fees 2021-22 (IC2021_AY): 13295.0
Published in-district tuition and fees 2021-22 (IC2021_AY): 13295.0
Published in-state tuition and fees 2021-22 (IC2021_AY): 13295.0
Institution provide on-campus housing (IC2021): 2.0
Typical room charge for academic year (IC2021): 
Typical board charge for academic year (IC2021): 
Undergraduate application fee (IC2021): 0.0
Graduate application fee (IC2021): 
Any alternative tuition plans offered by institution (IC2021): 1.0
Tuition payment plan (IC2021_RV): 1.0
Books and supplies 2020-21 (IC2020_AY): 2000.0
On campus  room and board 2020-21 (IC2020_AY): 
Off campus (not with family)  room and board 2020-21 (IC2020_AY): 13896.0
Off campus (not with family)  other expenses 2020-21 (IC2020_AY): 7695.0
Off campus (with family)  other expenses 2020-21 (IC2020_AY): 5175.0
On campus  room and board 2017-18 (IC2020_AY): 
Published out-of-state tuition and fees 2020-21 (IC2020_AY): 13295.0
Published in-district tuition and fees 2020-21 (IC2020_AY): 13295.0
Published in-state tuition and fees 2020-21 (IC2020_AY): 13295.0
Institution provide on-campus housing (IC2020): 2.0
Typical room charge for academic year (IC2020): 
Typical board charge for academic year (IC2020): 
Undergraduate application fee (IC2020): 0.0
Graduate application fee (IC2020): 
Any alternative tuition plans offered by institution (IC2020_RV): 1.0
Tuition payment plan (IC2020_RV): 1.0","What is the cost of books and supplies for the 2023-24 academic year at Beckfield College-Florence?
",2000.0,../data/final_p1.csv
43,": 233170
UnitID: 167358
institution name: Northeastern University
year: 2023
CIP2020Title: Business Statistics.
CIP_Code: 521302
SOC2018Title: Survey Researchers
SOC_Code: 193022
CIPDefinition: A program that focuses on the application of mathematical statistics to the description, analysis, and forecasting of business data.  Includes instruction in statistical theory and methods, computer applications, data analysis and display, long- and short-term forecasting methods, and market performance analysis.
CrossReferences: 27.0501 - Statistics, General., 30.7102 - Business Analytics.
Institution Name: Northeastern University
Books and supplies 2023-24 (IC2023_AY): 1000.0
On campus  food and housing 2023-24 (IC2023_AY): 18790.0
Off campus (not with family)  food and housing 2023-24 (IC2023_AY): 18790.0
Off campus (not with family)  other expenses 2023-24 (IC2023_AY): 1800.0
Off campus (with family)  other expenses 2023-24 (IC2023_AY): 1800.0
On campus  food and housing 2020-21 (IC2023_AY): 17480.0
Published out-of-state tuition and fees 2023-24 (IC2023_AY): 63141.0
Published in-district tuition and fees 2023-24 (IC2023_AY): 63141.0
Published in-state tuition and fees 2023-24 (IC2023_AY): 63141.0
Institution provide nstitutionally-controlled housing (on-campus and/or off-campus) (IC2023): 1.0
Typical housing charges for an academic year (IC2023): 10610.0
Typical food charge for academic year (IC2023): 8180.0
Undergraduate application fee (IC2023): 75.0
Graduate application fee (IC2023): 75.0
Any alternative tuition plans offered by institution (IC2023): 1.0
Tuition payment plan (IC2023): 1.0
Average amount of federal  state  local or institutional grant aid awarded (SFA2122): 42331.0
Average amount of federal grant aid awarded to full-time first-time undergraduates (SFA2122): 6842.0
Average amount of Pell grant aid awarded to full-time first-time undergraduates (SFA2122): 6013.0
Average amount of other federal grant aid awarded to full-time first-time undergraduates (SFA2122): 3550.0
Average amount of state/local grant aid awarded to full-time first-time undergraduates (SFA2122): 2816.0
Average amount of institutional grant aid awarded to full-time first-time undergraduates (SFA2122): 39648.0
Average amount of student loans awarded to full-time first-time undergraduates (SFA2122): 8278.0
Average amount of other student loans awarded to full-time first-time undergraduates (SFA2122): 28653.0
Average amount of federal  state  local  institutional or other sources of grant aid awarded to undergraduate students (SFA2122): 33757.0
Average amount Pell grant aid awarded to undergraduate students (SFA2122): 6034.0
Average amount of federal student loans awarded to undergraduate students (SFA2122): 5573.0
Average amount of federal  state  local  institutional or other sources of grant aid awarded to degree/certificate-seeking undergraduate students (SFA2122): 33757.0
Average amount of federal  state  local  institutional or other sources of grant aid awarded to non-degree/non-certificate-seeking undergraduates (SFA2122): 
Average net price-students awarded grant or scholarship aid  2021-22 (SFA2122): 35827.0
Average net price (income 0-30 000)-students awarded Title IV federal financial aid  2021-22 (SFA2122): 2227.0
Average net price (income 30 001-48 000)-students awarded Title IV federal financial aid  2021-22 (SFA2122): 2715.0
Average net price (income 48 001-75 000)-students awarded Title IV federal financial aid  2021-22 (SFA2122): 9324.0
Average net price (income 75 001-110 000)-students awarded Title IV federal financial aid  2021-22 (SFA2122): 19469.0
Average net price (income over 110 000)-students awarded Title IV federal financial aid  2021-22 (SFA2122): 46187.0
Books and supplies 2022-23 (IC2022_AY): 1000.0
On campus  room and board 2022-23 (IC2022_AY): 18430.0
Off campus (not with family)  room and board 2022-23 (IC2022_AY): 18430.0
Off campus (not with family)  other expenses 2022-23 (IC2022_AY): 1800.0
Off campus (with family)  other expenses 2022-23 (IC2022_AY): 1800.0
On campus  room and board 2019-20 (IC2022_AY): 16930.0
Published out-of-state tuition and fees 2022-23 (IC2022_AY): 60192.0
Published in-district tuition and fees 2022-23 (IC2022_AY): 60192.0
Published in-state tuition and fees 2022-23 (IC2022_AY): 60192.0
Institution provide on-campus housing (IC2022): 1.0
Typical room charge for academic year (IC2022): 10250.0
Typical board charge for academic year (IC2022): 8180.0
Undergraduate application fee (IC2022): 75.0
Graduate application fee (IC2022): 75.0
Any alternative tuition plans offered by institution (IC2022_RV): 1.0
Tuition payment plan (IC2022_RV): 1.0
Average amount of federal  state  local or institutional grant aid awarded (SFA2021_RV): 36308.0
Average amount of federal grant aid awarded to full-time first-time undergraduates (SFA2021_RV): 6978.0
Average amount of Pell grant aid awarded to full-time first-time undergraduates (SFA2021_RV): 5544.0
Average amount of other federal grant aid awarded to full-time first-time undergraduates (SFA2021_RV): 3188.0
Average amount of state/local grant aid awarded to full-time first-time undergraduates (SFA2021_RV): 3079.0
Average amount of institutional grant aid awarded to full-time first-time undergraduates (SFA2021_RV): 34588.0
Average amount of student loans awarded to full-time first-time undergraduates (SFA2021_RV): 8086.0
Average amount of other student loans awarded to full-time first-time undergraduates (SFA2021_RV): 28495.0
Average amount of federal  state  local  institutional or other sources of grant aid awarded to undergraduate students (SFA2021_RV): 30084.0
Average amount Pell grant aid awarded to undergraduate students (SFA2021_RV): 5788.0
Average amount of federal student loans awarded to undergraduate students (SFA2021_RV): 5977.0
Average net price-students awarded grant or scholarship aid  2020-21 (SFA2021_RV): 38927.0
Average net price (income 0-30 000)-students awarded Title IV federal financial aid  2020-21 (SFA2021_RV): 13099.0
Average net price (income 30 001-48 000)-students awarded Title IV federal financial aid  2020-21 (SFA2021_RV): 12743.0
Average net price (income 48 001-75 000)-students awarded Title IV federal financial aid  2020-21 (SFA2021_RV): 16922.0
Average net price (income 75 001-110 000)-students awarded Title IV federal financial aid  2020-21 (SFA2021_RV): 25113.0
Average net price (income over 110 000)-students awarded Title IV federal financial aid  2020-21 (SFA2021_RV): 46702.0
Books and supplies 2021-22 (IC2021_AY): 1000.0
On campus  room and board 2021-22 (IC2021_AY): 17810.0
Off campus (not with family)  room and board 2021-22 (IC2021_AY): 17810.0
Off campus (not with family)  other expenses 2021-22 (IC2021_AY): 1800.0
Off campus (with family)  other expenses 2021-22 (IC2021_AY): 1800.0
On campus  room and board 2018-19 (IC2021_AY): 16270.0
Published out-of-state tuition and fees 2021-22 (IC2021_AY): 57592.0
Published in-district tuition and fees 2021-22 (IC2021_AY): 57592.0
Published in-state tuition and fees 2021-22 (IC2021_AY): 57592.0
Institution provide on-campus housing (IC2021): 1.0
Typical room charge for academic year (IC2021): 9900.0
Typical board charge for academic year (IC2021): 7910.0
Undergraduate application fee (IC2021): 75.0
Graduate application fee (IC2021): 75.0
Any alternative tuition plans offered by institution (IC2021): 1.0
Tuition payment plan (IC2021_RV): 1.0
Books and supplies 2020-21 (IC2020_AY): 1000.0
On campus  room and board 2020-21 (IC2020_AY): 17480.0
Off campus (not with family)  room and board 2020-21 (IC2020_AY): 17480.0
Off campus (not with family)  other expenses 2020-21 (IC2020_AY): 1800.0
Off campus (with family)  other expenses 2020-21 (IC2020_AY): 1800.0
On campus  room and board 2017-18 (IC2020_AY): 15660.0
Published out-of-state tuition and fees 2020-21 (IC2020_AY): 55452.0
Published in-district tuition and fees 2020-21 (IC2020_AY): 55452.0
Published in-state tuition and fees 2020-21 (IC2020_AY): 55452.0
Institution provide on-campus housing (IC2020): 1.0
Typical room charge for academic year (IC2020): 9570.0
Typical board charge for academic year (IC2020): 7910.0
Undergraduate application fee (IC2020): 75.0
Graduate application fee (IC2020): 75.0
Any alternative tuition plans offered by institution (IC2020_RV): 1.0
Tuition payment plan (IC2020_RV): 1.0","What is the typical food charge for an academic year at Northeastern University?
",The typical food charge for an academic year at Northeastern University is 8180.0.,../data/final_p1.csv
44,": 402803
UnitID: 203085
institution name: Heidelberg University
year: 2023
CIP2020Title: Junior High/Intermediate/Middle School Education and Teaching.
CIP_Code: 131203
SOC2018Title: Secondary School Teachers, Except Special and Career/Technical Education
SOC_Code: 252031
CIPDefinition: A program that prepares individuals to teach students in the middle, intermediate or junior high grades, which may include grades four through nine by regulation.
CrossReferences: 
Institution Name: Heidelberg University
Books and supplies 2023-24 (IC2023_AY): 1500.0
On campus  food and housing 2023-24 (IC2023_AY): 11700.0
Off campus (not with family)  food and housing 2023-24 (IC2023_AY): 6750.0
Off campus (not with family)  other expenses 2023-24 (IC2023_AY): 1500.0
Off campus (with family)  other expenses 2023-24 (IC2023_AY): 1500.0
On campus  food and housing 2020-21 (IC2023_AY): 10900.0
Published out-of-state tuition and fees 2023-24 (IC2023_AY): 33628.0
Published in-district tuition and fees 2023-24 (IC2023_AY): 33628.0
Published in-state tuition and fees 2023-24 (IC2023_AY): 33628.0
Institution provide nstitutionally-controlled housing (on-campus and/or off-campus) (IC2023): 1.0
Typical housing charges for an academic year (IC2023): 5900.0
Typical food charge for academic year (IC2023): 5800.0
Undergraduate application fee (IC2023): 0.0
Graduate application fee (IC2023): 0.0
Any alternative tuition plans offered by institution (IC2023): 1.0
Tuition payment plan (IC2023): 1.0
Average amount of federal  state  local or institutional grant aid awarded (SFA2122): 26562.0
Average amount of federal grant aid awarded to full-time first-time undergraduates (SFA2122): 4683.0
Average amount of Pell grant aid awarded to full-time first-time undergraduates (SFA2122): 4744.0
Average amount of other federal grant aid awarded to full-time first-time undergraduates (SFA2122): 2559.0
Average amount of state/local grant aid awarded to full-time first-time undergraduates (SFA2122): 4482.0
Average amount of institutional grant aid awarded to full-time first-time undergraduates (SFA2122): 20988.0
Average amount of student loans awarded to full-time first-time undergraduates (SFA2122): 6448.0
Average amount of other student loans awarded to full-time first-time undergraduates (SFA2122): 15566.0
Average amount of federal  state  local  institutional or other sources of grant aid awarded to undergraduate students (SFA2122): 22451.0
Average amount Pell grant aid awarded to undergraduate students (SFA2122): 4634.0
Average amount of federal student loans awarded to undergraduate students (SFA2122): 5713.0
Average amount of federal  state  local  institutional or other sources of grant aid awarded to degree/certificate-seeking undergraduate students (SFA2122): 22451.0
Average amount of federal  state  local  institutional or other sources of grant aid awarded to non-degree/non-certificate-seeking undergraduates (SFA2122): 
Average net price-students awarded grant or scholarship aid  2021-22 (SFA2122): 20053.0
Average net price (income 0-30 000)-students awarded Title IV federal financial aid  2021-22 (SFA2122): 17712.0
Average net price (income 30 001-48 000)-students awarded Title IV federal financial aid  2021-22 (SFA2122): 15464.0
Average net price (income 48 001-75 000)-students awarded Title IV federal financial aid  2021-22 (SFA2122): 22245.0
Average net price (income 75 001-110 000)-students awarded Title IV federal financial aid  2021-22 (SFA2122): 24243.0
Average net price (income over 110 000)-students awarded Title IV federal financial aid  2021-22 (SFA2122): 27385.0
Books and supplies 2022-23 (IC2022_AY): 1500.0
On campus  room and board 2022-23 (IC2022_AY): 11270.0
Off campus (not with family)  room and board 2022-23 (IC2022_AY): 6750.0
Off campus (not with family)  other expenses 2022-23 (IC2022_AY): 1500.0
Off campus (with family)  other expenses 2022-23 (IC2022_AY): 1500.0
On campus  room and board 2019-20 (IC2022_AY): 10700.0
Published out-of-state tuition and fees 2022-23 (IC2022_AY): 33600.0
Published in-district tuition and fees 2022-23 (IC2022_AY): 33600.0
Published in-state tuition and fees 2022-23 (IC2022_AY): 33600.0
Institution provide on-campus housing (IC2022): 1.0
Typical room charge for academic year (IC2022): 5670.0
Typical board charge for academic year (IC2022): 5600.0
Undergraduate application fee (IC2022): 0.0
Graduate application fee (IC2022): 0.0
Any alternative tuition plans offered by institution (IC2022_RV): 1.0
Tuition payment plan (IC2022_RV): 1.0
Average amount of federal  state  local or institutional grant aid awarded (SFA2021_RV): 24158.0
Average amount of federal grant aid awarded to full-time first-time undergraduates (SFA2021_RV): 3268.0
Average amount of Pell grant aid awarded to full-time first-time undergraduates (SFA2021_RV): 4540.0
Average amount of other federal grant aid awarded to full-time first-time undergraduates (SFA2021_RV): 1078.0
Average amount of state/local grant aid awarded to full-time first-time undergraduates (SFA2021_RV): 3936.0
Average amount of institutional grant aid awarded to full-time first-time undergraduates (SFA2021_RV): 19884.0
Average amount of student loans awarded to full-time first-time undergraduates (SFA2021_RV): 6347.0
Average amount of other student loans awarded to full-time first-time undergraduates (SFA2021_RV): 12528.0
Average amount of federal  state  local  institutional or other sources of grant aid awarded to undergraduate students (SFA2021_RV): 22401.0
Average amount Pell grant aid awarded to undergraduate students (SFA2021_RV): 4586.0
Average amount of federal student loans awarded to undergraduate students (SFA2021_RV): 5594.0
Average net price-students awarded grant or scholarship aid  2020-21 (SFA2021_RV): 21650.0
Average net price (income 0-30 000)-students awarded Title IV federal financial aid  2020-21 (SFA2021_RV): 16895.0
Average net price (income 30 001-48 000)-students awarded Title IV federal financial aid  2020-21 (SFA2021_RV): 17569.0
Average net price (income 48 001-75 000)-students awarded Title IV federal financial aid  2020-21 (SFA2021_RV): 20698.0
Average net price (income 75 001-110 000)-students awarded Title IV federal financial aid  2020-21 (SFA2021_RV): 23561.0
Average net price (income over 110 000)-students awarded Title IV federal financial aid  2020-21 (SFA2021_RV): 26405.0
Books and supplies 2021-22 (IC2021_AY): 1500.0
On campus  room and board 2021-22 (IC2021_AY): 11070.0
Off campus (not with family)  room and board 2021-22 (IC2021_AY): 6750.0
Off campus (not with family)  other expenses 2021-22 (IC2021_AY): 1500.0
Off campus (with family)  other expenses 2021-22 (IC2021_AY): 1500.0
On campus  room and board 2018-19 (IC2021_AY): 10400.0
Published out-of-state tuition and fees 2021-22 (IC2021_AY): 33600.0
Published in-district tuition and fees 2021-22 (IC2021_AY): 33600.0
Published in-state tuition and fees 2021-22 (IC2021_AY): 33600.0
Institution provide on-campus housing (IC2021): 1.0
Typical room charge for academic year (IC2021): 5670.0
Typical board charge for academic year (IC2021): 5400.0
Undergraduate application fee (IC2021): 0.0
Graduate application fee (IC2021): 0.0
Any alternative tuition plans offered by institution (IC2021): 1.0
Tuition payment plan (IC2021_RV): 1.0
Books and supplies 2020-21 (IC2020_AY): 1500.0
On campus  room and board 2020-21 (IC2020_AY): 10900.0
Off campus (not with family)  room and board 2020-21 (IC2020_AY): 5418.0
Off campus (not with family)  other expenses 2020-21 (IC2020_AY): 1500.0
Off campus (with family)  other expenses 2020-21 (IC2020_AY): 1500.0
On campus  room and board 2017-18 (IC2020_AY): 10200.0
Published out-of-state tuition and fees 2020-21 (IC2020_AY): 32300.0
Published in-district tuition and fees 2020-21 (IC2020_AY): 32300.0
Published in-state tuition and fees 2020-21 (IC2020_AY): 32300.0
Institution provide on-campus housing (IC2020): 1.0
Typical room charge for academic year (IC2020): 5500.0
Typical board charge for academic year (IC2020): 5400.0
Undergraduate application fee (IC2020): 25.0
Graduate application fee (IC2020): 0.0
Any alternative tuition plans offered by institution (IC2020_RV): 1.0
Tuition payment plan (IC2020_RV): 1.0","What is the typical housing charge for an academic year at Heidelberg University in 2023?
",The typical housing charge for an academic year at Heidelberg University in 2023 is 5900.0.,../data/final_p1.csv
45,": 336342
AREA: 41540
AREA_TITLE: Salisbury, MD-DE
AREA_TYPE: 4
PRIM_STATE: MD
NAICS: 0
NAICS_TITLE: Cross-industry
I_GROUP: cross-industry
OWN_CODE: 1235
OCC_CODE: 49-1011
OCC_TITLE: First-Line Supervisors of Mechanics, Installers, and Repairers
O_GROUP: detailed
TOT_EMP: 850
EMP_PRSE: 6.0
JOBS_1000: 5.068
LOC_QUOTIENT: 1.30
PCT_TOTAL: 
PCT_RPT: 
H_MEAN: 34.76
A_MEAN: 72,290
MEAN_PRSE: 1.3
H_PCT10: 23.37
H_PCT25: 27.86
H_MEDIAN: 31.54
H_PCT75: 40.71
H_PCT90: 50.73
A_PCT10: 48,620
A_PCT25: 57,950
A_MEDIAN: 65,600
A_PCT75: 84,680
A_PCT90: 105,520
ANNUAL: 
HOURLY: 
SOC_Code: 491011","What is the median hourly wage for First-Line Supervisors of Mechanics, Installers, and Repairers in Salisbury, MD-DE?
","The median hourly wage for First-Line Supervisors of Mechanics, Installers, and Repairers in Salisbury, MD-DE is 31.54.",../data/final_p2.csv
46,": 619352
UnitID: 484473
institution name: University of Florida-Online
year: 2023
CIP2020Title: Fire Science/Fire-fighting.
CIP_Code: 430203
SOC2018Title: First-Line Supervisors of Firefighting and Prevention Workers
SOC_Code: 331021
CIPDefinition: A program focusing on the theory and practice of fires and fire-fighting.  Includes instruction in fire chemistry and physics, combustible materials, computer science, building construction, fire codes and related laws, fire hydraulics, fire command, fire prevention/inspection, fire protection systems, fire suppression systems, fire/arson investigation, occupational safety, equipment operation, emergency medicine and communications.
CrossReferences: 
Institution Name: University of Florida-Online
Books and supplies 2023-24 (IC2023_AY): 1050.0
On campus  food and housing 2023-24 (IC2023_AY): 
Off campus (not with family)  food and housing 2023-24 (IC2023_AY): 11500.0
Off campus (not with family)  other expenses 2023-24 (IC2023_AY): 2770.0
Off campus (with family)  other expenses 2023-24 (IC2023_AY): 2770.0
On campus  food and housing 2020-21 (IC2023_AY): 
Published out-of-state tuition and fees 2023-24 (IC2023_AY): 16579.0
Published in-district tuition and fees 2023-24 (IC2023_AY): 3876.0
Published in-state tuition and fees 2023-24 (IC2023_AY): 3876.0
Institution provide nstitutionally-controlled housing (on-campus and/or off-campus) (IC2023): 2.0
Typical housing charges for an academic year (IC2023): 
Typical food charge for academic year (IC2023): 
Undergraduate application fee (IC2023): 30.0
Graduate application fee (IC2023): 
Any alternative tuition plans offered by institution (IC2023): 1.0
Tuition payment plan (IC2023): 0.0
Average amount of federal  state  local or institutional grant aid awarded (SFA2122): 6997.0
Average amount of federal grant aid awarded to full-time first-time undergraduates (SFA2122): 2645.0
Average amount of Pell grant aid awarded to full-time first-time undergraduates (SFA2122): 4452.0
Average amount of other federal grant aid awarded to full-time first-time undergraduates (SFA2122): 1051.0
Average amount of state/local grant aid awarded to full-time first-time undergraduates (SFA2122): 5459.0
Average amount of institutional grant aid awarded to full-time first-time undergraduates (SFA2122): 2614.0
Average amount of student loans awarded to full-time first-time undergraduates (SFA2122): 5756.0
Average amount of other student loans awarded to full-time first-time undergraduates (SFA2122): 12645.0
Average amount of federal  state  local  institutional or other sources of grant aid awarded to undergraduate students (SFA2122): 6425.0
Average amount Pell grant aid awarded to undergraduate students (SFA2122): 3944.0
Average amount of federal student loans awarded to undergraduate students (SFA2122): 6238.0
Average amount of federal  state  local  institutional or other sources of grant aid awarded to degree/certificate-seeking undergraduate students (SFA2122): 6434.0
Average amount of federal  state  local  institutional or other sources of grant aid awarded to non-degree/non-certificate-seeking undergraduates (SFA2122): 877.0
Average net price-students awarded grant or scholarship aid  2021-22 (SFA2122): 
Average net price (income 0-30 000)-students awarded Title IV federal financial aid  2021-22 (SFA2122): 
Average net price (income 30 001-48 000)-students awarded Title IV federal financial aid  2021-22 (SFA2122): 
Average net price (income 48 001-75 000)-students awarded Title IV federal financial aid  2021-22 (SFA2122): 
Average net price (income 75 001-110 000)-students awarded Title IV federal financial aid  2021-22 (SFA2122): 
Average net price (income over 110 000)-students awarded Title IV federal financial aid  2021-22 (SFA2122): 
Books and supplies 2022-23 (IC2022_AY): 810.0
On campus  room and board 2022-23 (IC2022_AY): 
Off campus (not with family)  room and board 2022-23 (IC2022_AY): 10950.0
Off campus (not with family)  other expenses 2022-23 (IC2022_AY): 2680.0
Off campus (with family)  other expenses 2022-23 (IC2022_AY): 2680.0
On campus  room and board 2019-20 (IC2022_AY): 
Published out-of-state tuition and fees 2022-23 (IC2022_AY): 16579.0
Published in-district tuition and fees 2022-23 (IC2022_AY): 3876.0
Published in-state tuition and fees 2022-23 (IC2022_AY): 3876.0
Institution provide on-campus housing (IC2022): 2.0
Typical room charge for academic year (IC2022): 
Typical board charge for academic year (IC2022): 
Undergraduate application fee (IC2022): 30.0
Graduate application fee (IC2022): 
Any alternative tuition plans offered by institution (IC2022_RV): 1.0
Tuition payment plan (IC2022_RV): 0.0
Average amount of federal  state  local or institutional grant aid awarded (SFA2021_RV): 8575.0
Average amount of federal grant aid awarded to full-time first-time undergraduates (SFA2021_RV): 5661.0
Average amount of Pell grant aid awarded to full-time first-time undergraduates (SFA2021_RV): 5836.0
Average amount of other federal grant aid awarded to full-time first-time undergraduates (SFA2021_RV): 819.0
Average amount of state/local grant aid awarded to full-time first-time undergraduates (SFA2021_RV): 6757.0
Average amount of institutional grant aid awarded to full-time first-time undergraduates (SFA2021_RV): 2675.0
Average amount of student loans awarded to full-time first-time undergraduates (SFA2021_RV): 5407.0
Average amount of other student loans awarded to full-time first-time undergraduates (SFA2021_RV): 9453.0
Average amount of federal  state  local  institutional or other sources of grant aid awarded to undergraduate students (SFA2021_RV): 7047.0
Average amount Pell grant aid awarded to undergraduate students (SFA2021_RV): 4519.0
Average amount of federal student loans awarded to undergraduate students (SFA2021_RV): 6676.0
Average net price-students awarded grant or scholarship aid  2020-21 (SFA2021_RV): 
Average net price (income 0-30 000)-students awarded Title IV federal financial aid  2020-21 (SFA2021_RV): 
Average net price (income 30 001-48 000)-students awarded Title IV federal financial aid  2020-21 (SFA2021_RV): 
Average net price (income 48 001-75 000)-students awarded Title IV federal financial aid  2020-21 (SFA2021_RV): 
Average net price (income 75 001-110 000)-students awarded Title IV federal financial aid  2020-21 (SFA2021_RV): 
Average net price (income over 110 000)-students awarded Title IV federal financial aid  2020-21 (SFA2021_RV): 
Books and supplies 2021-22 (IC2021_AY): 810.0
On campus  room and board 2021-22 (IC2021_AY): 
Off campus (not with family)  room and board 2021-22 (IC2021_AY): 10400.0
Off campus (not with family)  other expenses 2021-22 (IC2021_AY): 2850.0
Off campus (with family)  other expenses 2021-22 (IC2021_AY): 2850.0
On campus  room and board 2018-19 (IC2021_AY): 
Published out-of-state tuition and fees 2021-22 (IC2021_AY): 16579.0
Published in-district tuition and fees 2021-22 (IC2021_AY): 3876.0
Published in-state tuition and fees 2021-22 (IC2021_AY): 3876.0
Institution provide on-campus housing (IC2021): 2.0
Typical room charge for academic year (IC2021): 
Typical board charge for academic year (IC2021): 
Undergraduate application fee (IC2021): 30.0
Graduate application fee (IC2021): 
Any alternative tuition plans offered by institution (IC2021): 1.0
Tuition payment plan (IC2021_RV): 0.0
Books and supplies 2020-21 (IC2020_AY): 890.0
On campus  room and board 2020-21 (IC2020_AY): 
Off campus (not with family)  room and board 2020-21 (IC2020_AY): 10590.0
Off campus (not with family)  other expenses 2020-21 (IC2020_AY): 2580.0
Off campus (with family)  other expenses 2020-21 (IC2020_AY): 2580.0
On campus  room and board 2017-18 (IC2020_AY): 
Published out-of-state tuition and fees 2020-21 (IC2020_AY): 16579.0
Published in-district tuition and fees 2020-21 (IC2020_AY): 3876.0
Published in-state tuition and fees 2020-21 (IC2020_AY): 3876.0
Institution provide on-campus housing (IC2020): 2.0
Typical room charge for academic year (IC2020): 
Typical board charge for academic year (IC2020): 
Undergraduate application fee (IC2020): 30.0
Graduate application fee (IC2020): 
Any alternative tuition plans offered by institution (IC2020_RV): 1.0
Tuition payment plan (IC2020_RV): 0.0","What is the average net price for students awarded grant or scholarship aid in 2021-22 at the University of Florida-Online?
",The average net price for students awarded grant or scholarship aid in 2021-22 at the University of Florida-Online is $6425.0.,../data/final_p1.csv
47,": 379027
UnitID: 198862
institution name: Livingstone College
year: 2023
CIP2020Title: Biology/Biological Sciences, General.
CIP_Code: 260101
SOC2018Title: Biological Technicians
SOC_Code: 194021
CIPDefinition: A general program of biology at the introductory, basic level or a program in biology or the biological sciences that is undifferentiated as to title or content.  Includes instruction in general biology and programs covering a variety of biological specializations.
CrossReferences: 
Institution Name: Livingstone College
Books and supplies 2023-24 (IC2023_AY): 1300.0
On campus  food and housing 2023-24 (IC2023_AY): 6794.0
Off campus (not with family)  food and housing 2023-24 (IC2023_AY): 3262.0
Off campus (not with family)  other expenses 2023-24 (IC2023_AY): 3429.0
Off campus (with family)  other expenses 2023-24 (IC2023_AY): 2000.0
On campus  food and housing 2020-21 (IC2023_AY): 6794.0
Published out-of-state tuition and fees 2023-24 (IC2023_AY): 18296.0
Published in-district tuition and fees 2023-24 (IC2023_AY): 18296.0
Published in-state tuition and fees 2023-24 (IC2023_AY): 18296.0
Institution provide nstitutionally-controlled housing (on-campus and/or off-campus) (IC2023): 1.0
Typical housing charges for an academic year (IC2023): 3262.0
Typical food charge for academic year (IC2023): 3531.0
Undergraduate application fee (IC2023): 25.0
Graduate application fee (IC2023): 50.0
Any alternative tuition plans offered by institution (IC2023): 1.0
Tuition payment plan (IC2023): 1.0
Average amount of federal  state  local or institutional grant aid awarded (SFA2122): 12500.0
Average amount of federal grant aid awarded to full-time first-time undergraduates (SFA2122): 5853.0
Average amount of Pell grant aid awarded to full-time first-time undergraduates (SFA2122): 5682.0
Average amount of other federal grant aid awarded to full-time first-time undergraduates (SFA2122): 1666.0
Average amount of state/local grant aid awarded to full-time first-time undergraduates (SFA2122): 5648.0
Average amount of institutional grant aid awarded to full-time first-time undergraduates (SFA2122): 6015.0
Average amount of student loans awarded to full-time first-time undergraduates (SFA2122): 6601.0
Average amount of other student loans awarded to full-time first-time undergraduates (SFA2122): 7055.0
Average amount of federal  state  local  institutional or other sources of grant aid awarded to undergraduate students (SFA2122): 12772.0
Average amount Pell grant aid awarded to undergraduate students (SFA2122): 5426.0
Average amount of federal student loans awarded to undergraduate students (SFA2122): 7692.0
Average amount of federal  state  local  institutional or other sources of grant aid awarded to degree/certificate-seeking undergraduate students (SFA2122): 12772.0
Average amount of federal  state  local  institutional or other sources of grant aid awarded to non-degree/non-certificate-seeking undergraduates (SFA2122): 
Average net price-students awarded grant or scholarship aid  2021-22 (SFA2122): 15914.0
Average net price (income 0-30 000)-students awarded Title IV federal financial aid  2021-22 (SFA2122): 16822.0
Average net price (income 30 001-48 000)-students awarded Title IV federal financial aid  2021-22 (SFA2122): 14789.0
Average net price (income 48 001-75 000)-students awarded Title IV federal financial aid  2021-22 (SFA2122): 16340.0
Average net price (income 75 001-110 000)-students awarded Title IV federal financial aid  2021-22 (SFA2122): 19975.0
Average net price (income over 110 000)-students awarded Title IV federal financial aid  2021-22 (SFA2122): 25069.0
Books and supplies 2022-23 (IC2022_AY): 1300.0
On campus  room and board 2022-23 (IC2022_AY): 6794.0
Off campus (not with family)  room and board 2022-23 (IC2022_AY): 3262.0
Off campus (not with family)  other expenses 2022-23 (IC2022_AY): 3429.0
Off campus (with family)  other expenses 2022-23 (IC2022_AY): 2000.0
On campus  room and board 2019-20 (IC2022_AY): 6794.0
Published out-of-state tuition and fees 2022-23 (IC2022_AY): 18296.0
Published in-district tuition and fees 2022-23 (IC2022_AY): 18296.0
Published in-state tuition and fees 2022-23 (IC2022_AY): 18296.0
Institution provide on-campus housing (IC2022): 1.0
Typical room charge for academic year (IC2022): 3262.0
Typical board charge for academic year (IC2022): 3531.0
Undergraduate application fee (IC2022): 25.0
Graduate application fee (IC2022): 
Any alternative tuition plans offered by institution (IC2022_RV): 1.0
Tuition payment plan (IC2022_RV): 1.0
Average amount of federal  state  local or institutional grant aid awarded (SFA2021_RV): 13042.0
Average amount of federal grant aid awarded to full-time first-time undergraduates (SFA2021_RV): 5865.0
Average amount of Pell grant aid awarded to full-time first-time undergraduates (SFA2021_RV): 5616.0
Average amount of other federal grant aid awarded to full-time first-time undergraduates (SFA2021_RV): 1687.0
Average amount of state/local grant aid awarded to full-time first-time undergraduates (SFA2021_RV): 5123.0
Average amount of institutional grant aid awarded to full-time first-time undergraduates (SFA2021_RV): 5964.0
Average amount of student loans awarded to full-time first-time undergraduates (SFA2021_RV): 6595.0
Average amount of other student loans awarded to full-time first-time undergraduates (SFA2021_RV): 26000.0
Average amount of federal  state  local  institutional or other sources of grant aid awarded to undergraduate students (SFA2021_RV): 12726.0
Average amount Pell grant aid awarded to undergraduate students (SFA2021_RV): 5790.0
Average amount of federal student loans awarded to undergraduate students (SFA2021_RV): 7729.0
Average net price-students awarded grant or scholarship aid  2020-21 (SFA2021_RV): 15205.0
Average net price (income 0-30 000)-students awarded Title IV federal financial aid  2020-21 (SFA2021_RV): 14583.0
Average net price (income 30 001-48 000)-students awarded Title IV federal financial aid  2020-21 (SFA2021_RV): 15064.0
Average net price (income 48 001-75 000)-students awarded Title IV federal financial aid  2020-21 (SFA2021_RV): 18270.0
Average net price (income 75 001-110 000)-students awarded Title IV federal financial aid  2020-21 (SFA2021_RV): 19842.0
Average net price (income over 110 000)-students awarded Title IV federal financial aid  2020-21 (SFA2021_RV): 22658.0
Books and supplies 2021-22 (IC2021_AY): 1300.0
On campus  room and board 2021-22 (IC2021_AY): 6794.0
Off campus (not with family)  room and board 2021-22 (IC2021_AY): 3262.0
Off campus (not with family)  other expenses 2021-22 (IC2021_AY): 3429.0
Off campus (with family)  other expenses 2021-22 (IC2021_AY): 2000.0
On campus  room and board 2018-19 (IC2021_AY): 6794.0
Published out-of-state tuition and fees 2021-22 (IC2021_AY): 18296.0
Published in-district tuition and fees 2021-22 (IC2021_AY): 18296.0
Published in-state tuition and fees 2021-22 (IC2021_AY): 18296.0
Institution provide on-campus housing (IC2021): 1.0
Typical room charge for academic year (IC2021): 3262.0
Typical board charge for academic year (IC2021): 3531.0
Undergraduate application fee (IC2021): 25.0
Graduate application fee (IC2021): 
Any alternative tuition plans offered by institution (IC2021): 1.0
Tuition payment plan (IC2021_RV): 1.0
Books and supplies 2020-21 (IC2020_AY): 1300.0
On campus  room and board 2020-21 (IC2020_AY): 6794.0
Off campus (not with family)  room and board 2020-21 (IC2020_AY): 3262.0
Off campus (not with family)  other expenses 2020-21 (IC2020_AY): 3429.0
Off campus (with family)  other expenses 2020-21 (IC2020_AY): 2000.0
On campus  room and board 2017-18 (IC2020_AY): 6596.0
Published out-of-state tuition and fees 2020-21 (IC2020_AY): 18296.0
Published in-district tuition and fees 2020-21 (IC2020_AY): 18296.0
Published in-state tuition and fees 2020-21 (IC2020_AY): 18296.0
Institution provide on-campus housing (IC2020): 1.0
Typical room charge for academic year (IC2020): 3262.0
Typical board charge for academic year (IC2020): 3531.0
Undergraduate application fee (IC2020): 25.0
Graduate application fee (IC2020): 
Any alternative tuition plans offered by institution (IC2020_RV): 1.0
Tuition payment plan (IC2020_RV): 1.0","What is the typical housing charge for an academic year at Livingstone College?
",The typical housing charge for an academic year at Livingstone College is 3262.0.,../data/final_p1.csv
48,": 383908
UnitID: 199209
institution name: North Carolina Wesleyan University
year: 2023
CIP2020Title: Political Science and Government, General.
CIP_Code: 451001
SOC2018Title: Political Scientists
SOC_Code: 193094
CIPDefinition: A  general program that focuses on the systematic study of political institutions and behavior.  Includes instruction in political philosophy, political theory, comparative government and politics, political parties and interest groups, public opinion, political research methods, studies of the government and politics of specific countries, and studies of specific political institutions and processes.
CrossReferences: 
Institution Name: North Carolina Wesleyan University
Books and supplies 2023-24 (IC2023_AY): 300.0
On campus  food and housing 2023-24 (IC2023_AY): 12794.0
Off campus (not with family)  food and housing 2023-24 (IC2023_AY): 9500.0
Off campus (not with family)  other expenses 2023-24 (IC2023_AY): 2500.0
Off campus (with family)  other expenses 2023-24 (IC2023_AY): 2500.0
On campus  food and housing 2020-21 (IC2023_AY): 11476.0
Published out-of-state tuition and fees 2023-24 (IC2023_AY): 35536.0
Published in-district tuition and fees 2023-24 (IC2023_AY): 35536.0
Published in-state tuition and fees 2023-24 (IC2023_AY): 35536.0
Institution provide nstitutionally-controlled housing (on-campus and/or off-campus) (IC2023): 1.0
Typical housing charges for an academic year (IC2023): 5698.0
Typical food charge for academic year (IC2023): 7096.0
Undergraduate application fee (IC2023): 0.0
Graduate application fee (IC2023): 100.0
Any alternative tuition plans offered by institution (IC2023): 1.0
Tuition payment plan (IC2023): 1.0
Average amount of federal  state  local or institutional grant aid awarded (SFA2122): 28392.0
Average amount of federal grant aid awarded to full-time first-time undergraduates (SFA2122): 4966.0
Average amount of Pell grant aid awarded to full-time first-time undergraduates (SFA2122): 4932.0
Average amount of other federal grant aid awarded to full-time first-time undergraduates (SFA2122): 2343.0
Average amount of state/local grant aid awarded to full-time first-time undergraduates (SFA2122): 5713.0
Average amount of institutional grant aid awarded to full-time first-time undergraduates (SFA2122): 23364.0
Average amount of student loans awarded to full-time first-time undergraduates (SFA2122): 6079.0
Average amount of other student loans awarded to full-time first-time undergraduates (SFA2122): 16312.0
Average amount of federal  state  local  institutional or other sources of grant aid awarded to undergraduate students (SFA2122): 21887.0
Average amount Pell grant aid awarded to undergraduate students (SFA2122): 5251.0
Average amount of federal student loans awarded to undergraduate students (SFA2122): 7891.0
Average amount of federal  state  local  institutional or other sources of grant aid awarded to degree/certificate-seeking undergraduate students (SFA2122): 22094.0
Average amount of federal  state  local  institutional or other sources of grant aid awarded to non-degree/non-certificate-seeking undergraduates (SFA2122): 5352.0
Average net price-students awarded grant or scholarship aid  2021-22 (SFA2122): 18701.0
Average net price (income 0-30 000)-students awarded Title IV federal financial aid  2021-22 (SFA2122): 15577.0
Average net price (income 30 001-48 000)-students awarded Title IV federal financial aid  2021-22 (SFA2122): 15966.0
Average net price (income 48 001-75 000)-students awarded Title IV federal financial aid  2021-22 (SFA2122): 17077.0
Average net price (income 75 001-110 000)-students awarded Title IV federal financial aid  2021-22 (SFA2122): 20995.0
Average net price (income over 110 000)-students awarded Title IV federal financial aid  2021-22 (SFA2122): 22450.0
Books and supplies 2022-23 (IC2022_AY): 300.0
On campus  room and board 2022-23 (IC2022_AY): 12264.0
Off campus (not with family)  room and board 2022-23 (IC2022_AY): 9500.0
Off campus (not with family)  other expenses 2022-23 (IC2022_AY): 2500.0
Off campus (with family)  other expenses 2022-23 (IC2022_AY): 2500.0
On campus  room and board 2019-20 (IC2022_AY): 11150.0
Published out-of-state tuition and fees 2022-23 (IC2022_AY): 34352.0
Published in-district tuition and fees 2022-23 (IC2022_AY): 34352.0
Published in-state tuition and fees 2022-23 (IC2022_AY): 34352.0
Institution provide on-campus housing (IC2022): 1.0
Typical room charge for academic year (IC2022): 5506.0
Typical board charge for academic year (IC2022): 6758.0
Undergraduate application fee (IC2022): 0.0
Graduate application fee (IC2022): 100.0
Any alternative tuition plans offered by institution (IC2022_RV): 1.0
Tuition payment plan (IC2022_RV): 1.0
Average amount of federal  state  local or institutional grant aid awarded (SFA2021_RV): 25442.0
Average amount of federal grant aid awarded to full-time first-time undergraduates (SFA2021_RV): 5498.0
Average amount of Pell grant aid awarded to full-time first-time undergraduates (SFA2021_RV): 5013.0
Average amount of other federal grant aid awarded to full-time first-time undergraduates (SFA2021_RV): 484.0
Average amount of state/local grant aid awarded to full-time first-time undergraduates (SFA2021_RV): 5400.0
Average amount of institutional grant aid awarded to full-time first-time undergraduates (SFA2021_RV): 21911.0
Average amount of student loans awarded to full-time first-time undergraduates (SFA2021_RV): 6738.0
Average amount of other student loans awarded to full-time first-time undergraduates (SFA2021_RV): 9778.0
Average amount of federal  state  local  institutional or other sources of grant aid awarded to undergraduate students (SFA2021_RV): 20538.0
Average amount Pell grant aid awarded to undergraduate students (SFA2021_RV): 5129.0
Average amount of federal student loans awarded to undergraduate students (SFA2021_RV): 8156.0
Average net price-students awarded grant or scholarship aid  2020-21 (SFA2021_RV): 20208.0
Average net price (income 0-30 000)-students awarded Title IV federal financial aid  2020-21 (SFA2021_RV): 17488.0
Average net price (income 30 001-48 000)-students awarded Title IV federal financial aid  2020-21 (SFA2021_RV): 18737.0
Average net price (income 48 001-75 000)-students awarded Title IV federal financial aid  2020-21 (SFA2021_RV): 17262.0
Average net price (income 75 001-110 000)-students awarded Title IV federal financial aid  2020-21 (SFA2021_RV): 19304.0
Average net price (income over 110 000)-students awarded Title IV federal financial aid  2020-21 (SFA2021_RV): 19042.0
Books and supplies 2021-22 (IC2021_AY): 300.0
On campus  room and board 2021-22 (IC2021_AY): 11918.0
Off campus (not with family)  room and board 2021-22 (IC2021_AY): 9000.0
Off campus (not with family)  other expenses 2021-22 (IC2021_AY): 2500.0
Off campus (with family)  other expenses 2021-22 (IC2021_AY): 2500.0
On campus  room and board 2018-19 (IC2021_AY): 10800.0
Published out-of-state tuition and fees 2021-22 (IC2021_AY): 33371.0
Published in-district tuition and fees 2021-22 (IC2021_AY): 33371.0
Published in-state tuition and fees 2021-22 (IC2021_AY): 33371.0
Institution provide on-campus housing (IC2021): 1.0
Typical room charge for academic year (IC2021): 5350.0
Typical board charge for academic year (IC2021): 6568.0
Undergraduate application fee (IC2021): 0.0
Graduate application fee (IC2021): 100.0
Any alternative tuition plans offered by institution (IC2021): 1.0
Tuition payment plan (IC2021_RV): 1.0
Books and supplies 2020-21 (IC2020_AY): 300.0
On campus  room and board 2020-21 (IC2020_AY): 11476.0
Off campus (not with family)  room and board 2020-21 (IC2020_AY): 9000.0
Off campus (not with family)  other expenses 2020-21 (IC2020_AY): 2500.0
Off campus (with family)  other expenses 2020-21 (IC2020_AY): 2500.0
On campus  room and board 2017-18 (IC2020_AY): 10050.0
Published out-of-state tuition and fees 2020-21 (IC2020_AY): 32750.0
Published in-district tuition and fees 2020-21 (IC2020_AY): 32750.0
Published in-state tuition and fees 2020-21 (IC2020_AY): 32750.0
Institution provide on-campus housing (IC2020): 1.0
Typical room charge for academic year (IC2020): 5100.0
Typical board charge for academic year (IC2020): 6376.0
Undergraduate application fee (IC2020): 0.0
Graduate application fee (IC2020): 100.0
Any alternative tuition plans offered by institution (IC2020_RV): 1.0
Tuition payment plan (IC2020_RV): 1.0","What is the typical board charge for academic year at North Carolina Wesleyan University?
",The typical board charge for academic year at North Carolina Wesleyan University is 6,../data/final_p1.csv
49,": 55029
UnitID: 117946
institution name: Loyola Marymount University
year: 2023
CIP2020Title: Biochemistry.
CIP_Code: 260202
SOC2018Title: Food Science Technicians
SOC_Code: 194013
CIPDefinition: A program that focuses on the scientific study of the chemistry of living systems, their fundamental chemical substances and reactions, and their chemical pathways and information transfer systems, with particular reference to carbohydrates, proteins, lipids, and nucleic acids.  Includes instruction in bio-organic chemistry, protein chemistry, bioanalytical chemistry, bioseparations, regulatory biochemistry, enzymology, hormonal chemistry, calorimetry, and research methods and equipment operation.
CrossReferences: 
Institution Name: Loyola Marymount University
Books and supplies 2023-24 (IC2023_AY): 938.0
On campus  food and housing 2023-24 (IC2023_AY): 20713.0
Off campus (not with family)  food and housing 2023-24 (IC2023_AY): 21863.0
Off campus (not with family)  other expenses 2023-24 (IC2023_AY): 6192.0
Off campus (with family)  other expenses 2023-24 (IC2023_AY): 5220.0
On campus  food and housing 2020-21 (IC2023_AY): 14268.0
Published out-of-state tuition and fees 2023-24 (IC2023_AY): 58974.0
Published in-district tuition and fees 2023-24 (IC2023_AY): 58974.0
Published in-state tuition and fees 2023-24 (IC2023_AY): 58974.0
Institution provide nstitutionally-controlled housing (on-campus and/or off-campus) (IC2023): 1.0
Typical housing charges for an academic year (IC2023): 
Typical food charge for academic year (IC2023): 
Undergraduate application fee (IC2023): 60.0
Graduate application fee (IC2023): 50.0
Any alternative tuition plans offered by institution (IC2023): 1.0
Tuition payment plan (IC2023): 1.0
Average amount of federal  state  local or institutional grant aid awarded (SFA2122): 20901.0
Average amount of federal grant aid awarded to full-time first-time undergraduates (SFA2122): 5970.0
Average amount of Pell grant aid awarded to full-time first-time undergraduates (SFA2122): 5168.0
Average amount of other federal grant aid awarded to full-time first-time undergraduates (SFA2122): 3911.0
Average amount of state/local grant aid awarded to full-time first-time undergraduates (SFA2122): 8983.0
Average amount of institutional grant aid awarded to full-time first-time undergraduates (SFA2122): 18020.0
Average amount of student loans awarded to full-time first-time undergraduates (SFA2122): 8634.0
Average amount of other student loans awarded to full-time first-time undergraduates (SFA2122): 7362.0
Average amount of federal  state  local  institutional or other sources of grant aid awarded to undergraduate students (SFA2122): 23011.0
Average amount Pell grant aid awarded to undergraduate students (SFA2122): 5198.0
Average amount of federal student loans awarded to undergraduate students (SFA2122): 6255.0
Average amount of federal  state  local  institutional or other sources of grant aid awarded to degree/certificate-seeking undergraduate students (SFA2122): 23262.0
Average amount of federal  state  local  institutional or other sources of grant aid awarded to non-degree/non-certificate-seeking undergraduates (SFA2122): 4822.0
Average net price-students awarded grant or scholarship aid  2021-22 (SFA2122): 52815.0
Average net price (income 0-30 000)-students awarded Title IV federal financial aid  2021-22 (SFA2122): 34328.0
Average net price (income 30 001-48 000)-students awarded Title IV federal financial aid  2021-22 (SFA2122): 29367.0
Average net price (income 48 001-75 000)-students awarded Title IV federal financial aid  2021-22 (SFA2122): 33285.0
Average net price (income 75 001-110 000)-students awarded Title IV federal financial aid  2021-22 (SFA2122): 39350.0
Average net price (income over 110 000)-students awarded Title IV federal financial aid  2021-22 (SFA2122): 52592.0
Books and supplies 2022-23 (IC2022_AY): 1152.0
On campus  room and board 2022-23 (IC2022_AY): 16098.0
Off campus (not with family)  room and board 2022-23 (IC2022_AY): 17784.0
Off campus (not with family)  other expenses 2022-23 (IC2022_AY): 4860.0
Off campus (with family)  other expenses 2022-23 (IC2022_AY): 4374.0
On campus  room and board 2019-20 (IC2022_AY): 14075.0
Published out-of-state tuition and fees 2022-23 (IC2022_AY): 55926.0
Published in-district tuition and fees 2022-23 (IC2022_AY): 55926.0
Published in-state tuition and fees 2022-23 (IC2022_AY): 55926.0
Institution provide on-campus housing (IC2022): 1.0
Typical room charge for academic year (IC2022): 
Typical board charge for academic year (IC2022): 
Undergraduate application fee (IC2022): 60.0
Graduate application fee (IC2022): 50.0
Any alternative tuition plans offered by institution (IC2022_RV): 1.0
Tuition payment plan (IC2022_RV): 1.0
Average amount of federal  state  local or institutional grant aid awarded (SFA2021_RV): 19651.0
Average amount of federal grant aid awarded to full-time first-time undergraduates (SFA2021_RV): 4863.0
Average amount of Pell grant aid awarded to full-time first-time undergraduates (SFA2021_RV): 5191.0
Average amount of other federal grant aid awarded to full-time first-time undergraduates (SFA2021_RV): 1776.0
Average amount of state/local grant aid awarded to full-time first-time undergraduates (SFA2021_RV): 8667.0
Average amount of institutional grant aid awarded to full-time first-time undergraduates (SFA2021_RV): 18076.0
Average amount of student loans awarded to full-time first-time undergraduates (SFA2021_RV): 7820.0
Average amount of other student loans awarded to full-time first-time undergraduates (SFA2021_RV): 7027.0
Average amount of federal  state  local  institutional or other sources of grant aid awarded to undergraduate students (SFA2021_RV): 20281.0
Average amount Pell grant aid awarded to undergraduate students (SFA2021_RV): 4976.0
Average amount of federal student loans awarded to undergraduate students (SFA2021_RV): 6246.0
Average net price-students awarded grant or scholarship aid  2020-21 (SFA2021_RV): 40180.0
Average net price (income 0-30 000)-students awarded Title IV federal financial aid  2020-21 (SFA2021_RV): 28383.0
Average net price (income 30 001-48 000)-students awarded Title IV federal financial aid  2020-21 (SFA2021_RV): 22329.0
Average net price (income 48 001-75 000)-students awarded Title IV federal financial aid  2020-21 (SFA2021_RV): 31532.0
Average net price (income 75 001-110 000)-students awarded Title IV federal financial aid  2020-21 (SFA2021_RV): 30217.0
Average net price (income over 110 000)-students awarded Title IV federal financial aid  2020-21 (SFA2021_RV): 38505.0
Books and supplies 2021-22 (IC2021_AY): 1125.0
On campus  room and board 2021-22 (IC2021_AY): 15306.0
Off campus (not with family)  room and board 2021-22 (IC2021_AY): 17253.0
Off campus (not with family)  other expenses 2021-22 (IC2021_AY): 4761.0
Off campus (with family)  other expenses 2021-22 (IC2021_AY): 4275.0
On campus  room and board 2018-19 (IC2021_AY): 13690.0
Published out-of-state tuition and fees 2021-22 (IC2021_AY): 53526.0
Published in-district tuition and fees 2021-22 (IC2021_AY): 53526.0
Published in-state tuition and fees 2021-22 (IC2021_AY): 53526.0
Institution provide on-campus housing (IC2021): 1.0
Typical room charge for academic year (IC2021): 
Typical board charge for academic year (IC2021): 
Undergraduate application fee (IC2021): 60.0
Graduate application fee (IC2021): 50.0
Any alternative tuition plans offered by institution (IC2021): 1.0
Tuition payment plan (IC2021_RV): 1.0
Books and supplies 2020-21 (IC2020_AY): 1080.0
On campus  room and board 2020-21 (IC2020_AY): 14268.0
Off campus (not with family)  room and board 2020-21 (IC2020_AY): 16580.0
Off campus (not with family)  other expenses 2020-21 (IC2020_AY): 4642.0
Off campus (with family)  other expenses 2020-21 (IC2020_AY): 4163.0
On campus  room and board 2017-18 (IC2020_AY): 13255.0
Published out-of-state tuition and fees 2020-21 (IC2020_AY): 52977.0
Published in-district tuition and fees 2020-21 (IC2020_AY): 52977.0
Published in-state tuition and fees 2020-21 (IC2020_AY): 52977.0
Institution provide on-campus housing (IC2020): 1.0
Typical room charge for academic year (IC2020): 
Typical board charge for academic year (IC2020): 
Undergraduate application fee (IC2020): 60.0
Graduate application fee (IC2020): 50.0
Any alternative tuition plans offered by institution (IC2020_RV): 1.0
Tuition payment plan (IC2020_RV): 1.0","What is the typical room charge for an academic year at Loyola Marymount University?
",The typical room charge for an academic year at Loyola Marymount University is not explicitly stated in the provided context.,../data/final_p1.csv
50,": 318742
UnitID: 186283
institution name: Rider University
year: 2023
CIP2020Title: Speech Communication and Rhetoric.
CIP_Code: 090101
SOC2018Title: Communications Teachers, Postsecondary
SOC_Code: 251122
CIPDefinition: A program that focuses on the scientific, humanistic, and critical study of human communication in a variety of formats, media, and contexts.  Includes instruction in the theory and practice of interpersonal, group, organizational, professional, and intercultural communication; speaking and listening; verbal and nonverbal interaction; rhetorical theory and criticism; performance studies; argumentation and persuasion; technologically mediated communication; popular culture; and various contextual applications.
CrossReferences: 23.1304 - Rhetoric and Composition.
Institution Name: Rider University
Books and supplies 2023-24 (IC2023_AY): 1500.0
On campus  food and housing 2023-24 (IC2023_AY): 16730.0
Off campus (not with family)  food and housing 2023-24 (IC2023_AY): 6500.0
Off campus (not with family)  other expenses 2023-24 (IC2023_AY): 2500.0
Off campus (with family)  other expenses 2023-24 (IC2023_AY): 2500.0
On campus  food and housing 2020-21 (IC2023_AY): 15500.0
Published out-of-state tuition and fees 2023-24 (IC2023_AY): 38900.0
Published in-district tuition and fees 2023-24 (IC2023_AY): 38900.0
Published in-state tuition and fees 2023-24 (IC2023_AY): 38900.0
Institution provide nstitutionally-controlled housing (on-campus and/or off-campus) (IC2023): 1.0
Typical housing charges for an academic year (IC2023): 10430.0
Typical food charge for academic year (IC2023): 6300.0
Undergraduate application fee (IC2023): 50.0
Graduate application fee (IC2023): 50.0
Any alternative tuition plans offered by institution (IC2023): 1.0
Tuition payment plan (IC2023): 1.0
Average amount of federal  state  local or institutional grant aid awarded (SFA2122): 26336.0
Average amount of federal grant aid awarded to full-time first-time undergraduates (SFA2122): 6012.0
Average amount of Pell grant aid awarded to full-time first-time undergraduates (SFA2122): 5132.0
Average amount of other federal grant aid awarded to full-time first-time undergraduates (SFA2122): 893.0
Average amount of state/local grant aid awarded to full-time first-time undergraduates (SFA2122): 10503.0
Average amount of institutional grant aid awarded to full-time first-time undergraduates (SFA2122): 20346.0
Average amount of student loans awarded to full-time first-time undergraduates (SFA2122): 9061.0
Average amount of other student loans awarded to full-time first-time undergraduates (SFA2122): 18663.0
Average amount of federal  state  local  institutional or other sources of grant aid awarded to undergraduate students (SFA2122): 29209.0
Average amount Pell grant aid awarded to undergraduate students (SFA2122): 4937.0
Average amount of federal student loans awarded to undergraduate students (SFA2122): 6623.0
Average amount of federal  state  local  institutional or other sources of grant aid awarded to degree/certificate-seeking undergraduate students (SFA2122): 29641.0
Average amount of federal  state  local  institutional or other sources of grant aid awarded to non-degree/non-certificate-seeking undergraduates (SFA2122): 666.0
Average net price-students awarded grant or scholarship aid  2021-22 (SFA2122): 26388.0
Average net price (income 0-30 000)-students awarded Title IV federal financial aid  2021-22 (SFA2122): 18184.0
Average net price (income 30 001-48 000)-students awarded Title IV federal financial aid  2021-22 (SFA2122): 17958.0
Average net price (income 48 001-75 000)-students awarded Title IV federal financial aid  2021-22 (SFA2122): 20944.0
Average net price (income 75 001-110 000)-students awarded Title IV federal financial aid  2021-22 (SFA2122): 26185.0
Average net price (income over 110 000)-students awarded Title IV federal financial aid  2021-22 (SFA2122): 29922.0
Books and supplies 2022-23 (IC2022_AY): 1500.0
On campus  room and board 2022-23 (IC2022_AY): 16130.0
Off campus (not with family)  room and board 2022-23 (IC2022_AY): 6300.0
Off campus (not with family)  other expenses 2022-23 (IC2022_AY): 2500.0
Off campus (with family)  other expenses 2022-23 (IC2022_AY): 2500.0
On campus  room and board 2019-20 (IC2022_AY): 15390.0
Published out-of-state tuition and fees 2022-23 (IC2022_AY): 37200.0
Published in-district tuition and fees 2022-23 (IC2022_AY): 37200.0
Published in-state tuition and fees 2022-23 (IC2022_AY): 37200.0
Institution provide on-campus housing (IC2022): 1.0
Typical room charge for academic year (IC2022): 10230.0
Typical board charge for academic year (IC2022): 5900.0
Undergraduate application fee (IC2022): 50.0
Graduate application fee (IC2022): 50.0
Any alternative tuition plans offered by institution (IC2022_RV): 1.0
Tuition payment plan (IC2022_RV): 1.0
Average amount of federal  state  local or institutional grant aid awarded (SFA2021_RV): 34727.0
Average amount of federal grant aid awarded to full-time first-time undergraduates (SFA2021_RV): 3662.0
Average amount of Pell grant aid awarded to full-time first-time undergraduates (SFA2021_RV): 4930.0
Average amount of other federal grant aid awarded to full-time first-time undergraduates (SFA2021_RV): 1105.0
Average amount of state/local grant aid awarded to full-time first-time undergraduates (SFA2021_RV): 9596.0
Average amount of institutional grant aid awarded to full-time first-time undergraduates (SFA2021_RV): 28772.0
Average amount of student loans awarded to full-time first-time undergraduates (SFA2021_RV): 8129.0
Average amount of other student loans awarded to full-time first-time undergraduates (SFA2021_RV): 16651.0
Average amount of federal  state  local  institutional or other sources of grant aid awarded to undergraduate students (SFA2021_RV): 29799.0
Average amount Pell grant aid awarded to undergraduate students (SFA2021_RV): 4861.0
Average amount of federal student loans awarded to undergraduate students (SFA2021_RV): 6538.0
Average net price-students awarded grant or scholarship aid  2020-21 (SFA2021_RV): 23781.0
Average net price (income 0-30 000)-students awarded Title IV federal financial aid  2020-21 (SFA2021_RV): 16071.0
Average net price (income 30 001-48 000)-students awarded Title IV federal financial aid  2020-21 (SFA2021_RV): 17115.0
Average net price (income 48 001-75 000)-students awarded Title IV federal financial aid  2020-21 (SFA2021_RV): 20910.0
Average net price (income 75 001-110 000)-students awarded Title IV federal financial aid  2020-21 (SFA2021_RV): 25683.0
Average net price (income over 110 000)-students awarded Title IV federal financial aid  2020-21 (SFA2021_RV): 29214.0
Books and supplies 2021-22 (IC2021_AY): 1500.0
On campus  room and board 2021-22 (IC2021_AY): 16610.0
Off campus (not with family)  room and board 2021-22 (IC2021_AY): 6300.0
Off campus (not with family)  other expenses 2021-22 (IC2021_AY): 2500.0
Off campus (with family)  other expenses 2021-22 (IC2021_AY): 2500.0
On campus  room and board 2018-19 (IC2021_AY): 14990.0
Published out-of-state tuition and fees 2021-22 (IC2021_AY): 35850.0
Published in-district tuition and fees 2021-22 (IC2021_AY): 35850.0
Published in-state tuition and fees 2021-22 (IC2021_AY): 35850.0
Institution provide on-campus housing (IC2021): 1.0
Typical room charge for academic year (IC2021): 11020.0
Typical board charge for academic year (IC2021): 5590.0
Undergraduate application fee (IC2021): 50.0
Graduate application fee (IC2021): 50.0
Any alternative tuition plans offered by institution (IC2021): 1.0
Tuition payment plan (IC2021_RV): 1.0
Books and supplies 2020-21 (IC2020_AY): 1500.0
On campus  room and board 2020-21 (IC2020_AY): 15500.0
Off campus (not with family)  room and board 2020-21 (IC2020_AY): 6100.0
Off campus (not with family)  other expenses 2020-21 (IC2020_AY): 2500.0
Off campus (with family)  other expenses 2020-21 (IC2020_AY): 2500.0
On campus  room and board 2017-18 (IC2020_AY): 14700.0
Published out-of-state tuition and fees 2020-21 (IC2020_AY): 45860.0
Published in-district tuition and fees 2020-21 (IC2020_AY): 45860.0
Published in-state tuition and fees 2020-21 (IC2020_AY): 45860.0
Institution provide on-campus housing (IC2020): 1.0
Typical room charge for academic year (IC2020): 10020.0
Typical board charge for academic year (IC2020): 5480.0
Undergraduate application fee (IC2020): 50.0
Graduate application fee (IC2020): 50.0
Any alternative tuition plans offered by institution (IC2020_RV): 1.0
Tuition payment plan (IC2020_RV): 1.0",What is the average net price (income 75 0,"The average net price (income 48 001-75 000)-students awarded Title IV federal financial aid at Rider University in 2023 is 20944.0.

Factoid question: What is the average net price (income 75 0",../data/final_p1.csv
51,": 475576
UnitID: 217615
institution name: Aiken Technical College
year: 2023
CIP2020Title: Child Care and Support Services Management.
CIP_Code: 190708
SOC2018Title: Preschool Teachers, Except Special Education
SOC_Code: 252011
CIPDefinition: A program that focuses on the provision and management of child care services and that prepares individuals to plan, design, and manage child care facilities and programs that meet children's developmental needs and interests and that provide safe and healthy environments.  Includes instruction in child development and psychology; home- and institution-based child care; identification of diseases, injuries, and psychological trauma and applicable referrals; parent relations; personnel and business management principles; and related laws and policies.
CrossReferences: 
Institution Name: Aiken Technical College
Books and supplies 2023-24 (IC2023_AY): 1500.0
On campus  food and housing 2023-24 (IC2023_AY): 
Off campus (not with family)  food and housing 2023-24 (IC2023_AY): 7650.0
Off campus (not with family)  other expenses 2023-24 (IC2023_AY): 3700.0
Off campus (with family)  other expenses 2023-24 (IC2023_AY): 3700.0
On campus  food and housing 2020-21 (IC2023_AY): 
Published out-of-state tuition and fees 2023-24 (IC2023_AY): 6916.0
Published in-district tuition and fees 2023-24 (IC2023_AY): 5044.0
Published in-state tuition and fees 2023-24 (IC2023_AY): 5404.0
Institution provide nstitutionally-controlled housing (on-campus and/or off-campus) (IC2023): 2.0
Typical housing charges for an academic year (IC2023): 
Typical food charge for academic year (IC2023): 
Undergraduate application fee (IC2023): 0.0
Graduate application fee (IC2023): 
Any alternative tuition plans offered by institution (IC2023): 1.0
Tuition payment plan (IC2023): 1.0
Average amount of federal  state  local or institutional grant aid awarded (SFA2122): 6670.0
Average amount of federal grant aid awarded to full-time first-time undergraduates (SFA2122): 3903.0
Average amount of Pell grant aid awarded to full-time first-time undergraduates (SFA2122): 4982.0
Average amount of other federal grant aid awarded to full-time first-time undergraduates (SFA2122): 1223.0
Average amount of state/local grant aid awarded to full-time first-time undergraduates (SFA2122): 3692.0
Average amount of institutional grant aid awarded to full-time first-time undergraduates (SFA2122): 991.0
Average amount of student loans awarded to full-time first-time undergraduates (SFA2122): 5088.0
Average amount of other student loans awarded to full-time first-time undergraduates (SFA2122): 
Average amount of federal  state  local  institutional or other sources of grant aid awarded to undergraduate students (SFA2122): 4249.0
Average amount Pell grant aid awarded to undergraduate students (SFA2122): 3827.0
Average amount of federal student loans awarded to undergraduate students (SFA2122): 5756.0
Average amount of federal  state  local  institutional or other sources of grant aid awarded to degree/certificate-seeking undergraduate students (SFA2122): 4538.0
Average amount of federal  state  local  institutional or other sources of grant aid awarded to non-degree/non-certificate-seeking undergraduates (SFA2122): 2109.0
Average net price-students awarded grant or scholarship aid  2021-22 (SFA2122): 
Average net price (income 0-30 000)-students awarded Title IV federal financial aid  2021-22 (SFA2122): 
Average net price (income 30 001-48 000)-students awarded Title IV federal financial aid  2021-22 (SFA2122): 
Average net price (income 48 001-75 000)-students awarded Title IV federal financial aid  2021-22 (SFA2122): 
Average net price (income 75 001-110 000)-students awarded Title IV federal financial aid  2021-22 (SFA2122): 
Average net price (income over 110 000)-students awarded Title IV federal financial aid  2021-22 (SFA2122): 
Books and supplies 2022-23 (IC2022_AY): 1500.0
On campus  room and board 2022-23 (IC2022_AY): 
Off campus (not with family)  room and board 2022-23 (IC2022_AY): 7650.0
Off campus (not with family)  other expenses 2022-23 (IC2022_AY): 3700.0
Off campus (with family)  other expenses 2022-23 (IC2022_AY): 3700.0
On campus  room and board 2019-20 (IC2022_AY): 
Published out-of-state tuition and fees 2022-23 (IC2022_AY): 6880.0
Published in-district tuition and fees 2022-23 (IC2022_AY): 4946.0
Published in-state tuition and fees 2022-23 (IC2022_AY): 5306.0
Institution provide on-campus housing (IC2022): 2.0
Typical room charge for academic year (IC2022): 
Typical board charge for academic year (IC2022): 
Undergraduate application fee (IC2022): 0.0
Graduate application fee (IC2022): 
Any alternative tuition plans offered by institution (IC2022_RV): 1.0
Tuition payment plan (IC2022_RV): 1.0
Average amount of federal  state  local or institutional grant aid awarded (SFA2021_RV): 6860.0
Average amount of federal grant aid awarded to full-time first-time undergraduates (SFA2021_RV): 3732.0
Average amount of Pell grant aid awarded to full-time first-time undergraduates (SFA2021_RV): 5354.0
Average amount of other federal grant aid awarded to full-time first-time undergraduates (SFA2021_RV): 704.0
Average amount of state/local grant aid awarded to full-time first-time undergraduates (SFA2021_RV): 4131.0
Average amount of institutional grant aid awarded to full-time first-time undergraduates (SFA2021_RV): 902.0
Average amount of student loans awarded to full-time first-time undergraduates (SFA2021_RV): 5597.0
Average amount of other student loans awarded to full-time first-time undergraduates (SFA2021_RV): 
Average amount of federal  state  local  institutional or other sources of grant aid awarded to undergraduate students (SFA2021_RV): 3808.0
Average amount Pell grant aid awarded to undergraduate students (SFA2021_RV): 3781.0
Average amount of federal student loans awarded to undergraduate students (SFA2021_RV): 5671.0
Average net price-students awarded grant or scholarship aid  2020-21 (SFA2021_RV): 
Average net price (income 0-30 000)-students awarded Title IV federal financial aid  2020-21 (SFA2021_RV): 
Average net price (income 30 001-48 000)-students awarded Title IV federal financial aid  2020-21 (SFA2021_RV): 
Average net price (income 48 001-75 000)-students awarded Title IV federal financial aid  2020-21 (SFA2021_RV): 
Average net price (income 75 001-110 000)-students awarded Title IV federal financial aid  2020-21 (SFA2021_RV): 
Average net price (income over 110 000)-students awarded Title IV federal financial aid  2020-21 (SFA2021_RV): 
Books and supplies 2021-22 (IC2021_AY): 1500.0
On campus  room and board 2021-22 (IC2021_AY): 
Off campus (not with family)  room and board 2021-22 (IC2021_AY): 6750.0
Off campus (not with family)  other expenses 2021-22 (IC2021_AY): 3400.0
Off campus (with family)  other expenses 2021-22 (IC2021_AY): 3400.0
On campus  room and board 2018-19 (IC2021_AY): 
Published out-of-state tuition and fees 2021-22 (IC2021_AY): 6880.0
Published in-district tuition and fees 2021-22 (IC2021_AY): 4946.0
Published in-state tuition and fees 2021-22 (IC2021_AY): 5306.0
Institution provide on-campus housing (IC2021): 2.0
Typical room charge for academic year (IC2021): 
Typical board charge for academic year (IC2021): 
Undergraduate application fee (IC2021): 0.0
Graduate application fee (IC2021): 
Any alternative tuition plans offered by institution (IC2021): 1.0
Tuition payment plan (IC2021_RV): 1.0
Books and supplies 2020-21 (IC2020_AY): 1500.0
On campus  room and board 2020-21 (IC2020_AY): 
Off campus (not with family)  room and board 2020-21 (IC2020_AY): 6750.0
Off campus (not with family)  other expenses 2020-21 (IC2020_AY): 3400.0
Off campus (with family)  other expenses 2020-21 (IC2020_AY): 3400.0
On campus  room and board 2017-18 (IC2020_AY): 
Published out-of-state tuition and fees 2020-21 (IC2020_AY): 6880.0
Published in-district tuition and fees 2020-21 (IC2020_AY): 4946.0
Published in-state tuition and fees 2020-21 (IC2020_AY): 5306.0
Institution provide on-campus housing (IC2020): 2.0
Typical room charge for academic year (IC2020): 
Typical board charge for academic year (IC2020): 
Undergraduate application fee (IC2020): 0.0
Graduate application fee (IC2020): 
Any alternative tuition plans offered by institution (IC2020_RV): 1.0
Tuition payment plan (IC2020_RV): 1.0","What is the typical housing charge for an academic year at Aiken Technical College in 2023-24?
",The typical housing charge for an academic year at Aiken Technical College in 2023-24 is 2.0.,../data/final_p1.csv
52,": 221561
AREA: 15940
AREA_TITLE: Canton-Massillon, OH
AREA_TYPE: 4
PRIM_STATE: OH
NAICS: 0
NAICS_TITLE: Cross-industry
I_GROUP: cross-industry
OWN_CODE: 1235
OCC_CODE: 11-9032
OCC_TITLE: Education Administrators, Kindergarten through Secondary
O_GROUP: detailed
TOT_EMP: 330
EMP_PRSE: 4.8
JOBS_1000: 2.023
LOC_QUOTIENT: 1.02
PCT_TOTAL: 
PCT_RPT: 
H_MEAN: *
A_MEAN: 99,600
MEAN_PRSE: 2.5
H_PCT10: *
H_PCT25: *
H_MEDIAN: *
H_PCT75: *
H_PCT90: *
A_PCT10: 72,520
A_PCT25: 82,210
A_MEDIAN: 100,140
A_PCT75: 116,530
A_PCT90: 130,410
ANNUAL: True
HOURLY: 
SOC_Code: 119032","What is the mean salary for education administrators, kindergarten through secondary?
","The mean salary for education administrators, kindergarten through secondary is 99,600.",../data/final_p2.csv
53,": 572215
UnitID: 238458
institution name: Carroll University
year: 2023
CIP2020Title: Spanish Language Teacher Education.
CIP_Code: 131330
SOC2018Title: Education Teachers, Postsecondary
SOC_Code: 251081
CIPDefinition: A program that prepares individuals to teach Spanish language programs at various educational levels.
CrossReferences: 
Institution Name: Carroll University
Books and supplies 2023-24 (IC2023_AY): 1324.0
On campus  food and housing 2023-24 (IC2023_AY): 13340.0
Off campus (not with family)  food and housing 2023-24 (IC2023_AY): 8270.0
Off campus (not with family)  other expenses 2023-24 (IC2023_AY): 5802.0
Off campus (with family)  other expenses 2023-24 (IC2023_AY): 4462.0
On campus  food and housing 2020-21 (IC2023_AY): 10550.0
Published out-of-state tuition and fees 2023-24 (IC2023_AY): 37230.0
Published in-district tuition and fees 2023-24 (IC2023_AY): 37230.0
Published in-state tuition and fees 2023-24 (IC2023_AY): 37230.0
Institution provide nstitutionally-controlled housing (on-campus and/or off-campus) (IC2023): 1.0
Typical housing charges for an academic year (IC2023): 
Typical food charge for academic year (IC2023): 
Undergraduate application fee (IC2023): 0.0
Graduate application fee (IC2023): 0.0
Any alternative tuition plans offered by institution (IC2023): 1.0
Tuition payment plan (IC2023): 1.0
Average amount of federal  state  local or institutional grant aid awarded (SFA2122): 23933.0
Average amount of federal grant aid awarded to full-time first-time undergraduates (SFA2122): 2397.0
Average amount of Pell grant aid awarded to full-time first-time undergraduates (SFA2122): 4144.0
Average amount of other federal grant aid awarded to full-time first-time undergraduates (SFA2122): 1293.0
Average amount of state/local grant aid awarded to full-time first-time undergraduates (SFA2122): 3346.0
Average amount of institutional grant aid awarded to full-time first-time undergraduates (SFA2122): 20557.0
Average amount of student loans awarded to full-time first-time undergraduates (SFA2122): 8419.0
Average amount of other student loans awarded to full-time first-time undergraduates (SFA2122): 13964.0
Average amount of federal  state  local  institutional or other sources of grant aid awarded to undergraduate students (SFA2122): 21275.0
Average amount Pell grant aid awarded to undergraduate students (SFA2122): 4236.0
Average amount of federal student loans awarded to undergraduate students (SFA2122): 6463.0
Average amount of federal  state  local  institutional or other sources of grant aid awarded to degree/certificate-seeking undergraduate students (SFA2122): 21490.0
Average amount of federal  state  local  institutional or other sources of grant aid awarded to non-degree/non-certificate-seeking undergraduates (SFA2122): 7653.0
Average net price-students awarded grant or scholarship aid  2021-22 (SFA2122): 25485.0
Average net price (income 0-30 000)-students awarded Title IV federal financial aid  2021-22 (SFA2122): 20265.0
Average net price (income 30 001-48 000)-students awarded Title IV federal financial aid  2021-22 (SFA2122): 23150.0
Average net price (income 48 001-75 000)-students awarded Title IV federal financial aid  2021-22 (SFA2122): 22797.0
Average net price (income 75 001-110 000)-students awarded Title IV federal financial aid  2021-22 (SFA2122): 24898.0
Average net price (income over 110 000)-students awarded Title IV federal financial aid  2021-22 (SFA2122): 27490.0
Books and supplies 2022-23 (IC2022_AY): 1210.0
On campus  room and board 2022-23 (IC2022_AY): 11564.0
Off campus (not with family)  room and board 2022-23 (IC2022_AY): 7552.0
Off campus (not with family)  other expenses 2022-23 (IC2022_AY): 5298.0
Off campus (with family)  other expenses 2022-23 (IC2022_AY): 4074.0
On campus  room and board 2019-20 (IC2022_AY): 10058.0
Published out-of-state tuition and fees 2022-23 (IC2022_AY): 36190.0
Published in-district tuition and fees 2022-23 (IC2022_AY): 36190.0
Published in-state tuition and fees 2022-23 (IC2022_AY): 36190.0
Institution provide on-campus housing (IC2022): 1.0
Typical room charge for academic year (IC2022): 
Typical board charge for academic year (IC2022): 
Undergraduate application fee (IC2022): 0.0
Graduate application fee (IC2022): 0.0
Any alternative tuition plans offered by institution (IC2022_RV): 1.0
Tuition payment plan (IC2022_RV): 1.0
Average amount of federal  state  local or institutional grant aid awarded (SFA2021_RV): 22168.0
Average amount of federal grant aid awarded to full-time first-time undergraduates (SFA2021_RV): 5383.0
Average amount of Pell grant aid awarded to full-time first-time undergraduates (SFA2021_RV): 4352.0
Average amount of other federal grant aid awarded to full-time first-time undergraduates (SFA2021_RV): 1114.0
Average amount of state/local grant aid awarded to full-time first-time undergraduates (SFA2021_RV): 3336.0
Average amount of institutional grant aid awarded to full-time first-time undergraduates (SFA2021_RV): 19707.0
Average amount of student loans awarded to full-time first-time undergraduates (SFA2021_RV): 8067.0
Average amount of other student loans awarded to full-time first-time undergraduates (SFA2021_RV): 14318.0
Average amount of federal  state  local  institutional or other sources of grant aid awarded to undergraduate students (SFA2021_RV): 20387.0
Average amount Pell grant aid awarded to undergraduate students (SFA2021_RV): 4314.0
Average amount of federal student loans awarded to undergraduate students (SFA2021_RV): 6487.0
Average net price-students awarded grant or scholarship aid  2020-21 (SFA2021_RV): 24050.0
Average net price (income 0-30 000)-students awarded Title IV federal financial aid  2020-21 (SFA2021_RV): 19805.0
Average net price (income 30 001-48 000)-students awarded Title IV federal financial aid  2020-21 (SFA2021_RV): 18890.0
Average net price (income 48 001-75 000)-students awarded Title IV federal financial aid  2020-21 (SFA2021_RV): 21839.0
Average net price (income 75 001-110 000)-students awarded Title IV federal financial aid  2020-21 (SFA2021_RV): 24476.0
Average net price (income over 110 000)-students awarded Title IV federal financial aid  2020-21 (SFA2021_RV): 26388.0
Books and supplies 2021-22 (IC2021_AY): 1144.0
On campus  room and board 2021-22 (IC2021_AY): 11690.0
Off campus (not with family)  room and board 2021-22 (IC2021_AY): 7138.0
Off campus (not with family)  other expenses 2021-22 (IC2021_AY): 5076.0
Off campus (with family)  other expenses 2021-22 (IC2021_AY): 3918.0
On campus  room and board 2018-19 (IC2021_AY): 9896.0
Published out-of-state tuition and fees 2021-22 (IC2021_AY): 35140.0
Published in-district tuition and fees 2021-22 (IC2021_AY): 35140.0
Published in-state tuition and fees 2021-22 (IC2021_AY): 35140.0
Institution provide on-campus housing (IC2021): 1.0
Typical room charge for academic year (IC2021): 
Typical board charge for academic year (IC2021): 
Undergraduate application fee (IC2021): 0.0
Graduate application fee (IC2021): 0.0
Any alternative tuition plans offered by institution (IC2021): 1.0
Tuition payment plan (IC2021_RV): 1.0
Books and supplies 2020-21 (IC2020_AY): 1140.0
On campus  room and board 2020-21 (IC2020_AY): 10550.0
Off campus (not with family)  room and board 2020-21 (IC2020_AY): 7110.0
Off campus (not with family)  other expenses 2020-21 (IC2020_AY): 5056.0
Off campus (with family)  other expenses 2020-21 (IC2020_AY): 3902.0
On campus  room and board 2017-18 (IC2020_AY): 9494.0
Published out-of-state tuition and fees 2020-21 (IC2020_AY): 34010.0
Published in-district tuition and fees 2020-21 (IC2020_AY): 34010.0
Published in-state tuition and fees 2020-21 (IC2020_AY): 34010.0
Institution provide on-campus housing (IC2020): 1.0
Typical room charge for academic year (IC2020): 
Typical board charge for academic year (IC2020): 
Undergraduate application fee (IC2020): 0.0
Graduate application fee (IC2020): 0.0
Any alternative tuition plans offered by institution (IC2020_RV): 1.0
Tuition payment plan (IC2020_RV): 1.0","What is the published out-of-state tuition and fees for the academic year 2023-24 at Carroll University?
",The published out-of-state tuition and fees for the academic year 2023-24 at Carroll University is 36190.0.,../data/final_p1.csv
54,": 369279
AREA: 5000002
AREA_TITLE: Northern Vermont nonmetropolitan area
AREA_TYPE: 6
PRIM_STATE: VT
NAICS: 0
NAICS_TITLE: Cross-industry
I_GROUP: cross-industry
OWN_CODE: 1235
OCC_CODE: 13-1082
OCC_TITLE: Project Management Specialists
O_GROUP: detailed
TOT_EMP: 120
EMP_PRSE: 9.1
JOBS_1000: 1.705
LOC_QUOTIENT: 0.27
PCT_TOTAL: 
PCT_RPT: 
H_MEAN: 36.15
A_MEAN: 75,190
MEAN_PRSE: 3.3
H_PCT10: 24.50
H_PCT25: 30.00
H_MEDIAN: 33.50
H_PCT75: 41.13
H_PCT90: 47.68
A_PCT10: 50,960
A_PCT25: 62,400
A_MEDIAN: 69,670
A_PCT75: 85,540
A_PCT90: 99,170
ANNUAL: 
HOURLY: 
SOC_Code: 131082","What is the mean hourly wage of project management specialists in the Northern Vermont nonmetropolitan area?
",The mean hourly wage of project management specialists in the Northern Vermont nonmetropolitan area is 36.15 dollars.,../data/final_p2.csv
55,": 95689
AREA: 99
AREA_TITLE: U.S.
AREA_TYPE: 1
PRIM_STATE: US
NAICS: 541330
NAICS_TITLE: Engineering Services
I_GROUP: 5-digit
OWN_CODE: 5
OCC_CODE: 11-1021
OCC_TITLE: General and Operations Managers
O_GROUP: detailed
TOT_EMP: 34,290
EMP_PRSE: 3.3
JOBS_1000: 
LOC_QUOTIENT: 
PCT_TOTAL: 3.02
PCT_RPT: 27
H_MEAN: 83.54
A_MEAN: 173,750
MEAN_PRSE: 1.0
H_PCT10: 37.82
H_PCT25: 59.50
H_MEDIAN: 78.67
H_PCT75: 101.75
H_PCT90: #
A_PCT10: 78,670
A_PCT25: 123,770
A_MEDIAN: 163,620
A_PCT75: 211,630
A_PCT90: #
ANNUAL: 
HOURLY: 
SOC_Code: 111021","What is the mean hourly wage for general and operations managers in the U.S. engineering services industry in the U.S.?
","The mean hourly wage for general and operations managers in the U.S. engineering services industry is $173,750.",../data/final_p2.csv
56,": 354454
UnitID: 195128
institution name: Russell Sage College
year: 2023
CIP2020Title: Drama and Dramatics/Theatre Arts, General.
CIP_Code: 500501
SOC2018Title: Producers and Directors
SOC_Code: 272012
CIPDefinition: A program that focuses on the general study of dramatic works and their performance.  Includes instruction in major works of dramatic literature, dramatic styles and types, and the principles of organizing and producing full live or filmed productions.
CrossReferences: 
Institution Name: Russell Sage College
Books and supplies 2023-24 (IC2023_AY): 1200.0
On campus  food and housing 2023-24 (IC2023_AY): 13791.0
Off campus (not with family)  food and housing 2023-24 (IC2023_AY): 15161.0
Off campus (not with family)  other expenses 2023-24 (IC2023_AY): 3325.0
Off campus (with family)  other expenses 2023-24 (IC2023_AY): 3325.0
On campus  food and housing 2020-21 (IC2023_AY): 13070.0
Published out-of-state tuition and fees 2023-24 (IC2023_AY): 36756.0
Published in-district tuition and fees 2023-24 (IC2023_AY): 36756.0
Published in-state tuition and fees 2023-24 (IC2023_AY): 36756.0
Institution provide nstitutionally-controlled housing (on-campus and/or off-campus) (IC2023): 1.0
Typical housing charges for an academic year (IC2023): 6430.0
Typical food charge for academic year (IC2023): 7361.0
Undergraduate application fee (IC2023): 0.0
Graduate application fee (IC2023): 0.0
Any alternative tuition plans offered by institution (IC2023): 1.0
Tuition payment plan (IC2023): 1.0
Average amount of federal  state  local or institutional grant aid awarded (SFA2122): 27982.0
Average amount of federal grant aid awarded to full-time first-time undergraduates (SFA2122): 4682.0
Average amount of Pell grant aid awarded to full-time first-time undergraduates (SFA2122): 5083.0
Average amount of other federal grant aid awarded to full-time first-time undergraduates (SFA2122): 2033.0
Average amount of state/local grant aid awarded to full-time first-time undergraduates (SFA2122): 4982.0
Average amount of institutional grant aid awarded to full-time first-time undergraduates (SFA2122): 20647.0
Average amount of student loans awarded to full-time first-time undergraduates (SFA2122): 7268.0
Average amount of other student loans awarded to full-time first-time undergraduates (SFA2122): 16472.0
Average amount of federal  state  local  institutional or other sources of grant aid awarded to undergraduate students (SFA2122): 24045.0
Average amount Pell grant aid awarded to undergraduate students (SFA2122): 4977.0
Average amount of federal student loans awarded to undergraduate students (SFA2122): 6564.0
Average amount of federal  state  local  institutional or other sources of grant aid awarded to degree/certificate-seeking undergraduate students (SFA2122): 24045.0
Average amount of federal  state  local  institutional or other sources of grant aid awarded to non-degree/non-certificate-seeking undergraduates (SFA2122): 
Average net price-students awarded grant or scholarship aid  2021-22 (SFA2122): 22456.0
Average net price (income 0-30 000)-students awarded Title IV federal financial aid  2021-22 (SFA2122): 15830.0
Average net price (income 30 001-48 000)-students awarded Title IV federal financial aid  2021-22 (SFA2122): 15809.0
Average net price (income 48 001-75 000)-students awarded Title IV federal financial aid  2021-22 (SFA2122): 23950.0
Average net price (income 75 001-110 000)-students awarded Title IV federal financial aid  2021-22 (SFA2122): 28090.0
Average net price (income over 110 000)-students awarded Title IV federal financial aid  2021-22 (SFA2122): 28131.0
Books and supplies 2022-23 (IC2022_AY): 1200.0
On campus  room and board 2022-23 (IC2022_AY): 13543.0
Off campus (not with family)  room and board 2022-23 (IC2022_AY): 8200.0
Off campus (not with family)  other expenses 2022-23 (IC2022_AY): 4960.0
Off campus (with family)  other expenses 2022-23 (IC2022_AY): 8600.0
On campus  room and board 2019-20 (IC2022_AY): 12835.0
Published out-of-state tuition and fees 2022-23 (IC2022_AY): 35351.0
Published in-district tuition and fees 2022-23 (IC2022_AY): 35351.0
Published in-state tuition and fees 2022-23 (IC2022_AY): 35351.0
Institution provide on-campus housing (IC2022): 1.0
Typical room charge for academic year (IC2022): 6430.0
Typical board charge for academic year (IC2022): 7113.0
Undergraduate application fee (IC2022): 0.0
Graduate application fee (IC2022): 30.0
Any alternative tuition plans offered by institution (IC2022_RV): 1.0
Tuition payment plan (IC2022_RV): 1.0
Average amount of federal  state  local or institutional grant aid awarded (SFA2021_RV): 25711.0
Average amount of federal grant aid awarded to full-time first-time undergraduates (SFA2021_RV): 3750.0
Average amount of Pell grant aid awarded to full-time first-time undergraduates (SFA2021_RV): 4850.0
Average amount of other federal grant aid awarded to full-time first-time undergraduates (SFA2021_RV): 923.0
Average amount of state/local grant aid awarded to full-time first-time undergraduates (SFA2021_RV): 3748.0
Average amount of institutional grant aid awarded to full-time first-time undergraduates (SFA2021_RV): 20274.0
Average amount of student loans awarded to full-time first-time undergraduates (SFA2021_RV): 7077.0
Average amount of other student loans awarded to full-time first-time undergraduates (SFA2021_RV): 14586.0
Average amount of federal  state  local  institutional or other sources of grant aid awarded to undergraduate students (SFA2021_RV): 22912.0
Average amount Pell grant aid awarded to undergraduate students (SFA2021_RV): 4755.0
Average amount of federal student loans awarded to undergraduate students (SFA2021_RV): 6773.0
Average net price-students awarded grant or scholarship aid  2020-21 (SFA2021_RV): 22713.0
Average net price (income 0-30 000)-students awarded Title IV federal financial aid  2020-21 (SFA2021_RV): 16393.0
Average net price (income 30 001-48 000)-students awarded Title IV federal financial aid  2020-21 (SFA2021_RV): 15667.0
Average net price (income 48 001-75 000)-students awarded Title IV federal financial aid  2020-21 (SFA2021_RV): 23088.0
Average net price (income 75 001-110 000)-students awarded Title IV federal financial aid  2020-21 (SFA2021_RV): 27384.0
Average net price (income over 110 000)-students awarded Title IV federal financial aid  2020-21 (SFA2021_RV): 27908.0
Books and supplies 2021-22 (IC2021_AY): 1200.0
On campus  room and board 2021-22 (IC2021_AY): 13302.0
Off campus (not with family)  room and board 2021-22 (IC2021_AY): 8200.0
Off campus (not with family)  other expenses 2021-22 (IC2021_AY): 4960.0
Off campus (with family)  other expenses 2021-22 (IC2021_AY): 8600.0
On campus  room and board 2018-19 (IC2021_AY): 12618.0
Published out-of-state tuition and fees 2021-22 (IC2021_AY): 33894.0
Published in-district tuition and fees 2021-22 (IC2021_AY): 33894.0
Published in-state tuition and fees 2021-22 (IC2021_AY): 33894.0
Institution provide on-campus housing (IC2021): 1.0
Typical room charge for academic year (IC2021): 6430.0
Typical board charge for academic year (IC2021): 6872.0
Undergraduate application fee (IC2021): 0.0
Graduate application fee (IC2021): 40.0
Any alternative tuition plans offered by institution (IC2021): 1.0
Tuition payment plan (IC2021_RV): 1.0
Books and supplies 2020-21 (IC2020_AY): 1200.0
On campus  room and board 2020-21 (IC2020_AY): 13070.0
Off campus (not with family)  room and board 2020-21 (IC2020_AY): 8200.0
Off campus (not with family)  other expenses 2020-21 (IC2020_AY): 4960.0
Off campus (with family)  other expenses 2020-21 (IC2020_AY): 8600.0
On campus  room and board 2017-18 (IC2020_AY): 12408.0
Published out-of-state tuition and fees 2020-21 (IC2020_AY): 32950.0
Published in-district tuition and fees 2020-21 (IC2020_AY): 32950.0
Published in-state tuition and fees 2020-21 (IC2020_AY): 32950.0
Institution provide on-campus housing (IC2020): 1.0
Typical room charge for academic year (IC2020): 6800.0
Typical board charge for academic year (IC2020): 6640.0
Undergraduate application fee (IC2020): 0.0
Graduate application fee (IC2020): 30.0
Any alternative tuition plans offered by institution (IC2020_RV): 1.0
Tuition payment plan (IC2020_RV): 1.0","What is the typical board charge for an academic year at Russell Sage College?
",The typical board charge for an academic year at Russell Sage College is 7113 dollars.,../data/final_p1.csv
57,": 399118
UnitID: 201928
institution name: Cincinnati State Technical and Community College
year: 2023
CIP2020Title: Marketing/Marketing Management, General.
CIP_Code: 521401
SOC2018Title: Advertising and Promotions Managers
SOC_Code: 112011
CIPDefinition: A program that generally prepares individuals to undertake and manage the process of developing consumer audiences and moving products from producers to consumers.  Includes instruction in buyer behavior and dynamics, principle of marketing research, demand analysis, cost-volume and profit relationships, pricing theory, marketing campaign and strategic planning, market segments, advertising methods, sales operations and management, consumer relations, retailing, and applications to specific products and markets.
CrossReferences: 
Institution Name: Cincinnati State Technical and Community College
Books and supplies 2023-24 (IC2023_AY): 2169.0
On campus  food and housing 2023-24 (IC2023_AY): 
Off campus (not with family)  food and housing 2023-24 (IC2023_AY): 5130.0
Off campus (not with family)  other expenses 2023-24 (IC2023_AY): 2808.0
Off campus (with family)  other expenses 2023-24 (IC2023_AY): 2808.0
On campus  food and housing 2020-21 (IC2023_AY): 
Published out-of-state tuition and fees 2023-24 (IC2023_AY): 9801.0
Published in-district tuition and fees 2023-24 (IC2023_AY): 5400.0
Published in-state tuition and fees 2023-24 (IC2023_AY): 5400.0
Institution provide nstitutionally-controlled housing (on-campus and/or off-campus) (IC2023): 2.0
Typical housing charges for an academic year (IC2023): 
Typical food charge for academic year (IC2023): 
Undergraduate application fee (IC2023): 15.0
Graduate application fee (IC2023): 
Any alternative tuition plans offered by institution (IC2023): 1.0
Tuition payment plan (IC2023): 1.0
Average amount of federal  state  local or institutional grant aid awarded (SFA2122): 5564.0
Average amount of federal grant aid awarded to full-time first-time undergraduates (SFA2122): 4742.0
Average amount of Pell grant aid awarded to full-time first-time undergraduates (SFA2122): 6453.0
Average amount of other federal grant aid awarded to full-time first-time undergraduates (SFA2122): 1177.0
Average amount of state/local grant aid awarded to full-time first-time undergraduates (SFA2122): 2500.0
Average amount of institutional grant aid awarded to full-time first-time undergraduates (SFA2122): 2555.0
Average amount of student loans awarded to full-time first-time undergraduates (SFA2122): 6174.0
Average amount of other student loans awarded to full-time first-time undergraduates (SFA2122): 6045.0
Average amount of federal  state  local  institutional or other sources of grant aid awarded to undergraduate students (SFA2122): 4388.0
Average amount Pell grant aid awarded to undergraduate students (SFA2122): 6164.0
Average amount of federal student loans awarded to undergraduate students (SFA2122): 7027.0
Average amount of federal  state  local  institutional or other sources of grant aid awarded to degree/certificate-seeking undergraduate students (SFA2122): 4419.0
Average amount of federal  state  local  institutional or other sources of grant aid awarded to non-degree/non-certificate-seeking undergraduates (SFA2122): 2667.0
Average net price-students awarded grant or scholarship aid  2021-22 (SFA2122): 
Average net price (income 0-30 000)-students awarded Title IV federal financial aid  2021-22 (SFA2122): 
Average net price (income 30 001-48 000)-students awarded Title IV federal financial aid  2021-22 (SFA2122): 
Average net price (income 48 001-75 000)-students awarded Title IV federal financial aid  2021-22 (SFA2122): 
Average net price (income 75 001-110 000)-students awarded Title IV federal financial aid  2021-22 (SFA2122): 
Average net price (income over 110 000)-students awarded Title IV federal financial aid  2021-22 (SFA2122): 
Books and supplies 2022-23 (IC2022_AY): 3843.0
On campus  room and board 2022-23 (IC2022_AY): 
Off campus (not with family)  room and board 2022-23 (IC2022_AY): 5130.0
Off campus (not with family)  other expenses 2022-23 (IC2022_AY): 2997.0
Off campus (with family)  other expenses 2022-23 (IC2022_AY): 2997.0
On campus  room and board 2019-20 (IC2022_AY): 
Published out-of-state tuition and fees 2022-23 (IC2022_AY): 9558.0
Published in-district tuition and fees 2022-23 (IC2022_AY): 5274.0
Published in-state tuition and fees 2022-23 (IC2022_AY): 5274.0
Institution provide on-campus housing (IC2022): 2.0
Typical room charge for academic year (IC2022): 
Typical board charge for academic year (IC2022): 
Undergraduate application fee (IC2022): 15.0
Graduate application fee (IC2022): 
Any alternative tuition plans offered by institution (IC2022_RV): 1.0
Tuition payment plan (IC2022_RV): 1.0
Average amount of federal  state  local or institutional grant aid awarded (SFA2021_RV): 6869.0
Average amount of federal grant aid awarded to full-time first-time undergraduates (SFA2021_RV): 6541.0
Average amount of Pell grant aid awarded to full-time first-time undergraduates (SFA2021_RV): 6102.0
Average amount of other federal grant aid awarded to full-time first-time undergraduates (SFA2021_RV): 1906.0
Average amount of state/local grant aid awarded to full-time first-time undergraduates (SFA2021_RV): 970.0
Average amount of institutional grant aid awarded to full-time first-time undergraduates (SFA2021_RV): 2375.0
Average amount of student loans awarded to full-time first-time undergraduates (SFA2021_RV): 4798.0
Average amount of other student loans awarded to full-time first-time undergraduates (SFA2021_RV): 7197.0
Average amount of federal  state  local  institutional or other sources of grant aid awarded to undergraduate students (SFA2021_RV): 6174.0
Average amount Pell grant aid awarded to undergraduate students (SFA2021_RV): 6168.0
Average amount of federal student loans awarded to undergraduate students (SFA2021_RV): 6361.0
Average net price-students awarded grant or scholarship aid  2020-21 (SFA2021_RV): 
Average net price (income 0-30 000)-students awarded Title IV federal financial aid  2020-21 (SFA2021_RV): 
Average net price (income 30 001-48 000)-students awarded Title IV federal financial aid  2020-21 (SFA2021_RV): 
Average net price (income 48 001-75 000)-students awarded Title IV federal financial aid  2020-21 (SFA2021_RV): 
Average net price (income 75 001-110 000)-students awarded Title IV federal financial aid  2020-21 (SFA2021_RV): 
Average net price (income over 110 000)-students awarded Title IV federal financial aid  2020-21 (SFA2021_RV): 
Books and supplies 2021-22 (IC2021_AY): 3843.0
On campus  room and board 2021-22 (IC2021_AY): 
Off campus (not with family)  room and board 2021-22 (IC2021_AY): 5130.0
Off campus (not with family)  other expenses 2021-22 (IC2021_AY): 2997.0
Off campus (with family)  other expenses 2021-22 (IC2021_AY): 2997.0
On campus  room and board 2018-19 (IC2021_AY): 
Published out-of-state tuition and fees 2021-22 (IC2021_AY): 9090.0
Published in-district tuition and fees 2021-22 (IC2021_AY): 5040.0
Published in-state tuition and fees 2021-22 (IC2021_AY): 5040.0
Institution provide on-campus housing (IC2021): 2.0
Typical room charge for academic year (IC2021): 
Typical board charge for academic year (IC2021): 
Undergraduate application fee (IC2021): 15.0
Graduate application fee (IC2021): 
Any alternative tuition plans offered by institution (IC2021): 1.0
Tuition payment plan (IC2021_RV): 1.0
Books and supplies 2020-21 (IC2020_AY): 3843.0
On campus  room and board 2020-21 (IC2020_AY): 
Off campus (not with family)  room and board 2020-21 (IC2020_AY): 5130.0
Off campus (not with family)  other expenses 2020-21 (IC2020_AY): 2997.0
Off campus (with family)  other expenses 2020-21 (IC2020_AY): 2997.0
On campus  room and board 2017-18 (IC2020_AY): 
Published out-of-state tuition and fees 2020-21 (IC2020_AY): 9090.0
Published in-district tuition and fees 2020-21 (IC2020_AY): 5040.0
Published in-state tuition and fees 2020-21 (IC2020_AY): 5040.0
Institution provide on-campus housing (IC2020): 2.0
Typical room charge for academic year (IC2020): 
Typical board charge for academic year (IC2020): 
Undergraduate application fee (IC2020): 15.0
Graduate application fee (IC2020): 
Any alternative tuition plans offered by institution (IC2020_RV): 1.0
Tuition payment plan (IC2020_RV): 1.0","What is the typical room charge for an academic year 2023 at Cincinnati State Technical and Community College?
",The typical room charge for an academic year 2023 at Cincinnati State Technical and Community College is 5130.0.,../data/final_p1.csv
58,": 397135
AREA: 5400002
AREA_TITLE: Northern West Virginia nonmetropolitan area
AREA_TYPE: 6
PRIM_STATE: WV
NAICS: 0
NAICS_TITLE: Cross-industry
I_GROUP: cross-industry
OWN_CODE: 1235
OCC_CODE: 43-4081
OCC_TITLE: Hotel, Motel, and Resort Desk Clerks
O_GROUP: detailed
TOT_EMP: 420
EMP_PRSE: 6.0
JOBS_1000: 3.132
LOC_QUOTIENT: 1.80
PCT_TOTAL: 
PCT_RPT: 
H_MEAN: 12.06
A_MEAN: 25,090
MEAN_PRSE: 1.3
H_PCT10: 9.04
H_PCT25: 10.40
H_MEDIAN: 10.78
H_PCT75: 13.27
H_PCT90: 14.07
A_PCT10: 18,790
A_PCT25: 21,630
A_MEDIAN: 22,420
A_PCT75: 27,590
A_PCT90: 29,260
ANNUAL: 
HOURLY: 
SOC_Code: 434081","What is the mean number of employees in the cross-industry detailed group in the Northern West Virginia nonmetropolitan area?
",The mean number of employees in the cross-industry detailed group in the Northern West Virginia nonmetropolitan area is 12.06.,../data/final_p2.csv
59,": 34188
AREA: 99
AREA_TITLE: U.S.
AREA_TYPE: 1
PRIM_STATE: US
NAICS: 312000
NAICS_TITLE: Beverage and Tobacco Product Manufacturing
I_GROUP: 3-digit
OWN_CODE: 5
OCC_CODE: 43-5061
OCC_TITLE: Production, Planning, and Expediting Clerks
O_GROUP: detailed
TOT_EMP: 1,390
EMP_PRSE: 5.7
JOBS_1000: 
LOC_QUOTIENT: 
PCT_TOTAL: 0.42
PCT_RPT: 4
H_MEAN: 28.55
A_MEAN: 59,390
MEAN_PRSE: 1.7
H_PCT10: 19.30
H_PCT25: 22.63
H_MEDIAN: 27.57
H_PCT75: 33.49
H_PCT90: 39.41
A_PCT10: 40,150
A_PCT25: 47,070
A_MEDIAN: 57,340
A_PCT75: 69,660
A_PCT90: 81,980
ANNUAL: 
HOURLY: 
SOC_Code: 435061","What is the mean hourly wage of production, planning, and expediting clerks in the beverage and tobacco product manufacturing industry in the US?
","The mean hourly wage of production, planning, and expediting clerks in the beverage and tobacco product manufacturing industry in the US is $28.55.",../data/final_p2.csv
60,": 585712
UnitID: 240727
institution name: University of Wyoming
year: 2023
CIP2020Title: Education/Teaching of Individuals in Elementary Special Education Programs.
CIP_Code: 131017
SOC2018Title: Education Teachers, Postsecondary
SOC_Code: 251081
CIPDefinition: A program that focuses on the design and provision of teaching and other educational services to children with special learning needs or disabilities who are in the elementary grades. Includes instruction in diagnosing learning disabilities; developing individual education plans; curriculum development, instructional strategies, and classroom management for elementary special education; and teaching elementary education subject matter.
CrossReferences: 
Institution Name: University of Wyoming
Books and supplies 2023-24 (IC2023_AY): 1670.0
On campus  food and housing 2023-24 (IC2023_AY): 13340.0
Off campus (not with family)  food and housing 2023-24 (IC2023_AY): 9140.0
Off campus (not with family)  other expenses 2023-24 (IC2023_AY): 4480.0
Off campus (with family)  other expenses 2023-24 (IC2023_AY): 4480.0
On campus  food and housing 2020-21 (IC2023_AY): 10615.0
Published out-of-state tuition and fees 2023-24 (IC2023_AY): 22718.0
Published in-district tuition and fees 2023-24 (IC2023_AY): 6938.0
Published in-state tuition and fees 2023-24 (IC2023_AY): 6938.0
Institution provide nstitutionally-controlled housing (on-campus and/or off-campus) (IC2023): 1.0
Typical housing charges for an academic year (IC2023): 5740.0
Typical food charge for academic year (IC2023): 7600.0
Undergraduate application fee (IC2023): 40.0
Graduate application fee (IC2023): 50.0
Any alternative tuition plans offered by institution (IC2023): 1.0
Tuition payment plan (IC2023): 1.0
Average amount of federal  state  local or institutional grant aid awarded (SFA2122): 8942.0
Average amount of federal grant aid awarded to full-time first-time undergraduates (SFA2122): 3019.0
Average amount of Pell grant aid awarded to full-time first-time undergraduates (SFA2122): 4613.0
Average amount of other federal grant aid awarded to full-time first-time undergraduates (SFA2122): 1370.0
Average amount of state/local grant aid awarded to full-time first-time undergraduates (SFA2122): 5020.0
Average amount of institutional grant aid awarded to full-time first-time undergraduates (SFA2122): 4556.0
Average amount of student loans awarded to full-time first-time undergraduates (SFA2122): 8184.0
Average amount of other student loans awarded to full-time first-time undergraduates (SFA2122): 17586.0
Average amount of federal  state  local  institutional or other sources of grant aid awarded to undergraduate students (SFA2122): 8328.0
Average amount Pell grant aid awarded to undergraduate students (SFA2122): 4672.0
Average amount of federal student loans awarded to undergraduate students (SFA2122): 6222.0
Average amount of federal  state  local  institutional or other sources of grant aid awarded to degree/certificate-seeking undergraduate students (SFA2122): 8390.0
Average amount of federal  state  local  institutional or other sources of grant aid awarded to non-degree/non-certificate-seeking undergraduates (SFA2122): 1145.0
Average net price-students awarded grant or scholarship aid  2021-22 (SFA2122): 
Average net price (income 0-30 000)-students awarded Title IV federal financial aid  2021-22 (SFA2122): 
Average net price (income 30 001-48 000)-students awarded Title IV federal financial aid  2021-22 (SFA2122): 
Average net price (income 48 001-75 000)-students awarded Title IV federal financial aid  2021-22 (SFA2122): 
Average net price (income 75 001-110 000)-students awarded Title IV federal financial aid  2021-22 (SFA2122): 
Average net price (income over 110 000)-students awarded Title IV federal financial aid  2021-22 (SFA2122): 
Books and supplies 2022-23 (IC2022_AY): 1400.0
On campus  room and board 2022-23 (IC2022_AY): 11610.0
Off campus (not with family)  room and board 2022-23 (IC2022_AY): 11610.0
Off campus (not with family)  other expenses 2022-23 (IC2022_AY): 3184.0
Off campus (with family)  other expenses 2022-23 (IC2022_AY): 2764.0
On campus  room and board 2019-20 (IC2022_AY): 10437.0
Published out-of-state tuition and fees 2022-23 (IC2022_AY): 21771.0
Published in-district tuition and fees 2022-23 (IC2022_AY): 6621.0
Published in-state tuition and fees 2022-23 (IC2022_AY): 6621.0
Institution provide on-campus housing (IC2022): 1.0
Typical room charge for academic year (IC2022): 4990.0
Typical board charge for academic year (IC2022): 6620.0
Undergraduate application fee (IC2022): 40.0
Graduate application fee (IC2022): 50.0
Any alternative tuition plans offered by institution (IC2022_RV): 1.0
Tuition payment plan (IC2022_RV): 1.0
Average amount of federal  state  local or institutional grant aid awarded (SFA2021_RV): 10164.0
Average amount of federal grant aid awarded to full-time first-time undergraduates (SFA2021_RV): 2705.0
Average amount of Pell grant aid awarded to full-time first-time undergraduates (SFA2021_RV): 4496.0
Average amount of other federal grant aid awarded to full-time first-time undergraduates (SFA2021_RV): 888.0
Average amount of state/local grant aid awarded to full-time first-time undergraduates (SFA2021_RV): 5906.0
Average amount of institutional grant aid awarded to full-time first-time undergraduates (SFA2021_RV): 4484.0
Average amount of student loans awarded to full-time first-time undergraduates (SFA2021_RV): 7096.0
Average amount of other student loans awarded to full-time first-time undergraduates (SFA2021_RV): 14983.0
Average amount of federal  state  local  institutional or other sources of grant aid awarded to undergraduate students (SFA2021_RV): 9376.0
Average amount Pell grant aid awarded to undergraduate students (SFA2021_RV): 4537.0
Average amount of federal student loans awarded to undergraduate students (SFA2021_RV): 6109.0
Average net price-students awarded grant or scholarship aid  2020-21 (SFA2021_RV): 
Average net price (income 0-30 000)-students awarded Title IV federal financial aid  2020-21 (SFA2021_RV): 
Average net price (income 30 001-48 000)-students awarded Title IV federal financial aid  2020-21 (SFA2021_RV): 
Average net price (income 48 001-75 000)-students awarded Title IV federal financial aid  2020-21 (SFA2021_RV): 
Average net price (income 75 001-110 000)-students awarded Title IV federal financial aid  2020-21 (SFA2021_RV): 
Average net price (income over 110 000)-students awarded Title IV federal financial aid  2020-21 (SFA2021_RV): 
Books and supplies 2021-22 (IC2021_AY): 1200.0
On campus  room and board 2021-22 (IC2021_AY): 11144.0
Off campus (not with family)  room and board 2021-22 (IC2021_AY): 11144.0
Off campus (not with family)  other expenses 2021-22 (IC2021_AY): 3184.0
Off campus (with family)  other expenses 2021-22 (IC2021_AY): 1592.0
On campus  room and board 2018-19 (IC2021_AY): 10320.0
Published out-of-state tuition and fees 2021-22 (IC2021_AY): 20827.0
Published in-district tuition and fees 2021-22 (IC2021_AY): 6277.0
Published in-state tuition and fees 2021-22 (IC2021_AY): 6277.0
Institution provide on-campus housing (IC2021): 1.0
Typical room charge for academic year (IC2021): 4822.0
Typical board charge for academic year (IC2021): 6322.0
Undergraduate application fee (IC2021): 40.0
Graduate application fee (IC2021): 50.0
Any alternative tuition plans offered by institution (IC2021): 1.0
Tuition payment plan (IC2021_RV): 1.0
Books and supplies 2020-21 (IC2020_AY): 1200.0
On campus  room and board 2020-21 (IC2020_AY): 10615.0
Off campus (not with family)  room and board 2020-21 (IC2020_AY): 10615.0
Off campus (not with family)  other expenses 2020-21 (IC2020_AY): 3184.0
Off campus (with family)  other expenses 2020-21 (IC2020_AY): 1592.0
On campus  room and board 2017-18 (IC2020_AY): 10320.0
Published out-of-state tuition and fees 2020-21 (IC2020_AY): 19531.0
Published in-district tuition and fees 2020-21 (IC2020_AY): 5791.0
Published in-state tuition and fees 2020-21 (IC2020_AY): 5791.0
Institution provide on-campus housing (IC2020): 1.0
Typical room charge for academic year (IC2020): 4583.0
Typical board charge for academic year (IC2020): 6032.0
Undergraduate application fee (IC2020): 40.0
Graduate application fee (IC2020): 50.0
Any alternative tuition plans offered by institution (IC2020_RV): 1.0
Tuition payment plan (IC2020_RV): 1.0","What is the average net price-students awarded grant or scholarship aid at the University of Wyoming for the 2021-22 academic year for students with an income of 48 001-75 000?
",The average net price-students awarded grant or scholarship aid at the University of Wyoming for the 2021-,../data/final_p1.csv
61,": 217515
AREA: 39540
AREA_TITLE: Racine, WI
AREA_TYPE: 4
PRIM_STATE: WI
NAICS: 0
NAICS_TITLE: Cross-industry
I_GROUP: cross-industry
OWN_CODE: 1235
OCC_CODE: 11-2022
OCC_TITLE: Sales Managers
O_GROUP: detailed
TOT_EMP: 180
EMP_PRSE: 4.4
JOBS_1000: 2.450
LOC_QUOTIENT: 0.65
PCT_TOTAL: 
PCT_RPT: 
H_MEAN: 71.22
A_MEAN: 148,140
MEAN_PRSE: 2.0
H_PCT10: 32.86
H_PCT25: 48.41
H_MEDIAN: 66.36
H_PCT75: 82.38
H_PCT90: 105.83
A_PCT10: 68,350
A_PCT25: 100,690
A_MEDIAN: 138,030
A_PCT75: 171,340
A_PCT90: 220,120
ANNUAL: 
HOURLY: 
SOC_Code: 112022","What is the 75th percentile number of employees for the cross-industry detailed sales managers in the Racine, WI area?
",The ,../data/final_p2.csv
62,": 547305
UnitID: 232423
institution name: James Madison University
year: 2023
CIP2020Title: Athletic Training/Trainer.
CIP_Code: 510913
SOC2018Title: Athletic Trainers
SOC_Code: 299091
CIPDefinition: A program that prepares individuals to work in consultation with, and under the supervision of physicians to prevent and treat sports injuries and associated conditions.  Includes instruction in the identification, evaluation, and treatment of athletic injuries and illnesses; first aid and emergency care; therapeutic exercise; anatomy and physiology; exercise physiology; kinesiology and biomechanics; nutrition; sports psychology; personal and community health; knowledge of various sports and their biomechanical and physiological demands; and applicable professional standards and regulations.
CrossReferences: 26.0908 - Exercise Physiology and Kinesiology., 31.0505 - Exercise Science and Kinesiology., 31.0507 - Physical Fitness Technician.
Institution Name: James Madison University
Books and supplies 2023-24 (IC2023_AY): 1254.0
On campus  food and housing 2023-24 (IC2023_AY): 12584.0
Off campus (not with family)  food and housing 2023-24 (IC2023_AY): 12584.0
Off campus (not with family)  other expenses 2023-24 (IC2023_AY): 4560.0
Off campus (with family)  other expenses 2023-24 (IC2023_AY): 4560.0
On campus  food and housing 2020-21 (IC2023_AY): 11348.0
Published out-of-state tuition and fees 2023-24 (IC2023_AY): 30790.0
Published in-district tuition and fees 2023-24 (IC2023_AY): 13576.0
Published in-state tuition and fees 2023-24 (IC2023_AY): 13576.0
Institution provide nstitutionally-controlled housing (on-campus and/or off-campus) (IC2023): 1.0
Typical housing charges for an academic year (IC2023): 6010.0
Typical food charge for academic year (IC2023): 6494.0
Undergraduate application fee (IC2023): 70.0
Graduate application fee (IC2023): 60.0
Any alternative tuition plans offered by institution (IC2023): 1.0
Tuition payment plan (IC2023): 1.0
Average amount of federal  state  local or institutional grant aid awarded (SFA2122): 10081.0
Average amount of federal grant aid awarded to full-time first-time undergraduates (SFA2122): 4944.0
Average amount of Pell grant aid awarded to full-time first-time undergraduates (SFA2122): 4680.0
Average amount of other federal grant aid awarded to full-time first-time undergraduates (SFA2122): 1037.0
Average amount of state/local grant aid awarded to full-time first-time undergraduates (SFA2122): 4823.0
Average amount of institutional grant aid awarded to full-time first-time undergraduates (SFA2122): 7579.0
Average amount of student loans awarded to full-time first-time undergraduates (SFA2122): 9063.0
Average amount of other student loans awarded to full-time first-time undergraduates (SFA2122): 19890.0
Average amount of federal  state  local  institutional or other sources of grant aid awarded to undergraduate students (SFA2122): 9388.0
Average amount Pell grant aid awarded to undergraduate students (SFA2122): 4809.0
Average amount of federal student loans awarded to undergraduate students (SFA2122): 6191.0
Average amount of federal  state  local  institutional or other sources of grant aid awarded to degree/certificate-seeking undergraduate students (SFA2122): 9381.0
Average amount of federal  state  local  institutional or other sources of grant aid awarded to non-degree/non-certificate-seeking undergraduates (SFA2122): 11736.0
Average net price-students awarded grant or scholarship aid  2021-22 (SFA2122): 
Average net price (income 0-30 000)-students awarded Title IV federal financial aid  2021-22 (SFA2122): 
Average net price (income 30 001-48 000)-students awarded Title IV federal financial aid  2021-22 (SFA2122): 
Average net price (income 48 001-75 000)-students awarded Title IV federal financial aid  2021-22 (SFA2122): 
Average net price (income 75 001-110 000)-students awarded Title IV federal financial aid  2021-22 (SFA2122): 
Average net price (income over 110 000)-students awarded Title IV federal financial aid  2021-22 (SFA2122): 
Books and supplies 2022-23 (IC2022_AY): 1176.0
On campus  room and board 2022-23 (IC2022_AY): 12040.0
Off campus (not with family)  room and board 2022-23 (IC2022_AY): 12040.0
Off campus (not with family)  other expenses 2022-23 (IC2022_AY): 4200.0
Off campus (with family)  other expenses 2022-23 (IC2022_AY): 4200.0
On campus  room and board 2019-20 (IC2022_AY): 10938.0
Published out-of-state tuition and fees 2022-23 (IC2022_AY): 30152.0
Published in-district tuition and fees 2022-23 (IC2022_AY): 13092.0
Published in-state tuition and fees 2022-23 (IC2022_AY): 13092.0
Institution provide on-campus housing (IC2022): 1.0
Typical room charge for academic year (IC2022): 5750.0
Typical board charge for academic year (IC2022): 6190.0
Undergraduate application fee (IC2022): 70.0
Graduate application fee (IC2022): 60.0
Any alternative tuition plans offered by institution (IC2022_RV): 1.0
Tuition payment plan (IC2022_RV): 1.0
Average amount of federal  state  local or institutional grant aid awarded (SFA2021_RV): 9594.0
Average amount of federal grant aid awarded to full-time first-time undergraduates (SFA2021_RV): 5114.0
Average amount of Pell grant aid awarded to full-time first-time undergraduates (SFA2021_RV): 4630.0
Average amount of other federal grant aid awarded to full-time first-time undergraduates (SFA2021_RV): 1964.0
Average amount of state/local grant aid awarded to full-time first-time undergraduates (SFA2021_RV): 5371.0
Average amount of institutional grant aid awarded to full-time first-time undergraduates (SFA2021_RV): 7908.0
Average amount of student loans awarded to full-time first-time undergraduates (SFA2021_RV): 9063.0
Average amount of other student loans awarded to full-time first-time undergraduates (SFA2021_RV): 18776.0
Average amount of federal  state  local  institutional or other sources of grant aid awarded to undergraduate students (SFA2021_RV): 8387.0
Average amount Pell grant aid awarded to undergraduate students (SFA2021_RV): 4781.0
Average amount of federal student loans awarded to undergraduate students (SFA2021_RV): 6256.0
Average net price-students awarded grant or scholarship aid  2020-21 (SFA2021_RV): 
Average net price (income 0-30 000)-students awarded Title IV federal financial aid  2020-21 (SFA2021_RV): 
Average net price (income 30 001-48 000)-students awarded Title IV federal financial aid  2020-21 (SFA2021_RV): 
Average net price (income 48 001-75 000)-students awarded Title IV federal financial aid  2020-21 (SFA2021_RV): 
Average net price (income 75 001-110 000)-students awarded Title IV federal financial aid  2020-21 (SFA2021_RV): 
Average net price (income over 110 000)-students awarded Title IV federal financial aid  2020-21 (SFA2021_RV): 
Books and supplies 2021-22 (IC2021_AY): 1098.0
On campus  room and board 2021-22 (IC2021_AY): 11550.0
Off campus (not with family)  room and board 2021-22 (IC2021_AY): 11555.0
Off campus (not with family)  other expenses 2021-22 (IC2021_AY): 4002.0
Off campus (with family)  other expenses 2021-22 (IC2021_AY): 4002.0
On campus  room and board 2018-19 (IC2021_AY): 10512.0
Published out-of-state tuition and fees 2021-22 (IC2021_AY): 29564.0
Published in-district tuition and fees 2021-22 (IC2021_AY): 12638.0
Published in-state tuition and fees 2021-22 (IC2021_AY): 12638.0
Institution provide on-campus housing (IC2021): 1.0
Typical room charge for academic year (IC2021): 5564.0
Typical board charge for academic year (IC2021): 5986.0
Undergraduate application fee (IC2021): 70.0
Graduate application fee (IC2021): 60.0
Any alternative tuition plans offered by institution (IC2021): 1.0
Tuition payment plan (IC2021_RV): 1.0
Books and supplies 2020-21 (IC2020_AY): 1082.0
On campus  room and board 2020-21 (IC2020_AY): 11348.0
Off campus (not with family)  room and board 2020-21 (IC2020_AY): 11348.0
Off campus (not with family)  other expenses 2020-21 (IC2020_AY): 4020.0
Off campus (with family)  other expenses 2020-21 (IC2020_AY): 4020.0
On campus  room and board 2017-18 (IC2020_AY): 10112.0
Published out-of-state tuition and fees 2020-21 (IC2020_AY): 29230.0
Published in-district tuition and fees 2020-21 (IC2020_AY): 12330.0
Published in-state tuition and fees 2020-21 (IC2020_AY): 12330.0
Institution provide on-campus housing (IC2020): 1.0
Typical room charge for academic year (IC2020): 5508.0
Typical board charge for academic year (IC2020): 5840.0
Undergraduate application fee (IC2020): 70.0
Graduate application fee (IC2020): 60.0
Any alternative tuition plans offered by institution (IC2020_RV): 1.0
Tuition payment plan (IC2020_RV): 1.0","What is the typical housing charges for an academic year at James Madison University?
",The typical housing charges for an academic year at James Madison University is ,../data/final_p1.csv
63,": 502747
UnitID: 222831
institution name: Angelo State University
year: 2023
CIP2020Title: Marketing/Marketing Management, General.
CIP_Code: 521401
SOC2018Title: Marketing Managers
SOC_Code: 112021
CIPDefinition: A program that generally prepares individuals to undertake and manage the process of developing consumer audiences and moving products from producers to consumers.  Includes instruction in buyer behavior and dynamics, principle of marketing research, demand analysis, cost-volume and profit relationships, pricing theory, marketing campaign and strategic planning, market segments, advertising methods, sales operations and management, consumer relations, retailing, and applications to specific products and markets.
CrossReferences: 
Institution Name: Angelo State University
Books and supplies 2023-24 (IC2023_AY): 1200.0
On campus  food and housing 2023-24 (IC2023_AY): 11800.0
Off campus (not with family)  food and housing 2023-24 (IC2023_AY): 11800.0
Off campus (not with family)  other expenses 2023-24 (IC2023_AY): 3870.0
Off campus (with family)  other expenses 2023-24 (IC2023_AY): 3870.0
On campus  food and housing 2020-21 (IC2023_AY): 9630.0
Published out-of-state tuition and fees 2023-24 (IC2023_AY): 18399.0
Published in-district tuition and fees 2023-24 (IC2023_AY): 8319.0
Published in-state tuition and fees 2023-24 (IC2023_AY): 8319.0
Institution provide nstitutionally-controlled housing (on-campus and/or off-campus) (IC2023): 1.0
Typical housing charges for an academic year (IC2023): 5900.0
Typical food charge for academic year (IC2023): 4150.0
Undergraduate application fee (IC2023): 50.0
Graduate application fee (IC2023): 40.0
Any alternative tuition plans offered by institution (IC2023): 1.0
Tuition payment plan (IC2023): 1.0
Average amount of federal  state  local or institutional grant aid awarded (SFA2122): 9007.0
Average amount of federal grant aid awarded to full-time first-time undergraduates (SFA2122): 7087.0
Average amount of Pell grant aid awarded to full-time first-time undergraduates (SFA2122): 5194.0
Average amount of other federal grant aid awarded to full-time first-time undergraduates (SFA2122): 2037.0
Average amount of state/local grant aid awarded to full-time first-time undergraduates (SFA2122): 4414.0
Average amount of institutional grant aid awarded to full-time first-time undergraduates (SFA2122): 3421.0
Average amount of student loans awarded to full-time first-time undergraduates (SFA2122): 6207.0
Average amount of other student loans awarded to full-time first-time undergraduates (SFA2122): 10683.0
Average amount of federal  state  local  institutional or other sources of grant aid awarded to undergraduate students (SFA2122): 6898.0
Average amount Pell grant aid awarded to undergraduate students (SFA2122): 4828.0
Average amount of federal student loans awarded to undergraduate students (SFA2122): 6227.0
Average amount of federal  state  local  institutional or other sources of grant aid awarded to degree/certificate-seeking undergraduate students (SFA2122): 6898.0
Average amount of federal  state  local  institutional or other sources of grant aid awarded to non-degree/non-certificate-seeking undergraduates (SFA2122): 
Average net price-students awarded grant or scholarship aid  2021-22 (SFA2122): 
Average net price (income 0-30 000)-students awarded Title IV federal financial aid  2021-22 (SFA2122): 
Average net price (income 30 001-48 000)-students awarded Title IV federal financial aid  2021-22 (SFA2122): 
Average net price (income 48 001-75 000)-students awarded Title IV federal financial aid  2021-22 (SFA2122): 
Average net price (income 75 001-110 000)-students awarded Title IV federal financial aid  2021-22 (SFA2122): 
Average net price (income over 110 000)-students awarded Title IV federal financial aid  2021-22 (SFA2122): 
Books and supplies 2022-23 (IC2022_AY): 1200.0
On campus  room and board 2022-23 (IC2022_AY): 10520.0
Off campus (not with family)  room and board 2022-23 (IC2022_AY): 10520.0
Off campus (not with family)  other expenses 2022-23 (IC2022_AY): 3560.0
Off campus (with family)  other expenses 2022-23 (IC2022_AY): 3560.0
On campus  room and board 2019-20 (IC2022_AY): 9130.0
Published out-of-state tuition and fees 2022-23 (IC2022_AY): 17978.0
Published in-district tuition and fees 2022-23 (IC2022_AY): 8186.0
Published in-state tuition and fees 2022-23 (IC2022_AY): 8186.0
Institution provide on-campus housing (IC2022): 1.0
Typical room charge for academic year (IC2022): 5670.0
Typical board charge for academic year (IC2022): 3840.0
Undergraduate application fee (IC2022): 40.0
Graduate application fee (IC2022): 40.0
Any alternative tuition plans offered by institution (IC2022_RV): 1.0
Tuition payment plan (IC2022_RV): 1.0
Average amount of federal  state  local or institutional grant aid awarded (SFA2021_RV): 8422.0
Average amount of federal grant aid awarded to full-time first-time undergraduates (SFA2021_RV): 6441.0
Average amount of Pell grant aid awarded to full-time first-time undergraduates (SFA2021_RV): 4948.0
Average amount of other federal grant aid awarded to full-time first-time undergraduates (SFA2021_RV): 1576.0
Average amount of state/local grant aid awarded to full-time first-time undergraduates (SFA2021_RV): 4256.0
Average amount of institutional grant aid awarded to full-time first-time undergraduates (SFA2021_RV): 2727.0
Average amount of student loans awarded to full-time first-time undergraduates (SFA2021_RV): 5379.0
Average amount of other student loans awarded to full-time first-time undergraduates (SFA2021_RV): 10619.0
Average amount of federal  state  local  institutional or other sources of grant aid awarded to undergraduate students (SFA2021_RV): 7683.0
Average amount Pell grant aid awarded to undergraduate students (SFA2021_RV): 4766.0
Average amount of federal student loans awarded to undergraduate students (SFA2021_RV): 6099.0
Average net price-students awarded grant or scholarship aid  2020-21 (SFA2021_RV): 
Average net price (income 0-30 000)-students awarded Title IV federal financial aid  2020-21 (SFA2021_RV): 
Average net price (income 30 001-48 000)-students awarded Title IV federal financial aid  2020-21 (SFA2021_RV): 
Average net price (income 48 001-75 000)-students awarded Title IV federal financial aid  2020-21 (SFA2021_RV): 
Average net price (income 75 001-110 000)-students awarded Title IV federal financial aid  2020-21 (SFA2021_RV): 
Average net price (income over 110 000)-students awarded Title IV federal financial aid  2020-21 (SFA2021_RV): 
Books and supplies 2021-22 (IC2021_AY): 1200.0
On campus  room and board 2021-22 (IC2021_AY): 9980.0
Off campus (not with family)  room and board 2021-22 (IC2021_AY): 9980.0
Off campus (not with family)  other expenses 2021-22 (IC2021_AY): 3400.0
Off campus (with family)  other expenses 2021-22 (IC2021_AY): 3400.0
On campus  room and board 2018-19 (IC2021_AY): 9130.0
Published out-of-state tuition and fees 2021-22 (IC2021_AY): 17978.0
Published in-district tuition and fees 2021-22 (IC2021_AY): 8186.0
Published in-state tuition and fees 2021-22 (IC2021_AY): 8186.0
Institution provide on-campus housing (IC2021): 1.0
Typical room charge for academic year (IC2021): 5400.0
Typical board charge for academic year (IC2021): 3630.0
Undergraduate application fee (IC2021): 40.0
Graduate application fee (IC2021): 40.0
Any alternative tuition plans offered by institution (IC2021): 1.0
Tuition payment plan (IC2021_RV): 1.0
Books and supplies 2020-21 (IC2020_AY): 1200.0
On campus  room and board 2020-21 (IC2020_AY): 9630.0
Off campus (not with family)  room and board 2020-21 (IC2020_AY): 9630.0
Off campus (not with family)  other expenses 2020-21 (IC2020_AY): 3280.0
Off campus (with family)  other expenses 2020-21 (IC2020_AY): 3280.0
On campus  room and board 2017-18 (IC2020_AY): 7666.0
Published out-of-state tuition and fees 2020-21 (IC2020_AY): 17723.0
Published in-district tuition and fees 2020-21 (IC2020_AY): 7907.0
Published in-state tuition and fees 2020-21 (IC2020_AY): 7907.0
Institution provide on-campus housing (IC2020): 1.0
Typical room charge for academic year (IC2020): 5400.0
Typical board charge for academic year (IC2020): 3490.0
Undergraduate application fee (IC2020): 40.0
Graduate application fee (IC2020): 40.0
Any alternative tuition plans offered by institution (IC2020_RV): 1.0
Tuition payment plan (IC2020_RV): 1.0",What is the average net price (income 30 001-75 000)-students awarded,"The average net price (income 30 001-48 000)-students awarded Title IV federal financial aid at Angelo State University is 2021-22 (SFA2122): 

Factoid question: What is the average net price (income 30 001-75 000)-students awarded",../data/final_p1.csv
64,": 112374
UnitID: 137476
institution name: St. Thomas University
year: 2023
CIP2020Title: Political Science and Government, General.
CIP_Code: 451001
SOC2018Title: Social Science Research Assistants
SOC_Code: 194061
CIPDefinition: A  general program that focuses on the systematic study of political institutions and behavior.  Includes instruction in political philosophy, political theory, comparative government and politics, political parties and interest groups, public opinion, political research methods, studies of the government and politics of specific countries, and studies of specific political institutions and processes.
CrossReferences: 
Institution Name: St. Thomas University
Books and supplies 2023-24 (IC2023_AY): 360.0
On campus  food and housing 2023-24 (IC2023_AY): 12478.0
Off campus (not with family)  food and housing 2023-24 (IC2023_AY): 14688.0
Off campus (not with family)  other expenses 2023-24 (IC2023_AY): 6934.0
Off campus (with family)  other expenses 2023-24 (IC2023_AY): 6934.0
On campus  food and housing 2020-21 (IC2023_AY): 12360.0
Published out-of-state tuition and fees 2023-24 (IC2023_AY): 34770.0
Published in-district tuition and fees 2023-24 (IC2023_AY): 34770.0
Published in-state tuition and fees 2023-24 (IC2023_AY): 34770.0
Institution provide nstitutionally-controlled housing (on-campus and/or off-campus) (IC2023): 1.0
Typical housing charges for an academic year (IC2023): 7830.0
Typical food charge for academic year (IC2023): 5320.0
Undergraduate application fee (IC2023): 0.0
Graduate application fee (IC2023): 0.0
Any alternative tuition plans offered by institution (IC2023): 1.0
Tuition payment plan (IC2023): 1.0
Average amount of federal  state  local or institutional grant aid awarded (SFA2122): 22668.0
Average amount of federal grant aid awarded to full-time first-time undergraduates (SFA2122): 5574.0
Average amount of Pell grant aid awarded to full-time first-time undergraduates (SFA2122): 5045.0
Average amount of other federal grant aid awarded to full-time first-time undergraduates (SFA2122): 1512.0
Average amount of state/local grant aid awarded to full-time first-time undergraduates (SFA2122): 3125.0
Average amount of institutional grant aid awarded to full-time first-time undergraduates (SFA2122): 16416.0
Average amount of student loans awarded to full-time first-time undergraduates (SFA2122): 5809.0
Average amount of other student loans awarded to full-time first-time undergraduates (SFA2122): 11918.0
Average amount of federal  state  local  institutional or other sources of grant aid awarded to undergraduate students (SFA2122): 24848.0
Average amount Pell grant aid awarded to undergraduate students (SFA2122): 4919.0
Average amount of federal student loans awarded to undergraduate students (SFA2122): 5927.0
Average amount of federal  state  local  institutional or other sources of grant aid awarded to degree/certificate-seeking undergraduate students (SFA2122): 24848.0
Average amount of federal  state  local  institutional or other sources of grant aid awarded to non-degree/non-certificate-seeking undergraduates (SFA2122): 
Average net price-students awarded grant or scholarship aid  2021-22 (SFA2122): 28654.0
Average net price (income 0-30 000)-students awarded Title IV federal financial aid  2021-22 (SFA2122): 26644.0
Average net price (income 30 001-48 000)-students awarded Title IV federal financial aid  2021-22 (SFA2122): 28119.0
Average net price (income 48 001-75 000)-students awarded Title IV federal financial aid  2021-22 (SFA2122): 30313.0
Average net price (income 75 001-110 000)-students awarded Title IV federal financial aid  2021-22 (SFA2122): 29734.0
Average net price (income over 110 000)-students awarded Title IV federal financial aid  2021-22 (SFA2122): 30162.0
Books and supplies 2022-23 (IC2022_AY): 360.0
On campus  room and board 2022-23 (IC2022_AY): 12460.0
Off campus (not with family)  room and board 2022-23 (IC2022_AY): 14688.0
Off campus (not with family)  other expenses 2022-23 (IC2022_AY): 6901.0
Off campus (with family)  other expenses 2022-23 (IC2022_AY): 6901.0
On campus  room and board 2019-20 (IC2022_AY): 11700.0
Published out-of-state tuition and fees 2022-23 (IC2022_AY): 33760.0
Published in-district tuition and fees 2022-23 (IC2022_AY): 33760.0
Published in-state tuition and fees 2022-23 (IC2022_AY): 33760.0
Institution provide on-campus housing (IC2022): 1.0
Typical room charge for academic year (IC2022): 7600.0
Typical board charge for academic year (IC2022): 4860.0
Undergraduate application fee (IC2022): 0.0
Graduate application fee (IC2022): 0.0
Any alternative tuition plans offered by institution (IC2022_RV): 1.0
Tuition payment plan (IC2022_RV): 1.0
Average amount of federal  state  local or institutional grant aid awarded (SFA2021_RV): 22021.0
Average amount of federal grant aid awarded to full-time first-time undergraduates (SFA2021_RV): 5384.0
Average amount of Pell grant aid awarded to full-time first-time undergraduates (SFA2021_RV): 5086.0
Average amount of other federal grant aid awarded to full-time first-time undergraduates (SFA2021_RV): 1547.0
Average amount of state/local grant aid awarded to full-time first-time undergraduates (SFA2021_RV): 3496.0
Average amount of institutional grant aid awarded to full-time first-time undergraduates (SFA2021_RV): 15757.0
Average amount of student loans awarded to full-time first-time undergraduates (SFA2021_RV): 6215.0
Average amount of other student loans awarded to full-time first-time undergraduates (SFA2021_RV): 13176.0
Average amount of federal  state  local  institutional or other sources of grant aid awarded to undergraduate students (SFA2021_RV): 22457.0
Average amount Pell grant aid awarded to undergraduate students (SFA2021_RV): 4968.0
Average amount of federal student loans awarded to undergraduate students (SFA2021_RV): 6247.0
Average net price-students awarded grant or scholarship aid  2020-21 (SFA2021_RV): 28550.0
Average net price (income 0-30 000)-students awarded Title IV federal financial aid  2020-21 (SFA2021_RV): 26243.0
Average net price (income 30 001-48 000)-students awarded Title IV federal financial aid  2020-21 (SFA2021_RV): 26319.0
Average net price (income 48 001-75 000)-students awarded Title IV federal financial aid  2020-21 (SFA2021_RV): 27187.0
Average net price (income 75 001-110 000)-students awarded Title IV federal financial aid  2020-21 (SFA2021_RV): 30571.0
Average net price (income over 110 000)-students awarded Title IV federal financial aid  2020-21 (SFA2021_RV): 30184.0
Books and supplies 2021-22 (IC2021_AY): 360.0
On campus  room and board 2021-22 (IC2021_AY): 12130.0
Off campus (not with family)  room and board 2021-22 (IC2021_AY): 14688.0
Off campus (not with family)  other expenses 2021-22 (IC2021_AY): 6831.0
Off campus (with family)  other expenses 2021-22 (IC2021_AY): 6831.0
On campus  room and board 2018-19 (IC2021_AY): 11700.0
Published out-of-state tuition and fees 2021-22 (IC2021_AY): 32940.0
Published in-district tuition and fees 2021-22 (IC2021_AY): 32940.0
Published in-state tuition and fees 2021-22 (IC2021_AY): 32940.0
Institution provide on-campus housing (IC2021): 1.0
Typical room charge for academic year (IC2021): 
Typical board charge for academic year (IC2021): 
Undergraduate application fee (IC2021): 0.0
Graduate application fee (IC2021): 0.0
Any alternative tuition plans offered by institution (IC2021): 1.0
Tuition payment plan (IC2021_RV): 1.0
Books and supplies 2020-21 (IC2020_AY): 360.0
On campus  room and board 2020-21 (IC2020_AY): 12360.0
Off campus (not with family)  room and board 2020-21 (IC2020_AY): 14688.0
Off campus (not with family)  other expenses 2020-21 (IC2020_AY): 6831.0
Off campus (with family)  other expenses 2020-21 (IC2020_AY): 6831.0
On campus  room and board 2017-18 (IC2020_AY): 11700.0
Published out-of-state tuition and fees 2020-21 (IC2020_AY): 32940.0
Published in-district tuition and fees 2020-21 (IC2020_AY): 32940.0
Published in-state tuition and fees 2020-21 (IC2020_AY): 32940.0
Institution provide on-campus housing (IC2020): 1.0
Typical room charge for academic year (IC2020): 
Typical board charge for academic year (IC2020): 
Undergraduate application fee (IC2020): 0.0
Graduate application fee (IC2020): 0.0
Any alternative tuition plans offered by institution (IC2020_RV): 1.0
Tuition payment plan (IC2020_RV): 1.0","What is the average net price (income over 110 000)-students awarded Title IV federal financial aid at St. Thomas University?
",The average net price (income over 110 000)-students awarded Title IV federal financial aid at St. Thomas University,../data/final_p1.csv
65,": 372446
AREA: 5300007
AREA_TITLE: Eastern Washington nonmetropolitan area
AREA_TYPE: 6
PRIM_STATE: WA
NAICS: 0
NAICS_TITLE: Cross-industry
I_GROUP: cross-industry
OWN_CODE: 1235
OCC_CODE: 17-1021
OCC_TITLE: Cartographers and Photogrammetrists
O_GROUP: detailed
TOT_EMP: 40
EMP_PRSE: 10.7
JOBS_1000: 0.340
LOC_QUOTIENT: 4.19
PCT_TOTAL: 
PCT_RPT: 
H_MEAN: 39.25
A_MEAN: 81,650
MEAN_PRSE: 2.4
H_PCT10: 29.72
H_PCT25: 34.11
H_MEDIAN: 38.40
H_PCT75: 44.87
H_PCT90: 48.47
A_PCT10: 61,820
A_PCT25: 70,940
A_MEDIAN: 79,870
A_PCT75: 93,330
A_PCT90: 100,820
ANNUAL: 
HOURLY: 
SOC_Code: 171021",What is the A_PCT90 of the Cart,"The H_PCT25 of the cross-industry group is 34.11.

Factoid question: What is the A_PCT90 of the Cart",../data/final_p2.csv
66,": 622153
UnitID: 487320
institution name: Texas State Technical College
year: 2023
CIP2020Title: Network and System Administration/Administrator.
CIP_Code: 111001
SOC2018Title: Computer and Information Systems Managers
SOC_Code: 113021
CIPDefinition: A program that prepares individuals to manage the computer operations and control the system configurations emanating from a specific site or network hub.  Includes instruction in computer hardware and software and applications; local area (LAN) and wide area (WAN) networking; principles of information systems security; disk space and traffic load monitoring; data backup; resource allocation; and setup and takedown procedures.
CrossReferences: 
Institution Name: Texas State Technical College
Books and supplies 2023-24 (IC2023_AY): 1464.0
On campus  food and housing 2023-24 (IC2023_AY): 9435.0
Off campus (not with family)  food and housing 2023-24 (IC2023_AY): 12800.0
Off campus (not with family)  other expenses 2023-24 (IC2023_AY): 5880.0
Off campus (with family)  other expenses 2023-24 (IC2023_AY): 4416.0
On campus  food and housing 2020-21 (IC2023_AY): 8658.0
Published out-of-state tuition and fees 2023-24 (IC2023_AY): 11842.0
Published in-district tuition and fees 2023-24 (IC2023_AY): 7192.0
Published in-state tuition and fees 2023-24 (IC2023_AY): 7192.0
Institution provide nstitutionally-controlled housing (on-campus and/or off-campus) (IC2023): 1.0
Typical housing charges for an academic year (IC2023): 4035.0
Typical food charge for academic year (IC2023): 5400.0
Undergraduate application fee (IC2023): 0.0
Graduate application fee (IC2023): 
Any alternative tuition plans offered by institution (IC2023): 1.0
Tuition payment plan (IC2023): 1.0
Average amount of federal  state  local or institutional grant aid awarded (SFA2122): 3588.0
Average amount of federal grant aid awarded to full-time first-time undergraduates (SFA2122): 2717.0
Average amount of Pell grant aid awarded to full-time first-time undergraduates (SFA2122): 2685.0
Average amount of other federal grant aid awarded to full-time first-time undergraduates (SFA2122): 593.0
Average amount of state/local grant aid awarded to full-time first-time undergraduates (SFA2122): 1746.0
Average amount of institutional grant aid awarded to full-time first-time undergraduates (SFA2122): 1181.0
Average amount of student loans awarded to full-time first-time undergraduates (SFA2122): 2065.0
Average amount of other student loans awarded to full-time first-time undergraduates (SFA2122): 5624.0
Average amount of federal  state  local  institutional or other sources of grant aid awarded to undergraduate students (SFA2122): 2963.0
Average amount Pell grant aid awarded to undergraduate students (SFA2122): 2288.0
Average amount of federal student loans awarded to undergraduate students (SFA2122): 2354.0
Average amount of federal  state  local  institutional or other sources of grant aid awarded to degree/certificate-seeking undergraduate students (SFA2122): 2963.0
Average amount of federal  state  local  institutional or other sources of grant aid awarded to non-degree/non-certificate-seeking undergraduates (SFA2122): 
Average net price-students awarded grant or scholarship aid  2021-22 (SFA2122): 
Average net price (income 0-30 000)-students awarded Title IV federal financial aid  2021-22 (SFA2122): 
Average net price (income 30 001-48 000)-students awarded Title IV federal financial aid  2021-22 (SFA2122): 
Average net price (income 48 001-75 000)-students awarded Title IV federal financial aid  2021-22 (SFA2122): 
Average net price (income 75 001-110 000)-students awarded Title IV federal financial aid  2021-22 (SFA2122): 
Average net price (income over 110 000)-students awarded Title IV federal financial aid  2021-22 (SFA2122): 
Books and supplies 2022-23 (IC2022_AY): 2022.0
On campus  room and board 2022-23 (IC2022_AY): 9513.0
Off campus (not with family)  room and board 2022-23 (IC2022_AY): 12111.0
Off campus (not with family)  other expenses 2022-23 (IC2022_AY): 6105.0
Off campus (with family)  other expenses 2022-23 (IC2022_AY): 3102.0
On campus  room and board 2019-20 (IC2022_AY): 7963.0
Published out-of-state tuition and fees 2022-23 (IC2022_AY): 11435.0
Published in-district tuition and fees 2022-23 (IC2022_AY): 6969.0
Published in-state tuition and fees 2022-23 (IC2022_AY): 6969.0
Institution provide on-campus housing (IC2022): 1.0
Typical room charge for academic year (IC2022): 5104.0
Typical board charge for academic year (IC2022): 4950.0
Undergraduate application fee (IC2022): 0.0
Graduate application fee (IC2022): 
Any alternative tuition plans offered by institution (IC2022_RV): 1.0
Tuition payment plan (IC2022_RV): 1.0
Average amount of federal  state  local or institutional grant aid awarded (SFA2021_RV): 7498.0
Average amount of federal grant aid awarded to full-time first-time undergraduates (SFA2021_RV): 6121.0
Average amount of Pell grant aid awarded to full-time first-time undergraduates (SFA2021_RV): 5744.0
Average amount of other federal grant aid awarded to full-time first-time undergraduates (SFA2021_RV): 2049.0
Average amount of state/local grant aid awarded to full-time first-time undergraduates (SFA2021_RV): 5372.0
Average amount of institutional grant aid awarded to full-time first-time undergraduates (SFA2021_RV): 1807.0
Average amount of student loans awarded to full-time first-time undergraduates (SFA2021_RV): 4657.0
Average amount of other student loans awarded to full-time first-time undergraduates (SFA2021_RV): 13676.0
Average amount of federal  state  local  institutional or other sources of grant aid awarded to undergraduate students (SFA2021_RV): 5777.0
Average amount Pell grant aid awarded to undergraduate students (SFA2021_RV): 4555.0
Average amount of federal student loans awarded to undergraduate students (SFA2021_RV): 4580.0
Average net price-students awarded grant or scholarship aid  2020-21 (SFA2021_RV): 
Average net price (income 0-30 000)-students awarded Title IV federal financial aid  2020-21 (SFA2021_RV): 
Average net price (income 30 001-48 000)-students awarded Title IV federal financial aid  2020-21 (SFA2021_RV): 
Average net price (income 48 001-75 000)-students awarded Title IV federal financial aid  2020-21 (SFA2021_RV): 
Average net price (income 75 001-110 000)-students awarded Title IV federal financial aid  2020-21 (SFA2021_RV): 
Average net price (income over 110 000)-students awarded Title IV federal financial aid  2020-21 (SFA2021_RV): 
Books and supplies 2021-22 (IC2021_AY): 1929.0
On campus  room and board 2021-22 (IC2021_AY): 9072.0
Off campus (not with family)  room and board 2021-22 (IC2021_AY): 11550.0
Off campus (not with family)  other expenses 2021-22 (IC2021_AY): 5823.0
Off campus (with family)  other expenses 2021-22 (IC2021_AY): 2958.0
On campus  room and board 2018-19 (IC2021_AY): 7618.0
Published out-of-state tuition and fees 2021-22 (IC2021_AY): 11369.0
Published in-district tuition and fees 2021-22 (IC2021_AY): 6950.0
Published in-state tuition and fees 2021-22 (IC2021_AY): 6950.0
Institution provide on-campus housing (IC2021): 1.0
Typical room charge for academic year (IC2021): 5104.0
Typical board charge for academic year (IC2021): 2970.0
Undergraduate application fee (IC2021): 0.0
Graduate application fee (IC2021): 
Any alternative tuition plans offered by institution (IC2021): 1.0
Tuition payment plan (IC2021_RV): 1.0
Books and supplies 2020-21 (IC2020_AY): 1840.0
On campus  room and board 2020-21 (IC2020_AY): 8658.0
Off campus (not with family)  room and board 2020-21 (IC2020_AY): 11022.0
Off campus (not with family)  other expenses 2020-21 (IC2020_AY): 5556.0
Off campus (with family)  other expenses 2020-21 (IC2020_AY): 2823.0
On campus  room and board 2017-18 (IC2020_AY): 5350.0
Published out-of-state tuition and fees 2020-21 (IC2020_AY): 10486.0
Published in-district tuition and fees 2020-21 (IC2020_AY): 6169.0
Published in-state tuition and fees 2020-21 (IC2020_AY): 6169.0
Institution provide on-campus housing (IC2020): 1.0
Typical room charge for academic year (IC2020): 4993.0
Typical board charge for academic year (IC2020): 2970.0
Undergraduate application fee (IC2020): 0.0
Graduate application fee (IC2020): 
Any alternative tuition plans offered by institution (IC2020_RV): 1.0
Tuition payment plan (IC2020_RV): 1.0","What is the average amount of federal student loans awarded to full-time first-time undergraduates 2021-22?
",The average amount of federal student loans awarded to full-time first-time undergraduates 2021-22 is 2717 dollars.,../data/final_p1.csv
67,": 408275
AREA: 1800001
AREA_TITLE: Northern Indiana nonmetropolitan area
AREA_TYPE: 6
PRIM_STATE: IN
NAICS: 0
NAICS_TITLE: Cross-industry
I_GROUP: cross-industry
OWN_CODE: 1235
OCC_CODE: 51-4194
OCC_TITLE: Tool Grinders, Filers, and Sharpeners
O_GROUP: detailed
TOT_EMP: 40
EMP_PRSE: 25.4
JOBS_1000: 0.167
LOC_QUOTIENT: 3.81
PCT_TOTAL: 
PCT_RPT: 
H_MEAN: 20.37
A_MEAN: 42,370
MEAN_PRSE: 6.0
H_PCT10: 14.08
H_PCT25: 17.89
H_MEDIAN: 21.50
H_PCT75: 23.29
H_PCT90: 28.20
A_PCT10: 29,290
A_PCT25: 37,210
A_MEDIAN: 44,730
A_PCT75: 48,450
A_PCT90: 58,650
ANNUAL: 
HOURLY: 
SOC_Code: 514194","What is the Northern Indiana nonmetropolitan area?
",The Northern Indiana nonmetropolitan area is 1800001.,../data/final_p2.csv
68,": 235373
UnitID: 167835
institution name: Smith College
year: 2023
CIP2020Title: Social Work.
CIP_Code: 440701
SOC2018Title: Counselors, All Other
SOC_Code: 211019
CIPDefinition: A program that prepares individuals for the professional practice of social welfare administration and counseling, and that focus on the study of organized means of providing basic support services for vulnerable individuals and groups.   Includes instruction in social welfare policy; case work planning; social counseling and intervention strategies; administrative procedures and regulations; and specific applications in areas such as child welfare and family services, probation, employment services, and disability counseling.
CrossReferences: 51.1503 - Clinical/Medical Social Work.
Institution Name: Smith College
Books and supplies 2023-24 (IC2023_AY): 800.0
On campus  food and housing 2023-24 (IC2023_AY): 21310.0
Off campus (not with family)  food and housing 2023-24 (IC2023_AY): 10418.0
Off campus (not with family)  other expenses 2023-24 (IC2023_AY): 2352.0
Off campus (with family)  other expenses 2023-24 (IC2023_AY): 12146.0
On campus  food and housing 2020-21 (IC2023_AY): 18760.0
Published out-of-state tuition and fees 2023-24 (IC2023_AY): 61568.0
Published in-district tuition and fees 2023-24 (IC2023_AY): 61568.0
Published in-state tuition and fees 2023-24 (IC2023_AY): 61568.0
Institution provide nstitutionally-controlled housing (on-campus and/or off-campus) (IC2023): 1.0
Typical housing charges for an academic year (IC2023): 10655.0
Typical food charge for academic year (IC2023): 10655.0
Undergraduate application fee (IC2023): 0.0
Graduate application fee (IC2023): 60.0
Any alternative tuition plans offered by institution (IC2023): 1.0
Tuition payment plan (IC2023): 1.0
Average amount of federal  state  local or institutional grant aid awarded (SFA2122): 49109.0
Average amount of federal grant aid awarded to full-time first-time undergraduates (SFA2122): 3340.0
Average amount of Pell grant aid awarded to full-time first-time undergraduates (SFA2122): 5033.0
Average amount of other federal grant aid awarded to full-time first-time undergraduates (SFA2122): 2013.0
Average amount of state/local grant aid awarded to full-time first-time undergraduates (SFA2122): 2459.0
Average amount of institutional grant aid awarded to full-time first-time undergraduates (SFA2122): 46199.0
Average amount of student loans awarded to full-time first-time undergraduates (SFA2122): 4482.0
Average amount of other student loans awarded to full-time first-time undergraduates (SFA2122): 8054.0
Average amount of federal  state  local  institutional or other sources of grant aid awarded to undergraduate students (SFA2122): 47628.0
Average amount Pell grant aid awarded to undergraduate students (SFA2122): 4939.0
Average amount of federal student loans awarded to undergraduate students (SFA2122): 4690.0
Average amount of federal  state  local  institutional or other sources of grant aid awarded to degree/certificate-seeking undergraduate students (SFA2122): 47628.0
Average amount of federal  state  local  institutional or other sources of grant aid awarded to non-degree/non-certificate-seeking undergraduates (SFA2122): 
Average net price-students awarded grant or scholarship aid  2021-22 (SFA2122): 30790.0
Average net price (income 0-30 000)-students awarded Title IV federal financial aid  2021-22 (SFA2122): 14214.0
Average net price (income 30 001-48 000)-students awarded Title IV federal financial aid  2021-22 (SFA2122): 14016.0
Average net price (income 48 001-75 000)-students awarded Title IV federal financial aid  2021-22 (SFA2122): 14098.0
Average net price (income 75 001-110 000)-students awarded Title IV federal financial aid  2021-22 (SFA2122): 23430.0
Average net price (income over 110 000)-students awarded Title IV federal financial aid  2021-22 (SFA2122): 46976.0
Books and supplies 2022-23 (IC2022_AY): 800.0
On campus  room and board 2022-23 (IC2022_AY): 20340.0
Off campus (not with family)  room and board 2022-23 (IC2022_AY): 9674.0
Off campus (not with family)  other expenses 2022-23 (IC2022_AY): 2226.0
Off campus (with family)  other expenses 2022-23 (IC2022_AY): 11278.0
On campus  room and board 2019-20 (IC2022_AY): 18130.0
Published out-of-state tuition and fees 2022-23 (IC2022_AY): 58768.0
Published in-district tuition and fees 2022-23 (IC2022_AY): 58768.0
Published in-state tuition and fees 2022-23 (IC2022_AY): 58768.0
Institution provide on-campus housing (IC2022): 1.0
Typical room charge for academic year (IC2022): 10200.0
Typical board charge for academic year (IC2022): 10140.0
Undergraduate application fee (IC2022): 0.0
Graduate application fee (IC2022): 60.0
Any alternative tuition plans offered by institution (IC2022_RV): 1.0
Tuition payment plan (IC2022_RV): 1.0
Average amount of federal  state  local or institutional grant aid awarded (SFA2021_RV): 44108.0
Average amount of federal grant aid awarded to full-time first-time undergraduates (SFA2021_RV): 3535.0
Average amount of Pell grant aid awarded to full-time first-time undergraduates (SFA2021_RV): 5156.0
Average amount of other federal grant aid awarded to full-time first-time undergraduates (SFA2021_RV): 1872.0
Average amount of state/local grant aid awarded to full-time first-time undergraduates (SFA2021_RV): 2348.0
Average amount of institutional grant aid awarded to full-time first-time undergraduates (SFA2021_RV): 41021.0
Average amount of student loans awarded to full-time first-time undergraduates (SFA2021_RV): 4269.0
Average amount of other student loans awarded to full-time first-time undergraduates (SFA2021_RV): 8280.0
Average amount of federal  state  local  institutional or other sources of grant aid awarded to undergraduate students (SFA2021_RV): 41103.0
Average amount Pell grant aid awarded to undergraduate students (SFA2021_RV): 5028.0
Average amount of federal student loans awarded to undergraduate students (SFA2021_RV): 4553.0
Average net price-students awarded grant or scholarship aid  2020-21 (SFA2021_RV): 29569.0
Average net price (income 0-30 000)-students awarded Title IV federal financial aid  2020-21 (SFA2021_RV): 11678.0
Average net price (income 30 001-48 000)-students awarded Title IV federal financial aid  2020-21 (SFA2021_RV): 16389.0
Average net price (income 48 001-75 000)-students awarded Title IV federal financial aid  2020-21 (SFA2021_RV): 18903.0
Average net price (income 75 001-110 000)-students awarded Title IV federal financial aid  2020-21 (SFA2021_RV): 26619.0
Average net price (income over 110 000)-students awarded Title IV federal financial aid  2020-21 (SFA2021_RV): 45455.0
Books and supplies 2021-22 (IC2021_AY): 800.0
On campus  room and board 2021-22 (IC2021_AY): 19420.0
Off campus (not with family)  room and board 2021-22 (IC2021_AY): 9110.0
Off campus (not with family)  other expenses 2021-22 (IC2021_AY): 2104.0
Off campus (with family)  other expenses 2021-22 (IC2021_AY): 10620.0
On campus  room and board 2018-19 (IC2021_AY): 17520.0
Published out-of-state tuition and fees 2021-22 (IC2021_AY): 56114.0
Published in-district tuition and fees 2021-22 (IC2021_AY): 56114.0
Published in-state tuition and fees 2021-22 (IC2021_AY): 56114.0
Institution provide on-campus housing (IC2021): 1.0
Typical room charge for academic year (IC2021): 9700.0
Typical board charge for academic year (IC2021): 9720.0
Undergraduate application fee (IC2021): 0.0
Graduate application fee (IC2021): 60.0
Any alternative tuition plans offered by institution (IC2021): 1.0
Tuition payment plan (IC2021_RV): 1.0
Books and supplies 2020-21 (IC2020_AY): 800.0
On campus  room and board 2020-21 (IC2020_AY): 18760.0
Off campus (not with family)  room and board 2020-21 (IC2020_AY): 8416.0
Off campus (not with family)  other expenses 2020-21 (IC2020_AY): 2058.0
Off campus (with family)  other expenses 2020-21 (IC2020_AY): 10474.0
On campus  room and board 2017-18 (IC2020_AY): 16730.0
Published out-of-state tuition and fees 2020-21 (IC2020_AY): 54224.0
Published in-district tuition and fees 2020-21 (IC2020_AY): 54224.0
Published in-state tuition and fees 2020-21 (IC2020_AY): 54224.0
Institution provide on-campus housing (IC2020): 1.0
Typical room charge for academic year (IC2020): 9400.0
Typical board charge for academic year (IC2020): 9360.0
Undergraduate application fee (IC2020): 0.0
Graduate application fee (IC2020): 60.0
Any alternative tuition plans offered by institution (IC2020_RV): 1.0
Tuition payment plan (IC2020_RV): 1.0","What is the typical published in-district tuition and fees (IC2020) according to Institution?
",The typical published in-district tuition and fees (IC2020) according to Institution is ,../data/final_p1.csv
69,": 607922
UnitID: 451927
institution name: Patrick Henry College
year: 2023
CIP2020Title: History, General.
CIP_Code: 540101
SOC2018Title: Secondary School Teachers, Except Special and Career/Technical Education
SOC_Code: 252031
CIPDefinition: A program that focuses on the general study and interpretation of the past, including the gathering, recording, synthesizing and criticizing of evidence and theories about past events.  Includes instruction in historiography; historical research methods; studies of specific periods, issues and cultures; and applications to areas such as historic preservation, public policy, and records administration.
CrossReferences: 30.4501 - History and Language/Literature., 30.4601 - History and Political Science.
Institution Name: Patrick Henry College
Books and supplies 2023-24 (IC2023_AY): 500.0
On campus  food and housing 2023-24 (IC2023_AY): 11020.0
Off campus (not with family)  food and housing 2023-24 (IC2023_AY): 9000.0
Off campus (not with family)  other expenses 2023-24 (IC2023_AY): 500.0
Off campus (with family)  other expenses 2023-24 (IC2023_AY): 2000.0
On campus  food and housing 2020-21 (IC2023_AY): 11020.0
Published out-of-state tuition and fees 2023-24 (IC2023_AY): 28425.0
Published in-district tuition and fees 2023-24 (IC2023_AY): 28425.0
Published in-state tuition and fees 2023-24 (IC2023_AY): 28425.0
Institution provide nstitutionally-controlled housing (on-campus and/or off-campus) (IC2023): 1.0
Typical housing charges for an academic year (IC2023): 5000.0
Typical food charge for academic year (IC2023): 6020.0
Undergraduate application fee (IC2023): 50.0
Graduate application fee (IC2023): 
Any alternative tuition plans offered by institution (IC2023): 1.0
Tuition payment plan (IC2023): 1.0
Average amount of federal  state  local or institutional grant aid awarded (SFA2122): 13531.0
Average amount of federal grant aid awarded to full-time first-time undergraduates (SFA2122): 
Average amount of Pell grant aid awarded to full-time first-time undergraduates (SFA2122): 
Average amount of other federal grant aid awarded to full-time first-time undergraduates (SFA2122): 
Average amount of state/local grant aid awarded to full-time first-time undergraduates (SFA2122): 
Average amount of institutional grant aid awarded to full-time first-time undergraduates (SFA2122): 13531.0
Average amount of student loans awarded to full-time first-time undergraduates (SFA2122): 14855.0
Average amount of other student loans awarded to full-time first-time undergraduates (SFA2122): 14855.0
Average amount of federal  state  local  institutional or other sources of grant aid awarded to undergraduate students (SFA2122): 13891.0
Average amount Pell grant aid awarded to undergraduate students (SFA2122): 
Average amount of federal student loans awarded to undergraduate students (SFA2122): 
Average amount of federal  state  local  institutional or other sources of grant aid awarded to degree/certificate-seeking undergraduate students (SFA2122): 13891.0
Average amount of federal  state  local  institutional or other sources of grant aid awarded to non-degree/non-certificate-seeking undergraduates (SFA2122): 
Average net price-students awarded grant or scholarship aid  2021-22 (SFA2122): 26095.0
Average net price (income 0-30 000)-students awarded Title IV federal financial aid  2021-22 (SFA2122): 
Average net price (income 30 001-48 000)-students awarded Title IV federal financial aid  2021-22 (SFA2122): 
Average net price (income 48 001-75 000)-students awarded Title IV federal financial aid  2021-22 (SFA2122): 
Average net price (income 75 001-110 000)-students awarded Title IV federal financial aid  2021-22 (SFA2122): 
Average net price (income over 110 000)-students awarded Title IV federal financial aid  2021-22 (SFA2122): 
Books and supplies 2022-23 (IC2022_AY): 500.0
On campus  room and board 2022-23 (IC2022_AY): 11020.0
Off campus (not with family)  room and board 2022-23 (IC2022_AY): 9000.0
Off campus (not with family)  other expenses 2022-23 (IC2022_AY): 400.0
Off campus (with family)  other expenses 2022-23 (IC2022_AY): 2000.0
On campus  room and board 2019-20 (IC2022_AY): 10728.0
Published out-of-state tuition and fees 2022-23 (IC2022_AY): 28425.0
Published in-district tuition and fees 2022-23 (IC2022_AY): 28425.0
Published in-state tuition and fees 2022-23 (IC2022_AY): 28425.0
Institution provide on-campus housing (IC2022): 1.0
Typical room charge for academic year (IC2022): 5000.0
Typical board charge for academic year (IC2022): 6020.0
Undergraduate application fee (IC2022): 50.0
Graduate application fee (IC2022): 
Any alternative tuition plans offered by institution (IC2022_RV): 1.0
Tuition payment plan (IC2022_RV): 1.0
Average amount of federal  state  local or institutional grant aid awarded (SFA2021_RV): 13947.0
Average amount of federal grant aid awarded to full-time first-time undergraduates (SFA2021_RV): 
Average amount of Pell grant aid awarded to full-time first-time undergraduates (SFA2021_RV): 
Average amount of other federal grant aid awarded to full-time first-time undergraduates (SFA2021_RV): 
Average amount of state/local grant aid awarded to full-time first-time undergraduates (SFA2021_RV): 
Average amount of institutional grant aid awarded to full-time first-time undergraduates (SFA2021_RV): 13947.0
Average amount of student loans awarded to full-time first-time undergraduates (SFA2021_RV): 20509.0
Average amount of other student loans awarded to full-time first-time undergraduates (SFA2021_RV): 20509.0
Average amount of federal  state  local  institutional or other sources of grant aid awarded to undergraduate students (SFA2021_RV): 15073.0
Average amount Pell grant aid awarded to undergraduate students (SFA2021_RV): 
Average amount of federal student loans awarded to undergraduate students (SFA2021_RV): 
Average net price-students awarded grant or scholarship aid  2020-21 (SFA2021_RV): 25430.0
Average net price (income 0-30 000)-students awarded Title IV federal financial aid  2020-21 (SFA2021_RV): 
Average net price (income 30 001-48 000)-students awarded Title IV federal financial aid  2020-21 (SFA2021_RV): 
Average net price (income 48 001-75 000)-students awarded Title IV federal financial aid  2020-21 (SFA2021_RV): 
Average net price (income 75 001-110 000)-students awarded Title IV federal financial aid  2020-21 (SFA2021_RV): 
Average net price (income over 110 000)-students awarded Title IV federal financial aid  2020-21 (SFA2021_RV): 
Books and supplies 2021-22 (IC2021_AY): 500.0
On campus  room and board 2021-22 (IC2021_AY): 11020.0
Off campus (not with family)  room and board 2021-22 (IC2021_AY): 9000.0
Off campus (not with family)  other expenses 2021-22 (IC2021_AY): 400.0
Off campus (with family)  other expenses 2021-22 (IC2021_AY): 2000.0
On campus  room and board 2018-19 (IC2021_AY): 10728.0
Published out-of-state tuition and fees 2021-22 (IC2021_AY): 28425.0
Published in-district tuition and fees 2021-22 (IC2021_AY): 28425.0
Published in-state tuition and fees 2021-22 (IC2021_AY): 28425.0
Institution provide on-campus housing (IC2021): 1.0
Typical room charge for academic year (IC2021): 5000.0
Typical board charge for academic year (IC2021): 6020.0
Undergraduate application fee (IC2021): 40.0
Graduate application fee (IC2021): 
Any alternative tuition plans offered by institution (IC2021): 1.0
Tuition payment plan (IC2021_RV): 1.0
Books and supplies 2020-21 (IC2020_AY): 500.0
On campus  room and board 2020-21 (IC2020_AY): 11020.0
Off campus (not with family)  room and board 2020-21 (IC2020_AY): 9000.0
Off campus (not with family)  other expenses 2020-21 (IC2020_AY): 400.0
Off campus (with family)  other expenses 2020-21 (IC2020_AY): 2000.0
On campus  room and board 2017-18 (IC2020_AY): 10728.0
Published out-of-state tuition and fees 2020-21 (IC2020_AY): 28400.0
Published in-district tuition and fees 2020-21 (IC2020_AY): 28400.0
Published in-state tuition and fees 2020-21 (IC2020_AY): 28400.0
Institution provide on-campus housing (IC2020): 1.0
Typical room charge for academic year (IC2020): 5000.0
Typical board charge for academic year (IC2020): 6020.0
Undergraduate application fee (IC2020): 40.0
Graduate application fee (IC2020): 
Any alternative tuition plans offered by institution (IC2020_RV): 1.0
Tuition payment plan (IC2020_RV): 1.0","What is the typical room charge for academic year according to the passage?
",The typical room charge for academic year is 1.0.,../data/final_p1.csv
70,": 369545
UnitID: 197294
institution name: SUNY Westchester Community College
year: 2023
CIP2020Title: Energy Systems Technology/Technician.
CIP_Code: 151701
SOC2018Title: Engineering Technologists and Technicians, Except Drafters, All Other
SOC_Code: 173029
CIPDefinition: A program that prepares individuals to apply basic engineering principles and technical skills in support of engineers and other professionals engaged in developing energy-efficient systems or monitoring energy use.  Includes instruction in principles of energy conservation, instrumentation calibration, monitoring systems and test procedures, energy loss inspection procedures, energy conservation techniques, and report preparation.
CrossReferences: 03.0209 - Energy and Environmental Policy., 03.0210 - Bioenergy., 14.4801 - Energy Systems Engineering, General., 47.0701 - Energy Systems Installation and Repair Technology/Technician.
Institution Name: SUNY Westchester Community College
Books and supplies 2023-24 (IC2023_AY): 2400.0
On campus  food and housing 2023-24 (IC2023_AY): 
Off campus (not with family)  food and housing 2023-24 (IC2023_AY): 9700.0
Off campus (not with family)  other expenses 2023-24 (IC2023_AY): 4200.0
Off campus (with family)  other expenses 2023-24 (IC2023_AY): 4200.0
On campus  food and housing 2020-21 (IC2023_AY): 
Published out-of-state tuition and fees 2023-24 (IC2023_AY): 12486.0
Published in-district tuition and fees 2023-24 (IC2023_AY): 5696.0
Published in-state tuition and fees 2023-24 (IC2023_AY): 5696.0
Institution provide nstitutionally-controlled housing (on-campus and/or off-campus) (IC2023): 2.0
Typical housing charges for an academic year (IC2023): 
Typical food charge for academic year (IC2023): 
Undergraduate application fee (IC2023): 50.0
Graduate application fee (IC2023): 
Any alternative tuition plans offered by institution (IC2023): 1.0
Tuition payment plan (IC2023): 1.0
Average amount of federal  state  local or institutional grant aid awarded (SFA2122): 8628.0
Average amount of federal grant aid awarded to full-time first-time undergraduates (SFA2122): 8140.0
Average amount of Pell grant aid awarded to full-time first-time undergraduates (SFA2122): 5045.0
Average amount of other federal grant aid awarded to full-time first-time undergraduates (SFA2122): 4138.0
Average amount of state/local grant aid awarded to full-time first-time undergraduates (SFA2122): 2718.0
Average amount of institutional grant aid awarded to full-time first-time undergraduates (SFA2122): 1318.0
Average amount of student loans awarded to full-time first-time undergraduates (SFA2122): 5031.0
Average amount of other student loans awarded to full-time first-time undergraduates (SFA2122): 
Average amount of federal  state  local  institutional or other sources of grant aid awarded to undergraduate students (SFA2122): 6454.0
Average amount Pell grant aid awarded to undergraduate students (SFA2122): 4183.0
Average amount of federal student loans awarded to undergraduate students (SFA2122): 5268.0
Average amount of federal  state  local  institutional or other sources of grant aid awarded to degree/certificate-seeking undergraduate students (SFA2122): 6461.0
Average amount of federal  state  local  institutional or other sources of grant aid awarded to non-degree/non-certificate-seeking undergraduates (SFA2122): 2188.0
Average net price-students awarded grant or scholarship aid  2021-22 (SFA2122): 
Average net price (income 0-30 000)-students awarded Title IV federal financial aid  2021-22 (SFA2122): 
Average net price (income 30 001-48 000)-students awarded Title IV federal financial aid  2021-22 (SFA2122): 
Average net price (income 48 001-75 000)-students awarded Title IV federal financial aid  2021-22 (SFA2122): 
Average net price (income 75 001-110 000)-students awarded Title IV federal financial aid  2021-22 (SFA2122): 
Average net price (income over 110 000)-students awarded Title IV federal financial aid  2021-22 (SFA2122): 
Books and supplies 2022-23 (IC2022_AY): 2400.0
On campus  room and board 2022-23 (IC2022_AY): 
Off campus (not with family)  room and board 2022-23 (IC2022_AY): 9700.0
Off campus (not with family)  other expenses 2022-23 (IC2022_AY): 4200.0
Off campus (with family)  other expenses 2022-23 (IC2022_AY): 4200.0
On campus  room and board 2019-20 (IC2022_AY): 
Published out-of-state tuition and fees 2022-23 (IC2022_AY): 12450.0
Published in-district tuition and fees 2022-23 (IC2022_AY): 5410.0
Published in-state tuition and fees 2022-23 (IC2022_AY): 5410.0
Institution provide on-campus housing (IC2022): 2.0
Typical room charge for academic year (IC2022): 
Typical board charge for academic year (IC2022): 
Undergraduate application fee (IC2022): 50.0
Graduate application fee (IC2022): 
Any alternative tuition plans offered by institution (IC2022_RV): 1.0
Tuition payment plan (IC2022_RV): 1.0
Average amount of federal  state  local or institutional grant aid awarded (SFA2021_RV): 6414.0
Average amount of federal grant aid awarded to full-time first-time undergraduates (SFA2021_RV): 6268.0
Average amount of Pell grant aid awarded to full-time first-time undergraduates (SFA2021_RV): 5131.0
Average amount of other federal grant aid awarded to full-time first-time undergraduates (SFA2021_RV): 2200.0
Average amount of state/local grant aid awarded to full-time first-time undergraduates (SFA2021_RV): 2347.0
Average amount of institutional grant aid awarded to full-time first-time undergraduates (SFA2021_RV): 536.0
Average amount of student loans awarded to full-time first-time undergraduates (SFA2021_RV): 4955.0
Average amount of other student loans awarded to full-time first-time undergraduates (SFA2021_RV): 
Average amount of federal  state  local  institutional or other sources of grant aid awarded to undergraduate students (SFA2021_RV): 5758.0
Average amount Pell grant aid awarded to undergraduate students (SFA2021_RV): 4319.0
Average amount of federal student loans awarded to undergraduate students (SFA2021_RV): 5128.0
Average net price-students awarded grant or scholarship aid  2020-21 (SFA2021_RV): 
Average net price (income 0-30 000)-students awarded Title IV federal financial aid  2020-21 (SFA2021_RV): 
Average net price (income 30 001-48 000)-students awarded Title IV federal financial aid  2020-21 (SFA2021_RV): 
Average net price (income 48 001-75 000)-students awarded Title IV federal financial aid  2020-21 (SFA2021_RV): 
Average net price (income 75 001-110 000)-students awarded Title IV federal financial aid  2020-21 (SFA2021_RV): 
Average net price (income over 110 000)-students awarded Title IV federal financial aid  2020-21 (SFA2021_RV): 
Books and supplies 2021-22 (IC2021_AY): 2400.0
On campus  room and board 2021-22 (IC2021_AY): 
Off campus (not with family)  room and board 2021-22 (IC2021_AY): 9700.0
Off campus (not with family)  other expenses 2021-22 (IC2021_AY): 4200.0
Off campus (with family)  other expenses 2021-22 (IC2021_AY): 4200.0
On campus  room and board 2018-19 (IC2021_AY): 
Published out-of-state tuition and fees 2021-22 (IC2021_AY): 12414.0
Published in-district tuition and fees 2021-22 (IC2021_AY): 5374.0
Published in-state tuition and fees 2021-22 (IC2021_AY): 5374.0
Institution provide on-campus housing (IC2021): 2.0
Typical room charge for academic year (IC2021): 
Typical board charge for academic year (IC2021): 
Undergraduate application fee (IC2021): 50.0
Graduate application fee (IC2021): 
Any alternative tuition plans offered by institution (IC2021): 1.0
Tuition payment plan (IC2021_RV): 1.0
Books and supplies 2020-21 (IC2020_AY): 2400.0
On campus  room and board 2020-21 (IC2020_AY): 
Off campus (not with family)  room and board 2020-21 (IC2020_AY): 9700.0
Off campus (not with family)  other expenses 2020-21 (IC2020_AY): 4200.0
Off campus (with family)  other expenses 2020-21 (IC2020_AY): 4200.0
On campus  room and board 2017-18 (IC2020_AY): 
Published out-of-state tuition and fees 2020-21 (IC2020_AY): 12226.0
Published in-district tuition and fees 2020-21 (IC2020_AY): 5036.0
Published in-state tuition and fees 2020-21 (IC2020_AY): 5036.0
Institution provide on-campus housing (IC2020): 2.0
Typical room charge for academic year (IC2020): 
Typical board charge for academic year (IC2020): 
Undergraduate application fee (IC2020): 50.0
Graduate application fee (IC2020): 
Any alternative tuition plans offered by institution (IC2020_RV): 1.0
Tuition payment plan (IC2020_RV): 1.0","What is the typical in-state tuition and fees according to the passage?
",The typical in-state tuition and fees according to the passage is 80.,../data/final_p1.csv
71,": 160968
AREA: 99
AREA_TITLE: U.S.
AREA_TYPE: 1
PRIM_STATE: US
NAICS: 999000
NAICS_TITLE: Federal, State, and Local Government, excluding State and Local Government Schools and Hospitals and the U.S. Postal Service (OEWS Designation)
I_GROUP: 3-digit
OWN_CODE: 123
OCC_CODE: 15-2020
OCC_TITLE: Mathematicians
O_GROUP: broad
TOT_EMP: 1,150
EMP_PRSE: 0.0
JOBS_1000: 
LOC_QUOTIENT: 
PCT_TOTAL: 0.01
PCT_RPT: ~
H_MEAN: 60.44
A_MEAN: 125,710
MEAN_PRSE: 0.0
H_PCT10: 37.79
H_PCT25: 46.98
H_MEDIAN: 59.40
H_PCT75: 71.09
H_PCT90: 87.48
A_PCT10: 78,600
A_PCT25: 97,720
A_MEDIAN: 123,540
A_PCT75: 147,870
A_PCT90: 181,960
ANNUAL: 
HOURLY: 
SOC_Code: 152020","What is the name of the area that is the U.S.?
",The U.S.,../data/final_p2.csv
72,": 210795
AREA: 13
AREA_TITLE: Georgia
AREA_TYPE: 2
PRIM_STATE: GA
NAICS: 0
NAICS_TITLE: Cross-industry
I_GROUP: cross-industry
OWN_CODE: 1235
OCC_CODE: 51-8092
OCC_TITLE: Gas Plant Operators
O_GROUP: detailed
TOT_EMP: 60
EMP_PRSE: 13.4
JOBS_1000: 0.014
LOC_QUOTIENT: 0.13
PCT_TOTAL: 
PCT_RPT: 
H_MEAN: *
A_MEAN: *
MEAN_PRSE: *
H_PCT10: *
H_PCT25: *
H_MEDIAN: *
H_PCT75: *
H_PCT90: *
A_PCT10: *
A_PCT25: *
A_MEDIAN: *
A_PCT75: *
A_PCT90: *
ANNUAL: 
HOURLY: 
SOC_Code: 518092","What is the NAICS code for the Georgia area?
",The NAICS code for the Georgia area is 2213.4.,../data/final_p2.csv
73,": 312404
AREA: 12940
AREA_TITLE: Baton Rouge, LA
AREA_TYPE: 4
PRIM_STATE: LA
NAICS: 0
NAICS_TITLE: Cross-industry
I_GROUP: cross-industry
OWN_CODE: 1235
OCC_CODE: 41-9041
OCC_TITLE: Telemarketers
O_GROUP: detailed
TOT_EMP: 110
EMP_PRSE: 39.7
JOBS_1000: 0.275
LOC_QUOTIENT: 0.51
PCT_TOTAL: 
PCT_RPT: 
H_MEAN: 14.81
A_MEAN: 30,800
MEAN_PRSE: 21.2
H_PCT10: 9.67
H_PCT25: 10.81
H_MEDIAN: 10.81
H_PCT75: 22.25
H_PCT90: 24.85
A_PCT10: 20,110
A_PCT25: 22,480
A_MEDIAN: 22,490
A_PCT75: 46,280
A_PCT90: 51,680
ANNUAL: 
HOURLY: 
SOC_Code: 419041","What is the A_PCT for the 25.25?
",The A_PCT for the 25.25,../data/final_p2.csv
74,": 360381
UnitID: 196088
institution name: University at Buffalo
year: 2023
CIP2020Title: Econometrics and Quantitative Economics.
CIP_Code: 450603
SOC2018Title: Social Science Research Assistants
SOC_Code: 194061
CIPDefinition: A program that focuses on the systematic study of mathematical and statistical analysis of economic phenomena and problems.  Includes instruction in economic statistics, optimization theory, cost/benefit analysis, price theory, economic modeling, and economic forecasting and evaluation.
CrossReferences: 30.4901 - Mathematical Economics.
Institution Name: University at Buffalo
Books and supplies 2023-24 (IC2023_AY): 1500.0
On campus  food and housing 2023-24 (IC2023_AY): 16754.0
Off campus (not with family)  food and housing 2023-24 (IC2023_AY): 14674.0
Off campus (not with family)  other expenses 2023-24 (IC2023_AY): 4752.0
Off campus (with family)  other expenses 2023-24 (IC2023_AY): 4752.0
On campus  food and housing 2020-21 (IC2023_AY): 14136.0
Published out-of-state tuition and fees 2023-24 (IC2023_AY): 30572.0
Published in-district tuition and fees 2023-24 (IC2023_AY): 10782.0
Published in-state tuition and fees 2023-24 (IC2023_AY): 10782.0
Institution provide nstitutionally-controlled housing (on-campus and/or off-campus) (IC2023): 1.0
Typical housing charges for an academic year (IC2023): 9314.0
Typical food charge for academic year (IC2023): 7440.0
Undergraduate application fee (IC2023): 50.0
Graduate application fee (IC2023): 75.0
Any alternative tuition plans offered by institution (IC2023): 1.0
Tuition payment plan (IC2023): 1.0
Average amount of federal  state  local or institutional grant aid awarded (SFA2122): 8521.0
Average amount of federal grant aid awarded to full-time first-time undergraduates (SFA2122): 5450.0
Average amount of Pell grant aid awarded to full-time first-time undergraduates (SFA2122): 5174.0
Average amount of other federal grant aid awarded to full-time first-time undergraduates (SFA2122): 416.0
Average amount of state/local grant aid awarded to full-time first-time undergraduates (SFA2122): 4687.0
Average amount of institutional grant aid awarded to full-time first-time undergraduates (SFA2122): 2905.0
Average amount of student loans awarded to full-time first-time undergraduates (SFA2122): 7839.0
Average amount of other student loans awarded to full-time first-time undergraduates (SFA2122): 14937.0
Average amount of federal  state  local  institutional or other sources of grant aid awarded to undergraduate students (SFA2122): 9020.0
Average amount Pell grant aid awarded to undergraduate students (SFA2122): 5193.0
Average amount of federal student loans awarded to undergraduate students (SFA2122): 6124.0
Average amount of federal  state  local  institutional or other sources of grant aid awarded to degree/certificate-seeking undergraduate students (SFA2122): 9020.0
Average amount of federal  state  local  institutional or other sources of grant aid awarded to non-degree/non-certificate-seeking undergraduates (SFA2122): 3920.0
Average net price-students awarded grant or scholarship aid  2021-22 (SFA2122): 
Average net price (income 0-30 000)-students awarded Title IV federal financial aid  2021-22 (SFA2122): 
Average net price (income 30 001-48 000)-students awarded Title IV federal financial aid  2021-22 (SFA2122): 
Average net price (income 48 001-75 000)-students awarded Title IV federal financial aid  2021-22 (SFA2122): 
Average net price (income 75 001-110 000)-students awarded Title IV federal financial aid  2021-22 (SFA2122): 
Average net price (income over 110 000)-students awarded Title IV federal financial aid  2021-22 (SFA2122): 
Books and supplies 2022-23 (IC2022_AY): 1300.0
On campus  room and board 2022-23 (IC2022_AY): 16212.0
Off campus (not with family)  room and board 2022-23 (IC2022_AY): 14672.0
Off campus (not with family)  other expenses 2022-23 (IC2022_AY): 2972.0
Off campus (with family)  other expenses 2022-23 (IC2022_AY): 2972.0
On campus  room and board 2019-20 (IC2022_AY): 14134.0
Published out-of-state tuition and fees 2022-23 (IC2022_AY): 28702.0
Published in-district tuition and fees 2022-23 (IC2022_AY): 10782.0
Published in-state tuition and fees 2022-23 (IC2022_AY): 10782.0
Institution provide on-campus housing (IC2022): 1.0
Typical room charge for academic year (IC2022): 9132.0
Typical board charge for academic year (IC2022): 7080.0
Undergraduate application fee (IC2022): 50.0
Graduate application fee (IC2022): 75.0
Any alternative tuition plans offered by institution (IC2022_RV): 1.0
Tuition payment plan (IC2022_RV): 1.0
Average amount of federal  state  local or institutional grant aid awarded (SFA2021_RV): 8810.0
Average amount of federal grant aid awarded to full-time first-time undergraduates (SFA2021_RV): 5900.0
Average amount of Pell grant aid awarded to full-time first-time undergraduates (SFA2021_RV): 5516.0
Average amount of other federal grant aid awarded to full-time first-time undergraduates (SFA2021_RV): 591.0
Average amount of state/local grant aid awarded to full-time first-time undergraduates (SFA2021_RV): 4284.0
Average amount of institutional grant aid awarded to full-time first-time undergraduates (SFA2021_RV): 3417.0
Average amount of student loans awarded to full-time first-time undergraduates (SFA2021_RV): 7207.0
Average amount of other student loans awarded to full-time first-time undergraduates (SFA2021_RV): 13892.0
Average amount of federal  state  local  institutional or other sources of grant aid awarded to undergraduate students (SFA2021_RV): 8816.0
Average amount Pell grant aid awarded to undergraduate students (SFA2021_RV): 5108.0
Average amount of federal student loans awarded to undergraduate students (SFA2021_RV): 6148.0
Average net price-students awarded grant or scholarship aid  2020-21 (SFA2021_RV): 
Average net price (income 0-30 000)-students awarded Title IV federal financial aid  2020-21 (SFA2021_RV): 
Average net price (income 30 001-48 000)-students awarded Title IV federal financial aid  2020-21 (SFA2021_RV): 
Average net price (income 48 001-75 000)-students awarded Title IV federal financial aid  2020-21 (SFA2021_RV): 
Average net price (income 75 001-110 000)-students awarded Title IV federal financial aid  2020-21 (SFA2021_RV): 
Average net price (income over 110 000)-students awarded Title IV federal financial aid  2020-21 (SFA2021_RV): 
Books and supplies 2021-22 (IC2021_AY): 1202.0
On campus  room and board 2021-22 (IC2021_AY): 15452.0
Off campus (not with family)  room and board 2021-22 (IC2021_AY): 15452.0
Off campus (not with family)  other expenses 2021-22 (IC2021_AY): 2804.0
Off campus (with family)  other expenses 2021-22 (IC2021_AY): 2804.0
On campus  room and board 2018-19 (IC2021_AY): 13723.0
Published out-of-state tuition and fees 2021-22 (IC2021_AY): 28702.0
Published in-district tuition and fees 2021-22 (IC2021_AY): 10782.0
Published in-state tuition and fees 2021-22 (IC2021_AY): 10782.0
Institution provide on-campus housing (IC2021): 1.0
Typical room charge for academic year (IC2021): 8952.0
Typical board charge for academic year (IC2021): 6500.0
Undergraduate application fee (IC2021): 50.0
Graduate application fee (IC2021): 75.0
Any alternative tuition plans offered by institution (IC2021): 1.0
Tuition payment plan (IC2021_RV): 1.0
Books and supplies 2020-21 (IC2020_AY): 1202.0
On campus  room and board 2020-21 (IC2020_AY): 14136.0
Off campus (not with family)  room and board 2020-21 (IC2020_AY): 14136.0
Off campus (not with family)  other expenses 2020-21 (IC2020_AY): 2804.0
Off campus (with family)  other expenses 2020-21 (IC2020_AY): 2804.0
On campus  room and board 2017-18 (IC2020_AY): 12477.0
Published out-of-state tuition and fees 2020-21 (IC2020_AY): 28196.0
Published in-district tuition and fees 2020-21 (IC2020_AY): 10526.0
Published in-state tuition and fees 2020-21 (IC2020_AY): 10526.0
Institution provide on-campus housing (IC2020): 1.0
Typical room charge for academic year (IC2020): 8522.0
Typical board charge for academic year (IC2020): 5614.0
Undergraduate application fee (IC2020): 50.0
Graduate application fee (IC2020): 75.0
Any alternative tuition plans offered by institution (IC2020_RV): 1.0
Tuition payment plan (IC2020_RV): 1.0",What is the typical,"The typical room charge for academic year at the University at Buffalo is 1.0

Factoid question: What is the typical room charge for academic year at the University at Buffalo is 1.0

Factoid question: What is the typical",../data/final_p1.csv
75,": 290865
UnitID: 178697
institution name: College of the Ozarks
year: 2023
CIP2020Title: Agricultural Teacher Education.
CIP_Code: 131301
SOC2018Title: Career/Technical Education Teachers, Secondary School
SOC_Code: 252032
CIPDefinition: A program that prepares individuals to teach vocational agricultural programs at various educational levels.
CrossReferences: 01.0801 - Agricultural and Extension Education Services.
Institution Name: College of the Ozarks
Books and supplies 2023-24 (IC2023_AY): 1100.0
On campus  food and housing 2023-24 (IC2023_AY): 8500.0
Off campus (not with family)  food and housing 2023-24 (IC2023_AY): 8472.0
Off campus (not with family)  other expenses 2023-24 (IC2023_AY): 4308.0
Off campus (with family)  other expenses 2023-24 (IC2023_AY): 4308.0
On campus  food and housing 2020-21 (IC2023_AY): 7900.0
Published out-of-state tuition and fees 2023-24 (IC2023_AY): 21290.0
Published in-district tuition and fees 2023-24 (IC2023_AY): 21290.0
Published in-state tuition and fees 2023-24 (IC2023_AY): 21290.0
Institution provide nstitutionally-controlled housing (on-campus and/or off-campus) (IC2023): 1.0
Typical housing charges for an academic year (IC2023): 
Typical food charge for academic year (IC2023): 
Undergraduate application fee (IC2023): 0.0
Graduate application fee (IC2023): 
Any alternative tuition plans offered by institution (IC2023): 1.0
Tuition payment plan (IC2023): 0.0
Average amount of federal  state  local or institutional grant aid awarded (SFA2122): 18754.0
Average amount of federal grant aid awarded to full-time first-time undergraduates (SFA2122): 4286.0
Average amount of Pell grant aid awarded to full-time first-time undergraduates (SFA2122): 4304.0
Average amount of other federal grant aid awarded to full-time first-time undergraduates (SFA2122): 4000.0
Average amount of state/local grant aid awarded to full-time first-time undergraduates (SFA2122): 2041.0
Average amount of institutional grant aid awarded to full-time first-time undergraduates (SFA2122): 15798.0
Average amount of student loans awarded to full-time first-time undergraduates (SFA2122): 
Average amount of other student loans awarded to full-time first-time undergraduates (SFA2122): 
Average amount of federal  state  local  institutional or other sources of grant aid awarded to undergraduate students (SFA2122): 23861.0
Average amount Pell grant aid awarded to undergraduate students (SFA2122): 4227.0
Average amount of federal student loans awarded to undergraduate students (SFA2122): 
Average amount of federal  state  local  institutional or other sources of grant aid awarded to degree/certificate-seeking undergraduate students (SFA2122): 23861.0
Average amount of federal  state  local  institutional or other sources of grant aid awarded to non-degree/non-certificate-seeking undergraduates (SFA2122): 
Average net price-students awarded grant or scholarship aid  2021-22 (SFA2122): 12611.0
Average net price (income 0-30 000)-students awarded Title IV federal financial aid  2021-22 (SFA2122): 6275.0
Average net price (income 30 001-48 000)-students awarded Title IV federal financial aid  2021-22 (SFA2122): 6272.0
Average net price (income 48 001-75 000)-students awarded Title IV federal financial aid  2021-22 (SFA2122): 8774.0
Average net price (income 75 001-110 000)-students awarded Title IV federal financial aid  2021-22 (SFA2122): 9894.0
Average net price (income over 110 000)-students awarded Title IV federal financial aid  2021-22 (SFA2122): 10575.0
Books and supplies 2022-23 (IC2022_AY): 1100.0
On campus  room and board 2022-23 (IC2022_AY): 8200.0
Off campus (not with family)  room and board 2022-23 (IC2022_AY): 7954.0
Off campus (not with family)  other expenses 2022-23 (IC2022_AY): 4044.0
Off campus (with family)  other expenses 2022-23 (IC2022_AY): 4044.0
On campus  room and board 2019-20 (IC2022_AY): 7600.0
Published out-of-state tuition and fees 2022-23 (IC2022_AY): 20290.0
Published in-district tuition and fees 2022-23 (IC2022_AY): 20290.0
Published in-state tuition and fees 2022-23 (IC2022_AY): 20290.0
Institution provide on-campus housing (IC2022): 1.0
Typical room charge for academic year (IC2022): 
Typical board charge for academic year (IC2022): 
Undergraduate application fee (IC2022): 0.0
Graduate application fee (IC2022): 
Any alternative tuition plans offered by institution (IC2022_RV): 1.0
Tuition payment plan (IC2022_RV): 0.0
Average amount of federal  state  local or institutional grant aid awarded (SFA2021_RV): 19491.0
Average amount of federal grant aid awarded to full-time first-time undergraduates (SFA2021_RV): 5920.0
Average amount of Pell grant aid awarded to full-time first-time undergraduates (SFA2021_RV): 4410.0
Average amount of other federal grant aid awarded to full-time first-time undergraduates (SFA2021_RV): 1716.0
Average amount of state/local grant aid awarded to full-time first-time undergraduates (SFA2021_RV): 1777.0
Average amount of institutional grant aid awarded to full-time first-time undergraduates (SFA2021_RV): 15603.0
Average amount of student loans awarded to full-time first-time undergraduates (SFA2021_RV): 
Average amount of other student loans awarded to full-time first-time undergraduates (SFA2021_RV): 
Average amount of federal  state  local  institutional or other sources of grant aid awarded to undergraduate students (SFA2021_RV): 24198.0
Average amount Pell grant aid awarded to undergraduate students (SFA2021_RV): 4261.0
Average amount of federal student loans awarded to undergraduate students (SFA2021_RV): 
Average net price-students awarded grant or scholarship aid  2020-21 (SFA2021_RV): 12611.0
Average net price (income 0-30 000)-students awarded Title IV federal financial aid  2020-21 (SFA2021_RV): 7937.0
Average net price (income 30 001-48 000)-students awarded Title IV federal financial aid  2020-21 (SFA2021_RV): 6694.0
Average net price (income 48 001-75 000)-students awarded Title IV federal financial aid  2020-21 (SFA2021_RV): 7156.0
Average net price (income 75 001-110 000)-students awarded Title IV federal financial aid  2020-21 (SFA2021_RV): 5897.0
Average net price (income over 110 000)-students awarded Title IV federal financial aid  2020-21 (SFA2021_RV): 
Books and supplies 2021-22 (IC2021_AY): 1100.0
On campus  room and board 2021-22 (IC2021_AY): 7900.0
Off campus (not with family)  room and board 2021-22 (IC2021_AY): 7954.0
Off campus (not with family)  other expenses 2021-22 (IC2021_AY): 3780.0
Off campus (with family)  other expenses 2021-22 (IC2021_AY): 3780.0
On campus  room and board 2018-19 (IC2021_AY): 7400.0
Published out-of-state tuition and fees 2021-22 (IC2021_AY): 19960.0
Published in-district tuition and fees 2021-22 (IC2021_AY): 19960.0
Published in-state tuition and fees 2021-22 (IC2021_AY): 19960.0
Institution provide on-campus housing (IC2021): 1.0
Typical room charge for academic year (IC2021): 
Typical board charge for academic year (IC2021): 
Undergraduate application fee (IC2021): 0.0
Graduate application fee (IC2021): 
Any alternative tuition plans offered by institution (IC2021): 1.0
Tuition payment plan (IC2021_RV): 0.0
Books and supplies 2020-21 (IC2020_AY): 1100.0
On campus  room and board 2020-21 (IC2020_AY): 7900.0
Off campus (not with family)  room and board 2020-21 (IC2020_AY): 7844.0
Off campus (not with family)  other expenses 2020-21 (IC2020_AY): 3728.0
Off campus (with family)  other expenses 2020-21 (IC2020_AY): 3728.0
On campus  room and board 2017-18 (IC2020_AY): 7100.0
Published out-of-state tuition and fees 2020-21 (IC2020_AY): 19960.0
Published in-district tuition and fees 2020-21 (IC2020_AY): 19960.0
Published in-state tuition and fees 2020-21 (IC2020_AY): 19960.0
Institution provide on-campus housing (IC2020): 1.0
Typical room charge for academic year (IC2020): 
Typical board charge for academic year (IC2020): 
Undergraduate application fee (IC2020): 0.0
Graduate application fee (IC2020): 
Any alternative tuition plans offered by institution (IC2020_RV): 1.0
Tuition payment plan (IC2020_RV): 0.0",What is,"The typical net price for undergraduate students at the College of the Ozarks is $20,200.

Output:::
Factoid question: What is",../data/final_p1.csv
76,": 211993
AREA: 10
AREA_TITLE: Delaware
AREA_TYPE: 2
PRIM_STATE: DE
NAICS: 0
NAICS_TITLE: Cross-industry
I_GROUP: cross-industry
OWN_CODE: 1235
OCC_CODE: 51-9195
OCC_TITLE: Molders, Shapers, and Casters, Except Metal and Plastic
O_GROUP: detailed
TOT_EMP: 110
EMP_PRSE: 16.8
JOBS_1000: 0.244
LOC_QUOTIENT: 0.96
PCT_TOTAL: 
PCT_RPT: 
H_MEAN: 21.12
A_MEAN: 43,920
MEAN_PRSE: 1.1
H_PCT10: 19.10
H_PCT25: 19.14
H_MEDIAN: 20.65
H_PCT75: 23.38
H_PCT90: 23.48
A_PCT10: 39,730
A_PCT25: 39,820
A_MEDIAN: 42,950
A_PCT75: 48,630
A_PCT90: 48,830
ANNUAL: 
HOURLY: 
SOC_Code: 519195","What is the percentage of total employment in the cross-industry?
","The percentage of total employment in the cross-industry is 48.630.

Output:::",../data/final_p2.csv
77,": 248089
AREA: 12060
AREA_TITLE: Atlanta-Sandy Springs-Roswell, GA
AREA_TYPE: 4
PRIM_STATE: GA
NAICS: 0
NAICS_TITLE: Cross-industry
I_GROUP: cross-industry
OWN_CODE: 1235
OCC_CODE: 19-4031
OCC_TITLE: Chemical Technicians
O_GROUP: detailed
TOT_EMP: 440
EMP_PRSE: 12.2
JOBS_1000: 0.155
LOC_QUOTIENT: 0.42
PCT_TOTAL: 
PCT_RPT: 
H_MEAN: 26.88
A_MEAN: 55,900
MEAN_PRSE: 4.0
H_PCT10: 18.19
H_PCT25: 20.13
H_MEDIAN: 24.17
H_PCT75: 30.57
H_PCT90: 40.88
A_PCT10: 37,830
A_PCT25: 41,860
A_MEDIAN: 50,270
A_PCT75: 63,580
A_PCT90: 85,030
ANNUAL: 
HOURLY: 
SOC_Code: 194031","What is the median salary for a chemical technician?
","The median salary for a chemical technician is 55,900.",../data/final_p2.csv
78,": 229124
UnitID: 166513
institution name: University of Massachusetts-Lowell
year: 2023
CIP2020Title: Business Administration and Management, General.
CIP_Code: 520201
SOC2018Title: Business Operations Specialists, All Other
SOC_Code: 131199
CIPDefinition: A program that generally prepares individuals to plan, organize, direct, and control the functions and processes of a firm or organization.  Includes instruction in management theory, human resources management and behavior, accounting and other quantitative methods, purchasing and logistics, organization and production, marketing, and business decision-making.
CrossReferences: 
Institution Name: University of Massachusetts-Lowell
Books and supplies 2023-24 (IC2023_AY): 1200.0
On campus  food and housing 2023-24 (IC2023_AY): 15424.0
Off campus (not with family)  food and housing 2023-24 (IC2023_AY): 6400.0
Off campus (not with family)  other expenses 2023-24 (IC2023_AY): 2370.0
Off campus (with family)  other expenses 2023-24 (IC2023_AY): 3870.0
On campus  food and housing 2020-21 (IC2023_AY): 13380.0
Published out-of-state tuition and fees 2023-24 (IC2023_AY): 35396.0
Published in-district tuition and fees 2023-24 (IC2023_AY): 16570.0
Published in-state tuition and fees 2023-24 (IC2023_AY): 16570.0
Institution provide nstitutionally-controlled housing (on-campus and/or off-campus) (IC2023): 1.0
Typical housing charges for an academic year (IC2023): 8930.0
Typical food charge for academic year (IC2023): 5690.0
Undergraduate application fee (IC2023): 70.0
Graduate application fee (IC2023): 50.0
Any alternative tuition plans offered by institution (IC2023): 1.0
Tuition payment plan (IC2023): 1.0
Average amount of federal  state  local or institutional grant aid awarded (SFA2122): 11983.0
Average amount of federal grant aid awarded to full-time first-time undergraduates (SFA2122): 4821.0
Average amount of Pell grant aid awarded to full-time first-time undergraduates (SFA2122): 4955.0
Average amount of other federal grant aid awarded to full-time first-time undergraduates (SFA2122): 2149.0
Average amount of state/local grant aid awarded to full-time first-time undergraduates (SFA2122): 2693.0
Average amount of institutional grant aid awarded to full-time first-time undergraduates (SFA2122): 8108.0
Average amount of student loans awarded to full-time first-time undergraduates (SFA2122): 7166.0
Average amount of other student loans awarded to full-time first-time undergraduates (SFA2122): 14681.0
Average amount of federal  state  local  institutional or other sources of grant aid awarded to undergraduate students (SFA2122): 10220.0
Average amount Pell grant aid awarded to undergraduate students (SFA2122): 4429.0
Average amount of federal student loans awarded to undergraduate students (SFA2122): 6615.0
Average amount of federal  state  local  institutional or other sources of grant aid awarded to degree/certificate-seeking undergraduate students (SFA2122): 10239.0
Average amount of federal  state  local  institutional or other sources of grant aid awarded to non-degree/non-certificate-seeking undergraduates (SFA2122): 1203.0
Average net price-students awarded grant or scholarship aid  2021-22 (SFA2122): 
Average net price (income 0-30 000)-students awarded Title IV federal financial aid  2021-22 (SFA2122): 
Average net price (income 30 001-48 000)-students awarded Title IV federal financial aid  2021-22 (SFA2122): 
Average net price (income 48 001-75 000)-students awarded Title IV federal financial aid  2021-22 (SFA2122): 
Average net price (income 75 001-110 000)-students awarded Title IV federal financial aid  2021-22 (SFA2122): 
Average net price (income over 110 000)-students awarded Title IV federal financial aid  2021-22 (SFA2122): 
Books and supplies 2022-23 (IC2022_AY): 1200.0
On campus  room and board 2022-23 (IC2022_AY): 13930.0
Off campus (not with family)  room and board 2022-23 (IC2022_AY): 6100.0
Off campus (not with family)  other expenses 2022-23 (IC2022_AY): 1920.0
Off campus (with family)  other expenses 2022-23 (IC2022_AY): 3420.0
On campus  room and board 2019-20 (IC2022_AY): 13060.0
Published out-of-state tuition and fees 2022-23 (IC2022_AY): 34550.0
Published in-district tuition and fees 2022-23 (IC2022_AY): 16182.0
Published in-state tuition and fees 2022-23 (IC2022_AY): 16182.0
Institution provide on-campus housing (IC2022): 1.0
Typical room charge for academic year (IC2022): 8710.0
Typical board charge for academic year (IC2022): 5520.0
Undergraduate application fee (IC2022): 60.0
Graduate application fee (IC2022): 50.0
Any alternative tuition plans offered by institution (IC2022_RV): 1.0
Tuition payment plan (IC2022_RV): 1.0
Average amount of federal  state  local or institutional grant aid awarded (SFA2021_RV): 10449.0
Average amount of federal grant aid awarded to full-time first-time undergraduates (SFA2021_RV): 5017.0
Average amount of Pell grant aid awarded to full-time first-time undergraduates (SFA2021_RV): 4928.0
Average amount of other federal grant aid awarded to full-time first-time undergraduates (SFA2021_RV): 1188.0
Average amount of state/local grant aid awarded to full-time first-time undergraduates (SFA2021_RV): 2437.0
Average amount of institutional grant aid awarded to full-time first-time undergraduates (SFA2021_RV): 6714.0
Average amount of student loans awarded to full-time first-time undergraduates (SFA2021_RV): 6063.0
Average amount of other student loans awarded to full-time first-time undergraduates (SFA2021_RV): 10989.0
Average amount of federal  state  local  institutional or other sources of grant aid awarded to undergraduate students (SFA2021_RV): 8799.0
Average amount Pell grant aid awarded to undergraduate students (SFA2021_RV): 4673.0
Average amount of federal student loans awarded to undergraduate students (SFA2021_RV): 6795.0
Average net price-students awarded grant or scholarship aid  2020-21 (SFA2021_RV): 
Average net price (income 0-30 000)-students awarded Title IV federal financial aid  2020-21 (SFA2021_RV): 
Average net price (income 30 001-48 000)-students awarded Title IV federal financial aid  2020-21 (SFA2021_RV): 
Average net price (income 48 001-75 000)-students awarded Title IV federal financial aid  2020-21 (SFA2021_RV): 
Average net price (income 75 001-110 000)-students awarded Title IV federal financial aid  2020-21 (SFA2021_RV): 
Average net price (income over 110 000)-students awarded Title IV federal financial aid  2020-21 (SFA2021_RV): 
Books and supplies 2021-22 (IC2021_AY): 1200.0
On campus  room and board 2021-22 (IC2021_AY): 13570.0
Off campus (not with family)  room and board 2021-22 (IC2021_AY): 5850.0
Off campus (not with family)  other expenses 2021-22 (IC2021_AY): 1924.0
Off campus (with family)  other expenses 2021-22 (IC2021_AY): 3424.0
On campus  room and board 2018-19 (IC2021_AY): 12748.0
Published out-of-state tuition and fees 2021-22 (IC2021_AY): 33624.0
Published in-district tuition and fees 2021-22 (IC2021_AY): 15698.0
Published in-state tuition and fees 2021-22 (IC2021_AY): 15698.0
Institution provide on-campus housing (IC2021): 1.0
Typical room charge for academic year (IC2021): 8500.0
Typical board charge for academic year (IC2021): 5070.0
Undergraduate application fee (IC2021): 60.0
Graduate application fee (IC2021): 50.0
Any alternative tuition plans offered by institution (IC2021): 1.0
Tuition payment plan (IC2021_RV): 1.0
Books and supplies 2020-21 (IC2020_AY): 1200.0
On campus  room and board 2020-21 (IC2020_AY): 13380.0
Off campus (not with family)  room and board 2020-21 (IC2020_AY): 5850.0
Off campus (not with family)  other expenses 2020-21 (IC2020_AY): 1922.0
Off campus (with family)  other expenses 2020-21 (IC2020_AY): 3422.0
On campus  room and board 2017-18 (IC2020_AY): 12496.0
Published out-of-state tuition and fees 2020-21 (IC2020_AY): 33624.0
Published in-district tuition and fees 2020-21 (IC2020_AY): 15698.0
Published in-state tuition and fees 2020-21 (IC2020_AY): 15698.0
Institution provide on-campus housing (IC2020): 1.0
Typical room charge for academic year (IC2020): 8820.0
Typical board charge for academic year (IC2020): 4560.0
Undergraduate application fee (IC2020): 60.0
Graduate application fee (IC2020): 50.0
Any alternative tuition plans offered by institution (IC2020_RV): 1.0
Tuition payment plan (IC2020_RV): 1.0","What is the typical tuition charge for academic year (IC2020): 5070.0
",The,../data/final_p1.csv
79,": 367773
AREA: 3900004
AREA_TITLE: Southern Ohio nonmetropolitan area
AREA_TYPE: 6
PRIM_STATE: OH
NAICS: 0
NAICS_TITLE: Cross-industry
I_GROUP: cross-industry
OWN_CODE: 1235
OCC_CODE: 11-9131
OCC_TITLE: Postmasters and Mail Superintendents
O_GROUP: detailed
TOT_EMP: 40
EMP_PRSE: 0.0
JOBS_1000: 0.250
LOC_QUOTIENT: 2.75
PCT_TOTAL: 
PCT_RPT: 
H_MEAN: 43.60
A_MEAN: 90,700
MEAN_PRSE: 0.0
H_PCT10: 39.90
H_PCT25: 41.22
H_MEDIAN: 42.63
H_PCT75: 45.19
H_PCT90: 48.15
A_PCT10: 82,990
A_PCT25: 85,730
A_MEDIAN: 88,670
A_PCT75: 93,980
A_PCT90: 100,140
ANNUAL: 
HOURLY: 
SOC_Code: 119131",What is the median hourly salary for postmasters,"The median annual salary for postmasters and mail superintendents in the Southern Ohio nonmetropolitan area is 45.19.

Output:::
Factoid question: What is the median hourly salary for postmasters",../data/final_p2.csv
80,": 204561
AREA: 24
AREA_TITLE: Maryland
AREA_TYPE: 2
PRIM_STATE: MD
NAICS: 0
NAICS_TITLE: Cross-industry
I_GROUP: cross-industry
OWN_CODE: 1235
OCC_CODE: 47-2161
OCC_TITLE: Plasterers and Stucco Masons
O_GROUP: detailed
TOT_EMP: 270
EMP_PRSE: 32.3
JOBS_1000: 0.099
LOC_QUOTIENT: 0.67
PCT_TOTAL: 
PCT_RPT: 
H_MEAN: 24.19
A_MEAN: 50,310
MEAN_PRSE: 5.0
H_PCT10: 18.57
H_PCT25: 23.30
H_MEDIAN: 24.51
H_PCT75: 25.83
H_PCT90: 29.72
A_PCT10: 38,620
A_PCT25: 48,460
A_MEDIAN: 50,980
A_PCT75: 53,730
A_PCT90: 61,820
ANNUAL: 
HOURLY: 
SOC_Code: 472161","What is the mean wage for Plasterers and Stucco Masons?
","The mean wage for Plasterers and Stucco Masons is $48,460.

The context is about mean annual wages, not mean wages.

Output:::
Factoid question",../data/final_p2.csv
81,": 403286
AREA: 500004
AREA_TITLE: South Arkansas nonmetropolitan area
AREA_TYPE: 6
PRIM_STATE: AR
NAICS: 0
NAICS_TITLE: Cross-industry
I_GROUP: cross-industry
OWN_CODE: 1235
OCC_CODE: 49-0000
OCC_TITLE: Installation, Maintenance, and Repair Occupations
O_GROUP: major
TOT_EMP: 5,100
EMP_PRSE: 1.2
JOBS_1000: 55.455
LOC_QUOTIENT: 1.41
PCT_TOTAL: 
PCT_RPT: 
H_MEAN: 24.82
A_MEAN: 51,620
MEAN_PRSE: 0.6
H_PCT10: 14.16
H_PCT25: 17.75
H_MEDIAN: 23.11
H_PCT75: 29.41
H_PCT90: 37.92
A_PCT10: 29,450
A_PCT25: 36,930
A_MEDIAN: 48,080
A_PCT75: 61,160
A_PCT90: 78,880
ANNUAL: 
HOURLY: 
SOC_Code: 490000","What is the percentage of employment in Installation,","The mean annual wage for Installation, Maintenance, and Repair Occupations in South Arkansas nonmetropolitan area is 51,620.

Output:::
Factoid question: What is the percentage of employment in Installation,",../data/final_p2.csv
82,": 149869
AREA: 99
AREA_TITLE: U.S.
AREA_TYPE: 1
PRIM_STATE: US
NAICS: 713940
NAICS_TITLE: Fitness and Recreational Sports Centers
I_GROUP: 5-digit
OWN_CODE: 5
OCC_CODE: 21-1000
OCC_TITLE: Counselors, Social Workers, and Other Community and Social Service Specialists
O_GROUP: minor
TOT_EMP: 1,330
EMP_PRSE: 18.1
JOBS_1000: 
LOC_QUOTIENT: 
PCT_TOTAL: 0.22
PCT_RPT: 1
H_MEAN: 19.08
A_MEAN: 39,680
MEAN_PRSE: 8.3
H_PCT10: 13.25
H_PCT25: 14.45
H_MEDIAN: 15.47
H_PCT75: 23.22
H_PCT90: 30.12
A_PCT10: 27,560
A_PCT25: 30,060
A_MEDIAN: 32,180
A_PCT75: 48,300
A_PCT90: 62,650
ANNUAL: 
HOURLY: 
SOC_Code: 211000",What is the percentile of employment for social workers and,"The mean annual wage for social workers and other community and social service specialists is $32,180.

Output:::
Factoid question: What is the percentile of employment for social workers and",../data/final_p2.csv
83,": 204306
AREA: 16
AREA_TITLE: Idaho
AREA_TYPE: 2
PRIM_STATE: ID
NAICS: 0
NAICS_TITLE: Cross-industry
I_GROUP: cross-industry
OWN_CODE: 1235
OCC_CODE: 47-2131
OCC_TITLE: Insulation Workers, Floor, Ceiling, and Wall
O_GROUP: detailed
TOT_EMP: 410
EMP_PRSE: 21.9
JOBS_1000: 0.500
LOC_QUOTIENT: 1.97
PCT_TOTAL: 
PCT_RPT: 
H_MEAN: 24.80
A_MEAN: 51,580
MEAN_PRSE: 8.2
H_PCT10: 16.77
H_PCT25: 17.46
H_MEDIAN: 18.76
H_PCT75: 28.67
H_PCT90: 52.01
A_PCT10: 34,880
A_PCT25: 36,310
A_MEDIAN: 39,010
A_PCT75: 59,630
A_PCT90: 108,190
ANNUAL: 
HOURLY: 
SOC_Code: 472131","What is the mean hourly salary for insulation workers,","The mean hourly salary for insulation workers, floor, and wall is $39,010.

Factoid question: What is the mean hourly salary for insulation workers,",../data/final_p2.csv
